Title,Description,Source,Fetched Date,Combined Text,Score,Sentiment
Major call looms for Hodge after NZ PGA Championship win,Fresh off claiming the New Zealand PGA Championship on Sunday Tyler Hodge has revealed theres a possibility he could call time on his professional career during the winter See what he said,News AU,2025-03-09T07:18:33.162956,major call loom hodge nz pga championship win . fresh claiming new zealand pga championship sunday tyler hodge revealed there possibility could call time professional career winter see said,0.875,Positive
LeBron in heated confrontation about his son,US sports personality Stephen A Smith has lifted the lid on what made LeBron James confront him on the sidelines during a Lakers game,News AU,2025-03-09T07:18:33.162956,lebron heated confrontation son . u sport personality stephen smith lifted lid made lebron james confront sideline lakers game,-0.4588,Negative
Cummings weighs up his options for Broadsiding Tom Kitten,Godolphin had a massive day in Sydney and Melbourne on Saturday but it wasnt to be for one of their brightest stars,News AU,2025-03-09T07:18:33.162956,cummings weighs option broadsiding tom kitten . godolphin massive day sydney melbourne saturday wasnt one brightest star,-0.4973,Negative
Aussie defectors staggering gold medal act,Six months after sensationally switching his allegiance from Australia to England the cycling defector has rubbed salt in the wounds,News AU,2025-03-09T07:18:33.162956,aussie defector staggering gold medal act . six month sensationally switching allegiance australia england cycling defector rubbed salt wound,-0.4019,Negative
First baby of two champs Aussies big news,Controversial boxing star Ebanie Bridges has dropped a series of photos of her new baby boy with fellow world champ Kell Brook,News AU,2025-03-09T07:18:33.162956,first baby two champ aussie big news . controversial boxing star ebanie bridge dropped series photo new baby boy fellow world champ kell brook,0.6597,Positive
