Title,Description,Source,Fetched Date,Combined Text,Score,Sentiment
Eminem Calls Back to PlatinumBlond Slim Shady Era With Houdini VMAs Performance,Eminems latest album may be called The Death of Slim Shady but for his first TV performances from the album the rapper brought back his platinumhaired alter ego along with a horde of lookalikes In an opening reminiscent of his 2000 VMAs performance of Real Slim Shady and The Way I Am in which Eminem,Hollywood Reporter,2024-09-12T07:22:08.090558,eminem call back platinumblond slim shady era houdini vmas performance . eminems latest album may called death slim shady first tv performance album rapper brought back platinumhaired alter ego along horde lookalikes opening reminiscent 2000 vmas performance real slim shady way eminem,-0.5994,Negative
Katy Perry Urges Young Artists to Stay True to Yourself After She Performs Medley of Greatest Hits Accepts Video Vanguard Honor,Katy Perry was honored with the Michael Jackson Video Vanguard Award at the 2024 MTV Video Music Awards Before introducing Perry to the stage for her video vanguard performance Orlando Bloom shared a kind message about his longtime partners accomplishments You fell in love with her as Katy Perry I fell in love with her,Hollywood Reporter,2024-09-12T07:22:08.090558,katy perry urge young artist stay true performs medley greatest hit accepts video vanguard honor . katy perry honored michael jackson video vanguard award 2024 mtv video music award introducing perry stage video vanguard performance orlando bloom shared kind message longtime partner accomplishment fell love katy perry fell love,0.9895,Positive
Halsey Rocks Out in a Garage for Performance of Ego at 2024 MTV VMAs,Halsey returned to the MTV Video Music Awards stage Wednesday night with a performance of her new song Ego After riding up to a house on the stage on a bicycle the singer pulled up a garage door to reveal her band waiting inside Halsey quickly grabbed her guitar and proceeded to rock out in the garage,Hollywood Reporter,2024-09-12T07:22:08.090558,halsey rock garage performance ego 2024 mtv vmas . halsey returned mtv video music award stage wednesday night performance new song ego riding house stage bicycle singer pulled garage door reveal band waiting inside halsey quickly grabbed guitar proceeded rock garage,0.5423,Positive
MTV VMAs Winners List,Taylor Swift topped the 2024 MTV Video Music Awards winning seven awards including video of the year for Fortnight featuring Post Malone Sabrina Carpenter took home the Moon Person for song of the year and Chappell Roan was named best new artist the 2024 show SZA Eminem Lenny Kravitz Blackpinks Lisa and Tyla were among,Hollywood Reporter,2024-09-12T07:22:08.090558,mtv vmas winner list . taylor swift topped 2024 mtv video music award winning seven award including video year fortnight featuring post malone sabrina carpenter took home moon person song year chappell roan named best new artist 2024 show sza eminem lenny kravitz blackpinks lisa tyla among,0.9648,Positive
SNL Actor Chloe Troast Says Season 50 Exit Was Not My Choice,Chloe Troasts exit from Saturday Night Live was not my choice the comedian told fans on social media Wednesday Hey everyone I wanted to let you know that I will not be on SNL next season she wrote on TikTok This was not my choice I wish I was there getting to be with my friends It,Hollywood Reporter,2024-09-12T07:22:08.090558,snl actor chloe troast say season 50 exit choice . chloe troasts exit saturday night live choice comedian told fan social medium wednesday hey everyone wanted let know snl next season wrote tiktok choice wish getting friend,0.8689,Positive
Chappell Roan Offers Fierce Performance of Good Luck Babe at 2024 MTV VMAs,Chappell Roan took to the MTV Video Music Awards stage Wednesday night to perform her hit song Good Luck Babe After being introduced by Sasha Colby as your favorite drag queens favorite artist the singer appeared in a medieval armorinspired costume as a castle erupted in flames behind her Throughout the fierce performance Roan didnt hold back,Hollywood Reporter,2024-09-12T07:22:08.090558,chappell roan offer fierce performance good luck babe 2024 mtv vmas . chappell roan took mtv video music award stage wednesday night perform hit song good luck babe introduced sasha colby favorite drag queen favorite artist singer appeared medieval armorinspired costume castle erupted flame behind throughout fierce performance roan didnt hold back,0.9607,Positive
Robbie Williams Asks If Were All Watching the Oasis Reunion Hoping for a Crash Exclusive Video,Lets talk about the monkey in the room Like literally Better Man Paramounts new Robbie Williams biopic that premiered at TIFF 2024 this week had a surprise in store for filmgoers Williams is portrayed by a monkey Not a metaphoric monkey Not an occasional dreamsequence monkey An actual CG monkey For the entire movie For,Hollywood Reporter,2024-09-12T07:22:08.090558,robbie williams asks watching oasis reunion hoping crash exclusive video . let talk monkey room like literally better man paramounts new robbie williams biopic premiered tiff 2024 week surprise store filmgoers williams portrayed monkey metaphoric monkey occasional dreamsequence monkey actual cg monkey entire movie,0.7964,Positive
Blackpinks Lisa Is a RedHot Rockstar in Fiery Solo VMA Debut,Blackpinks Lisa can add an electric 2024 MTV VMAs performance and a best KPop VMA to her evergrowing list of accolades this year The 27yearold Thai singer and rapper whose real name is Lalisa Manobal took to the stage early in the night for her first solo performance at MTVs Video Music Awards Decked out,Hollywood Reporter,2024-09-12T07:22:08.090558,blackpinks lisa redhot rockstar fiery solo vma debut . blackpinks lisa add electric 2024 mtv vmas performance best kpop vma evergrowing list accolade year 27yearold thai singer rapper whose real name lalisa manobal took stage early night first solo performance mtvs video music award decked,0.743,Positive
Sabrina Carpenter Gives Out of This World Performance at 2024 MTV VMAs,Sabrina Carpenter gave a performance at the MTV Video Music Awards that was quite literally out of this world Wednesday night After being introduced by legendary singer Cyndi Lauper Carpenter performed some of her biggest hits from this summer including Please Please Please Taste and Espresso Sporting a silver sparkly outfit the artist kicked off her,Hollywood Reporter,2024-09-12T07:22:08.090558,sabrina carpenter give world performance 2024 mtv vmas . sabrina carpenter gave performance mtv video music award quite literally world wednesday night introduced legendary singer cyndi lauper carpenter performed biggest hit summer including please please please taste espresso sporting silver sparkly outfit artist kicked,0.8555,Positive
Drama at OpenWeb as a new CEO is announced and the founding CEO says hes staying,OpenWeb a New York startup whose tools help publishers engage users has a unique problem Its cofounding CEO reportedly wont leave even though it announced a new CEO According to,TechCrunch,2024-09-12T07:22:08.386430,drama openweb new ceo announced founding ceo say he staying . openweb new york startup whose tool help publisher engage user unique problem cofounding ceo reportedly wont leave even though announced new ceo according,0.3711,Positive
Adam Neumanns crypto comeback company is reportedly refunding investors,In a development that will surprise few former WeWork CEO Adam Neumanns climatecryptocarboncredit startup Flowcarbon appears to be in the process of curling up to die Forbes reported today Buyers,TechCrunch,2024-09-12T07:22:08.386430,adam neumann crypto comeback company reportedly refunding investor . development surprise former wework ceo adam neumann climatecryptocarboncredit startup flowcarbon appears process curling die forbes reported today buyer,-0.4215,Negative
Amazon starts testing ads in its Rufus chatbot,Rufus Amazons recently launched shoppingfocused chatbot is getting ads soon Thats according to a changelog published by Amazon this week first spotted by AdWeek which states that sponsored ads could,TechCrunch,2024-09-12T07:22:08.386430,amazon start testing ad rufus chatbot . rufus amazon recently launched shoppingfocused chatbot getting ad soon thats according changelog published amazon week first spotted adweek state sponsored ad could,0.5574,Positive
LineLeap lets users pay to skip the line at bars,No one likes standing in line I was reminded of just how awful the experience can be last Saturday while being herded like cattle through a twohour queue for a,TechCrunch,2024-09-12T07:22:08.386430,lineleap let user pay skip line bar . one like standing line reminded awful experience last saturday herded like cattle twohour queue,0.1531,Neutral
A comprehensive list of 2024 tech layoffs,A complete list of all the known layoffs in tech from Big Tech to startups broken down by month throughout 2024,TechCrunch,2024-09-12T07:22:08.386430,comprehensive list 2024 tech layoff . complete list known layoff tech big tech startup broken month throughout 2024,-0.2732,Negative
OpenAI reportedly in talks to raise at 150B valuation,OpenAI is reportedly in talks with investors to raise 65 billion at a 150 billion premoney valuation according to Bloomberg The new valuation is significantly higher than OpenAIs previously reported,TechCrunch,2024-09-12T07:22:08.386430,openai reportedly talk raise 150b valuation . openai reportedly talk investor raise 65 billion 150 billion premoney valuation according bloomberg new valuation significantly higher openais previously reported,0.0,Neutral
AI illusions and navigating The Money Trap with Alok Sama,On todays episode of Equity Rebecca Bellan sat down with Alok Sama a Morgan Stanley veteran and former president and CFO of SoftBank Group International,TechCrunch,2024-09-12T07:22:08.386430,ai illusion navigating money trap alok sama . today episode equity rebecca bellan sat alok sama morgan stanley veteran former president cfo softbank group international,-0.3182,Negative
These sub1mm robots morph and crawl with an electric zap,Along with biological organisms the robots were inspired kirigami a variation of origami wherein objects are cut in addition to folded,TechCrunch,2024-09-12T07:22:08.386430,sub1mm robot morph crawl electric zap . along biological organism robot inspired kirigami variation origami wherein object cut addition folded,0.2732,Positive
YouTube Shorts collaborative Add Yours sticker is now available to all users,YouTube confirmed on Wednesday that its collaborative Add Yours sticker for YouTube Shorts is now fully rolled out The Googleowned company first announced the feature back in July The sticker,TechCrunch,2024-09-12T07:22:08.386430,youtube short collaborative add sticker available user . youtube confirmed wednesday collaborative add sticker youtube short fully rolled googleowned company first announced feature back july sticker,0.0,Neutral
Bluesky catches up to X with native support for video,With native video support Bluesky will be able to better compete with other X rivals including Instagram Threads and the decentralized service Mastodon among others,TechCrunch,2024-09-12T07:22:08.386430,bluesky catch x native support video . native video support bluesky able better compete x rival including instagram thread decentralized service mastodon among others,0.8074,Positive
Taylor Swift cites fears around AI as she endorses the Democratic ticket,After a historic presidential debate replete with discourse about eating pets Taylor Swift ended the evening with a bang Arguably the most powerful figure in American pop culture the singersongwriter,TechCrunch,2024-09-12T07:22:08.386430,taylor swift cite fear around ai endorses democratic ticket . historic presidential debate replete discourse eating pet taylor swift ended evening bang arguably powerful figure american pop culture singersongwriter,0.3818,Positive
Mark Zuckerberg says hes done apologizing,The home of the Golden State Warriors was packed on Tuesday evening this week but it wasnt to watch Steph Curry Thousands of fans gathered at the Chase Center in,TechCrunch,2024-09-12T07:22:08.386430,mark zuckerberg say he done apologizing . home golden state warrior packed tuesday evening week wasnt watch steph curry thousand fan gathered chase center,0.25,Positive
This Week in AI OpenAIs new Strawberry model may be smart yet sluggish,Hiya folks welcome to TechCrunchs regular AI newsletter If you want this in your inbox every Wednesday sign up here This week in AI OpenAIs next major product announcement is imminent,TechCrunch,2024-09-12T07:22:08.386430,week ai openais new strawberry model may smart yet sluggish . hiya folk welcome techcrunchs regular ai newsletter want inbox every wednesday sign week ai openais next major product announcement imminent,0.5106,Positive
Media talent app HUSSLUP shuts down as workers in Hollywood continue to face job slowdown,HUSSLUP the job search and networking app for the entertainment industry goes on an indefinite hiatus starting Friday,TechCrunch,2024-09-12T07:22:08.386430,medium talent app husslup shuts worker hollywood continue face job slowdown . husslup job search networking app entertainment industry go indefinite hiatus starting friday,0.6808,Positive
Googles AI notetaking app NotebookLM can now explain complex topics to you out loud,Google announced on Wednesday that its AI notetaking and research app NotebookLM is adding an Audio Overview feature Audio Overview will give users another way to digest and comprehend the,TechCrunch,2024-09-12T07:22:08.386430,google ai notetaking app notebooklm explain complex topic loud . google announced wednesday ai notetaking research app notebooklm adding audio overview feature audio overview give user another way digest comprehend,0.0,Neutral
TechCrunch Minute Why this entrepreneur is running the Oakland Ballers like a startup,The coolest startup in the Bay Area isnt making AI robots or selfdriving taxis Its actually a baseball team As his beloved Oakland As plan,TechCrunch,2024-09-12T07:22:08.386430,techcrunch minute entrepreneur running oakland ballers like startup . coolest startup bay area isnt making ai robot selfdriving taxi actually baseball team beloved oakland plan,0.7003,Positive
Apples newly available winback offers let developers reach lapsed subscribers,Apple explains that these offers are designed to reach an app or games previous subscribers and encourage them to return,TechCrunch,2024-09-12T07:22:08.386430,apple newly available winback offer let developer reach lapsed subscriber . apple explains offer designed reach app game previous subscriber encourage return,0.5423,Positive
Oura has acquired metabolic health startup Veri,Blood sugar levels are foundational to the Veri platform,TechCrunch,2024-09-12T07:22:08.386430,oura acquired metabolic health startup veri . blood sugar level foundational veri platform,0.0,Neutral
Fearless Fund is shutting down its contested Strivers Grant program,Fearless Fund has settled its case with the American Alliance for Equal Rights AAER agreeing to shut down its Strivers Grant program,TechCrunch,2024-09-12T07:22:08.386430,fearless fund shutting contested striver grant program . fearless fund settled case american alliance equal right aaer agreeing shut striver grant program,0.9042,Positive
Meet Verse an AIpowered creative app that helps Gen Z design and publish expressive content,Verse a new AIpowered creative app is aiming to help Gen Z users create hypervisual and expressive content The iOS app allows users to design and publish multimedia content on,TechCrunch,2024-09-12T07:22:08.386430,meet verse aipowered creative app help gen z design publish expressive content . verse new aipowered creative app aiming help gen z user create hypervisual expressive content io app allows user design publish multimedia content,0.9062,Positive
The torture behind Blues turnaround,A novel approach tested Carltons AFLW players but paid off during a round 2 thriller in Mackay,News AU,2024-09-12T07:22:10.068994,torture behind blue turnaround . novel approach tested carltons aflw player paid round 2 thriller mackay,-0.296,Negative
AFL great hails selfless Lions superstar,AFL great Luke Hodge has been impressed with the way a twotime Brownlow medallist has taken his game to new levels this season,News AU,2024-09-12T07:22:10.068994,afl great hail selfless lion superstar . afl great luke hodge impressed way twotime brownlow medallist taken game new level season,0.9118,Positive
New Raygun photos we cant ignore,After a very controversial performance at the Paris Olympics Raygun has returned home and weve got the pictures to prove it,News AU,2024-09-12T07:22:10.068994,new raygun photo cant ignore . controversial performance paris olympics raygun returned home weve got picture prove,0.4023,Positive
Genie smashes fans as tennis drama erupts,The Canadian was forced to defend a tweet she wrote about Pegula after it was misinterpreted by fans,News AU,2024-09-12T07:22:10.068994,genie smash fan tennis drama erupts . canadian forced defend tweet wrote pegula misinterpreted fan,-0.1779,Neutral
Timely reality check fires up Bulldogs,Canterburys forwards walked off Accor Stadium feeling like they were responsible for the loss to Manly Now they have the chance for revenge,News AU,2024-09-12T07:22:10.068994,timely reality check fire bulldog . canterbury forward walked accor stadium feeling like responsible loss manly chance revenge,-0.2023,Neutral
Secret helping Luai prepare for last ride,As the enormity of his move to the Wests Tigers sinks in Jarome Luai has revealed the secret tool that has helped him stay grounded,News AU,2024-09-12T07:22:10.068994,secret helping luai prepare last ride . enormity move west tiger sink jarome luai revealed secret tool helped stay grounded,0.296,Positive
Id love to Rebuilt bowlers highspeed goal,An Australian fast bowler is still determined to break speed records as she prepares to break a sixyear World Cup drought,News AU,2024-09-12T07:22:10.068994,id love rebuilt bowler highspeed goal . australian fast bowler still determined break speed record prepares break sixyear world cup drought,0.765,Positive
Aussie star makes history in nuclear blitz,Australian cricketer Travis Head delivered a nuclear blitz as he pummelled England during the opening of three T20 matches,News AU,2024-09-12T07:22:10.068994,aussie star make history nuclear blitz . australian cricketer travis head delivered nuclear blitz pummelled england opening three t20 match,0.0,Neutral
Did it again Hewitts bold plan pays off,With no Alex de Minaur at the Davis Cup Australia needed others to step up and three of them did,News AU,2024-09-12T07:22:10.068994,hewitts bold plan pay . alex de minaur davis cup australia needed others step three,0.296,Positive
Darts prodigy is here to win in Australia,Luke Littler has taken the darts world by storm this year and the teenager is in Australia this week determined to continue his red hot form,News AU,2024-09-12T07:22:10.068994,dart prodigy win australia . luke littler taken dart world storm year teenager australia week determined continue red hot form,0.7351,Positive
Absolutely hate it Aussies in Paris drama,A new rule at the Olympics athletics events is sure to divide athletes and fans and produce high drama in Paris writes Sally Pearson,News AU,2024-09-12T07:22:10.068994,absolutely hate aussie paris drama . new rule olympics athletics event sure divide athlete fan produce high drama paris writes sally pearson,-0.101,Neutral
Astonishing rise set to flip F1 in 215m race,Daniel Ricciardo has been given a reality check as the urgency mounts at Red Bull amid a threehorse race to replace a struggling driver,News AU,2024-09-12T07:22:10.068994,astonishing rise set flip f1 215m race . daniel ricciardo given reality check urgency mount red bull amid threehorse race replace struggling driver,-0.4215,Negative
Whispers over billionaires bombshell F1 powerplay,A bombshell report has claimed a billionaire team owner is scrambling to secure one of the most seismic deals in F1 history,News AU,2024-09-12T07:22:10.068994,whisper billionaire bombshell f1 powerplay . bombshell report claimed billionaire team owner scrambling secure one seismic deal f1 history,0.34,Positive
Clarkson exclusive leaked 295m bombshell,Former Top Gear host Jeremy Clarkson broke massive news back at the British Grand Prix in July with the F1 world finally giving him props,News AU,2024-09-12T07:22:10.068994,clarkson exclusive leaked 295m bombshell . former top gear host jeremy clarkson broke massive news back british grand prix july f1 world finally giving prop,0.3818,Positive
150 for six chicken nuggets at US Open,Tennis fans have lashed out at the ridiculous price of a chic new spin on chicken nuggets at the US Open,News AU,2024-09-12T07:22:10.068994,150 six chicken nugget u open . tennis fan lashed ridiculous price chic new spin chicken nugget u open,0.2263,Neutral
Coach breaks down over NFL stars arrest,Footage of an NFL superstars police confrontation has been released with his coach getting emotional addressing the incident,News AU,2024-09-12T07:22:10.068994,coach break nfl star arrest . footage nfl superstar police confrontation released coach getting emotional addressing incident,-0.4767,Negative
Stars wifes heartbreaking eulogy reveal,There have been distressing scenes as the wives of killed brothers revealed devastating pregnancy news as the duo were laid to rest,News AU,2024-09-12T07:22:10.068994,star wife heartbreaking eulogy reveal . distressing scene wife killed brother revealed devastating pregnancy news duo laid rest,-0.9382,Negative
Dominating Socceroos whizkids ultimate aim,It was only the woodwork that denied teenage sensation Nestory Irankunda a memorable goal for the Socceroos against Indonesia,News AU,2024-09-12T07:22:10.068994,dominating socceroos whizkids ultimate aim . woodwork denied teenage sensation nestory irankunda memorable goal socceroos indonesia,-0.6249,Negative
Common theme haunting Socceroos,Matches next month against China and Japan have taken on extra importance for the Socceroos after their disappointing start to the latest round of World Cup qualifiers,News AU,2024-09-12T07:22:10.068994,common theme haunting socceroos . match next month china japan taken extra importance socceroos disappointing start latest round world cup qualifier,-0.4215,Negative
Doesnt have the chin Tszyus brutal Canelo warning,Tim Tszyu didnt mince his words predicting the outcome of Canelo Alvarezs world title showdown with Edgar Berlanga Plus a look behind the scenes at his Las Vegas training camp,News AU,2024-09-12T07:22:10.068994,doesnt chin tszyus brutal canelo warning . tim tszyu didnt mince word predicting outcome canelo alvarezs world title showdown edgar berlanga plus look behind scene la vega training camp,0.2249,Neutral
Rorys message as merger stalls,As the golf world sits in limbo waiting for a new deal between the PGA Tour and LIVs Saudi backers Rory McIlroy has a message for officials,News AU,2024-09-12T07:22:10.068994,rorys message merger stall . golf world sits limbo waiting new deal pga tour livs saudi backer rory mcilroy message official,-0.2023,Neutral
SuperCoach NBL dictionary Easy guide to fantasy jargon,With terms like Cheapies Guns PODS Floors and Ceilings its no wonder some people get confused by terms used in SuperCoach NBL But dont be discouraged,News AU,2024-09-12T07:22:10.068994,supercoach nbl dictionary easy guide fantasy jargon . term like cheapies gun pod floor ceiling wonder people get confused term used supercoach nbl dont discouraged,0.4512,Positive
Former Wallabies gun quits Australia,He was the second youngest player ever to earn a cap for the Wallabies and now the former wunderkind is leaving to play overseas,News AU,2024-09-12T07:22:10.068994,former wallaby gun quits australia . second youngest player ever earn cap wallaby former wunderkind leaving play overseas,0.0,Neutral
Body found in search for rugby legends wife,Police have made a tragic discovery in the search for a rugby legends wife after she vanished going for a group swim,News AU,2024-09-12T07:22:10.068994,body found search rugby legend wife . police made tragic discovery search rugby legend wife vanished going group swim,-0.4588,Negative
Romantic Warrior success inspires Japanese stars Cox Plate bid,Romantic Warriors win in the Cox Plate encouraged the connections of Japanese star Prognosis to take up the challenge this year,News AU,2024-09-12T07:22:10.068994,romantic warrior success inspires japanese star cox plate bid . romantic warrior win cox plate encouraged connection japanese star prognosis take challenge year,0.9559,Positive
Incredible Aussie trio make cycling history,One Australian on the podium at the end of a cycling grand tour is an achievement but three in Spain made for an historic day,News AU,2024-09-12T07:22:10.068994,incredible aussie trio make cycling history . one australian podium end cycling grand tour achievement three spain made historic day,0.4588,Positive
