Title,Description,Source,Fetched Date,Combined Text,Score,Sentiment
Boeing boss in lastditch plea as strike vote looms,New chief executive tells staff that a strike would put the embattled firms recovery in jeopardy,BBC Business,2024-09-12T07:22:07.750825,boeing bos lastditch plea strike vote loom . new chief executive tell staff strike would put embattled firm recovery jeopardy,-0.7184,Negative
US inflation falls to lowest in over three years,Consumer prices in the US rose 25 over the 12 months to August the slowest pace since February 2021,BBC Business,2024-09-12T07:22:07.750825,u inflation fall lowest three year . consumer price u rose 25 12 month august slowest pace since february 2021,-0.3818,Negative
Iconic firm Campbell Soup set to drop soup from name,Executives at the 155year old firm plan to change its name to reflect its growing line of products,BBC Business,2024-09-12T07:22:07.750825,iconic firm campbell soup set drop soup name . executive 155year old firm plan change name reflect growing line product,-0.1027,Neutral
UK chancellor warns hard decisions ahead in Budget,Rachel Reeves says tough choices will have to be made over tax spending and welfare,BBC Business,2024-09-12T07:22:07.750825,uk chancellor warns hard decision ahead budget . rachel reef say tough choice made tax spending welfare,-0.3182,Negative
Passengers stranded after strike at main Kenya airport,A protest against plans to lease JKIA Kenyas main airport to an Indian company sparks disruption,BBC Business,2024-09-12T07:22:07.750825,passenger stranded strike main kenya airport . protest plan lease jkia kenya main airport indian company spark disruption,-0.4767,Negative
Firm wins trademark case against easyJet owner,The airlines owner says he will appeal against the ruling which found there was no infringement,BBC Business,2024-09-12T07:22:07.750825,firm win trademark case easyjet owner . airline owner say appeal ruling found infringement,0.1779,Neutral
Rightmove rejects 56bn offer from Murdochs firm,The property listing website said the offer from its Australian rival was wholly opportunistic,BBC Business,2024-09-12T07:22:07.750825,rightmove reject 56bn offer murdoch firm . property listing website said offer australian rival wholly opportunistic,-0.4215,Negative
Chelsea ownership rift exposed and explained,BBC Sport explores the split between Chelseas coowners Todd Boehly and Clearlake Capital led by Behdad Eghbali,BBC Business,2024-09-12T07:22:07.750825,chelsea ownership rift exposed explained . bbc sport explores split chelseas coowners todd boehly clearlake capital led behdad eghbali,-0.0772,Neutral
Kakeibo The Japanese art of saving money,Kakeibo a centuryold Japanese technique for budgeting is a nononsense way to take charge of your finances,BBC Business,2024-09-12T07:22:07.750825,kakeibo japanese art saving money . kakeibo centuryold japanese technique budgeting nononsense way take charge finance,0.0,Neutral
Good Bad Billionaire,Simon Jack and Zing Tsjeng find out how the worlds billionaires made their money and then judge them Are they good bad or just another billionaire Listen to season two New episodes released on Mondays,BBC Business,2024-09-12T07:22:07.750825,good bad billionaire . simon jack zing tsjeng find world billionaire made money judge good bad another billionaire listen season two new episode released monday,-0.296,Negative
How Microsoft is tackling AI bias,Microsoft is turning to AI to make its workplace more inclusive,BBC Business,2024-09-12T07:22:07.750825,microsoft tackling ai bias . microsoft turning ai make workplace inclusive,-0.1027,Neutral
Aly Raisman on competing at the highest level,The decorated US gymnast opened up to the BBCs Katty Kay about blocking out the noise trusting her training and her winning mindset,BBC Business,2024-09-12T07:22:07.750825,aly raisman competing highest level . decorated u gymnast opened bbcs katty kay blocking noise trusting training winning mindset,0.5423,Positive
Jackie JoynerKersees goldmedal attitude,The retired athlete and halloffamer opened up to the BBCs Katty Kay about the challenges she faced on the road to the Olympics and the winning mindset that saw her through them,BBC Business,2024-09-12T07:22:07.750825,jackie joynerkersees goldmedal attitude . retired athlete halloffamer opened bbcs katty kay challenge faced road olympics winning mindset saw,0.5719,Positive
Sony reveals much more expensive and powerful PlayStation 5 Pro,UK gamers will have to shell out 69999 when the upgraded console launches on 7 November,BBC Business,2024-09-12T07:22:07.750825,sony reveals much expensive powerful playstation 5 pro . uk gamers shell 69999 upgraded console launch 7 november,0.4215,Positive
UK sells peaches from Fukushima nuclear disaster region,Harrods sale of the fruit is part of efforts to restore trust after the 2011 radiation leak,BBC Business,2024-09-12T07:22:07.750825,uk sell peach fukushima nuclear disaster region . harrod sale fruit part effort restore trust 2011 radiation leak,-0.25,Negative
Apple told to pay Ireland 13bn in tax by EU,The European Court of Justice upheld a 2016 decision that said Apple received unlawful aid from Ireland,BBC Business,2024-09-12T07:22:07.750825,apple told pay ireland 13bn tax eu . european court justice upheld 2016 decision said apple received unlawful aid ireland,0.4588,Positive
EU court rules Google must pay 24bn fine,Google loses its appeal against the fine handed down for its shopping comparison service,BBC Business,2024-09-12T07:22:07.750825,eu court rule google must pay 24bn fine . google loses appeal fine handed shopping comparison service,-0.0258,Neutral
GB News owner buys Spectator magazine for 100m,The rightleaning political magazine has been sold to the hedge fund tycoon Sir Paul Marshall,BBC Business,2024-09-12T07:22:07.750825,gb news owner buy spectator magazine 100m . rightleaning political magazine sold hedge fund tycoon sir paul marshall,0.0,Neutral
Billionaire takes off for first ever private spacewalk,The mission is the first of three funded by payments processing business founder Jared Isaacman,BBC Business,2024-09-12T07:22:07.750825,billionaire take first ever private spacewalk . mission first three funded payment processing business founder jared isaacman,0.0,Neutral
Playing with FIRE How to quit work and retire in your 30s,A personal finance strategy popular among millennials is helping them to quit their job and retire decades early,BBC Business,2024-09-12T07:22:07.750825,playing fire quit work retire 30 . personal finance strategy popular among millennials helping quit job retire decade early,0.5267,Positive
Boomerang CEOs Do they ever succeed,Five years after being ousted from WeWork Adam Neumann wants to rebuy the nowbankrupt business,BBC Business,2024-09-12T07:22:07.750825,boomerang ceo ever succeed . five year ousted wework adam neumann want rebuy nowbankrupt business,0.5423,Positive
How industry leaders transformed their career,The BBCs Katty Kay has spoken to successful changemakers to ask what made them pivot in their career,BBC Business,2024-09-12T07:22:07.750825,industry leader transformed career . bbcs katty kay spoken successful changemakers ask made pivot career,0.5859,Positive
Women were the original beer brewers what changed,Today the beer industry is maledominated but it wasnt always so,BBC Business,2024-09-12T07:22:07.750825,woman original beer brewer changed . today beer industry maledominated wasnt always,0.3182,Positive
How waiting alters our perception of time,Expert advice on how to get through a waiting period,BBC Business,2024-09-12T07:22:07.750825,waiting alters perception time . expert advice get waiting period,0.0,Neutral
Do the superrich deserve their wealth,Should there be a cap on billionaires wealth and their inheritances,BBC Business,2024-09-12T07:22:07.750825,superrich deserve wealth . cap billionaire wealth inheritance,0.7506,Positive
Four simple hacks to succeed in every conversation,A career coach a choreographer a chef and a dragon boat captain offer advice on giving critical feedback,BBC Business,2024-09-12T07:22:07.750825,four simple hack succeed every conversation . career coach choreographer chef dragon boat captain offer advice giving critical feedback,0.5106,Positive
Solo and hybrid work Navigating our future and new normal,Covid19 reshaped the way we live and work We rethink solo working and explore the future of worklife,BBC Business,2024-09-12T07:22:07.750825,solo hybrid work navigating future new normal . covid19 reshaped way live work rethink solo working explore future worklife,0.0,Neutral
Can supersonic flight ever be sustainable,How a new era of quiet net zero supersonic airliners could revolutionise the aviation industry,BBC Business,2024-09-12T07:22:07.750825,supersonic flight ever sustainable . new era quiet net zero supersonic airliner could revolutionise aviation industry,0.0,Neutral
Commencement speech The surprising pitfall of your passions,Students are graduating in the US this week The commencement speeches might lead them into questionable choices,BBC Business,2024-09-12T07:22:07.750825,commencement speech surprising pitfall passion . student graduating u week commencement speech might lead questionable choice,0.4404,Positive
ASMR How whispering took over the internet,We meet the creators behind the current ASMR boom,BBC Business,2024-09-12T07:22:07.750825,asmr whispering took internet . meet creator behind current asmr boom,0.0,Neutral
A desk full of descriptions for your work colleagues,These are the long lost words youve been waiting for to describe your colleagues,BBC Business,2024-09-12T07:22:07.750825,desk full description work colleague . long lost word youve waiting describe colleague,-0.3182,Negative
Veterinarian suicide rates are very high Why,Veterinarian professionals are committing suicide at a higher rate than the general population,BBC Business,2024-09-12T07:22:07.750825,veterinarian suicide rate high . veterinarian professional committing suicide higher rate general population,-0.8658,Negative
John Lewis says recovery on track as losses narrow,Sales at its department stores fell in what it calls a challenging market but revenues at Waitrose grew,BBC Business,2024-09-12T07:22:07.750825,john lewis say recovery track loss narrow . sale department store fell call challenging market revenue waitrose grew,-0.1779,Neutral
Bank and chemist closures leave High Streets with holes,Chemists pubs and banks made up half of High Street closures in the first six months of 2024 data suggests,BBC Business,2024-09-12T07:22:07.750825,bank chemist closure leave high street hole . chemist pub bank made half high street closure first six month 2024 data suggests,-0.0516,Neutral
How quickly are prices rising in the UK,The rate at which prices are rising has nudged back above the Bank of Englands target of 2,BBC Business,2024-09-12T07:22:07.750825,quickly price rising uk . rate price rising nudged back bank england target 2,0.0,Neutral
How much is the winter fuel payment and how can I still claim it,Plans to change winter fuel payments have highlighted the problem of unclaimed pensioner benefits,BBC Business,2024-09-12T07:22:07.750825,much winter fuel payment still claim . plan change winter fuel payment highlighted problem unclaimed pensioner benefit,0.0772,Neutral
UK state pension set to rise by 460 next year,The latest figure comes as the government faces a backlash over cutting winter fuel payments for most pensioners,BBC Business,2024-09-12T07:22:07.750825,uk state pension set rise 460 next year . latest figure come government face backlash cutting winter fuel payment pensioner,-0.128,Neutral
Grim September ahead with 6000 steel and oil jobs to go in UK,The BBC understands the government is bracing itself for a tough month as workers face losing their jobs,BBC Business,2024-09-12T07:22:07.750825,grim september ahead 6000 steel oil job go uk . bbc understands government bracing tough month worker face losing job,-0.7783,Negative
New oil and gas ban threatens jobs unions warn,Unite and the GMB say fossil fuels should not be abandoned until workers know how their jobs will be protected,BBC Business,2024-09-12T07:22:07.750825,new oil gas ban threatens job union warn . unite gmb say fossil fuel abandoned worker know job protected,-0.7717,Negative
More bus services could come under control of councils,Transport Secretary Louise Haigh promises to deliver a bus revolution that will save vital routes,BBC Business,2024-09-12T07:22:07.750825,bus service could come control council . transport secretary louise haigh promise deliver bus revolution save vital route,0.7717,Positive
Asos shoppers hit out at new 395 returns charge,The company said it was introducing a charge for customers with a frequently high return rate,BBC Business,2024-09-12T07:22:07.750825,asos shopper hit new 395 return charge . company said introducing charge customer frequently high return rate,0.0,Neutral
Louisiana streets flooded as Hurricane Francine hits Gulf Coast,The Category 2 storm is producing lifethreatening flooding according to the National Hurricane Service,BBC Earth,2024-09-12T07:22:07.837017,louisiana street flooded hurricane francine hit gulf coast . category 2 storm producing lifethreatening flooding according national hurricane service,0.0,Neutral
The town that should have burned but didnt,In 2017 one of Californias largest ever wildfires was steadily approaching Montecito But it had long been preparing for just such an event,BBC Earth,2024-09-12T07:22:07.837017,town burned didnt . 2017 one california largest ever wildfire steadily approaching montecito long preparing event,0.0,Neutral
The secluded life of the USs lasagne lizard,Scuba diving scientists are scouring riverbeds for the USselusive endangered hellbender also known as the snot otter to give them a fighting chance of survival,BBC Earth,2024-09-12T07:22:07.837017,secluded life us lasagne lizard . scuba diving scientist scouring riverbed usselusive endangered hellbender also known snot otter give fighting chance survival,-0.0516,Neutral
Protecting Thailands famous paradise beach,Lucy Hedges is in Thailand where she explores the beach made worldfamous by Hollywood,BBC Earth,2024-09-12T07:22:07.837017,protecting thailand famous paradise beach . lucy hedge thailand explores beach made worldfamous hollywood,0.6369,Positive
The scientists drilling into an active Icelandic volcano,Scientists are preparing to drill into the rock of an Icelandic volcano to learn more about how volcanoes behave,BBC Earth,2024-09-12T07:22:07.837017,scientist drilling active icelandic volcano . scientist preparing drill rock icelandic volcano learn volcano behave,0.4019,Positive
Earths spectacular and remote capital of lightning,With storms occurring between 140 to 160 nights a year its no wonder the area is a world record holder,BBC Earth,2024-09-12T07:22:07.837017,earth spectacular remote capital lightning . storm occurring 140 160 night year wonder area world record holder,0.0,Neutral
Less is more Can degrowth save the world,The degrowth movement questions the feasibility of the idea of endless economic growth on a finite planet,BBC Earth,2024-09-12T07:22:07.837017,less degrowth save world . degrowth movement question feasibility idea endless economic growth finite planet,0.6728,Positive
How fixing how we farm might stop the next pandemic,Land use for food and agriculture around the world is putting pressure on climate and biodiversity,BBC Earth,2024-09-12T07:22:07.837017,fixing farm might stop next pandemic . land use food agriculture around world putting pressure climate biodiversity,-0.5267,Negative
How electric vehicles could improve our mental health,Noise and air pollution are major threats and EVs can therefore offer a promising solution,BBC Earth,2024-09-12T07:22:07.837017,electric vehicle could improve mental health . noise air pollution major threat ev therefore offer promising solution,0.5423,Positive
How greening our cities can reduce heat stress,Heat is the most deadly extreme weather phenomenon and cities are seeking ways to cool their urban cores,BBC Earth,2024-09-12T07:22:07.837017,greening city reduce heat stress . heat deadly extreme weather phenomenon city seeking way cool urban core,-0.128,Neutral
How climate chaos is threatening the real Paddington bear,Drought forces the real Paddington Bear into deadly conflict with cattle farmers in the Andes,BBC Earth,2024-09-12T07:22:07.837017,climate chaos threatening real paddington bear . drought force real paddington bear deadly conflict cattle farmer andes,-0.8555,Negative
Tidal kites New technology harnessing ocean energy,These mechanical creatures lurk beneath the waters surface and power homes in the Faroe Islands,BBC Earth,2024-09-12T07:22:07.837017,tidal kite new technology harnessing ocean energy . mechanical creature lurk beneath water surface power home faroe island,0.0772,Neutral
Malaysias adventure hotspot that crosses seven habitats,An 11mile hike in the Bako National Park in Malaysia transports travellers through seven distinct habitats,BBC Earth,2024-09-12T07:22:07.837017,malaysia adventure hotspot cross seven habitat . 11mile hike bako national park malaysia transport traveller seven distinct habitat,0.3182,Positive
The global phenomenon swallowing whole neighbourhoods,Giant ravines Entire communities are disappearing because of an extreme form of soil erosion,BBC Earth,2024-09-12T07:22:07.837017,global phenomenon swallowing whole neighbourhood . giant ravine entire community disappearing extreme form soil erosion,0.0,Neutral
A tale of the US through abandoned buildings,Two urban explorers stories of decay tell a tale of a changing American cultural landscape,BBC Earth,2024-09-12T07:22:07.837017,tale u abandoned building . two urban explorer story decay tell tale changing american cultural landscape,-0.6908,Negative
What makes the emperor penguin an eggcellent father,In the BBC Select documentary Penguins Spy in the Huddle we explore the world of penguin fathers,BBC Earth,2024-09-12T07:22:07.837017,make emperor penguin eggcellent father . bbc select documentary penguin spy huddle explore world penguin father,0.0,Neutral
The floating houses that are resilient to extreme weather,The floating houses built to withstand typhoons and flooding in the Philippines,BBC Earth,2024-09-12T07:22:07.837017,floating house resilient extreme weather . floating house built withstand typhoon flooding philippine,0.0,Neutral
What its like to camp in Antarctica,Marc Cieslak spends a night on ice camping under the stars,BBC Earth,2024-09-12T07:22:07.837017,like camp antarctica . marc cieslak spends night ice camping star,0.3612,Positive
Why sunsets on Mars are tinted blue,The reason behind the Red Planets nickname is also why its sunrises and sunsets look pale blue,BBC Earth,2024-09-12T07:22:07.837017,sunset mar tinted blue . reason behind red planet nickname also sunrise sunset look pale blue,0.0,Neutral
Molossia A small unrecognised nation within the US,With its own currency and head of state this American micronation has become an odd tourist destination,BBC Earth,2024-09-12T07:22:07.837017,molossia small unrecognised nation within u . currency head state american micronation become odd tourist destination,-0.3182,Negative
Can these 3Dprinted sea walls protect marine wildlife,One team is on a mission to create 3D printed sea walls with environmental benefits,BBC Earth,2024-09-12T07:22:07.837017,3dprinted sea wall protect marine wildlife . one team mission create 3d printed sea wall environmental benefit,0.7717,Positive
Ghost towns What nature does without us,Ghost towns are remnants of lost communities but also a testament to natures persistence,BBC Earth,2024-09-12T07:22:07.837017,ghost town nature without u . ghost town remnant lost community also testament nature persistence,-0.7096,Negative
Spectacular Nasa footage of solar activity behind the aurora,Our stars activity is increasing and that could mean more supercharged light shows on Earth,BBC Earth,2024-09-12T07:22:07.837017,spectacular nasa footage solar activity behind aurora . star activity increasing could mean supercharged light show earth,0.0,Neutral
Sea ice melt impacts birds feeding trips study,Albatrosses and petrels are being forced to fly further to find food a study claims,BBC Earth,2024-09-12T07:22:07.837017,sea ice melt impact bird feeding trip study . albatross petrel forced fly find food study claim,-0.4588,Negative
The Sicilian ocean songs with a hidden message,Sicilys mysterious ocean songs contain secret messages about ancient fishing practices with ramifications for todays ecology,BBC Earth,2024-09-12T07:22:07.837017,sicilian ocean song hidden message . sicily mysterious ocean song contain secret message ancient fishing practice ramification today ecology,0.0,Neutral
What weve learned since the biggest oil spill in US history,Fourteen years after the BP Deepwater Horizon disaster would we fare any better at cleaning up another huge oil spill,BBC Earth,2024-09-12T07:22:07.837017,weve learned since biggest oil spill u history . fourteen year bp deepwater horizon disaster would fare better cleaning another huge oil spill,0.0258,Neutral
How good fire is reviving wildlife,The destruction a fire brings can be crucial for certain species to thrive Meet the conservationists reviving the ancient art of good fire,BBC Earth,2024-09-12T07:22:07.837017,good fire reviving wildlife . destruction fire brings crucial certain specie thrive meet conservationist reviving ancient art good fire,-0.4588,Negative
The largest dam removal in US history is complete,The Klamath River is free of four huge dams for the first time in generations But for the Yurok tribe the rivers restoration is only just beginning starting with 18 billion seeds,BBC Earth,2024-09-12T07:22:07.837017,largest dam removal u history complete . klamath river free four huge dam first time generation yurok tribe river restoration beginning starting 18 billion seed,0.6808,Positive
The fall foliage town that banned influencers,As hordes of photographers began descending on a small rural community to capture its vibrant autumnal colours local residents have been fighting back,BBC Earth,2024-09-12T07:22:07.837017,fall foliage town banned influencers . horde photographer began descending small rural community capture vibrant autumnal colour local resident fighting back,-0.2732,Negative
The factor making it difficult for bees to find flowers,Were only touching the tip of the iceberg in terms of how these effects are influencing these pollinators,BBC Earth,2024-09-12T07:22:07.837017,factor making difficult bee find flower . touching tip iceberg term effect influencing pollinator,-0.3612,Negative
The giant vehicles pushing the limits of electric power,How much energy you can pack into a battery is one limit on how big an EV can get but meet the EVs ditching batteries altogether to attain mammoth proportions,BBC Earth,2024-09-12T07:22:07.837017,giant vehicle pushing limit electric power . much energy pack battery one limit big ev get meet ev ditching battery altogether attain mammoth proportion,0.2732,Positive
The living tractors reviving Turkeys wastelands,When water buffalo make a home for themselves in abandoned spaces they can bring with them a rich array of frogs bats and plant life,BBC Earth,2024-09-12T07:22:07.837017,living tractor reviving turkey wasteland . water buffalo make home abandoned space bring rich array frog bat plant life,0.1531,Neutral
Camila Cabello Gives Angsty June Gloom Performance at the 2024 MTV Music Video Awards,Camila Cabello performed June Gloom off her new LP CXOXO at the 2024 MTV Video Music Awards airing live from the UBS Arena on Long Island The pop stars performance started with a video clip featuring her blonde look from this album cycle playing from a laptop The camera then zoomed out to show a,Hollywood Reporter,2024-09-12T07:22:08.090558,camila cabello give angsty june gloom performance 2024 mtv music video award . camila cabello performed june gloom new lp cxoxo 2024 mtv video music award airing live ubs arena long island pop star performance started video clip featuring blonde look album cycle playing laptop camera zoomed show,0.1531,Neutral
LL Cool J Brings Energy to VMAs Stage With Medley of His Classic Hits and New Songs,LL Cool J hit the MTV VMAs stage on Wednesday night with a medley of his classic hits and new tunes to celebrate the 40th anniversary of Def Jam Records The rapper whose performance featured an appearance by Public Enemys Flavor Flav and Chuck D who are two of LLs original Def Jam labelmates,Hollywood Reporter,2024-09-12T07:22:08.090558,cool j brings energy vmas stage medley classic hit new song . cool j hit mtv vmas stage wednesday night medley classic hit new tune celebrate 40th anniversary def jam record rapper whose performance featured appearance public enemy flavor flav chuck two lls original def jam labelmates,0.802,Positive
Taylor Swift Wins Video of the Year at 2024 MTV VMAs Breaking Multiple Records,Taylor Swift took home the most coveted award of the night at the MTV Video Music Awards on Wednesday breaking several records with the win The superstar won video of the year for her song Fortnight featuring Post Malone Swift won seven VMAs this year bringing her alltime total to 30 tying her with Beyonc for most,Hollywood Reporter,2024-09-12T07:22:08.090558,taylor swift win video year 2024 mtv vmas breaking multiple record . taylor swift took home coveted award night mtv video music award wednesday breaking several record win superstar video year song fortnight featuring post malone swift seven vmas year bringing alltime total 30 tying beyonc,0.9584,Positive
