Title,Description,Source,Fetched Date
Outrageous Legend erupts over banner,An AFL legend has taken aim at Melbourne over one detail in their banner ahead of their final game of the season on Friday,News AU,2024-08-24T11:50:34.960528
NRLW Rd 5 Cowboys heap more misery on Raiders,The Cowboys have kept in touch with the top four after heaping more misery on the Raiders while the Knights overcame a bizarre delay to beat Parramatta See all the NRLW Round 5 news,News AU,2024-08-24T11:50:34.960528
NRL Live Raiders keeping ahead of struggling Panthers,Canberra weathered a storm of Panthers attack and have regained the lead through superstar youngster Kaeo Weekes Follow along for live score updates and SuperCoach news,News AU,2024-08-24T11:50:34.960528
World Cup shift after Aussie skippers fears,As trouble continues to make Bangladesh unsafe for travel the ICC has heeded player wishes and moved Octobers T20 World Cup,News AU,2024-08-24T11:50:34.960528
No idea Smiths frank Test admission,While he locked in his Big Bash future there are still a few questions Australian batting dynamo Steve Smith cant answer,News AU,2024-08-24T11:50:34.960528
Federers iconic tennis coach dead at 59,The tennis world has paid tribute after the man who coached Swiss maestro Roger Federer to his first Wimbledon title died,News AU,2024-08-24T11:50:34.960528
Aussies in 46year US Open first,Its been nearly half a century since there were as many Australians in the main draw of the US Open as there are now with two seeded men leading the charge,News AU,2024-08-24T11:50:34.960528
Darts prodigy is here to win in Australia,Luke Littler has taken the darts world by storm this year and the teenager is in Australia this week determined to continue his red hot form,News AU,2024-08-24T11:50:34.960528
Absolutely hate it Aussies in Paris drama,A new rule at the Olympics athletics events is sure to divide athletes and fans and produce high drama in Paris writes Sally Pearson,News AU,2024-08-24T11:50:34.960528
Astonishing rise set to flip F1 in 215m race,Daniel Ricciardo has been given a reality check as the urgency mounts at Red Bull amid a threehorse race to replace a struggling driver,News AU,2024-08-24T11:50:34.960528
Son of Aussie legends massive F1 promotion,Australia could have three drivers in Formula One next season after the son of an Aussie legend was promoted to the big time,News AU,2024-08-24T11:50:34.960528
Sleazy Hawk Tuah girls latest act slammed,A legendary US sports broadcaster has savaged the Hawk Tuah girl after the viral star continued to milk her 15 minutes of fame,News AU,2024-08-24T11:50:34.960528
Patty Mills 5m NBA lifeline revealed,A standout Olympic performance from Patty Mills has seemingly landed the 36yearold Aussie another lifeline to stay in the NBA,News AU,2024-08-24T11:50:34.960528
ExSocceroo returns to ALeague,Central Coast Mariners ALeague title defence will be boosted by the return of a former Socceroo,News AU,2024-08-24T11:50:34.960528
Socceroo extends stay at German club,On the eve of his likely Bundesliga debut a Socceroos star has secured his longterm future at his German club,News AU,2024-08-24T11:50:34.960528
How boxing helped Mazoudier out of mental health nightmare,Just days ahead of his payperview main event against Nikita Tszyu Koen Mazoudier has opened up on his drug and mental health anguish and how boxing saved him,News AU,2024-08-24T11:50:34.960528
Scotts 390m monster in 30m surge,Playing at high altitude in Colorado the worlds best golfers are smacking the ball a mile and the Aussie star didnt miss out,News AU,2024-08-24T11:50:34.960528
A SuperCoach NRL fans quick guide to SuperCoach NBL,If you love playing SuperCoach NRL youre going to have a blast with SuperCoach NBL Check out all the features you know and love and whats new,News AU,2024-08-24T11:50:34.960528
Folaus bombshell claims on viral post,Israel Folau has opened up about the social media post that ended his Wallabies career slamming the media and calling his treatment unfair,News AU,2024-08-24T11:50:34.960528
Wallaby keen to build on bittersweet comeback,Having finally made his return from injury a Wallabies prop wants to take his game to the next level on Australias tour of Argentina,News AU,2024-08-24T11:50:34.960528
Eliyass remains unbeaten in Australia with Premiers Cup victory,The Gai Waterhouse and Adrian Botttrained import Eliyass made it backtoback Australian stakes wins from as many starts in the Group 3 Premiers Cup at Randwick,News AU,2024-08-24T11:50:34.960528
Urgent safety recall for popular bike,An urgent recall has been issued for a popular bike after a flaw was detected that could lead to serious injury,News AU,2024-08-24T11:50:34.960528
