Title,Description,Source,Fetched Date,Combined Text,Score,Sentiment
Warren Buffett 94 stepping down as Berkshire Hathaway CEO,The veteran investor known as the Sage of Omaha told his companys annual meeting that he would hand over the reins to ViceChairman Greg Abel,BBC Business,2025-05-04T07:24:02.723606,warren buffett 94 stepping berkshire hathaway ceo . veteran investor known sage omaha told company annual meeting would hand rein vicechairman greg abel,0.4939,Positive
How Carneys election win will change direction of trade war,In his exclusive BBC interview the Canadian Prime Minister indicates how he plans to tackle Trump,BBC Business,2025-05-04T07:24:02.723606,carneys election win change direction trade war . exclusive bbc interview canadian prime minister indicates plan tackle trump,0.1027,Neutral
World of Business,Gain the leading edge with global insights for the boardroom and beyond in your inbox every Wednesday,BBC Business,2025-05-04T07:24:02.723606,world business . gain leading edge global insight boardroom beyond inbox every wednesday,0.5267,Positive
Elon Musks Starbase city in Texas on brink of becoming official,Local residents are voting on incorporating a patch of land as a new municipality with a SpaceX employee tipped to become mayor,BBC Business,2025-05-04T07:24:02.723606,elon musk starbase city texas brink becoming official . local resident voting incorporating patch land new municipality spacex employee tipped become mayor,0.0,Neutral
Wall Street stocks bounce back from Trump tariff losses,Investors were buoyed by a betterthanexpected jobs report and rising hope of USChina trade talks,BBC Business,2025-05-04T07:24:02.723606,wall street stock bounce back trump tariff loss . investor buoyed betterthanexpected job report rising hope uschina trade talk,0.1531,Neutral
Londons spiralling housing crisis in numbers,Research sets out the challenges and solutions to tackle the growing housing need in the capital,BBC Business,2025-05-04T07:24:02.723606,london spiralling housing crisis number . research set challenge solution tackle growing housing need capital,-0.128,Neutral
Are alcoholfree drinks worth the price in 2025,It can cost the same as traditional drinks but making a zero alcohol beverage is a complex process,BBC Business,2025-05-04T07:24:02.723606,alcoholfree drink worth price 2025. cost traditional drink making zero alcohol beverage complex process,0.2263,Neutral
Digital powerhouse Uber now accepts cash for fares,Taxi app giant Uber said trials showed some people preferred paying in cash or did not have a bank card,BBC Business,2025-05-04T07:24:02.723606,digital powerhouse uber accepts cash fare . taxi app giant uber said trial showed people preferred paying cash bank card,0.3804,Positive
Deported gang members get second chance at call centre,In the Mexican city of Tijuana a number of firms are employing people who were removed from the US,BBC Business,2025-05-04T07:24:02.723606,deported gang member get second chance call centre . mexican city tijuana number firm employing people removed u,0.3182,Positive
We dont care A defiant China looks beyond Trumps America,Chinese exporters tell the BBC if the US doesnt want their goods other countries have money to buy them,BBC Business,2025-05-04T07:24:02.723606,dont care defiant china look beyond trump america . chinese exporter tell bbc u doesnt want good country money buy,-0.5559,Negative
Highly unlikely for tariffs to be ratcheted up expert says,David Waddell says markets have sniffed out that there are reasons to be less pessimistic in this environment,BBC Business,2025-05-04T07:24:02.723606,highly unlikely tariff ratcheted expert say . david waddell say market sniffed reason less pessimistic environment,-0.2975,Negative
The exGoogle exec who wants to simplify your life,Marissa Mayer a former Google and Yahoo executive believes AI should simplify our lives,BBC Business,2025-05-04T07:24:02.723606,exgoogle exec want simplify life . marissa mayer former google yahoo executive belief ai simplify life,0.0772,Neutral
Tariffs on car parts entering the US come into force,Import taxes were eased after carmaker outcry but its still a big tariff analysts say,BBC Business,2025-05-04T07:24:02.723606,tariff car part entering u come force . import tax eased carmaker outcry still big tariff analyst say,-0.2732,Negative
US court rules exAbercrombie CEO unfit for trial,Mike Jeffries is mentally incompetent and will spend time in hospital to see if his condition improves a judge rules,BBC Business,2025-05-04T07:24:02.723606,u court rule exabercrombie ceo unfit trial . mike jeffries mentally incompetent spend time hospital see condition improves judge rule,-0.0772,Neutral
US jobs grow by more than expected despite tariff turmoil,Employers added 177000 roles in April as the jobs market continues to prove resilient,BBC Business,2025-05-04T07:24:02.723606,u job grow expected despite tariff turmoil . employer added 177000 role april job market continues prove resilient,0.2755,Positive
Temu to stop selling goods from China directly to US customers,The online marketplace says it will move to a local fulfillment model in the US with sales handled by locally based sellers,BBC Business,2025-05-04T07:24:02.723606,temu stop selling good china directly u customer . online marketplace say move local fulfillment model u sale handled locally based seller,0.1779,Neutral
MS supplier resorts to pen and paper after cyber attack,Whats going on behind the scenes in the aftermath of the cyber attack on MS,BBC Business,2025-05-04T07:24:02.723606,m supplier resort pen paper cyber attack . whats going behind scene aftermath cyber attack m,-0.7351,Negative
Coop cyber attack affects customer data firm admits after hackers contact BBC,The firm previously said there was no evidence that customer data was compromised,BBC Business,2025-05-04T07:24:02.723606,coop cyber attack affect customer data firm admits hacker contact bbc . firm previously said evidence customer data compromised,-0.2263,Neutral
Playing with FIRE How to quit work and retire in your 30s,A personal finance strategy popular among millennials is helping them to quit their job and retire decades early,BBC Business,2025-05-04T07:24:02.723606,playing fire quit work retire 30 . personal finance strategy popular among millennials helping quit job retire decade early,0.5267,Positive
Boomerang CEOs Do they ever succeed,Five years after being ousted from WeWork Adam Neumann wants to rebuy the nowbankrupt business,BBC Business,2025-05-04T07:24:02.723606,boomerang ceo ever succeed . five year ousted wework adam neumann want rebuy nowbankrupt business,0.5423,Positive
How industry leaders transformed their career,The BBCs Katty Kay has spoken to successful changemakers to ask what made them pivot in their career,BBC Business,2025-05-04T07:24:02.723606,industry leader transformed career . bbcs katty kay spoken successful changemakers ask made pivot career,0.5859,Positive
Women were the original beer brewers what changed,Today the beer industry is maledominated but it wasnt always so,BBC Business,2025-05-04T07:24:02.723606,woman original beer brewer changed . today beer industry maledominated wasnt always,0.3182,Positive
How waiting alters our perception of time,Expert advice on how to get through a waiting period,BBC Business,2025-05-04T07:24:02.723606,waiting alters perception time . expert advice get waiting period,0.0,Neutral
Do the superrich deserve their wealth,Should there be a cap on billionaires wealth and their inheritances,BBC Business,2025-05-04T07:24:02.723606,superrich deserve wealth . cap billionaire wealth inheritance,0.7506,Positive
Four simple hacks to succeed in every conversation,A career coach a choreographer a chef and a dragon boat captain offer advice on giving critical feedback,BBC Business,2025-05-04T07:24:02.723606,four simple hack succeed every conversation . career coach choreographer chef dragon boat captain offer advice giving critical feedback,0.5106,Positive
Solo and hybrid work Navigating our future and new normal,Covid19 reshaped the way we live and work We rethink solo working and explore the future of worklife,BBC Business,2025-05-04T07:24:02.723606,solo hybrid work navigating future new normal . covid19 reshaped way live work rethink solo working explore future worklife,0.0,Neutral
Can supersonic flight ever be sustainable,How a new era of quiet net zero supersonic airliners could revolutionise the aviation industry,BBC Business,2025-05-04T07:24:02.723606,supersonic flight ever sustainable . new era quiet net zero supersonic airliner could revolutionise aviation industry,0.0,Neutral
Commencement speech The surprising pitfall of your passions,Students are graduating in the US this week The commencement speeches might lead them into questionable choices,BBC Business,2025-05-04T07:24:02.723606,commencement speech surprising pitfall passion . student graduating u week commencement speech might lead questionable choice,0.4404,Positive
A desk full of descriptions for your work colleagues,These are the long lost words youve been waiting for to describe your colleagues,BBC Business,2025-05-04T07:24:02.723606,desk full description work colleague . long lost word youve waiting describe colleague,-0.3182,Negative
Veterinarian suicide rates are very high Why,Veterinarian professionals are committing suicide at a higher rate than the general population,BBC Business,2025-05-04T07:24:02.723606,veterinarian suicide rate high . veterinarian professional committing suicide higher rate general population,-0.8658,Negative
ASMR How whispering took over the internet,We meet the creators behind the current ASMR boom,BBC Business,2025-05-04T07:24:02.723606,asmr whispering took internet . meet creator behind current asmr boom,0.0,Neutral
Trump signs order to block funding to public radio,Trump alleged that both organisations have produced biased and partisan news coverage,BBC Business,2025-05-04T07:24:02.723606,trump sign order block funding public radio . trump alleged organisation produced biased partisan news coverage,-0.6124,Negative
Meta threatens to cut off Facebook in Nigeria over huge fines,The social media giant has challenged demands to pay 290m over regulatory violations,BBC Business,2025-05-04T07:24:02.723606,meta threatens cut facebook nigeria huge fine . social medium giant challenged demand pay 290m regulatory violation,-0.7269,Negative
Talks or no talks Who blinks first in USChina trade war,Donald Trump and Xi Jinping are locked in a game of chicken despite wanting the same outcome,BBC Business,2025-05-04T07:24:02.723606,talk talk blink first uschina trade war . donald trump xi jinping locked game chicken despite wanting outcome,-0.5994,Negative
Apple says most USbound iPhones no longer made in China,The technology giant says US tariffs will add around 900m to its costs this quarter,BBC Business,2025-05-04T07:24:02.723606,apple say usbound iphones longer made china . technology giant say u tariff add around 900m cost quarter,0.0,Neutral
MS working day and night over cyber attack,The boss of the retailer says he is really sorry for the disruption which caused it to pause its online operations,BBC Business,2025-05-04T07:24:02.723606,m working day night cyber attack . bos retailer say really sorry disruption caused pause online operation,-0.7559,Negative
Businesses count costs as India and Bangladesh impose trade restrictions,Relations between the countries have been sour for months but differences were mostly expressed verbally until now,BBC Business,2025-05-04T07:24:02.723606,business count cost india bangladesh impose trade restriction . relation country sour month difference mostly expressed verbally,-0.5106,Negative
Whats in the USUkraine resources deal,The BBCs analysis editor looks at what has been agreed in the muchanticipated agreement,BBC Business,2025-05-04T07:24:02.723606,whats usukraine resource deal . bbcs analysis editor look agreed muchanticipated agreement,0.6486,Positive
McDonalds sales drop as diners face uncertainty,The burger chain says its US customers are grappling with uncertainty,BBC Business,2025-05-04T07:24:02.723606,mcdonalds sale drop diner face uncertainty . burger chain say u customer grappling uncertainty,-0.7096,Negative
Xbox prices hiked worldwide amid tariff uncertainty,The company has pointed to increasing game development costs and market conditions,BBC Business,2025-05-04T07:24:02.723606,xbox price hiked worldwide amid tariff uncertainty . company pointed increasing game development cost market condition,-0.34,Negative
Dual Lawsuits Accuse and Deny Jos Menendezs Alleged Sexual Assaults of Menudo Members,Roy Rossell has filed a sweeping complaint against his former manager and the man holding some rights to the Latin groups songs is suing NBC over a 2023 docuseries,Hollywood Reporter,2025-05-04T07:24:03.490529,dual lawsuit accuse deny jos menendezs alleged sexual assault menudo member . roy rossell filed sweeping complaint former manager man holding right latin group song suing nbc 2023 docuseries,-0.9042,Negative
The Stars of White Lotus Yellowjackets and Star Trek Discovery Just Barnstormed Congress in the Name of Arts Funding,Trump wants the NEA gone So some of your favorite Hollywood actors were let loose on the Capitol to stop him think karaoke gauntlets to Republican staffers and Jason Isaacs getting teary,Hollywood Reporter,2025-05-04T07:24:03.490529,star white lotus yellowjackets star trek discovery barnstormed congress name art funding . trump want nea gone favorite hollywood actor let loose capitol stop think karaoke gauntlet republican staffer jason isaac getting teary,-0.0516,Neutral
Girl Group KATSEYE Returns With Gnarly Hyperpop Single,The HybeGeffen Records group whose formation through the competition series Dream Academy was documented in a Netflix documentary last year is back with a new experimental song,Hollywood Reporter,2025-05-04T07:24:03.490529,girl group katseye return gnarly hyperpop single . hybegeffen record group whose formation competition series dream academy documented netflix documentary last year back new experimental song,0.25,Positive
Beyonc Teaches Us to Expect the Unexpected During Cowboy Carter Tour Opening Week in Los Angeles,For night two the superstar added classics to her setlist including Single Ladies and Love on Top,Hollywood Reporter,2025-05-04T07:24:03.490529,beyonc teach u expect unexpected cowboy carter tour opening week los angeles . night two superstar added classic setlist including single lady love top,0.7184,Positive
PR Machine Expands With Launch of Influence Public Relations for Digital Talent Staff Promotions,Influence is cofounded by PR Machines Mike Liotta and Emily Baird the latter of whom will step down to become CEO at Influence while Rachel Hosseini and Grace Topalian are being upped at PR Machine,Hollywood Reporter,2025-05-04T07:24:03.490529,pr machine expands launch influence public relation digital talent staff promotion . influence cofounded pr machine mike liotta emily baird latter step become ceo influence rachel hosseini grace topalian upped pr machine,0.7184,Positive
PBS President Says Trumps Executive Order to End Funding Is Blatantly Unlawful,The Corporation for Public Broadcastings leadership doesnt get it either,Hollywood Reporter,2025-05-04T07:24:03.490529,pb president say trump executive order end funding blatantly unlawful . corporation public broadcasting leadership doesnt get either,0.0,Neutral
Fashion Designer Riccardo Tisci Accused of Drugging Sexually Assaulting New York Man in Legal Complaint,Tiscis rep said the allegations are categorically untrue in a statement,Hollywood Reporter,2025-05-04T07:24:03.490529,fashion designer riccardo tisci accused drugging sexually assaulting new york man legal complaint . tiscis rep said allegation categorically untrue statement,-0.7351,Negative
Prince Harry Loses Appeal Over UK Security Detail After Barristers Argued His Life Was At Stake,The ruling means that the Duke and Duchess of Sussex will receive a bespoke taxpayerfunded security service while in the UK,Hollywood Reporter,2025-05-04T07:24:03.490529,prince harry loses appeal uk security detail barrister argued life stake . ruling mean duke duchess sussex receive bespoke taxpayerfunded security service uk,-0.0,Neutral
Russell Brand Granted Bail at First London Court Hearing on Rape Sexual Assault Charges,The disgraced presenter charged with one count of rape one count of indecent assault one count of oral rape and two counts of sexual assault will have his next court appearance on May 30,Hollywood Reporter,2025-05-04T07:24:03.490529,russell brand granted bail first london court hearing rape sexual assault charge . disgraced presenter charged one count rape one count indecent assault one count oral rape two count sexual assault next court appearance may 30,-0.9839,Negative
Ed Sheeran Sets Play Release Date Drops Second Single Old Phone,I made this record all over the world finished it in Goa India and had some of the most fun explorative creative days of my life the singer wrote on Instagram,Hollywood Reporter,2025-05-04T07:24:03.490529,ed sheeran set play release date drop second single old phone . made record world finished goa india fun explorative creative day life singer wrote instagram,0.7579,Positive
Trump Signs Executive Order Directing Federal Funding Cuts to PBS and NPR,Its the latest move by the Trump administration to utilize federal powers to control or hamstring institutions whose actions or viewpoints he disagrees with,Hollywood Reporter,2025-05-04T07:24:03.490529,trump sign executive order directing federal funding cut pb npr . latest move trump administration utilize federal power control hamstring institution whose action viewpoint disagrees,-0.5267,Negative
Jack Antonoff Named ASCAPs Songwriter of the Year at 2025 Pop Awards,Teddy Swims Lose Control cowritten by ASCAP songwriter Joshua Ammo Coleman won pop song of the year,Hollywood Reporter,2025-05-04T07:24:03.490529,jack antonoff named ascaps songwriter year 2025 pop award . teddy swim lose control cowritten ascap songwriter joshua ammo coleman pop song year,0.2023,Neutral
Star knocked out cold in terrifying scenes,A Gold Coast Titans star was left in all sorts of trouble after being KOd in scary scenes after a tackle went wrong on Sunday,News AU,2025-05-04T07:24:04.960000,star knocked cold terrifying scene . gold coast titan star left sort trouble kod scary scene tackle went wrong sunday,-0.9136,Negative
Pure trash Fans savage world title fight,Boxing fans have been left seeing red after a world title fight turned into a joke of a contest as both men failed to fire a shot,News AU,2025-05-04T07:24:04.960000,pure trash fan savage world title fight . boxing fan left seeing red world title fight turned joke contest men failed fire shot,-0.7964,Negative
Salty dog War of words goes nuclear,Former teammates Bailey Smith and Marcus Bontempelli have traded verbal jabs as a fiery war explodes between the two stars,News AU,2025-05-04T07:24:04.960000,salty dog war word go nuclear . former teammate bailey smith marcus bontempelli traded verbal jab fiery war explodes two star,-0.8807,Negative
Police issue summons for disgraced AFL star,Disgraced footballer Tarryn Thomas is reportedly set to be charged by police after he was allegedly found in possession of an illegal substance,News AU,2025-05-04T07:24:04.960000,police issue summons disgraced afl star . disgraced footballer tarryn thomas reportedly set charged police allegedly found possession illegal substance,-0.886,Negative
Triggering Shades of grand final loss as Broncos dominated,The Penrith Panthers have found their fourtime premiership mojo while the Brisbane Broncos have blown plenty of chances in shades of their grand final loss,News AU,2025-05-04T07:24:04.960000,triggering shade grand final loss bronco dominated . penrith panther found fourtime premiership mojo brisbane bronco blown plenty chance shade grand final loss,0.5267,Positive
Tensions rise on the MCG as Hawks celebrate centenary,Theres plenty of feeling between Richmond and Hawthorn at the MCG with a big brawl eating up time in the second quarter but the Hawks are well and truly on top where it counts Follow live,News AU,2025-05-04T07:24:04.960000,tension rise mcg hawk celebrate centenary . there plenty feeling richmond hawthorn mcg big brawl eating time second quarter hawk well truly top count follow live,0.8271,Positive
Huge drugs bombshell rocks cricket,The World Test Championship final has been thrown into chaos with a star bowler confessing to a secret doping ban he is serving,News AU,2025-05-04T07:24:04.960000,huge drug bombshell rock cricket . world test championship final thrown chaos star bowler confessing secret doping ban serving,-0.4767,Negative
Harris century tops the charts in County Championship,A second century in four matches for former Test opener Marcus Harris has him averaging more than 100 in English County cricket,News AU,2025-05-04T07:24:04.960000,harris century top chart county championship . second century four match former test opener marcus harris averaging 100 english county cricket,0.5719,Positive
Wild scenes as courtside interview hijacked,A tennis star got caught in a lift and Coco Gauffs interview was cut short as Spains power outage caused havoc at the Madrid Open,News AU,2025-05-04T07:24:04.960000,wild scene courtside interview hijacked . tennis star got caught lift coco gauffs interview cut short spain power outage caused havoc madrid open,-0.7184,Negative
Sinner hit rock bottom due to doping saga,Twotime Australian Open champion Jannik Sinner is preparing to make his return to tennis after a threemonth ban and has spoken about the pain his doping saga has caused him,News AU,2025-05-04T07:24:04.960000,sinner hit rock bottom due doping saga . twotime australian open champion jannik sinner preparing make return tennis threemonth ban spoken pain doping saga caused,-0.4588,Negative
Legends verdict on brutal Billy Slater call,A Queensland legend has given his verdict on a big headache facing Maroons coach Billy Slater ahead of the State of Origin opener,News AU,2025-05-04T07:24:04.960000,legend verdict brutal billy slater call . queensland legend given verdict big headache facing maroon coach billy slater ahead state origin opener,-0.4404,Negative
Star threatens Piastri as feud erupts,Oscar Piastri has had his worst qualifying result of the year after a controversial incident that left a rival driver furious with the Australian,News AU,2025-05-04T07:24:04.960000,star threatens piastri feud erupts . oscar piastri worst qualifying result year controversial incident left rival driver furious australian,-0.9274,Negative
Race result overturned as chaos rocks F1,Oscar Piastris radio message said it all as the Miami Grand Prix sprint race descended into chaos with late penalties changing the final standings,News AU,2025-05-04T07:24:04.960000,race result overturned chaos rock f1 . oscar piastris radio message said miami grand prix sprint race descended chaos late penalty changing final standing,-0.8126,Negative
Reds remain winless in Fijian capital due to lastminute try,A final minute try has denied Queensland Reds a droughtbreaking win in Fiji and puts their chances of hosting a Super Rugby finals match in doubt,News AU,2025-05-04T07:24:04.960000,red remain winless fijian capital due lastminute try . final minute try denied queensland red droughtbreaking win fiji put chance hosting super rugby final match doubt,0.6486,Positive
Olympian returns to rugby as a man,Ellia Green an Olympic gold medallist and former NRLW competitor has made a comeback in a mens rugby competition,News AU,2025-05-04T07:24:04.960000,olympian return rugby man . ellia green olympic gold medallist former nrlw competitor made comeback men rugby competition,0.0,Neutral
Stadium left in shock after horror fall,A fan attending a Major League Baseball game was rushed to hospital after falling onto the playing field in a shocking scene,News AU,2025-05-04T07:24:04.960000,stadium left shock horror fall . fan attending major league baseball game rushed hospital falling onto playing field shocking scene,-0.7579,Negative
Aussie makes history wins major NBA award,He may have missed out on Defensive Player of the Year but Dyson Daniels could not be denied for his allround improvement in his first season at the Atlanta Hawks,News AU,2025-05-04T07:24:04.960000,aussie make history win major nba award . may missed defensive player year dyson daniel could denied allround improvement first season atlanta hawk,0.743,Positive
Frustration rage anger set in for Gunners after latest PL loss,Chasing momentum ahead of their Champions League semifinal Arsenals latest Premier League defeat left a sour taste in their managers mouth PREMIER LEAGUE WRAP,News AU,2025-05-04T07:24:04.960000,frustration rage anger set gunner latest pl loss . chasing momentum ahead champion league semifinal arsenal latest premier league defeat left sour taste manager mouth premier league wrap,-0.8957,Negative
City keen to exploit weak Sydney defence,Melbourne City has the chance to not only end Sydney FCs season on Saturday but also secure an AFC Champions League Elite spot,News AU,2025-05-04T07:24:04.960000,city keen exploit weak sydney defence . melbourne city chance end sydney fcs season saturday also secure afc champion league elite spot,0.7845,Positive
Aussie aura could end winning drought,The new Australian captain of the International Team for the Presidents Cup brings something special to the table,News AU,2025-05-04T07:24:04.960000,aussie aura could end winning drought . new australian captain international team president cup brings something special table,0.7269,Positive
