Title,Description,Source,Fetched Date,Combined Text,Score,Sentiment
End of an era NBA coaching great steps away,Stars of the NBA have paid tribute to Gregg Popovich after he brought one of the greatest NBA coaching careers in history to a close,News AU,2025-05-04T07:24:04.960000,end era nba coaching great step away . star nba paid tribute gregg popovich brought one greatest nba coaching career history close,0.8519,Positive
Doomben 10000 and Queensland Derby favourites trial on Monday at Randwick,Trainers John OShea and Tom Charlton will tune up some of their Queensland Winter Carnival big guns at Mondays set of Royal Randwick barrier trials,News AU,2025-05-04T07:24:04.960000,doomben 10000 queensland derby favourite trial monday randwick . trainer john oshea tom charlton tune queensland winter carnival big gun monday set royal randwick barrier trial,-0.4404,Negative
Olympian couples fatal fight about renos,A police interview with Rohan Dennis has revealed what happened in the tragic seconds before champion cyclist Melissa Hoskins death,News AU,2025-05-04T07:24:04.960000,olympian couple fatal fight reno . police interview rohan dennis revealed happened tragic second champion cyclist melissa hoskins death,-0.8442,Negative
Insane Dress steals show at Grand Prix,The model wife of a 300m star has stolen the spot light away from the celebrities that have flocked to the Miami Grand Prix,News AU,2025-05-04T07:24:04.960000,insane dress steal show grand prix . model wife 300m star stolen spot light away celebrity flocked miami grand prix,-0.4767,Negative
All hell breaks loose after car crash interview,NFL icon Bill Belichick has come out in defence of his 24yearold girlfriend after she intervened in a controversial TV interview,News AU,2025-05-04T07:24:04.960000,hell break loose car crash interview . nfl icon bill belichick come defence 24yearold girlfriend intervened controversial tv interview,-0.875,Negative
