Title,Description,Source,Fetched Date
HBO and CNN owner to split streaming and cable businesses,The media giant will separate its studio and streaming business away from its cable TV networks,BBC Business,2025-06-10T07:27:42.247190
Chinas electric cars are becoming slicker and cheaper but is there a deeper cost,The future for EVs will inevitably involve China But where does that leave the UK and Europe markets and what of the questions around national security,BBC Business,2025-06-10T07:27:42.247190
World of Business,Gain the leading edge with global insights for the boardroom and beyond in your inbox every Wednesday,BBC Business,2025-06-10T07:27:42.247190
I burst into tears How airline carryon confusion triggered legal row,Budget airlines may be forced to standardise rules on underseat bags under a proposed change to EU law,BBC Business,2025-06-10T07:27:42.247190
How Indias biggest art deal buried MF Husain masterpieces in a bank vault,The paintings are set to go up for auction for the first time on 12 June in Indias financial capital Mumbai,BBC Business,2025-06-10T07:27:42.247190
US and China meet for trade talks in London,Fresh talks aimed at resolving the trade war between the worlds two largest economies are taking place,BBC Business,2025-06-10T07:27:42.247190
Canada pledges to meet Natos 2 defence spending target within a year,Prime Minister Mark Carney said Canada could no longer be dependent on the US for its security and must act to secure its own borders,BBC Business,2025-06-10T07:27:42.247190
TrumpMusk row heightens fears over Nasa budget cuts,The space agency has published its budget request to Congress which would see funding for science projects cut by nearly a half,BBC Business,2025-06-10T07:27:42.247190
How airline fees have turned baggage into billions,The amount carriers now charge for luggage is raising the ire of politicians and consumer groups,BBC Business,2025-06-10T07:27:42.247190
US green energy firms brace for federal funding cuts,Billions of dollars of US federal funding for green energy projects hangs in the balance,BBC Business,2025-06-10T07:27:42.247190
Pressure on as USChina resume trade talks 9 Jun 2025,Markets react well as negotiators from Washington and Beijing meet in London to find a way forward,BBC Business,2025-06-10T07:27:42.247190
Drone shows are booming Could this spell the end for fireworks,Light shows involving hundreds and even thousands of drones are becoming big attractions,BBC Business,2025-06-10T07:27:42.247190
Britains energy bills problem and why firms are paid huge sums to stop producing power,Could the governments radical plan to change the way the UK distributes electricity really bring down bills or just lead to a postcode lottery,BBC Business,2025-06-10T07:27:42.247190
Will Musks explosive row with Trump help or harm his businesses,Experts say his tech empire needs more of Musks attention but also the continued custom of the government,BBC Business,2025-06-10T07:27:42.247190
Spending Review Massive cheques from the UK chancellor for some but what do totals hide,The total spend may be enormous writes Laura Kuenssberg but fears it could be painful for some remain,BBC Business,2025-06-10T07:27:42.247190
How Trump and Musk are still linked despite falling out,Political contributions government contracts and staff with divided loyalties mean the fallout may have only just begun,BBC Business,2025-06-10T07:27:42.247190
On board the driverless lorries hoping to transform Chinas transport industry,Driverless lorries are now operating across China but public concern about these vehicles remains,BBC Business,2025-06-10T07:27:42.247190
The decadesold intrigue over an Indian guest house in Mecca,A nowdemolished guest house in Mecca is at the centre of a bitter family tussle in India,BBC Business,2025-06-10T07:27:42.247190
Playing with FIRE How to quit work and retire in your 30s,A personal finance strategy popular among millennials is helping them to quit their job and retire decades early,BBC Business,2025-06-10T07:27:42.247190
Boomerang CEOs Do they ever succeed,Five years after being ousted from WeWork Adam Neumann wants to rebuy the nowbankrupt business,BBC Business,2025-06-10T07:27:42.247190
How industry leaders transformed their career,The BBCs Katty Kay has spoken to successful changemakers to ask what made them pivot in their career,BBC Business,2025-06-10T07:27:42.247190
Women were the original beer brewers what changed,Today the beer industry is maledominated but it wasnt always so,BBC Business,2025-06-10T07:27:42.247190
How waiting alters our perception of time,Expert advice on how to get through a waiting period,BBC Business,2025-06-10T07:27:42.247190
Do the superrich deserve their wealth,Should there be a cap on billionaires wealth and their inheritances,BBC Business,2025-06-10T07:27:42.247190
Four simple hacks to succeed in every conversation,A career coach a choreographer a chef and a dragon boat captain offer advice on giving critical feedback,BBC Business,2025-06-10T07:27:42.247190
Solo and hybrid work Navigating our future and new normal,Covid19 reshaped the way we live and work We rethink solo working and explore the future of worklife,BBC Business,2025-06-10T07:27:42.247190
Can supersonic flight ever be sustainable,How a new era of quiet net zero supersonic airliners could revolutionise the aviation industry,BBC Business,2025-06-10T07:27:42.247190
Commencement speech The surprising pitfall of your passions,Students are graduating in the US this week The commencement speeches might lead them into questionable choices,BBC Business,2025-06-10T07:27:42.247190
A desk full of descriptions for your work colleagues,These are the long lost words youve been waiting for to describe your colleagues,BBC Business,2025-06-10T07:27:42.247190
Veterinarian suicide rates are very high Why,Veterinarian professionals are committing suicide at a higher rate than the general population,BBC Business,2025-06-10T07:27:42.247190
ASMR How whispering took over the internet,We meet the creators behind the current ASMR boom,BBC Business,2025-06-10T07:27:42.247190
India central bank delivers sharp rate cut as growth and inflation fall,Indias economy grew by 65 in the previous financial year ending March data last week showed,BBC Business,2025-06-10T07:27:42.247190
MS hackers sent abuse and ransom demand directly to CEO,The criminals told the retailers boss he could make things fast and easy if he complied with their demands,BBC Business,2025-06-10T07:27:42.247190
Tesla shares tumble as TrumpMusk feud erupts,Tesla shares plunged 14 marking one of the steepest declines in months as Musk and Trump battled online,BBC Business,2025-06-10T07:27:42.247190
India leads in remittances but Trumps tax could deal a blow,Trumps proposed 35 tax on remittances by foreign workers could seriously impact top recipient India,BBC Business,2025-06-10T07:27:42.247190
Lululemon shares plunge as Trump tariffs bite,The athleisure brand joins a growing list of big firms to warn about the impact of Trumps policies,BBC Business,2025-06-10T07:27:42.247190
Dr Martens profits slump by more than 90,The company says a challenging market and uncertainty about tariffs are having an effect,BBC Business,2025-06-10T07:27:42.247190
Tariffs prompt record plunge in US imports,American purchases of Canadian goods in April fell to the lowest level since 2021,BBC Business,2025-06-10T07:27:42.247190
Trump confirms China trip after very good call with Xi,The leaders of the US and China agree to further talks aimed at reaching a deal amid an ongoing trade war,BBC Business,2025-06-10T07:27:42.247190
USBoeing deal over crashes repugnant lawyer for victims families,The plane maker has agreed to pay 11bn to avoid prosecution over two fatal crashes that killed 346 people,BBC Business,2025-06-10T07:27:42.247190
Doechii Calls Out Trumps Ruthless Attacks Amid LA Protests in BET Speech What Type of Government Is That,I want yall to consider what kind of government it appears to be when every time we exercise our democratic right to protest the military is deployed against us the Alter Ego rapper said Monday night,Hollywood Reporter,2025-06-10T07:27:42.552669
Thank You Sly Stone,The journalist who got the late funk legend to break his decadeslong silence pays tribute to his indelible message of hope needed now more than ever,Hollywood Reporter,2025-06-10T07:27:42.552669
BET Awards 2025 Snoop Dogg Keke Palmer Tyler Perry and More Stars Walk the Carpet,Host Kevin Hart Doechii Machine Gun Kelly Shaboozey Jordin Sparks and Andra Day also attended the awards ceremony in Los Angeles on Monday,Hollywood Reporter,2025-06-10T07:27:42.552669
Vin Diesel and Laverne Cox Among Speakers at 2025 CAA Amplify Summit,ACLU executive director Anthony Romero former prime minister of New Zealand Dame Jacinda Ardern and CEO of Microsoft AI Mustafa Suleyman will also head to Laguna Beach for the annual summit,Hollywood Reporter,2025-06-10T07:27:42.552669
Diddys Ex Passed Out After Reading Cassies Lawsuit Describing FreakOff Orgies,The rap moguls girlfriend until his arrest in September continued to testify on Monday about alleged abuse gaslighting and finding her agency as the relationship declined,Hollywood Reporter,2025-06-10T07:27:42.552669
Questlove Remembers Sly Stone He Dared to Be Simple in the Most Complex Ways,The Grammywinning musician produced and directed a documentary on Stones life and legacy,Hollywood Reporter,2025-06-10T07:27:42.552669
Sly Stone FunkRock Pioneer Dies at 82,The legendary artist died following a prolonged battle with COPD his family said Monday,Hollywood Reporter,2025-06-10T07:27:42.552669
Frederick Forsyth Author of The Day of the Jackal Dies at 86,The British journalist turned novelist wrote other thrillers that became movies too including The Odessa File The Dogs of War and The Fourth Protocol,Hollywood Reporter,2025-06-10T07:27:42.552669
Jared Letos Rep Denies Claims of Inappropriate Relationships With Women,The investigation published Saturday by Air Mail contains interviews with nine women the majority of whom are anonymous and allege that Leto behaved inappropriately with them more than a decade ago,Hollywood Reporter,2025-06-10T07:27:42.552669
Justin Baldonis 400 Million Defamation Lawsuit Against Blake Lively Tossed Out,In a major victory for Lively and husband Ryan Reynolds a New York federal judge has sided with the actress in a messy legal battle involving her It Ends With Us director and costar whom she accused of alleged sexual harassment and weaponizing social media,Hollywood Reporter,2025-06-10T07:27:42.552669
Taylor Swifts Reputation Album Surges Back to Top Five on Charts Following Masters Purchase,Swifties have come in full force streaming Swifts old albums after the superstar announced shed purchased her old catalog,Hollywood Reporter,2025-06-10T07:27:42.552669
Jurors Raise Concerns About Harvey Weinstein Deliberations,His attorney Arthur Aidala has repeatedly called for a mistrial and been denied as he said jurors are improperly considering Weinsteins past behavior,Hollywood Reporter,2025-06-10T07:27:42.552669
