Title,Description,Source,Fetched Date,Combined Text,Score,Sentiment
History rides against Socceroos in crucial clash with Japan,History is against the Socceroos but Australia could spring an almighty upset if a piece of Tony Popovics past can be recreated when they face Japan Follow the action here live tonight,News AU,2024-10-15T07:24:36.628887,history ride socceroos crucial clash japan . history socceroos australia could spring almighty upset piece tony popovics past recreated face japan follow action live tonight,-0.3818,Negative
Victory star eager to get better,One of Melbourne Victorys star players has had to adjust to the different tactics of the clubs new coach,News AU,2024-10-15T07:24:36.628887,victory star eager get better . one melbourne victory star player adjust different tactic club new coach,0.6597,Positive
Everything you need to know about Tszyu vs Murtazaliev,Tim Tszyu s loss against Sebastian Fundora is behind him now he is ready for redemption against undefeated Russian fighter Bakhram Murtazaliev Here is your ultimate guide to the world title fight,News AU,2024-10-15T07:24:36.628887,everything need know tszyu v murtazaliev . tim tszyu loss sebastian fundora behind ready redemption undefeated russian fighter bakhram murtazaliev ultimate guide world title fight,-0.2023,Neutral
SA star comes up clutch to win in second playoff hole at WA PGA,It took a second suddendeath playoff hole to split South Australian Jack Buchanan and West Australian Jordan Doull in an epic finish to the WA PGA Championship,News AU,2024-10-15T07:24:36.628887,sa star come clutch win second playoff hole wa pga . took second suddendeath playoff hole split south australian jack buchanan west australian jordan doull epic finish wa pga championship,0.7717,Positive
NBL late mail Two Breakers injured SuperCoach star signs on,New Zealand is the goto team for trades this week but two players wont be fronting up for the round 5 double Plus some big news on a very big name in SuperCoach,News AU,2024-10-15T07:24:36.628887,nbl late mail two breaker injured supercoach star sign . new zealand goto team trade week two player wont fronting round 5 double plus big news big name supercoach,-0.4019,Negative
Im ready Sad sight for NRL lovers,Less than a month after playing in an NRL preliminary final the newest multimilliondollar signing for Australian rugby declared himself ready to wear Wallaby gold,News AU,2024-10-15T07:24:36.628887,im ready sad sight nrl lover . less month playing nrl preliminary final newest multimilliondollar signing australian rugby declared ready wear wallaby gold,0.7369,Positive
Arrest warrant out for exWallabies captain,An international arrest warrant has been issued for a Wallabies captain over his conduct during his time in charge of a French club,News AU,2024-10-15T07:24:36.628887,arrest warrant exwallabies captain . international arrest warrant issued wallaby captain conduct time charge french club,-0.5859,Negative
Pressure wont Warp Japanese Caulfield Cup contender,Nobody at Caulfield was able to miss Japanese Caulfield Cup hopeful Warp Speed as the stayer completed his preparation with a look at the venue for Saturdays 5m challenge,News AU,2024-10-15T07:24:36.628887,pressure wont warp japanese caulfield cup contender . nobody caulfield able miss japanese caulfield cup hopeful warp speed stayer completed preparation look venue saturday 5m challenge,0.3182,Positive
Teen cyclist dead after horror incident,The cycling community has been rocked with news of an 18yearold dying following a horror incident at the world championships,News AU,2024-10-15T07:24:36.628887,teen cyclist dead horror incident . cycling community rocked news 18yearold dying following horror incident world championship,-0.8689,Negative
