Title,Description,Source,Fetched Date
Update on teen in coma after footy match,The family of a 17yearold footballer has given an update after the teen was flown to hospital when a local footy match turned violent,News AU,2024-09-16T07:22:50.841617
Cat returns with scars of horror injury,The 50 staples running across the top of his head at training on Monday showed just how severe Gary Rohans skull injury was,News AU,2024-09-16T07:22:50.841617
Tedescos warning to JWH ahead of return,The Roosters were well beaten in the middle by Penrith but the return of Jared WaereaHargreaves should fix that as long as he doesnt lose his cool,News AU,2024-09-16T07:22:50.841617
Aussies add firepower after T20 washout,Rain prevented Australia from winning the T20 series against England and the bigname reinforcements are arriving to make up for that in the ODO series,News AU,2024-09-16T07:22:50.841617
England level series Short claims five in defeat,Liam Livingstone has steered England towards a threewicket victory in the second T20I against Australia at Sophia Gardens to level the series But there was an unexpected shining star with the ball in defeat,News AU,2024-09-16T07:22:50.841617
New high for Aussie rising star,The first Australian to make a WTA 500 singles final since Ash Barty fell just short of victory but will walk away from Mexico with a special new title,News AU,2024-09-16T07:22:50.841617
Aussies defy ridiculous schedule for Davis Cup dream,The likely return of injured star Alex de Minaur will only bolster Australias Davis Cup bid after captain Lleyton Hewitts team made the finals without him,News AU,2024-09-16T07:22:50.841617
Darts prodigy is here to win in Australia,Luke Littler has taken the darts world by storm this year and the teenager is in Australia this week determined to continue his red hot form,News AU,2024-09-16T07:22:50.841617
Absolutely hate it Aussies in Paris drama,A new rule at the Olympics athletics events is sure to divide athletes and fans and produce high drama in Paris writes Sally Pearson,News AU,2024-09-16T07:22:50.841617
Astonishing rise set to flip F1 in 215m race,Daniel Ricciardo has been given a reality check as the urgency mounts at Red Bull amid a threehorse race to replace a struggling driver,News AU,2024-09-16T07:22:50.841617
Simply phenomenal Piastri stuns F1 world,Australian Oscar Piastri has claimed his second Formula 1 Grand Prix victory after the Azerbaijan Grand Prix ended in chaotic scenes,News AU,2024-09-16T07:22:50.841617
Actor killing himself over transformation,A hulking Hollywood actor has spoken out about the lengths hes been going to in order to keep his new toned down look going,News AU,2024-09-16T07:22:50.841617
Actor breaks silence on body transformation,A WWE legend turned Hollywood star has opened up on his transformation that left fans seriously concerned for his health,News AU,2024-09-16T07:22:50.841617
Alleged doublekiller breaks down in court,The man charged over the deaths of ice hockey star Johnny Gaudreau and his brother has burst into tears as a judge handed down a decision,News AU,2024-09-16T07:22:50.841617
Burrows Bengals aim to bounce back against Chiefs,Joe Burrow and the Cincinnati Bengals are aiming to avoid a second NFL defeat this weekend but in their way are Patrick Mahomes and the Chiefs,News AU,2024-09-16T07:22:50.841617
Key pair closing in on Socceroos recall,Socceroos coach Graham Arnold is likely to have more selection options for next months games against China and Japan,News AU,2024-09-16T07:22:50.841617
Brazilian star ready to shine in new strip,Sydney FCs star signing Douglas Costa has promised to deliver for the Sky Blues,News AU,2024-09-16T07:22:50.841617
Champion stunned in onesided UFC bout,Suga Sean OMalley has suffered a devastating loss to Georgian Merab Dvalishvili in a onesided contest at the Sphere in Las Vegas,News AU,2024-09-16T07:22:50.841617
Scotts bold plan to be like Tiger,After becoming Australias highestranked male golfer again aged 44 Adam Scott has a bold plan for one of the sports biggest tournaments,News AU,2024-09-16T07:22:50.841617
No Go Zone Injuries suspensions strike top SuperCoach stars,Reverse trades now A host of popular SuperCoach players are either out or have question marks hanging over them for the start of the season,News AU,2024-09-16T07:22:50.841617
Shock response to record Wallabies loss,A shellacking in Argentina for the Wallabies hasnt resulted in mass changes for the next even more imposing challenge,News AU,2024-09-16T07:22:50.841617
Epsom weight not a Bridge too far for Celestial Legend,In a shock spring carnival program switch Hall of Fame trainer Les Bridge is considering aiming Celestial Legend at the Group 1 15 million Epsom Handicap,News AU,2024-09-16T07:22:50.841617
Incredible Aussie trio make cycling history,One Australian on the podium at the end of a cycling grand tour is an achievement but three in Spain made for an historic day,News AU,2024-09-16T07:22:50.841617
