Title,Description,Source,Fetched Date
Why is China spending billions to get people to open their wallets,Beijing hopes better wages and discounts can enocurage spending and stave off greater economic trouble,BBC Business,2025-03-18T07:25:32.354926
Trade turmoil forecast to slash growth in Canada and Mexico,Trumps tariffs will hit its biggest steel trading partners economies the most the OECD predicts,BBC Business,2025-03-18T07:25:32.354926
World of Business,Gain the leading edge with global insights for the boardroom and beyond in your inbox every Wednesday,BBC Business,2025-03-18T07:25:32.354926
Jonathan Anderson steps down as creative director of Loewe,Jonathan Anderson thanks Loewe as he departs the Spanish luxury fashion house after 11 years,BBC Business,2025-03-18T07:25:32.354926
Small electric cars were said to be the future but SUVs now rule the road,Despite dire predictions of climate breakdown more Sports Utility Vehicles are being spotted on and off the roads,BBC Business,2025-03-18T07:25:32.354926
King meets Carney in symbolic support for Canada,The King who is also head of state of Canada meets the countrys new prime minister Mark Carney amid a trade war with the US,BBC Business,2025-03-18T07:25:32.354926
Trump moves to close down Voice of America,More than 1300 staff placed on administrative leave as White House accuses VOA of being antiTrump radical and leftist,BBC Business,2025-03-18T07:25:32.354926
Forever 21 operator files for bankruptcy in the US,US stores will remain open as Forever 21s operating company begins its process of winding down,BBC Business,2025-03-18T07:25:32.354926
Im a little angry Canadian firms boycott US products,Canadian firms say there is a need for more homegrown production after tariffs imposed by the US sparked a trade war,BBC Business,2025-03-18T07:25:32.354926
Week in Markets 14 March 2025,A weekly summary of the big stories from financial markets around the world,BBC Business,2025-03-18T07:25:32.354926
NYSE Opening Bell,Watch the latest from BBCs new daily business programme coming from the heart of New Yorks financial district,BBC Business,2025-03-18T07:25:32.354926
The exGoogle exec who wants to simplify your life,Marissa Mayer a former Google and Yahoo executive believes AI should simplify our lives,BBC Business,2025-03-18T07:25:32.354926
US government shutdown averted as Senate passes spending bill,The passage of the funding bill came hours before a shutdown with Democrats under fierce pressure to oppose the measure,BBC Business,2025-03-18T07:25:32.354926
Clothes brand gets 100 complaints a day that models are too fat,Snag clothing is cited in an online debate over whether adverts showing models who appear unhealthily fat should be banned,BBC Business,2025-03-18T07:25:32.354926
Musk says first mission to Mars will launch next year,The billionaire says an unmanned mission by his SpaceX Starship vehicle will be followed by human landings as early as 2029,BBC Business,2025-03-18T07:25:32.354926
Its not a competition The collaborative video game loved by players,Josef Fares has found big success with cooperative two player games Why arent others doing the same,BBC Business,2025-03-18T07:25:32.354926
Germany is back says Merz after historic spending deal,Germanys conservative leader clinches an major financial agreement ahead of a crunch vote in parliament,BBC Business,2025-03-18T07:25:32.354926
Does cutting UK benefits work,The government is to set out details of how it will save billions of pounds from the working welfare bill,BBC Business,2025-03-18T07:25:32.354926
Playing with FIRE How to quit work and retire in your 30s,A personal finance strategy popular among millennials is helping them to quit their job and retire decades early,BBC Business,2025-03-18T07:25:32.354926
Boomerang CEOs Do they ever succeed,Five years after being ousted from WeWork Adam Neumann wants to rebuy the nowbankrupt business,BBC Business,2025-03-18T07:25:32.354926
How industry leaders transformed their career,The BBCs Katty Kay has spoken to successful changemakers to ask what made them pivot in their career,BBC Business,2025-03-18T07:25:32.354926
Women were the original beer brewers what changed,Today the beer industry is maledominated but it wasnt always so,BBC Business,2025-03-18T07:25:32.354926
How waiting alters our perception of time,Expert advice on how to get through a waiting period,BBC Business,2025-03-18T07:25:32.354926
Do the superrich deserve their wealth,Should there be a cap on billionaires wealth and their inheritances,BBC Business,2025-03-18T07:25:32.354926
Four simple hacks to succeed in every conversation,A career coach a choreographer a chef and a dragon boat captain offer advice on giving critical feedback,BBC Business,2025-03-18T07:25:32.354926
Solo and hybrid work Navigating our future and new normal,Covid19 reshaped the way we live and work We rethink solo working and explore the future of worklife,BBC Business,2025-03-18T07:25:32.354926
Can supersonic flight ever be sustainable,How a new era of quiet net zero supersonic airliners could revolutionise the aviation industry,BBC Business,2025-03-18T07:25:32.354926
Commencement speech The surprising pitfall of your passions,Students are graduating in the US this week The commencement speeches might lead them into questionable choices,BBC Business,2025-03-18T07:25:32.354926
ASMR How whispering took over the internet,We meet the creators behind the current ASMR boom,BBC Business,2025-03-18T07:25:32.354926
A desk full of descriptions for your work colleagues,These are the long lost words youve been waiting for to describe your colleagues,BBC Business,2025-03-18T07:25:32.354926
Veterinarian suicide rates are very high Why,Veterinarian professionals are committing suicide at a higher rate than the general population,BBC Business,2025-03-18T07:25:32.354926
How Britains former top banker became Canadas prime minister,The former banker may not have been elected to office before but his experience managing global economic crises will help,BBC Business,2025-03-18T07:25:32.354926
Musks Tesla raises concern over Trump tariffs,The electric carmakers warning about tariffs comes despite its bosss key position in the Trump administration,BBC Business,2025-03-18T07:25:32.354926
Apple encrypted data row hearing begins in secret,The BBC along with civil liberties groups and some US politicians argue the case should be heard in public,BBC Business,2025-03-18T07:25:32.354926
Gold price hits 3000 as trade tensions mount,Demand for the precious metal has surged amid economic uncertainty over the impact of the global trade war,BBC Business,2025-03-18T07:25:32.354926
The unexpected knockon effect of Trumps minerals deal of the century,The president once derided attempts to develop new green technology as a green new scam but his deal could help boost the USs potential in the sector,BBC Business,2025-03-18T07:25:32.354926
UK economy shrank unexpectedly in January,A slowdown in manufacturing was one of the main reasons for the dip the Office for National Statistics says,BBC Business,2025-03-18T07:25:32.354926
Every McDonalds in UK warned over staff sexual abuse,The warning from the UKs equality watchdog comes after the extremely serious allegations uncovered by the BBC,BBC Business,2025-03-18T07:25:32.354926
The bluntspeaking Canadian taking his fight with Trump to Washington,Doug Ford meets Trumps top trade adviser as relations between the two countries hits a new low,BBC Business,2025-03-18T07:25:32.354926
Car sharing switches to electric to boost appeal,Car sharing has not taken off but will electric cars boost its appeal,BBC Business,2025-03-18T07:25:32.354926
iHeartRadio Music Awards Winners Billie Eilish and Finneas Take Album of the Year,Taylor Swift Benson Boone SZA GloRilla Sabrina Carpenter and Green Day also were among the winners during Monday nights show,Hollywood Reporter,2025-03-18T07:25:33.297643
ExCNN Anchor Don Lemon Reveals He Was Sexually Harassed by Women While at Network,While appearing on Bill Mahers podcast this weekend the veteran broadcaster shared a dark piece of his past as he explained his thoughts on gender and power dynamics,Hollywood Reporter,2025-03-18T07:25:33.297643
Lady Gaga Unleashes Mayhem On Albums Chart With No 1 Debut,The seventh such feat for Gaga comes as Kendrick Lamar and SZAs Luther spent a fourth week atop the Hot 100,Hollywood Reporter,2025-03-18T07:25:33.297643
SXSW Clarifies Changes to 2026 Music Conference,Next years edition of the festival will be two days shorter as SXSWs music programming will take place throughout the week,Hollywood Reporter,2025-03-18T07:25:33.297643
Neil Young Will Stop Selling Platinum Tickets for Concerts Says The Cures Robert Smith Inspired Him,I have a choice to make and can make a difference for my music loving friends Young wrote on his website,Hollywood Reporter,2025-03-18T07:25:33.297643
Civil Liberties Report Calls Out Italy Hungary for Media Freedom Violations,Giorgia Melonis government has shown heavy intolerance to media criticism the report finds calling out unprecedented levels of interference in public service media,Hollywood Reporter,2025-03-18T07:25:33.297643
Will Smith Announces Imminent Release Date for His First Album in 20 Years,The Oscarwinning actor who is still notorious for The Slap is moving back to his roots in radiofriendly hiphop with a record on March 28,Hollywood Reporter,2025-03-18T07:25:33.297643
How Gene and Betsy Hackmans Dog Died Revealed In New Report,There was no evidence of infectious disease trauma or poisoning that could have resulted in death according to a New Mexico Department of Agriculture report,Hollywood Reporter,2025-03-18T07:25:33.297643
Kanye West Drops New Song Seemingly Featuring Diddy and Daughter North,In a sincedeleted text conversation posted on Wests X account Kim Kardashian allegedly attempted to stop the release of the song,Hollywood Reporter,2025-03-18T07:25:33.297643
Playboi Cartis New Album Music Breaks Spotify Record,Cartis MUSIC is already making history the audio streaming giant wrote on social media,Hollywood Reporter,2025-03-18T07:25:33.297643
President Trump Signs Order to Cut Staff at Voice of America,Other US funded media organizations will be cut as well,Hollywood Reporter,2025-03-18T07:25:33.297643
PVRIS Releases 10Year Anniversary Edition of Debut Album White Noise Featuring Spiritboxs Courtney LaPlante,Lynn Gunn the bands frontwoman is now touring the anniversary album,Hollywood Reporter,2025-03-18T07:25:33.297643
Disgruntled NRL star has to pay to leave club,The Dragons have agreed to release a disgruntled player immediately following a club dispute with a staff member but theres a catch,News AU,2025-03-18T07:25:35.393254
Horrendous Melb suburbs huge gripe,The median house price here is 26m and the beach is a short walk away Its paradise for 11 months of the year,News AU,2025-03-18T07:25:35.393254
NRL club swings axe as stars mount comeback,One NRL club is breathing a sigh of relief while one coach has dropped the axe and others have rung the changes for round 2,News AU,2025-03-18T07:25:35.393254
Sea Eagles duo cleared Bulldogss replacement revealed,Its good news for a couple of Sea Eagles stars but team list Tuesday has thrown up some major shocks in the halves at a couple of desperate clubs,News AU,2025-03-18T07:25:35.393254
AFL Now Archers tribunal fate revealed Tiger and Hawk to come,North Melbourne youngster Jackson Archer attempted to overturn his threegame ban at the tribunal tonight See how he fared and follow more footy news live here,News AU,2025-03-18T07:25:35.393254
Newman underworld figure drop bombshell,Sam Newman has aired an extraordinary conspiracy theory and hit out over a video showing him with an infamous Melbourne figure,News AU,2025-03-18T07:25:35.393254
Prodigy still learning in breakout summer,A Victorian prodigy has announced himself as a future star with a breakout state season but he insists he has plenty more to learn,News AU,2025-03-18T07:25:35.393254
Its crazy Batting miracle keeps final hopes alive,Bonus points could be the deciding factor in who faces South Australia in the Sheffield Shield final and a trio of Queenslanders helped their state rack up crucial ones,News AU,2025-03-18T07:25:35.393254
Tennis loses it over teens savage death note,TV cameras have captured the brutal homework notes written by tennis newest teen phenom as she make made history against the world No 1,News AU,2025-03-18T07:25:35.393254
Tennis rocked by world No 1s putrid act,Tennis star Iga Swiatek has been booed by spectators after smashing a ball at a ball boy in an ugly act of sportsmanship,News AU,2025-03-18T07:25:35.393254
Disgusting accusations after Gout Gout feat,Australian athletics great John Steffensen has spoken out about the disgusting accusations made towards teen sensation Gout Gout,News AU,2025-03-18T07:25:35.393254
Stars dad puts heartless F1 boss to shame,A Red Bull rookie was in tears when his Australian GP ended in heartbreaking fashion but his team boss had zero sympathy for the youngster,News AU,2025-03-18T07:25:35.393254
International manhunt for exWallabies star,An international manhunt is underway after a former Wallabies captain was given a prison sentence while his location is unknown,News AU,2025-03-18T07:25:35.393254
Wallabies star remains loyal to Reds,One of the worlds best flankers is staying with the Queensland Reds for another three years,News AU,2025-03-18T07:25:35.393254
Pro wrestler dead after collapsing in the ring,The beloved pro wrestler has passed away aged 39 after suffering a medical emergency during a match on Sunday,News AU,2025-03-18T07:25:35.393254
Giddey in line for truly eyewatering payday,Australias Josh Giddey is set for a massive payday in the offseason after producing hot streak that could earn him an absolute fortune,News AU,2025-03-18T07:25:35.393254
The mindset helping Lions deal with adversity,Having overcome a host of problems to win last years AFL premiership the Brisbane Lions continue to show a steely mentality in their bid for another flag,News AU,2025-03-18T07:25:35.393254
Recalled Roo itching for an opportunity,Socceroos appearances for leftback Jason Davidson have been few and far in between since the 2015 AFC Asian Cup,News AU,2025-03-18T07:25:35.393254
UFC stars embarrassing wardrobe blunder,UFC fighter Marvin Vettori infamously attended a photoshoot with his pants on backwards but Sundays wardrobe topped that,News AU,2025-03-18T07:25:35.393254
I was stunned Underdogs nightmare as Rory wins Players decider,Rory McIlroy has cruised to a St Patricks Day victory at the Players Championship defeating JJ Spaun in a nervy threehole playoff at TPC Sawgrass after the American imploded,News AU,2025-03-18T07:25:35.393254
Tatum fumes as United pounce on Hawks injury to take game 3,It will go down as one of the great wins in Melbourne United history but Illawarra coach Justin Tatum was left fuming after what he thought was the visitors preying on a Hawks injury,News AU,2025-03-18T07:25:35.393254
Wyong tips Wednesday Imperial Force to strike again,Bjorn Baker colt Imperial Force was a dominant winner firstup and will prove tough to beat again when he heads to Wyong on Wednesday BEST BETS INSIDE MAIL,News AU,2025-03-18T07:25:35.393254
Olympic legends horrifying revelations,One of the greatest Olympians of all time has details disturbing details of his private life going public with childhood abuse and a drug addiction,News AU,2025-03-18T07:25:35.393254
Bodybuilding star drops scary truth bomb,A champion natural bodybuilder has revealed the secret tricks behind his insane physique and issued a warning about the sport,News AU,2025-03-18T07:25:35.393254
