Title,Description,Source,Fetched Date,Combined Text,Score,Sentiment
Trump signs sweeping tax and spending bill into law,A signing ceremony at the White House on Friday afternoon kicked off celebrations for 4 July,BBC Business,2025-07-05T07:25:34.466923,trump sign sweeping tax spending bill law . signing ceremony white house friday afternoon kicked celebration 4 july,0.0,Neutral
Do they have gold in them The Indian artisans up in arms over Pradas sandals,Artisans who make Kolhapuri sandals are demanding better recognition after Prada failed to acknowledge design roots,BBC Business,2025-07-05T07:25:34.466923,gold indian artisan arm pradas sandal . artisan make kolhapuri sandal demanding better recognition prada failed acknowledge design root,-0.3182,Negative
World of Business,Gain the leading edge with global insights for the boardroom and beyond in your inbox every Wednesday,BBC Business,2025-07-05T07:25:34.466923,world business . gain leading edge global insight boardroom beyond inbox every wednesday,0.5267,Positive
Trump says US to start sending out tariff letters,The move comes ahead of a deadline that may see much higher import taxes on goods coming into the US,BBC Business,2025-07-05T07:25:34.466923,trump say u start sending tariff letter . move come ahead deadline may see much higher import tax good coming u,0.4404,Positive
What have tariffs really done to the US economy,As President Trump weighs tariff plans he will have one eye on the US economy,BBC Business,2025-07-05T07:25:34.466923,tariff really done u economy . president trump weighs tariff plan one eye u economy,0.0,Neutral
US debt is now 37tn should we be worried,President Trumps budget bill will add to the US debt pile but is there a limit to how much the rest of the world will lend Uncle Sam,BBC Business,2025-07-05T07:25:34.466923,u debt 37tn worried . president trump budget bill add u debt pile limit much rest world lend uncle sam,-0.7351,Negative
Is it OK to cry at work,After UK Chancellor Rachel Reeves cried in parliament this week how acceptable is it to show emotion at work,BBC Business,2025-07-05T07:25:34.466923,ok cry work . uk chancellor rachel reef cried parliament week acceptable show emotion work,-0.296,Negative
One in 10 cars sold in UK made in China,One in 10 cars bought in the UK are Chinese owned new figures suggest,BBC Business,2025-07-05T07:25:34.466923,one 10 car sold uk made china . one 10 car bought uk chinese owned new figure suggest,0.0,Neutral
Why the worlds superyachts are getting bigger and bigger,Billionaires and multimillionaires around the globe are trading up for more space and luxury,BBC Business,2025-07-05T07:25:34.466923,world superyachts getting bigger bigger . billionaire multimillionaires around globe trading space luxury,0.0,Neutral
The bridge changing lives and boosting business,The resund bridge which connects Denmark and Sweden is celebrating 25 years since its opening,BBC Business,2025-07-05T07:25:34.466923,bridge changing life boosting business . resund bridge connects denmark sweden celebrating 25 year since opening,0.7269,Positive
Markets mixed ahead of US jobs data 2 July 2025,Chief Investment Officer at Hamilton Capital Partners says markets are in a wait and see mode over tariffs,BBC Business,2025-07-05T07:25:34.466923,market mixed ahead u job data 2 july 2025. chief investment officer hamilton capital partner say market wait see mode tariff,0.0,Neutral
Im being paid to fix issues caused by AI,Businesses that rush to use AI to write content or computer code often have to pay humans to fix it,BBC Business,2025-07-05T07:25:34.466923,im paid fix issue caused ai . business rush use ai write content computer code often pay human fix,-0.1027,Neutral
Sport agent Jonathan Barnett accused of rape in US lawsuit,Barnett denies allegations he kept the woman as a sex slave over a six year period,BBC Business,2025-07-05T07:25:34.466923,sport agent jonathan barnett accused rape u lawsuit . barnett denies allegation kept woman sex slave six year period,-0.891,Negative
Fictional Kpop bands beat BTS and Blackpink in US charts,Songs from the film KPop Demon Hunter have surpassed the success of reallife Kpop bands BTS and Blackpink,BBC Business,2025-07-05T07:25:34.466923,fictional kpop band beat bts blackpink u chart . song film kpop demon hunter surpassed success reallife kpop band bts blackpink,0.5719,Positive
Congress passes Trumps big beautiful bill cutting taxes and spending,The US president wins over sparring factions within his own party to get the bill passed after months of wrangling,BBC Business,2025-07-05T07:25:34.466923,congress pass trump big beautiful bill cutting tax spending . u president win sparring faction within party get bill passed month wrangling,0.872,Positive
The sale of illegal cigarettes signals a deeper problem with UK high streets,Some black market cigarettes have been found to contain dead flies and asbestos But the trade nods to a wider issue a BBC investigation has found,BBC Business,2025-07-05T07:25:34.466923,sale illegal cigarette signal deeper problem uk high street . black market cigarette found contain dead fly asbestos trade nod wider issue bbc investigation found,-0.891,Negative
Ryanair increases size limits for free cabin bags,The increase comes as the EU mandates a universal minimum size for free underseat bags,BBC Business,2025-07-05T07:25:34.466923,ryanair increase size limit free cabin bag . increase come eu mandate universal minimum size free underseat bag,0.8807,Positive
Trump gets major win now but it comes with risks down the road,The megabill helps the president deliver on promises but also contains the seeds of political peril writes Anthony Zurcher,BBC Business,2025-07-05T07:25:34.466923,trump get major win come risk road . megabill help president deliver promise also contains seed political peril writes anthony zurcher,0.6124,Positive
Playing with FIRE How to quit work and retire in your 30s,A personal finance strategy popular among millennials is helping them to quit their job and retire decades early,BBC Business,2025-07-05T07:25:34.466923,playing fire quit work retire 30 . personal finance strategy popular among millennials helping quit job retire decade early,0.5267,Positive
Boomerang CEOs Do they ever succeed,Five years after being ousted from WeWork Adam Neumann wants to rebuy the nowbankrupt business,BBC Business,2025-07-05T07:25:34.466923,boomerang ceo ever succeed . five year ousted wework adam neumann want rebuy nowbankrupt business,0.5423,Positive
How industry leaders transformed their career,The BBCs Katty Kay has spoken to successful changemakers to ask what made them pivot in their career,BBC Business,2025-07-05T07:25:34.466923,industry leader transformed career . bbcs katty kay spoken successful changemakers ask made pivot career,0.5859,Positive
Women were the original beer brewers what changed,Today the beer industry is maledominated but it wasnt always so,BBC Business,2025-07-05T07:25:34.466923,woman original beer brewer changed . today beer industry maledominated wasnt always,0.3182,Positive
How waiting alters our perception of time,Expert advice on how to get through a waiting period,BBC Business,2025-07-05T07:25:34.466923,waiting alters perception time . expert advice get waiting period,0.0,Neutral
Do the superrich deserve their wealth,Should there be a cap on billionaires wealth and their inheritances,BBC Business,2025-07-05T07:25:34.466923,superrich deserve wealth . cap billionaire wealth inheritance,0.7506,Positive
Four simple hacks to succeed in every conversation,A career coach a choreographer a chef and a dragon boat captain offer advice on giving critical feedback,BBC Business,2025-07-05T07:25:34.466923,four simple hack succeed every conversation . career coach choreographer chef dragon boat captain offer advice giving critical feedback,0.5106,Positive
Solo and hybrid work Navigating our future and new normal,Covid19 reshaped the way we live and work We rethink solo working and explore the future of worklife,BBC Business,2025-07-05T07:25:34.466923,solo hybrid work navigating future new normal . covid19 reshaped way live work rethink solo working explore future worklife,0.0,Neutral
Can supersonic flight ever be sustainable,How a new era of quiet net zero supersonic airliners could revolutionise the aviation industry,BBC Business,2025-07-05T07:25:34.466923,supersonic flight ever sustainable . new era quiet net zero supersonic airliner could revolutionise aviation industry,0.0,Neutral
Commencement speech The surprising pitfall of your passions,Students are graduating in the US this week The commencement speeches might lead them into questionable choices,BBC Business,2025-07-05T07:25:34.466923,commencement speech surprising pitfall passion . student graduating u week commencement speech might lead questionable choice,0.4404,Positive
A desk full of descriptions for your work colleagues,These are the long lost words youve been waiting for to describe your colleagues,BBC Business,2025-07-05T07:25:34.466923,desk full description work colleague . long lost word youve waiting describe colleague,-0.3182,Negative
Veterinarian suicide rates are very high Why,Veterinarian professionals are committing suicide at a higher rate than the general population,BBC Business,2025-07-05T07:25:34.466923,veterinarian suicide rate high . veterinarian professional committing suicide higher rate general population,-0.8658,Negative
ASMR How whispering took over the internet,We meet the creators behind the current ASMR boom,BBC Business,2025-07-05T07:25:34.466923,asmr whispering took internet . meet creator behind current asmr boom,0.0,Neutral
What will Trumps tax and spending bill do to the US national debt,US President Donald Trumps tax and spending bill has sparked intense debate BBC Verifys policy and analysis correspondent Ben Chu has been looking at what the bill could do to the US national debt,BBC Business,2025-07-05T07:25:34.466923,trump tax spending bill u national debt . u president donald trump tax spending bill sparked intense debate bbc verifys policy analysis correspondent ben chu looking bill could u national debt,-0.5719,Negative
What are the key items in Trumps sprawling budget bill,The tax and spending bill which is set to become law includes sweeping changes to taxes Social Security and more,BBC Business,2025-07-05T07:25:34.466923,key item trump sprawling budget bill . tax spending bill set become law includes sweeping change tax social security,0.34,Positive
Strong jump in US jobs as economy defies expectations,Hiring in the US defied expectations with 147000 jobs added last month official figures show,BBC Business,2025-07-05T07:25:34.466923,strong jump u job economy defies expectation . hiring u defied expectation 147000 job added last month official figure show,0.5106,Positive
Ryanair cancels flights for 30000 passengers due to French strike,Airlines and Frances transport minister has condemned the strikes as unacceptable at the start of summer holidays,BBC Business,2025-07-05T07:25:34.466923,ryanair cancel flight 30000 passenger due french strike . airline france transport minister condemned strike unacceptable start summer holiday,-0.7351,Negative
Microsoft to cut up to 9000 more jobs as it invests in AI,The US tech giant will axe 4 of its global workforce and plough money into artificial intelligence,BBC Business,2025-07-05T07:25:34.466923,microsoft cut 9000 job invests ai . u tech giant axe 4 global workforce plough money artificial intelligence,0.1531,Neutral
UK borrowing costs fall as investors nerves ease,The cost of UK government borrowing falls and the pound rallies as the PM says he works in lockstep with Rachel Reeves,BBC Business,2025-07-05T07:25:34.466923,uk borrowing cost fall investor nerve ease . cost uk government borrowing fall pound rally pm say work lockstep rachel reef,0.3612,Positive
Trump calls on US central bank head to quit immediately,The president has repeatedly criticised Jerome Powell for not cutting rates but has sent mixed signals about removing him from the role,BBC Business,2025-07-05T07:25:34.466923,trump call u central bank head quit immediately . president repeatedly criticised jerome powell cutting rate sent mixed signal removing role,-0.5106,Negative
Trump announces trade deal with Vietnam,The US plans to charge 20 tariffs on Vietnamese goods less than half the rate set to go into effect next week,BBC Business,2025-07-05T07:25:34.466923,trump announces trade deal vietnam . u plan charge 20 tariff vietnamese good less half rate set go effect next week,0.4404,Positive
Tesla deliveries fall for second quarter in a row,Elon Musks controversial role in the Trump administration has been blamed for the collapse in sales,BBC Business,2025-07-05T07:25:34.466923,tesla delivery fall second quarter row . elon musk controversial role trump administration blamed collapse sale,-0.7964,Negative
Caitlyn Jenners Manager Sophia Hutchins Dies at 29 Reports,The close friend of the former Olympian served as a Trump 2024 campaign surrogate and founded the sunscreen company Lumasol,Hollywood Reporter,2025-07-05T07:25:35.302424,caitlyn jenner manager sophia hutchins dy 29 report . close friend former olympian served trump 2024 campaign surrogate founded sunscreen company lumasol,0.4939,Positive
Top Dogs Again Joey Chestnut and Miki Sudo Win 2025 Nathans Famous Hot Dog Eating Contest,Sudo captured her 11th title defending her 2024 win as Chestnut made a triumphant comeback after last years ban,Hollywood Reporter,2025-07-05T07:25:35.302424,top dog joey chestnut miki sudo win 2025 nathans famous hot dog eating contest . sudo captured 11th title defending 2024 win chestnut made triumphant comeback last year ban,0.8481,Positive
La Roux Wants You to Know That Beyond Singing She Also Writes Produces and Performs Her Music,Elly Jackson playing this years Karlovy Vary Film Festival opening concert discusses her upcoming album interest in creating a soundtrack Tilda Swinton sexism Bulletproof and her development as an artist,Hollywood Reporter,2025-07-05T07:25:35.302424,la roux want know beyond singing also writes produce performs music . elly jackson playing year karlovy vary film festival opening concert discusses upcoming album interest creating soundtrack tilda swinton sexism bulletproof development artist,0.8591,Positive
JPop Trio Numberi Just Wants to Make Music They Love,The charttopping Japanese act recently performed at 88Risings SoCal music festival Head in the Clouds,Hollywood Reporter,2025-07-05T07:25:35.302424,jpop trio numberi want make music love . charttopping japanese act recently performed 88risings socal music festival head cloud,0.8271,Positive
Derek AE Fuhrmann CoWriter of Phillip Phillips Gone Gone Gone Dies at 44,The song went peaked at No 24 on the Billboard Hot 100 and appeared in films such as The Amazing SpiderMan 2 and Grudge Match,Hollywood Reporter,2025-07-05T07:25:35.302424,derek ae fuhrmann cowriter phillip phillips gone gone gone dy 44. song went peaked 24 billboard hot 100 appeared film amazing spiderman 2 grudge match,0.5859,Positive
Oasis Liam Gallagher Apologizes for Using Racial Slur Sorry If I Offended Anyone,I do not discriminate the musician wrote in a followup X post on Wednesday,Hollywood Reporter,2025-07-05T07:25:35.302424,oasis liam gallagher apologizes using racial slur sorry offended anyone . discriminate musician wrote followup x post wednesday,0.0516,Neutral
Can Diddys Career Survive His Verdict What the Music Industry Is Saying,Offers one executive Youve always had bad boys and bad behavior It was glorified it wasnt punished Its built into the roots of the business,Hollywood Reporter,2025-07-05T07:25:35.302424,diddys career survive verdict music industry saying . offer one executive youve always bad boy bad behavior glorified wasnt punished built root business,-0.1581,Neutral
Tennis Star Taylor Fritz Is Eyeing His First Grand Slam and He Really Hates to Lose,With Wimbledon underway the US sports star catches up with The Hollywood Reporter about life inside and outside of tennis I always need to have something Im working towards,Hollywood Reporter,2025-07-05T07:25:35.302424,tennis star taylor fritz eyeing first grand slam really hate lose . wimbledon underway u sport star catch hollywood reporter life inside outside tennis always need something im working towards,-0.763,Negative
Former World Champion Boxer Arrested by ICE Days After Fighting Jake Paul In Anaheim,Julio Csar Chvez Jr will be deported to Mexico the Department of Homeland Security says,Hollywood Reporter,2025-07-05T07:25:35.302424,former world champion boxer arrested ice day fighting jake paul anaheim . julio csar chvez jr deported mexico department homeland security say,0.1779,Neutral
Sukeban Japanese Female ProWrestling Brand Strikes NTT Docomo Studio Live Deal,Sukeban is a treasure trove of pop culture bringing together manga anime fashion music and beauty all through the powerful lens of womens professional wrestling,Hollywood Reporter,2025-07-05T07:25:35.302424,sukeban japanese female prowrestling brand strike ntt docomo studio live deal . sukeban treasure trove pop culture bringing together manga anime fashion music beauty powerful lens womens professional wrestling,0.8074,Positive
UK Streaming Levy Officially Rejected by Government We Support a Mixed Ecology,The government response published Thursday cited the more than 400 million contribution Barbie and Bridgerton made to the UK economy over the last five years,Hollywood Reporter,2025-07-05T07:25:35.302424,uk streaming levy officially rejected government support mixed ecology . government response published thursday cited 400 million contribution barbie bridgerton made uk economy last five year,-0.1531,Neutral
BBC Deemed Bob Vylan High Risk Before Glastonbury Set Moves Staff Off Live Events Team,After punk duo Bob Vylan chanted death to the IDF live on air the BBC has vowed to take action to ensure proper accountability for those found to be responsible for the broadcast,Hollywood Reporter,2025-07-05T07:25:35.302424,bbc deemed bob vylan high risk glastonbury set move staff live event team . punk duo bob vylan chanted death idf live air bbc vowed take action ensure proper accountability found responsible broadcast,-0.2732,Negative
