Title,Description,Source,Fetched Date
Trump crypto soars as president offers dinner to top holders,The meme coins website says its 220 top investors will be invited to a gala event with the president,BBC Business,2025-04-24T07:26:41.512185
Opportunity for big USChina trade deal says Bessent,The comments from the US Treasury Secretary come as the trade war between the worlds two biggest economies has escalated,BBC Business,2025-04-24T07:26:41.512185
World of Business,Gain the leading edge with global insights for the boardroom and beyond in your inbox every Wednesday,BBC Business,2025-04-24T07:26:41.512185
Musk to reduce Doge role after Tesla profits plunge,The tech boss says he intends to spend only one to two days a week on Trump administration matters,BBC Business,2025-04-24T07:26:41.512185
UK could lower US car tariffs in push for trade deal,UK negotiators are working flat out to get a trade deal with the US Chancellor Rachel Reeves says,BBC Business,2025-04-24T07:26:41.512185
Five cards China holds in a trade war with the US,From rare earths to billions in US debt heres what China has in its arsenal and how strong they are,BBC Business,2025-04-24T07:26:41.512185
Nissan boss says building cars in UK too expensive,The Sunderland factory pays more for electricity than any other Nissan plant says Alan Johnson,BBC Business,2025-04-24T07:26:41.512185
A dozen US states sue to halt Trumps tariffs,The lawsuit argues President Trump did not have the authority to enact the levies and start a global trade war,BBC Business,2025-04-24T07:26:41.512185
The recordbreaking tunnel being built from Denmark to Germany,The rail and road link will slash journey times between much of Scandinavia and continental Europe,BBC Business,2025-04-24T07:26:41.512185
Firms say Meta not helping them to recover hacked accounts,Businesses around the world say they are unable to get back into their Facebook and Instagram pages,BBC Business,2025-04-24T07:26:41.512185
NYSE Opening Bell,Watch the latest from BBCs new daily business programme coming from the heart of New Yorks financial district,BBC Business,2025-04-24T07:26:41.512185
The exGoogle exec who wants to simplify your life,Marissa Mayer a former Google and Yahoo executive believes AI should simplify our lives,BBC Business,2025-04-24T07:26:41.512185
China sends Boeing planes back to US over tariffs,Boeings boss says its looking to sell 50 more planes China has on order to other countries,BBC Business,2025-04-24T07:26:41.512185
Apple and Meta attack unfair 700m EU fines,The tech giants have reacted with fury accusing the EU of unfairly pursuing US companies,BBC Business,2025-04-24T07:26:41.512185
Trump hints at softening China tariffs and says no plan to sack Fed boss,His comments come amid a trade war with Beijing and after his attacks on the US central banks boss,BBC Business,2025-04-24T07:26:41.512185
Pressure builds on UK finances as Reeves pushes for US trade deal,The government borrowed more than expected last year placing more pressure on the public finances ahead of the full impact of US tariffs,BBC Business,2025-04-24T07:26:41.512185
ChatGPTmaker wants to buy Google Chrome,An OpenAI executive told a US judge the company would be interested in buying the popular browser,BBC Business,2025-04-24T07:26:41.512185
Why the IMF is worried about the economy three things to know,The influential financial agency is projecting slower economic growth in the US due to uncertainty around President Trumps tariffs,BBC Business,2025-04-24T07:26:41.512185
Playing with FIRE How to quit work and retire in your 30s,A personal finance strategy popular among millennials is helping them to quit their job and retire decades early,BBC Business,2025-04-24T07:26:41.512185
Boomerang CEOs Do they ever succeed,Five years after being ousted from WeWork Adam Neumann wants to rebuy the nowbankrupt business,BBC Business,2025-04-24T07:26:41.512185
How industry leaders transformed their career,The BBCs Katty Kay has spoken to successful changemakers to ask what made them pivot in their career,BBC Business,2025-04-24T07:26:41.512185
Women were the original beer brewers what changed,Today the beer industry is maledominated but it wasnt always so,BBC Business,2025-04-24T07:26:41.512185
How waiting alters our perception of time,Expert advice on how to get through a waiting period,BBC Business,2025-04-24T07:26:41.512185
Do the superrich deserve their wealth,Should there be a cap on billionaires wealth and their inheritances,BBC Business,2025-04-24T07:26:41.512185
Four simple hacks to succeed in every conversation,A career coach a choreographer a chef and a dragon boat captain offer advice on giving critical feedback,BBC Business,2025-04-24T07:26:41.512185
Solo and hybrid work Navigating our future and new normal,Covid19 reshaped the way we live and work We rethink solo working and explore the future of worklife,BBC Business,2025-04-24T07:26:41.512185
Can supersonic flight ever be sustainable,How a new era of quiet net zero supersonic airliners could revolutionise the aviation industry,BBC Business,2025-04-24T07:26:41.512185
Commencement speech The surprising pitfall of your passions,Students are graduating in the US this week The commencement speeches might lead them into questionable choices,BBC Business,2025-04-24T07:26:41.512185
A desk full of descriptions for your work colleagues,These are the long lost words youve been waiting for to describe your colleagues,BBC Business,2025-04-24T07:26:41.512185
Veterinarian suicide rates are very high Why,Veterinarian professionals are committing suicide at a higher rate than the general population,BBC Business,2025-04-24T07:26:41.512185
ASMR How whispering took over the internet,We meet the creators behind the current ASMR boom,BBC Business,2025-04-24T07:26:41.512185
Why should I care if the US dollar falls,Why movements in the US dollar have a massive impact internationally and how it could affect you,BBC Business,2025-04-24T07:26:41.512185
Vance calls for stronger IndiaUS relations as trade talks progress,US VicePresident JD Vance is currently on a fourday visit to India with his wife and three children,BBC Business,2025-04-24T07:26:41.512185
Global growth forecast slashed by IMF over tariff impact,The US suffers the biggest downgrade to growth among advanced economies in the influential International Monetary Funds latest forecast,BBC Business,2025-04-24T07:26:41.512185
US sets tariffs of up to 3521 on South East Asia solar panels,Several Chinese solar companies with factories across the region could face steep new tariffs,BBC Business,2025-04-24T07:26:41.512185
US stocks and dollar plunge as Trump attacks Fed chair Powell,The president amps up attack against US central bank boss calling him a major loser for not lowering interest rates,BBC Business,2025-04-24T07:26:41.512185
US FTC sues Uber alleging deceptive subscription practices,The FTC accused Uber of charging people for its Uber One subscription service without getting their consent,BBC Business,2025-04-24T07:26:41.512185
China warns nations against appeasing US in trade deals,Beijing was responding to reports that the US will pressure other nations to restrict trade with China,BBC Business,2025-04-24T07:26:41.512185
I was careful and followed instructions closely but still lost my crypto,A customers experience highlights issues dealing with cryptocurrency where many regular banking safeguards do not apply,BBC Business,2025-04-24T07:26:41.512185
DHL suspends high value US deliveries over tariffs,The postal giant will stop shipping packages to American consumers after a rise in red tape at customs,BBC Business,2025-04-24T07:26:41.512185
New Harvey Weinstein Accuser Revealed as Opening Statements Begin in Retrial,The former Hollywood producer is being retried on a criminal sexual charge and a rape charge from his 2020 trial and a criminal sexual charge related to former model Kaja Sokola,Hollywood Reporter,2025-04-24T07:26:42.285928
American Music Awards Nominations Kendrick Lamar Leads With 10 Post Malone Has 8 Billie Eilish Chappell Roan and Shaboozey Earn 7 Each,Bruno Mars Lady Gaga Morgan Wallen Sabrina Carpenter SZA and Taylor Swift make up a group of artists with six nominations,Hollywood Reporter,2025-04-24T07:26:42.285928
Larry David Pens Satirical My Dinner With Adolf Essay Mocking Bill Mahers White House Visit,Here I was prepared to meet Hitler the one Id seen and heard the public Hitler But this private Hitler was a completely different animal And oddly enough this one seemed more authentic like this was the real Hitler David jokes in his guest essay for The New York Times,Hollywood Reporter,2025-04-24T07:26:42.285928
Carlos Santana Postpones Concert After Suffering From Dehydration,He is doing well and is looking forward to coming back to San Antonio soon as well as continuing his US Tour Santanas manager said Tuesday,Hollywood Reporter,2025-04-24T07:26:42.285928
Roy Thomas Baker Queen and The Cars Producer Dies at 78,He notably produced the 1975 hit single Bohemian Rhapsody the moststreamed song from the 20th century,Hollywood Reporter,2025-04-24T07:26:42.285928
Quinta Brunson Recalls Sharing a Super Bowl Suite With Jill Biden and Secret Service Agents,I was scared because they said that somebody was going to be there who is currently running the country the Emmywinner said of potentially being seated alongside President Donald Trump,Hollywood Reporter,2025-04-24T07:26:42.285928
Amrit Kaur to Receive The Hollywood Reporters Women in Entertainment Canada Honor,The Sex Lives of College Girls star will receive the Breakthrough Award on May 29 in Toronto,Hollywood Reporter,2025-04-24T07:26:42.285928
Latin Grammys Returning to Las Vegas for 2025,The annual award show comes back to Sin City for the 15th time and the first time since 2022,Hollywood Reporter,2025-04-24T07:26:42.285928
Kevin Hart to Host 2025 BET Awards,The actor comedian and mogul will emcee the 25th anniversary celebration in June,Hollywood Reporter,2025-04-24T07:26:42.285928
Tina Knowles Has Been the Brains Behind the Business of Beyonc Now Its Her Turn to Shine,It came at a time that I was open to writing my history down says the author of her new book Matriarch A Memoir,Hollywood Reporter,2025-04-24T07:26:42.285928
Harvey Weinsteins Life Behind Bars Hes Still Running Sh Exclusive,On the eve of his New York retrial the fallen mogul spends 23 hours a day alone in his cell reading biographies and compulsively calling his prison consultant who also looks out for Luigi Mangione And he still manages to phone in the occasional Page Six item,Hollywood Reporter,2025-04-24T07:26:42.285928
Maggie Baird Wants to Leave a Better World for Her Children You Know Billie Eilish and Finneas,The SupportFeed founder and mother of two Grammy winners speaks with THR about plantbased eating and how the business can have a better eco footprint,Hollywood Reporter,2025-04-24T07:26:42.285928
McDermott tips Kiss to succeed as Wallabies coach,Queensland Reds mentor Les Kiss has been endorsed ahead of his expected elevation to the role of Wallabies coach,News AU,2025-04-24T07:26:43.798838
Brad Arthur set for shock NRL return,The former Parramatta Eels coach is set to be unveiled as an NRL coach once again in the coming days after a short stint in England,News AU,2025-04-24T07:26:43.798838
Elite talent turns back on homesickness,One of the AFLs most exciting players has turned his back on lucrative offers to return to his home state,News AU,2025-04-24T07:26:43.798838
Worlds strongest mans wild transformation,Eddie Hall has undergone a spectacular body transformation ahead of his first ever MMA fight this weekend,News AU,2025-04-24T07:26:43.798838
The biggest issues facing the Bears in 2027,Rival coaches insist player depth wont be an issue with two new clubs set to join the NRL in coming years with recruitment set to be the biggest test for the Bears in 2027,News AU,2025-04-24T07:26:43.798838
Young Saints star closes in on return after latest King blow,The Saints are set to be without Max King for a while longer but another young star is closing in a return to Ross Lyons side after a preseason setback,News AU,2025-04-24T07:26:43.798838
Cricket world stunned as star walks off,The cricket world couldnt quite believe what they were watching when a star walked off the field in a headscratching moment,News AU,2025-04-24T07:26:43.798838
I thought my face had come off Flintoff reveals horror crash details,Former England cricketer Andrew Flintoff has revealed harrowing details of his shocking Top Gear car crash in which he suffered serious facial injuries and broken ribs,News AU,2025-04-24T07:26:43.798838
Tennis world slams creepy shower rule,Tennis players will have to abide by a new creepy shower rule as the sport works to implement stricter doping measures,News AU,2025-04-24T07:26:43.798838
De Minaur powerless as Alcaraz curse extends,Its the same old story for Alex de Minaur after the Aussie star got in the way of a redhot Carlos Alcaraz on Saturday morning,News AU,2025-04-24T07:26:43.798838
AFL legends brutal assessment of old club,Fremantles greatest ever player Matthew Pavlich has given his old team a harsh reality check as they aim to break a 30year drought,News AU,2025-04-24T07:26:43.798838
Formula 1 rocked by bombshell theory,A new storm is brewing after a year of internal warfare that threatened to upend the contract of the sports most prized asset,News AU,2025-04-24T07:26:43.798838
Going to be painful F1 stars sad reveal,One of the biggest moves in sporting history is already showing signs of crumbling into an embarrassing heap in 2025,News AU,2025-04-24T07:26:43.798838
Rivalry round shake up forecast 1st Colts Rugby talking points,Theres nothing like a rivalry round to get the blood pumping and the adrenaline racing And in 1st Colts these grudge games could be extra significant Round four news injuries and talking points,News AU,2025-04-24T07:26:43.798838
Hall of Fame icon loses tragic health battle,The NFL is mourning the loss of a Hall of Fame star who lost his battle with a debilitating disease,News AU,2025-04-24T07:26:43.798838
Graphic texts exposed in NFL rape lawsuit,NFL legend turned TV star Shannon Sharpe has been accused of violently assaulting a woman and threatening to kill her,News AU,2025-04-24T07:26:43.798838
Reds made to wait for PL glory as Gunners hold on,Liverpool remain on the brink of winning the Premier League title with Arsenal doing just enough to delay trophy celebrations for the Reds,News AU,2025-04-24T07:26:43.798838
Disgraced radio stars replacement revealed,Marty Sheargold lost his job at Triple M in February after making vile remarks about the Matildas and hes now been replaced,News AU,2025-04-24T07:26:43.798838
Aussie guns plan to end major drought,No Australian has won the opening major of the womens season since 2006 and a the world No5 wants to end that drought this week,News AU,2025-04-24T07:26:43.798838
Aussie star set for lifechanging payday,Josh Giddeys first season in Chicago may have come to an end on Thursday but he is still expected to cash in big time,News AU,2025-04-24T07:26:43.798838
Hard to get your head around Kembla track record holder comes to town,Exciting sprinter Sunrise will attempt to back up her explosive Kembla Grange victory in Saturdays Midway Handicap at Randwick,News AU,2025-04-24T07:26:43.798838
Olympian couples fatal fight about renos,A police interview with Rohan Dennis has revealed what happened in the tragic seconds before champion cyclist Melissa Hoskins death,News AU,2025-04-24T07:26:43.798838
Shaq forced to bolt from live TV,While analysing a compelling NuggetsClippers on Inside the NBA alongside the rest of the crew ONeal made a hurried flustered exit,News AU,2025-04-24T07:26:43.798838
Politicians outrageous netball rant backfires,A selfstyled America First nationalist who recently called for the deportation of Selena Gomez has gone on another online tirade,News AU,2025-04-24T07:26:43.798838
