Title,Description,Source,Fetched Date,Combined Text,Score,Sentiment
Late Harrods boss Mohamed Al Fayed accused of multiple rapes by staff,Five women who worked at the luxury store say they were raped by the billionaire BBC documentary reveals,BBC Business,2024-09-19T07:22:26.563334,late harrod bos mohamed al fayed accused multiple rape staff . five woman worked luxury store say raped billionaire bbc documentary reveals,-0.91,Negative
X says its return in Brazil after ban inadvertent,The social media platform formerly known as Twitter was banned in the country in August,BBC Business,2024-09-19T07:22:26.563334,x say return brazil ban inadvertent . social medium platform formerly known twitter banned country august,-0.765,Negative
Nintendo sues Pokmon with guns video game firm,The Japanese company alleges that the Palworld video game infringes multiple patent rights,BBC Business,2024-09-19T07:22:26.563334,nintendo sue pokmon gun video game firm . japanese company alleges palworld video game infringes multiple patent right,-0.34,Negative
US sues ship firms for 100m over Baltimore bridge crash,The Justice Department said repair costs should be carried by the companies responsible not US citizens,BBC Business,2024-09-19T07:22:26.563334,u sue ship firm 100m baltimore bridge crash . justice department said repair cost carried company responsible u citizen,0.4588,Positive
Firm making drones for Ukraine plans more jobs,The company hopes to generate 200 jobs in the UK over the next three years across its two sites,BBC Business,2024-09-19T07:22:26.563334,firm making drone ukraine plan job . company hope generate 200 job uk next three year across two site,0.4404,Positive
UK interest rates expected to be held at 5,Economists are betting on rates being held in September with a cut to come in November instead,BBC Business,2024-09-19T07:22:26.563334,uk interest rate expected held 5. economist betting rate held september cut come november instead,0.2263,Neutral
Why hundreds of Samsung workers are protesting in India,About 1500 workers in Tamil Nadu state have been striking work for the past 11 days,BBC Business,2024-09-19T07:22:26.563334,hundred samsung worker protesting india . 1500 worker tamil nadu state striking work past 11 day,-0.4215,Negative
Whats the point of buying the latest smartphone,It is the time of year when new handsets are unveiled but they may offer only small improvements,BBC Business,2024-09-19T07:22:26.563334,whats point buying latest smartphone . time year new handset unveiled may offer small improvement,0.4588,Positive
Four simple hacks to succeed in every conversation,A career coach a choreographer a chef and a dragon boat captain offer advice on giving critical feedback,BBC Business,2024-09-19T07:22:26.563334,four simple hack succeed every conversation . career coach choreographer chef dragon boat captain offer advice giving critical feedback,0.5106,Positive
Good Bad Billionaire,Simon Jack and Zing Tsjeng find out how the worlds billionaires made their money and then judge them Are they good bad or just another billionaire Listen to season two New episodes released on Mondays,BBC Business,2024-09-19T07:22:26.563334,good bad billionaire . simon jack zing tsjeng find world billionaire made money judge good bad another billionaire listen season two new episode released monday,-0.296,Negative
How Microsoft is tackling AI bias,Microsoft is turning to AI to make its workplace more inclusive,BBC Business,2024-09-19T07:22:26.563334,microsoft tackling ai bias . microsoft turning ai make workplace inclusive,-0.1027,Neutral
Aly Raisman on competing at the highest level,The decorated US gymnast opened up to the BBCs Katty Kay about blocking out the noise trusting her training and her winning mindset,BBC Business,2024-09-19T07:22:26.563334,aly raisman competing highest level . decorated u gymnast opened bbcs katty kay blocking noise trusting training winning mindset,0.5423,Positive
Jackie JoynerKersees goldmedal attitude,The retired athlete and halloffamer opened up to the BBCs Katty Kay about the challenges she faced on the road to the Olympics and the winning mindset that saw her through them,BBC Business,2024-09-19T07:22:26.563334,jackie joynerkersees goldmedal attitude . retired athlete halloffamer opened bbcs katty kay challenge faced road olympics winning mindset saw,0.5719,Positive
Why finding out salary of UK PMs chief of staff matters,Political editor Chris Mason explains why the story about PM Keir Starmers chief of staff Sue Gray earning 170000 a year matters,BBC Business,2024-09-19T07:22:26.563334,finding salary uk pm chief staff matter . political editor chris mason explains story pm keir starmers chief staff sue gray earning 170000 year matter,0.0516,Neutral
What will a US interest rate cut mean for me,It will influence mortgages credit card and saving rates for millions of people in the US and even around the world,BBC Business,2024-09-19T07:22:26.563334,u interest rate cut mean . influence mortgage credit card saving rate million people u even around world,0.5423,Positive
How both campaigns will seize on interest rate cut in US election,With less than 50 days until the US election Anthony Zurcher looks at how the rate cut will shape the presidential campaign,BBC Business,2024-09-19T07:22:26.563334,campaign seize interest rate cut u election . less 50 day u election anthony zurcher look rate cut shape presidential campaign,-0.0516,Neutral
US goes big with first interest rate cut in four years,The Federal Reserve has cut its key lending rate by 05 percentage points a larger cut than expected,BBC Business,2024-09-19T07:22:26.563334,u go big first interest rate cut four year . federal reserve cut key lending rate 05 percentage point larger cut expected,-0.3182,Negative
Boeing suspends jobs for thousands after strike,Boeing says it is suspending jobs for thousands of staff in the US due to a worker strike,BBC Business,2024-09-19T07:22:26.563334,boeing suspends job thousand strike . boeing say suspending job thousand staff u due worker strike,-0.25,Negative
TGI Fridays UK owner falls into administration,Londonlisted Hostmore has appointed Teneo as administrators to help it sell the restaurants,BBC Business,2024-09-19T07:22:26.563334,tgi friday uk owner fall administration . londonlisted hostmore appointed teneo administrator help sell restaurant,0.4019,Positive
Playing with FIRE How to quit work and retire in your 30s,A personal finance strategy popular among millennials is helping them to quit their job and retire decades early,BBC Business,2024-09-19T07:22:26.563334,playing fire quit work retire 30 . personal finance strategy popular among millennials helping quit job retire decade early,0.5267,Positive
Boomerang CEOs Do they ever succeed,Five years after being ousted from WeWork Adam Neumann wants to rebuy the nowbankrupt business,BBC Business,2024-09-19T07:22:26.563334,boomerang ceo ever succeed . five year ousted wework adam neumann want rebuy nowbankrupt business,0.5423,Positive
How industry leaders transformed their career,The BBCs Katty Kay has spoken to successful changemakers to ask what made them pivot in their career,BBC Business,2024-09-19T07:22:26.563334,industry leader transformed career . bbcs katty kay spoken successful changemakers ask made pivot career,0.5859,Positive
Women were the original beer brewers what changed,Today the beer industry is maledominated but it wasnt always so,BBC Business,2024-09-19T07:22:26.563334,woman original beer brewer changed . today beer industry maledominated wasnt always,0.3182,Positive
How waiting alters our perception of time,Expert advice on how to get through a waiting period,BBC Business,2024-09-19T07:22:26.563334,waiting alters perception time . expert advice get waiting period,0.0,Neutral
Do the superrich deserve their wealth,Should there be a cap on billionaires wealth and their inheritances,BBC Business,2024-09-19T07:22:26.563334,superrich deserve wealth . cap billionaire wealth inheritance,0.7506,Positive
Solo and hybrid work Navigating our future and new normal,Covid19 reshaped the way we live and work We rethink solo working and explore the future of worklife,BBC Business,2024-09-19T07:22:26.563334,solo hybrid work navigating future new normal . covid19 reshaped way live work rethink solo working explore future worklife,0.0,Neutral
Can supersonic flight ever be sustainable,How a new era of quiet net zero supersonic airliners could revolutionise the aviation industry,BBC Business,2024-09-19T07:22:26.563334,supersonic flight ever sustainable . new era quiet net zero supersonic airliner could revolutionise aviation industry,0.0,Neutral
Commencement speech The surprising pitfall of your passions,Students are graduating in the US this week The commencement speeches might lead them into questionable choices,BBC Business,2024-09-19T07:22:26.563334,commencement speech surprising pitfall passion . student graduating u week commencement speech might lead questionable choice,0.4404,Positive
ASMR How whispering took over the internet,We meet the creators behind the current ASMR boom,BBC Business,2024-09-19T07:22:26.563334,asmr whispering took internet . meet creator behind current asmr boom,0.0,Neutral
A desk full of descriptions for your work colleagues,These are the long lost words youve been waiting for to describe your colleagues,BBC Business,2024-09-19T07:22:26.563334,desk full description work colleague . long lost word youve waiting describe colleague,-0.3182,Negative
Veterinarian suicide rates are very high Why,Veterinarian professionals are committing suicide at a higher rate than the general population,BBC Business,2024-09-19T07:22:26.563334,veterinarian suicide rate high . veterinarian professional committing suicide higher rate general population,-0.8658,Negative
Train drivers accept pay deal to end strike action,Aslef said 966 of its members who voted backed the deal marking the end of longrunning strikes,BBC Business,2024-09-19T07:22:26.563334,train driver accept pay deal end strike action . aslef said 966 member voted backed deal marking end longrunning strike,0.0772,Neutral
What are NI and income tax and what do I pay,Two National Insurance cuts came info effect in 2024 but many people are still paying more in tax,BBC Business,2024-09-19T07:22:26.563334,ni income tax pay . two national insurance cut came info effect 2024 many people still paying tax,-0.3612,Negative
Post Office boss to step down from role next year,The chief executive had already stepped back from frontline duties to prepare for the Horizon IT inquiry,BBC Business,2024-09-19T07:22:26.563334,post office bos step role next year . chief executive already stepped back frontline duty prepare horizon inquiry,0.0,Neutral
How the government raises and spends 1 trillion a year,Where the governments income comes from and what it spends that money on,BBC Business,2024-09-19T07:22:26.563334,government raise spends 1 trillion year . government income come spends money,0.0,Neutral
Party over for Tupperware as it files for bankruptcy,The US company says it will ask for court permission to start a sale process of the business,BBC Business,2024-09-19T07:22:26.563334,party tupperware file bankruptcy . u company say ask court permission start sale process business,0.4019,Positive
Inflation holds steady despite jump in air fares,Lower fuel prices helped offset the higher cost of flying in the year to August,BBC Business,2024-09-19T07:22:26.563334,inflation hold steady despite jump air fare . lower fuel price helped offset higher cost flying year august,-0.296,Negative
How quickly are prices rising in the UK,The rate at which prices are rising has nudged back above the Bank of Englands target of 2,BBC Business,2024-09-19T07:22:26.563334,quickly price rising uk . rate price rising nudged back bank england target 2,0.0,Neutral
New bank hubs to open but many dont have printers,New rules on branch closures take effect but questions remain over the facilities in shared hubs,BBC Business,2024-09-19T07:22:26.563334,new bank hub open many dont printer . new rule branch closure take effect question remain facility shared hub,0.34,Positive
Marlboro owner sells asthma inhaler firm over backlash,Philip Morris International bought Vectura Group just three years ago in a deal worth more than 1bn,BBC Business,2024-09-19T07:22:26.563334,marlboro owner sell asthma inhaler firm backlash . philip morris international bought vectura group three year ago deal worth 1bn,0.2263,Neutral
Drought leaves Amazon basin rivers at alltime low,The current drought is concerning because it comes relatively early in the Amazons dry season,BBC Earth,2024-09-19T07:22:26.673487,drought leaf amazon basin river alltime low . current drought concerning come relatively early amazon dry season,0.0772,Neutral
The weird biology of the enormous smelly corpse plant,It stands metres high takes a decade to flower smells like death and draws huge crowds when it blooms But scientists are still unravelling the baffling lifecycle of the titan arum,BBC Earth,2024-09-19T07:22:26.673487,weird biology enormous smelly corpse plant . stand metre high take decade flower smell like death draw huge crowd bloom scientist still unravelling baffling lifecycle titan arum,-0.6705,Negative
How New Orleans prepared itself for a hurricane,As Hurricane Francine leaves households without basic power in New Orleans a handful of community lighthouses could offer a crucial lifeline,BBC Earth,2024-09-19T07:22:26.673487,new orleans prepared hurricane . hurricane francine leaf household without basic power new orleans handful community lighthouse could offer crucial lifeline,0.2263,Neutral
The Bahamas The last lighthouse of its kind,Reece Parkinson heads to the Bahamas where he meets a community adapting to unpredictable weather patterns,BBC Earth,2024-09-19T07:22:26.673487,bahamas last lighthouse kind . reece parkinson head bahamas meet community adapting unpredictable weather pattern,0.5267,Positive
Protecting Thailands famous paradise beach,Lucy Hedges is in Thailand where she explores the beach made worldfamous by Hollywood,BBC Earth,2024-09-19T07:22:26.673487,protecting thailand famous paradise beach . lucy hedge thailand explores beach made worldfamous hollywood,0.6369,Positive
The scientists drilling into an active Icelandic volcano,Scientists are preparing to drill into the rock of an Icelandic volcano to learn more about how volcanoes behave,BBC Earth,2024-09-19T07:22:26.673487,scientist drilling active icelandic volcano . scientist preparing drill rock icelandic volcano learn volcano behave,0.4019,Positive
Earths spectacular and remote capital of lightning,With storms occurring between 140 to 160 nights a year its no wonder the area is a world record holder,BBC Earth,2024-09-19T07:22:26.673487,earth spectacular remote capital lightning . storm occurring 140 160 night year wonder area world record holder,0.0,Neutral
Less is more Can degrowth save the world,The degrowth movement questions the feasibility of the idea of endless economic growth on a finite planet,BBC Earth,2024-09-19T07:22:26.673487,less degrowth save world . degrowth movement question feasibility idea endless economic growth finite planet,0.6728,Positive
How fixing how we farm might stop the next pandemic,Land use for food and agriculture around the world is putting pressure on climate and biodiversity,BBC Earth,2024-09-19T07:22:26.673487,fixing farm might stop next pandemic . land use food agriculture around world putting pressure climate biodiversity,-0.5267,Negative
How electric vehicles could improve our mental health,Noise and air pollution are major threats and EVs can therefore offer a promising solution,BBC Earth,2024-09-19T07:22:26.673487,electric vehicle could improve mental health . noise air pollution major threat ev therefore offer promising solution,0.5423,Positive
How greening our cities can reduce heat stress,Heat is the most deadly extreme weather phenomenon and cities are seeking ways to cool their urban cores,BBC Earth,2024-09-19T07:22:26.673487,greening city reduce heat stress . heat deadly extreme weather phenomenon city seeking way cool urban core,-0.128,Neutral
How climate chaos is threatening the real Paddington bear,Drought forces the real Paddington Bear into deadly conflict with cattle farmers in the Andes,BBC Earth,2024-09-19T07:22:26.673487,climate chaos threatening real paddington bear . drought force real paddington bear deadly conflict cattle farmer andes,-0.8555,Negative
Tidal kites New technology harnessing ocean energy,These mechanical creatures lurk beneath the waters surface and power homes in the Faroe Islands,BBC Earth,2024-09-19T07:22:26.673487,tidal kite new technology harnessing ocean energy . mechanical creature lurk beneath water surface power home faroe island,0.0772,Neutral
Malaysias adventure hotspot that crosses seven habitats,An 11mile hike in the Bako National Park in Malaysia transports travellers through seven distinct habitats,BBC Earth,2024-09-19T07:22:26.673487,malaysia adventure hotspot cross seven habitat . 11mile hike bako national park malaysia transport traveller seven distinct habitat,0.3182,Positive
The global phenomenon swallowing whole neighbourhoods,Giant ravines Entire communities are disappearing because of an extreme form of soil erosion,BBC Earth,2024-09-19T07:22:26.673487,global phenomenon swallowing whole neighbourhood . giant ravine entire community disappearing extreme form soil erosion,0.0,Neutral
A tale of the US through abandoned buildings,Two urban explorers stories of decay tell a tale of a changing American cultural landscape,BBC Earth,2024-09-19T07:22:26.673487,tale u abandoned building . two urban explorer story decay tell tale changing american cultural landscape,-0.6908,Negative
What makes the emperor penguin an eggcellent father,In the BBC Select documentary Penguins Spy in the Huddle we explore the world of penguin fathers,BBC Earth,2024-09-19T07:22:26.673487,make emperor penguin eggcellent father . bbc select documentary penguin spy huddle explore world penguin father,0.0,Neutral
The floating houses that are resilient to extreme weather,The floating houses built to withstand typhoons and flooding in the Philippines,BBC Earth,2024-09-19T07:22:26.673487,floating house resilient extreme weather . floating house built withstand typhoon flooding philippine,0.0,Neutral
What its like to camp in Antarctica,Marc Cieslak spends a night on ice camping under the stars,BBC Earth,2024-09-19T07:22:26.673487,like camp antarctica . marc cieslak spends night ice camping star,0.3612,Positive
Why sunsets on Mars are tinted blue,The reason behind the Red Planets nickname is also why its sunrises and sunsets look pale blue,BBC Earth,2024-09-19T07:22:26.673487,sunset mar tinted blue . reason behind red planet nickname also sunrise sunset look pale blue,0.0,Neutral
Molossia A small unrecognised nation within the US,With its own currency and head of state this American micronation has become an odd tourist destination,BBC Earth,2024-09-19T07:22:26.673487,molossia small unrecognised nation within u . currency head state american micronation become odd tourist destination,-0.3182,Negative
Can these 3Dprinted sea walls protect marine wildlife,One team is on a mission to create 3D printed sea walls with environmental benefits,BBC Earth,2024-09-19T07:22:26.673487,3dprinted sea wall protect marine wildlife . one team mission create 3d printed sea wall environmental benefit,0.7717,Positive
Ghost towns What nature does without us,Ghost towns are remnants of lost communities but also a testament to natures persistence,BBC Earth,2024-09-19T07:22:26.673487,ghost town nature without u . ghost town remnant lost community also testament nature persistence,-0.7096,Negative
Climate a more fundamental threat than terror Lammy,Foreign Secretary David Lammy vows to put climate change at the heart of the UKs foreign policy,BBC Earth,2024-09-19T07:22:26.673487,climate fundamental threat terror lammy . foreign secretary david lammy vow put climate change heart uk foreign policy,-0.7783,Negative
Which is the dirty side of a hurricane,In tropical storms location matters when it comes to what damage to expect especially if youre on the dirty side of a hurricane where winds can be up to 50 stronger,BBC Earth,2024-09-19T07:22:26.673487,dirty side hurricane . tropical storm location matter come damage expect especially youre dirty side hurricane wind 50 stronger,-0.743,Negative
Why humpback whales are changing course,The first humpback whale to return to the North Pacifics Salish Sea in decades tells a new story about the global threat to whale populations,BBC Earth,2024-09-19T07:22:26.673487,humpback whale changing course . first humpback whale return north pacific salish sea decade tell new story global threat whale population,-0.5267,Negative
Mystery tremors were from massive nineday tsunami,Scientists launched an investigation after being baffled by seismic signals picked up across the world,BBC Earth,2024-09-19T07:22:26.673487,mystery tremor massive nineday tsunami . scientist launched investigation baffled seismic signal picked across world,0.128,Neutral
The fisher folk reviving Finlands moonscape,Finlands Linnunsuo wetland used to be a barren moonscape A local fishing community has transformed it into a biodiverse haven and an important carbon sink,BBC Earth,2024-09-19T07:22:26.673487,fisher folk reviving finland moonscape . finland linnunsuo wetland used barren moonscape local fishing community transformed biodiverse important carbon sink,0.2023,Neutral
I wouldnt wish it on my worst enemy The people who work inside the eye of a hurricane,As climate change makes hurricane systems more dangerous the need to understand their inner workings is greater than ever,BBC Earth,2024-09-19T07:22:26.673487,wouldnt wish worst enemy people work inside eye hurricane . climate change make hurricane system dangerous need understand inner working greater ever,0.5083,Positive
UK farmings net zero climate target in doubt,Doubts are raised over UK farmings ability to reach net zero greenhouse gas emissions by 2040,BBC Earth,2024-09-19T07:22:26.673487,uk farming net zero climate target doubt . doubt raised uk farming ability reach net zero greenhouse gas emission 2040,-0.3818,Negative
The town that should have burned but didnt,In 2017 one of Californias largest ever wildfires was steadily approaching Montecito But it had long been preparing for just such an event,BBC Earth,2024-09-19T07:22:26.673487,town burned didnt . 2017 one california largest ever wildfire steadily approaching montecito long preparing event,0.0,Neutral
The secluded life of the USs lasagne lizard,Scuba diving scientists are scouring riverbeds for the USselusive endangered hellbender also known as the snot otter to give them a fighting chance of survival,BBC Earth,2024-09-19T07:22:26.673487,secluded life us lasagne lizard . scuba diving scientist scouring riverbed usselusive endangered hellbender also known snot otter give fighting chance survival,-0.0516,Neutral
Chelsea Handler Connie Britton Andy Cohen Among Artists Urging Biden and Harris to Bring Israeli Hostages Home,Chelsea Handler Connie Britton Andy Cohen Mayim Bialik Patricia Heaton Jennifer Jason Leigh Ali Landry Rebecca Minkoff Isaac Mizrahi Michael Rapaport Melissa Rivers Gail Simmons Amy Smart Constance Zimmer and Ariel Martin are among 62 performers and artists from across television film fashion reality TV and social media urging President Joe Biden and,Hollywood Reporter,2024-09-19T07:22:27.050532,chelsea handler connie britton andy cohen among artist urging biden harris bring israeli hostage home . chelsea handler connie britton andy cohen mayim bialik patricia heaton jennifer jason leigh ali landry rebecca minkoff isaac mizrahi michael rapaport melissa river gail simmons amy smart constance zimmer ariel martin among 62 performer artist across television film fashion reality tv social medium urging president joe biden,0.4019,Positive
Why ProIsrael Hollywood Stars Like Debra Messing and Ginnifer Goodwin Turn to Hen Mazzig for Advice,Amid the cacophony of debate surrounding the IsraelHamas War its grown virtually impossible to avoid the thoughts of Hen Mazzig As the face of the Israeli cause one might argue that hes an unlikely candidate The 34yearold influencer is gay he was out throughout his tour of service in the IDF and spends his time,Hollywood Reporter,2024-09-19T07:22:27.050532,proisrael hollywood star like debra messing ginnifer goodwin turn hen mazzig advice . amid cacophony debate surrounding israelhamas war grown virtually impossible avoid thought hen mazzig face israeli cause one might argue he unlikely candidate 34yearold influencer gay throughout tour service idf spends time,-0.7184,Negative
Scandal Cast to Reunite for Kamala Harris Reproductive Freedom Bus Tour Exclusive,The Gladiators are back The cast of Scandal is reuniting this weekend in Michigan for the HarrisWalz campaigns Fighting for Reproductive Freedom Bus Tour Kerry Washington Tony Goldwyn Guillermo Daz Bellamy Young Katie Lowes Dan Bucatinsky Scott Foley Portia de Rossi George Newbern Jeff Perry and Cornelius Smith Jr will join hundreds of supporters and volunteers for,Hollywood Reporter,2024-09-19T07:22:27.050532,scandal cast reunite kamala harris reproductive freedom bus tour exclusive . gladiator back cast scandal reuniting weekend michigan harriswalz campaign fighting reproductive freedom bus tour kerry washington tony goldwyn guillermo daz bellamy young katie lowes dan bucatinsky scott foley portia de rossi george newbern jeff perry cornelius smith jr join hundred supporter volunteer,0.7096,Positive
