Title,Description,Source,Fetched Date,Combined Text,Score,Sentiment
JD Souther Famed Songwriter Eagles and Linda Ronstadt Collaborator Dies at 78,JD Souther the singer and songwriter who cowrote songs with the Eagles and Linda Ronstadt has died He was 78 Souther died peacefully at his home in New Mexico according to his rep No cause of death was given He was about to embark on a tour with Karla Bonoff Souther a Songwriters Hall of,Hollywood Reporter,2024-09-19T07:22:27.050532,jd souther famed songwriter eagle linda ronstadt collaborator dy 78. jd souther singer songwriter cowrote song eagle linda ronstadt died 78 souther died peacefully home new mexico according rep cause death given embark tour karla bonoff souther songwriter hall,-0.8271,Negative
Chappell Roan on Why Shes Kind of Hoping She Doesnt Win a Grammy,Chappell Roan may have taken home some hardware last week at the VMAs but shes not jumping at the idea of winning a Grammy musics highest honor Given the singers rapid climb to fame in the past year following the release of her debut album The Rise and Fall of a Midwest Princess in 2023 it,Hollywood Reporter,2024-09-19T07:22:27.050532,chappell roan shes kind hoping doesnt win grammy . chappell roan may taken home hardware last week vmas shes jumping idea winning grammy music highest honor given singer rapid climb fame past year following release debut album rise fall midwest princess 2023,0.9123,Positive
Sean Diddy Combs to Be Detained Pending Trial as Mogul Pleads Not Guilty to Sex Trafficking,Sean Diddy Combs was ordered to be detained pending trial Tuesday after he pleaded not guilty to charges including sex trafficking and racketeering On Tuesday morning the government unsealed a threecounty indictment accusing Combs of various crimes related to an alleged decadeslong pattern of physical and sexual violence against women in his orbit Federal prosecutors,Hollywood Reporter,2024-09-19T07:22:27.050532,sean diddy comb detained pending trial mogul pleads guilty sex trafficking . sean diddy comb ordered detained pending trial tuesday pleaded guilty charge including sex trafficking racketeering tuesday morning government unsealed threecounty indictment accusing comb various crime related alleged decadeslong pattern physical sexual violence woman orbit federal prosecutor,-0.9601,Negative
Billie Eilish and Finneas Endorse Kamala Harris,Billie Eilish and Finneas have endorsed Kamala Harris in her 2024 presidential bid The sibling musicians took to Instagram on Tuesday National Voter Registration Day to share their election preference We are voting for Kamala Harris and Tim Walz because they are fighting to protect our reproductive freedom our planet and our democracy Eilish says,Hollywood Reporter,2024-09-19T07:22:27.050532,billie eilish finneas endorse kamala harris . billie eilish finneas endorsed kamala harris 2024 presidential bid sibling musician took instagram tuesday national voter registration day share election preference voting kamala harris tim walz fighting protect reproductive freedom planet democracy eilish say,0.8689,Positive
Penlope Cruz Scores Latin Grammy Nomination,Penlope Cruz is an official Latin Grammy nominee The Oscarwinning actress earned a nomination for best short form music video for Residentes 313 which starts with Cruz delivering a poetic narration She also stars in the music video The track also earned a nomination for song of the year a nomination that goes to,Hollywood Reporter,2024-09-19T07:22:27.050532,penlope cruz score latin grammy nomination . penlope cruz official latin grammy nominee oscarwinning actress earned nomination best short form music video residentes 313 start cruz delivering poetic narration also star music video track also earned nomination song year nomination go,0.6369,Positive
Gracie Abrams Is Taking a Curious and Sensitive Approach to Life Music and Aspirations,The past few years may have been a whirlwind for Gracie Abrams but shes enjoying every moment especially all the firsts happening all the time Though Abrams is quite busy performing in soldout venues on her headlining tour which kicked off earlier this month Abrams recently took some time to chat with The Hollywood Reporter,Hollywood Reporter,2024-09-19T07:22:27.050532,gracie abrams taking curious sensitive approach life music aspiration . past year may whirlwind gracie abrams shes enjoying every moment especially first happening time though abrams quite busy performing soldout venue headlining tour kicked earlier month abrams recently took time chat hollywood reporter,0.6908,Positive
Sean Diddy Combs Charged With Sex Trafficking and Racketeering in Unsealed Indictment,Sean Diddy Combs has been charged with sex trafficking and racketeering for directing a vast criminal enterprise through which he assaulted and trafficked women with the help of his various businesses from at least 2008 Federal prosecutors in an indictment unsealed on Tuesday accused the music mogul of engaging in a pervasive pattern of abuse,Hollywood Reporter,2024-09-19T07:22:27.050532,sean diddy comb charged sex trafficking racketeering unsealed indictment . sean diddy comb charged sex trafficking racketeering directing vast criminal enterprise assaulted trafficked woman help various business least 2008 federal prosecutor indictment unsealed tuesday accused music mogul engaging pervasive pattern abuse,-0.8934,Negative
BlumFest to Include Paranormal Activity ReRelease,BlumFest has found its lineup for this years Halloween season It will kick off with the 2009 found footage feature Paranormal Activity that will get a onenight only rerelease Writerdirector Oren Pels Paranormal Activity kicks off the fest on Sept 25 in 150 AMC locations in 54 cities It will be followed every Wednesday by,Hollywood Reporter,2024-09-19T07:22:27.050532,blumfest include paranormal activity rerelease . blumfest found lineup year halloween season kick 2009 found footage feature paranormal activity get onenight rerelease writerdirector oren pel paranormal activity kick fest sept 25 150 amc location 54 city followed every wednesday,0.0,Neutral
Hollywood Stars from Marginalized Communities Urge Fellow Americans to Get Out to Vote in New PSA Exclusive,A halfdozen showbiz figures each of whom hails from a marginalized community within America have recorded a public service announcement that is launching on Tuesday which is National Voter Registration Day and exactly seven weeks to the day from the 2024 presidential election calling upon their fellow Americans to register to vote Participants in,Hollywood Reporter,2024-09-19T07:22:27.050532,hollywood star marginalized community urge fellow american get vote new psa exclusive . halfdozen showbiz figure hail marginalized community within america recorded public service announcement launching tuesday national voter registration day exactly seven week day 2024 presidential election calling upon fellow american register vote participant,0.2023,Neutral
India weighs easing market share limits for UPI payment operators,The governing body overseeing Indias popular UPI payments rail is considering increasing its proposed market share cap for operators like Google Pay PhonePe and Paytm,TechCrunch,2024-09-19T07:22:27.313684,india weighs easing market share limit upi payment operator . governing body overseeing india popular upi payment rail considering increasing proposed market share cap operator like google pay phonepe paytm,0.8519,Positive
Palmer Luckey returns to headsets as Anduril partners with Microsoft on US military tech,Palmer Luckey the Hawaiianshirt wearing founder who sold Oculus VR for 2 billion before cofounding the military tech company Anduril is back in the headset business in a sense,TechCrunch,2024-09-19T07:22:27.313684,palmer luckey return headset anduril partner microsoft u military tech . palmer luckey hawaiianshirt wearing founder sold oculus vr 2 billion cofounding military tech company anduril back headset business sense,0.0,Neutral
CEO of selfdriving startup Motional is stepping down,Motional the autonomous vehicle startup backed by Hyundai is shaking up its leadership ranks Karl Iagnemma an early pioneer in the autonomous vehicle industry whose startup Nutonomy lies at the,TechCrunch,2024-09-19T07:22:27.313684,ceo selfdriving startup motional stepping . motional autonomous vehicle startup backed hyundai shaking leadership rank karl iagnemma early pioneer autonomous vehicle industry whose startup nutonomy lie,-0.1531,Neutral
Craig Newmark pledges 100M to fight hacking by foreign governments,Craigslist founder Craig Newmark plans to donate 100 million to further strengthen US cybersecurity addressing what he sees as a growing threat from foreign governments he tells the WSJ Half,TechCrunch,2024-09-19T07:22:27.313684,craig newmark pledge 100m fight hacking foreign government . craigslist founder craig newmark plan donate 100 million strengthen u cybersecurity addressing see growing threat foreign government tell wsj half,-0.4588,Negative
JP Morgans head of startup banking says Founder Mode wont get you a unicorn,Ashraf Hebela JP Morgans Head of Startup Banking may sit on the finance side of startups these days But he once sat in the founder,TechCrunch,2024-09-19T07:22:27.313684,jp morgan head startup banking say founder mode wont get unicorn . ashraf hebela jp morgan head startup banking may sit finance side startup day sat founder,0.3818,Positive
Bluesky addresses trust and safety concerns around abuse spam and more,The company is in various stages of developing and piloting a range of initiatives focused on dealing with bad actors harassment spam fake accounts video safety and more,TechCrunch,2024-09-19T07:22:27.313684,bluesky address trust safety concern around abuse spam . company various stage developing piloting range initiative focused dealing bad actor harassment spam fake account video safety,-0.8316,Negative
Falai which hosts mediagenerating AI models raises 23M from a16z and others,Falai a devfocused platform for AIgenerated audio video and images today revealed that its raised 23 million in funding from investors including Andreessen Horowitz a16z Black Forest Labs cofounder Robin,TechCrunch,2024-09-19T07:22:27.313684,falai host mediagenerating ai model raise 23m a16z others . falai devfocused platform aigenerated audio video image today revealed raised 23 million funding investor including andreessen horowitz a16z black forest lab cofounder robin,0.0,Neutral
Bill requiring AM radio in new cars gets closer to law,A House committee overwhelmingly voted to approve a bill that would require new cars to be built with AM radio at no additional cost to the owner The AM for,TechCrunch,2024-09-19T07:22:27.313684,bill requiring radio new car get closer law . house committee overwhelmingly voted approve bill would require new car built radio additional cost owner,-0.128,Neutral
HTC takes on Apples Vision Pro and PC Gaming with 1000 Vive Focus Vision,The Vive Focus Vision has enough firepower under the hood to appeal to PC gamers tethered via the DisplayPort,TechCrunch,2024-09-19T07:22:27.313684,htc take apple vision pro pc gaming 1000 vive focus vision . vive focus vision enough firepower hood appeal pc gamers tethered via displayport,0.6124,Positive
Fisker reverses course on making Ocean owners pay for recall repairs,The reversal comes as EV startup Fisker prepares to enter the fourth month of its Chapter 11 bankruptcy process,TechCrunch,2024-09-19T07:22:27.313684,fisker revers course making ocean owner pay recall repair . reversal come ev startup fisker prepares enter fourth month chapter 11 bankruptcy process,-0.1027,Neutral
Three new ways to personalize your iPhones Home Screen in iOS 18,iOS 18 offers the most control over the look and feel of your iPhones user interface than any other version of Apples mobile operating system to date,TechCrunch,2024-09-19T07:22:27.313684,three new way personalize iphones home screen io 18. io 18 offer control look feel iphones user interface version apple mobile operating system date,0.0,Neutral
LinkedIn scraped user data for training before updating its terms of service,LinkedIn may have trained AI models on user data without updating its terms LinkedIn users in the US but not the EU EEA or Switzerland likely due to those,TechCrunch,2024-09-19T07:22:27.313684,linkedin scraped user data training updating term service . linkedin may trained ai model user data without updating term linkedin user u eu eea switzerland likely due,0.0,Neutral
This Week in AI Why OpenAIs o1 changes the AI regulation game,Hiya folks welcome to TechCrunchs regular AI newsletter If you want this in your inbox every Wednesday sign up here Its been just a few days since OpenAI revealed its latest,TechCrunch,2024-09-19T07:22:27.313684,week ai openais o1 change ai regulation game . hiya folk welcome techcrunchs regular ai newsletter want inbox every wednesday sign day since openai revealed latest,0.5106,Positive
US government took control of a botnet run by Chinese government hackers says FBI director,The FBI NSA and other US government agencies detailed a Chinesegovernment operation that used 260000 of internetconnected devices to launch cyberattacks,TechCrunch,2024-09-19T07:22:27.313684,u government took control botnet run chinese government hacker say fbi director . fbi nsa u government agency detailed chinesegovernment operation used 260000 internetconnected device launch cyberattacks,0.0,Neutral
Luminates hairsaving chemo helmet nears release as new funding goes toward home cancer care,The pitch sounds a bit scifi a helmet called Lily that people undergoing chemotherapy wear to prevent hair loss which is a common side effect of the treatment,TechCrunch,2024-09-19T07:22:27.313684,luminates hairsaving chemo helmet nears release new funding go toward home cancer care . pitch sound bit scifi helmet called lily people undergoing chemotherapy wear prevent hair loss common side effect treatment,-0.5267,Negative
TechCrunch Minute Everything you need to know about iOS 18,Its time to upgrade your iPhone to iOS 18 We know updating your phone is annoying and sometimes those software downloads can take a,TechCrunch,2024-09-19T07:22:27.313684,techcrunch minute everything need know io 18. time upgrade iphone io 18 know updating phone annoying sometimes software downloads take,-0.4019,Negative
YouTube launches Communities a Discordlike space for creators and fans to interact with each other,At its Made On YouTube event on Wednesday the company announced a new dedicated space for creators to interact with their fans and viewers The space called Communities is kind,TechCrunch,2024-09-19T07:22:27.313684,youtube launch community discordlike space creator fan interact . made youtube event wednesday company announced new dedicated space creator interact fan viewer space called community kind,0.875,Positive
Amazon adds PayPal as a payment option to Buy with Prime,Amazons Buy with Prime program which lets shoppers with a Prime membership purchase items from thirdparty stores and check out using their Amazon account is getting a new payment option,TechCrunch,2024-09-19T07:22:27.313684,amazon add paypal payment option buy prime . amazon buy prime program let shopper prime membership purchase item thirdparty store check using amazon account getting new payment option,0.4767,Positive
Edera is building a better Kubernetes and AI security solution from the ground up,Edera a startup looking to simplify and improve how Kubernetes containers and AI workloads are secured by offering a new hypervisor today announced that it has raised a 5 million,TechCrunch,2024-09-19T07:22:27.313684,edera building better kubernetes ai security solution ground . edera startup looking simplify improve kubernetes container ai workload secured offering new hypervisor today announced raised 5 million,0.9042,Positive
YouTube unveils Hype a new way for fans to help smaller creators grow their reach,YouTube creators no longer have to rely solely on the recommendation algorithm search results or collabs to help them grow their audience At the companys Made On YouTube event on,TechCrunch,2024-09-19T07:22:27.313684,youtube unveils hype new way fan help smaller creator grow reach . youtube creator longer rely solely recommendation algorithm search result collabs help grow audience company made youtube event,0.7783,Positive
Concerts lead to Roar looking elsewhere,An ALeague club wants to move one of their home games to a much smaller venue after being forced to play it midweek due to the scheduling of a concert,News AU,2024-09-19T07:22:28.939145,concert lead roar looking elsewhere . aleague club want move one home game much smaller venue forced play midweek due scheduling concert,-0.0772,Neutral
Ricciardo reveals surprise retirement location,Daniel Ricciardos F1 career is on shaky ground and now its emerged hes already thinking about where hed like to retire,News AU,2024-09-19T07:22:28.939145,ricciardo reveals surprise retirement location . daniel ricciardos f1 career shaky ground emerged he already thinking hed like retire,0.4019,Positive
Utterly reprehensible Cricket coach cops 20year ban,After an investigation into allegations of seriously improper behaviour a former Test batter and WBBL coach has been given a twodecade ban,News AU,2024-09-19T07:22:28.939145,utterly reprehensible cricket coach cop 20year ban . investigation allegation seriously improper behaviour former test batter wbbl coach given twodecade ban,-0.836,Negative
Contract detail seals Ricciardos F1 fate,Daniel Ricciardos Formula 1 fate seems all but sealed after contract details were brought to light in the wake of swirling rumours,News AU,2024-09-19T07:22:28.939145,contract detail seal ricciardos f1 fate . daniel ricciardos formula 1 fate seems sealed contract detail brought light wake swirling rumour,0.0,Neutral
Star Hawk to undergo surgery,A star Hawthorn midfielder will spend the offseason in recovery as the semifinalists prepare for a premiership tilt in 2025,News AU,2024-09-19T07:22:28.939145,star hawk undergo surgery . star hawthorn midfielder spend offseason recovery semifinalist prepare premiership tilt 2025,0.0,Neutral
Gives us a chance Dees happy with fixture chaos,The Demons look like a team on the decline but their coach says they can make good use of the AFLWs controversial scheduling call,News AU,2024-09-19T07:22:28.939145,give u chance dees happy fixture chaos . demon look like team decline coach say make good use aflws controversial scheduling call,0.6808,Positive
NRL star caught up in pub incident,Police are investigating after Canberra Raiders star Josh Papalii was allegedly involved in a pub incident early on Monday morning,News AU,2024-09-19T07:22:28.939145,nrl star caught pub incident . police investigating canberra raider star josh papalii allegedly involved pub incident early monday morning,0.0,Neutral
Made it ten times worse Star to be axed,Josh AddoCarr is widely expected to be sacked as he prepares to front the NRL integrity unit and explain his side of the cocaine drama,News AU,2024-09-19T07:22:28.939145,made ten time worse star axed . josh addocarr widely expected sacked prepares front nrl integrity unit explain side cocaine drama,-0.4215,Negative
Biggest loser from Comm Games revamp,Crickets future in a more sustainable Commonwealth Games is murky as other sports also face the chop in a streamlined format,News AU,2024-09-19T07:22:28.939145,biggest loser comm game revamp . cricket future sustainable commonwealth game murky sport also face chop streamlined format,-0.5267,Negative
Tennis star who fled country breaks silence,A former Italian tennis star has spoken out as ugly allegations over why she and her family fled the country continue to emerge,News AU,2024-09-19T07:22:28.939145,tennis star fled country break silence . former italian tennis star spoken ugly allegation family fled country continue emerge,-0.5106,Negative
No shame Dokic shares powerful message,Former tennis champion Jelena Dokic has declared she feels no shame over how she looked before her recent weight loss,News AU,2024-09-19T07:22:28.939145,shame dokic share powerful message . former tennis champion jelena dokic declared feel shame looked recent weight loss,0.1027,Neutral
Darts prodigy is here to win in Australia,Luke Littler has taken the darts world by storm this year and the teenager is in Australia this week determined to continue his red hot form,News AU,2024-09-19T07:22:28.939145,dart prodigy win australia . luke littler taken dart world storm year teenager australia week determined continue red hot form,0.7351,Positive
Absolutely hate it Aussies in Paris drama,A new rule at the Olympics athletics events is sure to divide athletes and fans and produce high drama in Paris writes Sally Pearson,News AU,2024-09-19T07:22:28.939145,absolutely hate aussie paris drama . new rule olympics athletics event sure divide athlete fan produce high drama paris writes sally pearson,-0.101,Neutral
Astonishing rise set to flip F1 in 215m race,Daniel Ricciardo has been given a reality check as the urgency mounts at Red Bull amid a threehorse race to replace a struggling driver,News AU,2024-09-19T07:22:28.939145,astonishing rise set flip f1 215m race . daniel ricciardo given reality check urgency mount red bull amid threehorse race replace struggling driver,-0.4215,Negative
Swirling Ricciardo rumour is worst one yet,Daniel Ricciardo is at the centre of the Formula 1 rumour mill again with the Australian reportedly set to be told some crushing news,News AU,2024-09-19T07:22:28.939145,swirling ricciardo rumour worst one yet . daniel ricciardo centre formula 1 rumour mill australian reportedly set told crushing news,-0.765,Negative
Aussie tennis champ model girlfriend split,Aussie tennis star Thanasi Kokkinakis has seemingly ended his 18month relationship with his glamorous model girlfriend,News AU,2024-09-19T07:22:28.939145,aussie tennis champ model girlfriend split . aussie tennis star thanasi kokkinakis seemingly ended 18month relationship glamorous model girlfriend,0.7506,Positive
Disabled boy banned from sport over rule,A 12yearold boy from Sydney with a disability has been banned from participating in his favourite hobby due to a heartbreaking rule change,News AU,2024-09-19T07:22:28.939145,disabled boy banned sport rule . 12yearold boy sydney disability banned participating favourite hobby due heartbreaking rule change,-0.8402,Negative
NBA icon Shaq in Xrated photo storm,Shaquille ONeal has responded to suggestions he is the secret boyfriend pictured in an Xrated photo shared by an Instagram influencer,News AU,2024-09-19T07:22:28.939145,nba icon shaq xrated photo storm . shaquille oneal responded suggestion secret boyfriend pictured xrated photo shared instagram influencer,0.34,Positive
Taylor Swift stuns at latest NFL game,Taylor Swift made another stunning entrance and showed off her support for boyfriend Travis Kelce at his latest NFL game,News AU,2024-09-19T07:22:28.939145,taylor swift stuns latest nfl game . taylor swift made another stunning entrance showed support boyfriend travis kelce latest nfl game,0.7906,Positive
Brazilian star ready for Sky Blues debut,Sydney FC is intent on growing its brand and reputation throughout Asia with good performances that will also reward the Sky Blues financially,News AU,2024-09-19T07:22:28.939145,brazilian star ready sky blue debut . sydney fc intent growing brand reputation throughout asia good performance also reward sky blue financially,0.8689,Positive
Banned Fears arise over boxing bout,An exboxing world champ has detailed his dire fears for the sport as he called for Jake Pauls fight with Mike Tyson to be called off,News AU,2024-09-19T07:22:28.939145,banned fear arise boxing bout . exboxing world champ detailed dire fear sport called jake paul fight mike tyson called,-0.8979,Negative
Cams redemption quest after wasted homecoming,Cam Smiths preparations for a tilt at a fourth Australian PGA title will include playing in a second event in Queensland this year,News AU,2024-09-19T07:22:28.939145,cam redemption quest wasted homecoming . cam smith preparation tilt fourth australian pga title include playing second event queensland year,-0.34,Negative
New to SuperCoach NBL Pick this team,Need a SuperCoach NBL team in a hurry We ran the numbers on six expert teams to deliver the ultimate starting lineup,News AU,2024-09-19T07:22:28.939145,new supercoach nbl pick team . need supercoach nbl team hurry ran number six expert team deliver ultimate starting lineup,0.0772,Neutral
Wallabies history will be made in Sydney,Nearly 15 years after making his Wallabies debut a national treasure will set a new Australian record against the All Blacks,News AU,2024-09-19T07:22:28.939145,wallaby history made sydney . nearly 15 year making wallaby debut national treasure set new australian record black,0.296,Positive
Wallabies keen to silence external noise,The soul searching continues for the Wallabies ahead of their Bledisloe Cup clash against New Zealand on Saturday,News AU,2024-09-19T07:22:28.939145,wallaby keen silence external noise . soul searching continues wallaby ahead bledisloe cup clash new zealand saturday,0.3612,Positive
I Am Me takes Shorts route to The Everest,I Am Me the brilliant mare stablemate Bella Nipotina has never beaten gets another chance to press her claims for the 20 million The TAB Everest at Royal Randwick on Saturday,News AU,2024-09-19T07:22:28.939145,take short route everest . brilliant mare stablemate bella nipotina never beaten get another chance press claim 20 million tab everest royal randwick saturday,0.7982,Positive
