Title,Description,Source,Fetched Date
Jaguars new electric concept car divides opinion,It comes less than a fortnight after the release of a teaser video that stirred online controversy,BBC Business,2024-12-03T07:26:59.080925
Musks record 56bn pay deal rejected for second time,The judge said the pay package would have been the largest ever for the boss of a listed company,BBC Business,2024-12-03T07:26:59.080925
World of Business,Gain the leading edge with global insights for the boardroom and beyond in your inbox every Wednesday,BBC Business,2024-12-03T07:26:59.080925
Trump threatens 100 tariff on Brics nations if they try to replace dollar,The presidentelect warned the group of nine nations against moving away from the dollar,BBC Business,2024-12-03T07:26:59.080925
Why are doctors wary of wearables,Wearable tech claims to help monitor our health but many doctors remain sceptical,BBC Business,2024-12-03T07:26:59.080925
Trump picks investment banker Warren Stephens as UK ambassador,The billionaire donated millions to Presidentelect Donald Trumps reelection campaign this year,BBC Business,2024-12-03T07:26:59.080925
Vietnamese tycoon loses death row appeal over worlds biggest bank fraud,She is now in a race for her life if she can pay back 75 of what she took she could be spared,BBC Business,2024-12-03T07:26:59.080925
Stellantis boss abruptly quits in boardroom clash,Carlos Tavares will leave immediately days after announcing plans to close a Vauxhall plant in Luton,BBC Business,2024-12-03T07:26:59.080925
Specialty coffee wins over tea lovers in smalltown India,Once restricted to only big cities highend specialty coffee chains are finding new customers across India,BBC Business,2024-12-03T07:26:59.080925
Why so many games are failing right now and why others are breakout hits,Making games is hard and in 2024 getting people to buy them is another challenge,BBC Business,2024-12-03T07:26:59.080925
Fear of missile use behind US curbs on China 2 Dec 2024,Expert says the key motivator behind the new US curbs on semiconductor exports to China is risk of missile use,BBC Business,2024-12-03T07:26:59.080925
Good Bad Billionaire,Simon Jack and Zing Tsjeng find out how the worlds billionaires made their money and then judge them Are they good bad or just another billionaire Listen to season two New episodes released on Mondays,BBC Business,2024-12-03T07:26:59.080925
How one product made a multimillion dollar brand,Nell Diamond CEO of Hill House Home shares how her small business skyrocketed to global success with the launch of the Nap Dress in 2019,BBC Business,2024-12-03T07:26:59.080925
Typhoo Tea to be rescued by vape maker for 10m,The firm behind ecigarette brand 88Vape will buy the tea business after it fell into administration,BBC Business,2024-12-03T07:26:59.080925
Cyber Monday How to spot a deal and not get ripped off,Experts tell us how to work out if a deal is a genuine bargain or could leave you out of pocket,BBC Business,2024-12-03T07:26:59.080925
Italian purees in UK supermarkets likely to contain Chinese forcedlabour tomatoes,Some products described as Italian appear to contain Chinese tomatoes BBC investigation suggests,BBC Business,2024-12-03T07:26:59.080925
Why Canadas Christmas presents may not be delivered on time this year,Small businesses are fretting as negotiations stall between Canadas postal service and its unionised workers,BBC Business,2024-12-03T07:26:59.080925
Five ways to persuade more people to buy electric cars,Demand for electric cars is lower than expected the industry says What might help to boost sales,BBC Business,2024-12-03T07:26:59.080925
Belgiums sex workers get maternity leave and pensions under worldfirst law,They will be entitled to official employment contracts health insurance and sick days,BBC Business,2024-12-03T07:26:59.080925
Playing with FIRE How to quit work and retire in your 30s,A personal finance strategy popular among millennials is helping them to quit their job and retire decades early,BBC Business,2024-12-03T07:26:59.080925
Boomerang CEOs Do they ever succeed,Five years after being ousted from WeWork Adam Neumann wants to rebuy the nowbankrupt business,BBC Business,2024-12-03T07:26:59.080925
How industry leaders transformed their career,The BBCs Katty Kay has spoken to successful changemakers to ask what made them pivot in their career,BBC Business,2024-12-03T07:26:59.080925
Women were the original beer brewers what changed,Today the beer industry is maledominated but it wasnt always so,BBC Business,2024-12-03T07:26:59.080925
How waiting alters our perception of time,Expert advice on how to get through a waiting period,BBC Business,2024-12-03T07:26:59.080925
Do the superrich deserve their wealth,Should there be a cap on billionaires wealth and their inheritances,BBC Business,2024-12-03T07:26:59.080925
Four simple hacks to succeed in every conversation,A career coach a choreographer a chef and a dragon boat captain offer advice on giving critical feedback,BBC Business,2024-12-03T07:26:59.080925
Solo and hybrid work Navigating our future and new normal,Covid19 reshaped the way we live and work We rethink solo working and explore the future of worklife,BBC Business,2024-12-03T07:26:59.080925
Can supersonic flight ever be sustainable,How a new era of quiet net zero supersonic airliners could revolutionise the aviation industry,BBC Business,2024-12-03T07:26:59.080925
Commencement speech The surprising pitfall of your passions,Students are graduating in the US this week The commencement speeches might lead them into questionable choices,BBC Business,2024-12-03T07:26:59.080925
ASMR How whispering took over the internet,We meet the creators behind the current ASMR boom,BBC Business,2024-12-03T07:26:59.080925
A desk full of descriptions for your work colleagues,These are the long lost words youve been waiting for to describe your colleagues,BBC Business,2024-12-03T07:26:59.080925
Veterinarian suicide rates are very high Why,Veterinarian professionals are committing suicide at a higher rate than the general population,BBC Business,2024-12-03T07:26:59.080925
Canadas oil patch rattled by Trumps tariff threat,The proposed tariffs if applied to oil and gas could hammer Canadas economy and hike prices at the pump for Americans analysts say,BBC Business,2024-12-03T07:26:59.080925
Al Fayed tried to control me with envelopes of cash says exHarrods director,Harrods boss manipulated and controlled managers to conceal his crimes exdirector tells the BBC,BBC Business,2024-12-03T07:26:59.080925
Major Canadian news outlets sue OpenAI,The suit a first for Canada alleges OpenAIs chatbot was illegally scraping news articles which the firm denies,BBC Business,2024-12-03T07:26:59.080925
Capturing the scent of Palestinian life in a bottle,Palestinian perfumers try to evoke memories of a better time with ingredients of their heritage,BBC Business,2024-12-03T07:26:59.080925
Uniqlo faces China backlash over cotton comments,Commentators call for a boycott of the chain in China after it told the BBC it does not use Xinjiang cotton,BBC Business,2024-12-03T07:26:59.080925
Rupert Grint to pay 18m after losing tax battle,The former Harry Potter star is ordered to pay the sum after losing a tax appeal,BBC Business,2024-12-03T07:26:59.080925
Crypto entrepreneur eats banana artwork bought for 62m,Justin Sun described Maurizio Cattelans infamous 2019 work as much better than other bananas,BBC Business,2024-12-03T07:26:59.080925
Indian airlines hit by nearly 1000 hoax bomb threats,More than 500 of the years bomb threats were received just in the last two weeks of October,BBC Business,2024-12-03T07:26:59.080925
Canada watchdog sues Google over alleged anticompetitive conduct,The suit is the latest regulatory headache for Google which is facing similar action in the US,BBC Business,2024-12-03T07:26:59.080925
The Hollywood Reporter Wins Best Website Online Journalist of the Year at National Arts Entertainment Journalism Awards,The news organization took home a total of 13 awards at Sunday nights gala where Kathy Bates Melissa Etheridge Tiffany Haddish and Kevin Frazier were honored,Hollywood Reporter,2024-12-03T07:26:59.298413
President Biden Pardons Son Hunter Reversing His Past Promise Not to Do So,The outgoing president spared the younger Biden a possible prison sentence for federal felony gun and tax convictions alleging that the prosecution of his son was politically motivated and a miscarriage of justice,Hollywood Reporter,2024-12-03T07:26:59.298413
Zayn Malik Dedicates Song to Liam Payne While Performing in Late Singers Hometown I Hope Youre Seeing This,Payne died on Oct 16,Hollywood Reporter,2024-12-03T07:26:59.298413
Bob Bryar Former My Chemical Romance Drummer Dies at 44,The musician was a member of the rock band from 2004 to 2010,Hollywood Reporter,2024-12-03T07:26:59.298413
Hailee Steinfeld Engaged to Buffalo Bills Quarterback Josh Allen,Allen and Steinfeld were first linked in the spring of 2023,Hollywood Reporter,2024-12-03T07:26:59.298413
Super Bowl Pregame Performers Jon Batiste Lauren Daigle Trombone Shorty and Ledisi,The Grammywinning musicians will be part of the pregame entertainment ahead of Kendrick Lamars halftime performance on Feb 9 in New Orleans,Hollywood Reporter,2024-12-03T07:26:59.298413
Rainy Macys Thanksgiving Day Parade Boasts Balloons and Stars in New York,Jennifer Hudson Idina Menzel and Kylie Minogue were among those who performed at this years edition of the Turkey Day spectacle,Hollywood Reporter,2024-12-03T07:26:59.298413
21 ProPalestinian Demonstrators Arrested at Macys Thanksgiving Day Parade,The group which blocked a Ronald McDonald balloon carried Palestinian flags and banners and chanted Free free Palestine,Hollywood Reporter,2024-12-03T07:26:59.298413
Sean Diddy Combs Denied Bail After Third Try,The court stressed rap moguls propensity for violence in addition to evidence indicating his willingness to skirt rules during his stay in prison,Hollywood Reporter,2024-12-03T07:26:59.298413
Sharon Stone Says Ignorant and Uneducated Americans to Blame for Trump ReElection,The actress had some strong words about America when discussing politics at the Turin Film Festival,Hollywood Reporter,2024-12-03T07:26:59.298413
The Weeknd Pairs New Album Release With OneNightOnly Concert at Rose Bowl,Hurry Up Tomorrow will drop on Jan 24 and a day after the pop star will hold at special concert at the famed stadium,Hollywood Reporter,2024-12-03T07:26:59.298413
Kamala Harris Team Says Hot Ones Turned Her Down and Clarifies Joe Rogan Decision,Campaign staffers explain some of their podcast decisions including not going on Joe Rogans podcast and how some shows rejected the candidate,Hollywood Reporter,2024-12-03T07:26:59.298413
Tennis legend dies aged 91,An Australian tennis icon who won Wimbledon and the US Open singles titles has died at the age of 91,News AU,2024-12-03T07:27:01.014387
Not just for Chad Swans preseason mission,Sydney captain Callum Mills has revealed what he is trying to do to help keep a Swans superstar at the club for the longterm,News AU,2024-12-03T07:27:01.014387
Aussie ready for next level in AEW,One of AEWs emerging stars cant wait to perform in front of Australian wrestling fans at the Brisbane Entertainment Centre in February,News AU,2024-12-03T07:27:01.014387
Australian tennis legend dead at 91,The tennis world has been left broken hearted after Aussie tennis legend Neale Fraser passed away following an illustrious career,News AU,2024-12-03T07:27:01.014387
Dusty wiped from history in shock move,Richmond has made a big call about Dustin Martin and fellow premiership heroes as the Tigers look to protect their No 1 pick,News AU,2024-12-03T07:27:01.014387
Annoys me Clueless NSW fans shut down,Blues coach Laurie Daley had many fans all saying the same thing after his return to coach NSW Those claims have been rubbished,News AU,2024-12-03T07:27:01.014387
Former NRL bad boys shock new role,Todd Carney who was sacked by two clubs in his NRL career has made a surprise return to the top tier of rugby league,News AU,2024-12-03T07:27:01.014387
Former NRL bosss lucrative new role,Cricket Australia has confirmed its new chief executive with a man familiar to NRL fans to take on the role next year,News AU,2024-12-03T07:27:01.014387
Nobody noticed Test mystery storm erupts,An Indian legend has suggested an injury to one of Australias most important players is shrouded in mystery ahead of the second Test,News AU,2024-12-03T07:27:01.014387
Nervy time Why Buckley fears for his job,Nathan Buckley says he and his colleagues are worried for their jobs at an AFL broadcaster declaring its a nervy time for them,News AU,2024-12-03T07:27:01.014387
Damning reasons for Aussie failure exposed,Cricket greats are making damning calls on the state of Australian cricket after the Aussies were embarrassed in the first Test,News AU,2024-12-03T07:27:01.014387
Primed Scary prediction for Test whitewash,Cricket legends are tipping Australia to dominate the Test summer as one players answer revealed the flaw in Indias team,News AU,2024-12-03T07:27:01.014387
Bombshell Red Bull report sends shockwaves,The guillotine has fallen at Red Bull with the world champion outfit set to transform what the grid looks like in 2025,News AU,2024-12-03T07:27:01.014387
Red Bull ready to swing the axe after nightmare year,The guillotine has fallen at Red Bull with the world champion outfit set to transform what the grid looks like in 2025,News AU,2024-12-03T07:27:01.014387
McGregors fiancee says the unthinkable,Conor McGregors partner has spoken out after the civil court findings and her response is horrifying,News AU,2024-12-03T07:27:01.014387
Ring girls fame reaches absurd heights,Boxings latest viral sensation continues to take the internet by storm with Sydney Thomas left overwhelmed by her newfound fame,News AU,2024-12-03T07:27:01.014387
Insane Aussie receives enormous praise,Dyson Daniels star continues to soar with the young Aussie drawing huge praise from one of the best players in NBA history,News AU,2024-12-03T07:27:01.014387
Insanity Pepper spray act rocks America,Ugly scenes have shocked America with police investigating a postgame brawl that is going viral for all the wrong reasons,News AU,2024-12-03T07:27:01.014387
Dagger in my heart Recalled Matildas torment,A luckless forward is determined to cement her spot in the Matildas side as she eyes a big role against Chinese Taipei,News AU,2024-12-03T07:27:01.014387
Matildas coach makes frank admission,The Matildas interim coach was candid about the issues the side is facing as they look to bounce back from consecutive losses,News AU,2024-12-03T07:27:01.014387
Olympians toxic relationship with ex court,The exgirlfriend of Olympic boxer Harry Garside has avoided conviction after she lost her cool and behaved extremely badly during a tussle with her famous partner,News AU,2024-12-03T07:27:01.014387
Legend survives scare in big Aus Open win,A day that started with high hopes for a decadelong winning drought coming to an end finished with something completely different,News AU,2024-12-03T07:27:01.014387
SuperCoach NBL fast trades tips for Round 11,The biggest star in SuperCoach NBL is smashing records and one of the best picks of the year is back on the trade radar Heres how to maximise your score for round 11,News AU,2024-12-03T07:27:01.014387
Wallaby gut punch as star makes NFL move,One of the Wallabies most exciting players has announced he is gambling everything to chase his dream in the United States,News AU,2024-12-03T07:27:01.014387
Star quits rugby to chase NFL dream,A former Wallaby is the latest Aussie to try his luck in the NFL with the rugby star accepting a spot in the international pathway program,News AU,2024-12-03T07:27:01.014387
Maher looks to Future for coveted Ballarat Cup win,Ciaron Maher has won Australias biggest and richest races but the champion trainer is chasing a much soughtafter victory in the Ballarat Cup on Saturday,News AU,2024-12-03T07:27:01.014387
Australia bans Olympic medallist for life,Australian cycling has thrown the book at Olympic medallist Matthew Richardson slamming the door shut after his shock defection,News AU,2024-12-03T07:27:01.014387
