Title,Description,Source,Fetched Date
Meta to pay 25m to settle Trump lawsuit over ban,The president sued the firm in 2021 over the suspension of his accounts after the 6 January Capitol riots,BBC Business,2025-01-30T07:21:36.572777
Trump attacks Fed after no change in interest rates,The US central bank keeps its key interest rate unchanged as it faces significant economic uncertainty,BBC Business,2025-01-30T07:21:36.572777
World of Business,Gain the leading edge with global insights for the boardroom and beyond in your inbox every Wednesday,BBC Business,2025-01-30T07:21:36.572777
Roman Abramovich could owe UK 1bn over tax dodge that helped bankroll Chelsea FC,Scheme to avoid tax on offshore billions may have been botched because money was managed from the UK BBC learns,BBC Business,2025-01-30T07:21:36.572777
Chancellor backs Heathrow expansion to boost UK growth,Rachel Reeves announces wideranging plans to get the UKs sluggish economy moving,BBC Business,2025-01-30T07:21:36.572777
CocaCola recalls drinks in UK due to chemical levels,The firm is recalling CocaCola products from shops but says the risk of illness is very low,BBC Business,2025-01-30T07:21:36.572777
OpenAI says Chinese rivals using its work for their AI apps,ChatGPT maker says it will need extra protection from US government following emergence of Chinese rival DeepSeek,BBC Business,2025-01-30T07:21:36.572777
Trump offers millions of federal workers eight months pay to resign,The offer is part of the presidents plan to shrink and reform the US government,BBC Business,2025-01-30T07:21:36.572777
DeepSeek shows AIs centre of power could shift away from US,The apps strong debut has shaken beliefs that the US would remain the unchallenged global AI superpower writes the BBCs Marc Cieslak,BBC Business,2025-01-30T07:21:36.572777
UK will not be able to resist Chinas tech dominance,Chinas AI success has come from policy and Chancellor Rachel Reevess recent visit to China highlights the importance of a close relationship,BBC Business,2025-01-30T07:21:36.572777
Expert predicts no Fed rate cut before June 29 Jan 2025,Mohamed ElErian chief economic adviser at Allianz says we will have to wait quite a bit for another rate cut,BBC Business,2025-01-30T07:21:36.572777
Good Bad Billionaire,Simon Jack and Zing Tsjeng find out how the worlds billionaires made their money and then judge them Are they good bad or just another billionaire Listen to season two New episodes released on Mondays,BBC Business,2025-01-30T07:21:36.572777
How one product made a multimillion dollar brand,Nell Diamond CEO of Hill House Home shares how her small business skyrocketed to global success with the launch of the Nap Dress in 2019,BBC Business,2025-01-30T07:21:36.572777
Garmin users say smartwatches have stopped working,Its Fenix 8 smartwatches which retail for just under 1000 are some of the devices to have issues,BBC Business,2025-01-30T07:21:36.572777
US tech stocks steady after DeepSeek AI app shock,DeepSeeks claim that its model was made at a fraction of the cost of its rivals has rocked the AI industry,BBC Business,2025-01-30T07:21:36.572777
Boeing loses almost 1bn every month in 2024,Boeing reported its second biggest annual loss ever after a tough year following a midair accident and worker strikes,BBC Business,2025-01-30T07:21:36.572777
How Chinas AI heroes overcame US curbs to stun Silicon Valley,How did a littleknown Chinese startup build a powerful new AI model despite restrictions,BBC Business,2025-01-30T07:21:36.572777
Abramovich dodged millions in tax with superyachtsforhire scheme,Shell companies were used to charter the sanctioned oligarchs yachts to himself evading VAT BBC reveals,BBC Business,2025-01-30T07:21:36.572777
Chinas DeepSeek AI shakes industry and dents Americas swagger,The app spooked the markets as well as the bullish sense of American superiority in AI development,BBC Business,2025-01-30T07:21:36.572777
Playing with FIRE How to quit work and retire in your 30s,A personal finance strategy popular among millennials is helping them to quit their job and retire decades early,BBC Business,2025-01-30T07:21:36.572777
Boomerang CEOs Do they ever succeed,Five years after being ousted from WeWork Adam Neumann wants to rebuy the nowbankrupt business,BBC Business,2025-01-30T07:21:36.572777
How industry leaders transformed their career,The BBCs Katty Kay has spoken to successful changemakers to ask what made them pivot in their career,BBC Business,2025-01-30T07:21:36.572777
Women were the original beer brewers what changed,Today the beer industry is maledominated but it wasnt always so,BBC Business,2025-01-30T07:21:36.572777
How waiting alters our perception of time,Expert advice on how to get through a waiting period,BBC Business,2025-01-30T07:21:36.572777
Do the superrich deserve their wealth,Should there be a cap on billionaires wealth and their inheritances,BBC Business,2025-01-30T07:21:36.572777
Four simple hacks to succeed in every conversation,A career coach a choreographer a chef and a dragon boat captain offer advice on giving critical feedback,BBC Business,2025-01-30T07:21:36.572777
Solo and hybrid work Navigating our future and new normal,Covid19 reshaped the way we live and work We rethink solo working and explore the future of worklife,BBC Business,2025-01-30T07:21:36.572777
Can supersonic flight ever be sustainable,How a new era of quiet net zero supersonic airliners could revolutionise the aviation industry,BBC Business,2025-01-30T07:21:36.572777
Commencement speech The surprising pitfall of your passions,Students are graduating in the US this week The commencement speeches might lead them into questionable choices,BBC Business,2025-01-30T07:21:36.572777
ASMR How whispering took over the internet,We meet the creators behind the current ASMR boom,BBC Business,2025-01-30T07:21:36.572777
A desk full of descriptions for your work colleagues,These are the long lost words youve been waiting for to describe your colleagues,BBC Business,2025-01-30T07:21:36.572777
Veterinarian suicide rates are very high Why,Veterinarian professionals are committing suicide at a higher rate than the general population,BBC Business,2025-01-30T07:21:36.572777
White House defends freezing funds as reasonable while Democrats express extreme alarm,The order is a potential fivealarm fire for organizations that serve communities nonprofit group executive says,BBC Business,2025-01-30T07:21:36.572777
Microsoft in talks to buy TikTok Trump says,The US President says he would like to see a bidding war over the sale of the social media app,BBC Business,2025-01-30T07:21:36.572777
CocaCola recalls drinks over safety concerns,The company says the drinks contain higher levels of chlorate but says the risk is very low,BBC Business,2025-01-30T07:21:36.572777
The Chinese AI app that has the world talking,A Chinese startup has built a lowcost AI model using less technologically advanced chips,BBC Business,2025-01-30T07:21:36.572777
Is Chinas AI tool DeepSeek as good as it seems,The artificial intelligence AI tool has shocked US markets after bursting onto the scene,BBC Business,2025-01-30T07:21:36.572777
Jaguar Land Rover bets 80m on bespoke paint services,The firm says it will more than double its capacity for bespoke paint orders for wealthy customers,BBC Business,2025-01-30T07:21:36.572777
Colombia yields on US deportation flights to avert trade war,President Gustavo Petro agrees to accept deported migrants after Trump ordered 25 tariffs on all goods,BBC Business,2025-01-30T07:21:36.572777
New Zealand eases visa rules for digital nomads to boost tourism,Visitors can now carry out remote working for a foreign employer while holidaying in the country for up to 90 days,BBC Business,2025-01-30T07:21:36.572777
Inside the race for Greenlands mineral wealth,The territorys untapped mineral wealth has caught the eye of both mining firms and Donald Trump,BBC Business,2025-01-30T07:21:36.572777
Fire Relief How Hollywood Is Coming to the Rescue,Industry insiders actors stylists location scouts even agents and lawyers are channeling their unique talents to aid the effort,Hollywood Reporter,2025-01-30T07:21:36.921904
Grammys Ceremony Will Include Tributes to Quincy Jones and the City of Los Angeles,Brad Paisley Brittany Howard Coldplays Chris Martin Cynthia Erivo Herbie Hancock Jacob Collier Janelle Mone John Legend Lainey Wilson Sheryl Crow St Vincent and Stevie Wonder have been announced as performers for Sundays show,Hollywood Reporter,2025-01-30T07:21:36.921904
Women in Music Industry Held On to Gains in 2024 Still Underrepresented Study Finds,The latest report from USCs Annenberg Inclusion Initiative found women made up little new ground towards greater industry parity,Hollywood Reporter,2025-01-30T07:21:36.921904
Harvey Weinstein Pushes for Earlier Trial I Need to Get Out of This Hell Hole,An April 15 trial date was set as Weinstein asked for an earlier start due to emergency health conditions,Hollywood Reporter,2025-01-30T07:21:36.921904
Recording Academy Sets Performers and Presenters for Grammy Awards Premiere Ceremony,The ceremony which takes place Sunday before the Grammys telecast will also raise additional funds to support wildfire relief efforts and honor first responders,Hollywood Reporter,2025-01-30T07:21:36.921904
Madonna Slams Trump Administration for Slowly Dismantling All the Freedoms We Have Been Fighting For,The pop icons comments come after the president signed an executive order barring transgender people from serving and enlisting in the military,Hollywood Reporter,2025-01-30T07:21:36.921904
Blackpinks Jisoo Inks Global Solo Deal With Warner Records Ahead of Debut Solo EP,The 30yearold Kpop star is also slated to star in the upcoming Prime Video Kdrama Newtopia,Hollywood Reporter,2025-01-30T07:21:36.921904
Sony Music Publishing Names Katie Welle President and Head of US AR,The music industry veteran most recently served as SVP of creative,Hollywood Reporter,2025-01-30T07:21:36.921904
New York Magazine Called Out For Cropping Black Partygoers Out of Image for MAGA Youth Cover Story,The Black cohost of the pictured event is calling it insane that he was removed from the picture of the event in Washington DC on the eve of Trumps inauguration,Hollywood Reporter,2025-01-30T07:21:36.921904
Selena Gomez Told by Border Czar to Cry to Congress as Senate Hopeful Calls for Deportation,The singeractress had posted and deleted a video of her sobbing over ICE raids,Hollywood Reporter,2025-01-30T07:21:36.921904
White House Says It Is Opening Briefing Room to Podcasters Social Media Influencers and Content Creators,Press Secretary Karoline Leavitt announced the new policy during her first press briefing Tuesday,Hollywood Reporter,2025-01-30T07:21:36.921904
Caroline Kennedy Excoriates RFK Jr Ahead of Confirmation a Predator,He put baby chickens and mice in the blender she says of her cousin chosen by President Trump to head HHS,Hollywood Reporter,2025-01-30T07:21:36.921904
Poms sledge statpadding Aussie duo,England just cant get Australias cricket team out of its head with the Aussies dominating the first Test against Sri Lanka,News AU,2025-01-30T07:21:39.029193
A precious moment Khawaja makes history Aussies pile on runs,Usman Khawaja has scored his first double century as Australia reasserts its dominance over Sri Lanka FOLLOW LIVE as the Aussies look to cash in,News AU,2025-01-30T07:21:39.029193
Forgotten Test guns rise continues,He went more than 760 days between Sheffield Shield hundreds after a Test ton in 2019 but now hes back in the spotlight Kurtis Patterson is posing big selection questions,News AU,2025-01-30T07:21:39.029193
Inglis takes big step in coaching career,Greg Inglis is a man in demand with the Hall of Famer accepting two major coaching roles in two days,News AU,2025-01-30T07:21:39.029193
Fingers crossed Kyrgios still in Davis Cup picture,Nick Kyrgios hopes of returning to the Davis Cup scene are over for now but his injury has opened the door for an Australian Open hero to make his debut,News AU,2025-01-30T07:21:39.029193
Australia left reeling by horrific Dokic reveal,Aussies are praising Jelena Dokic for her bravery after the tennis great recalled horrifying details of incident with her abusive father,News AU,2025-01-30T07:21:39.029193
Shattered Kangaroos young guns injury blow,A day after a trio of St Kilda stars were put on the sidelines a North Melbourne youngster has suffered a similar injury fate,News AU,2025-01-30T07:21:39.029193
Cue outrage Danger calls for drastic AFL change,The AFL is about to start the first year of its most lucrative broadcasting deal ever and one of the games superstar players has demanded a change,News AU,2025-01-30T07:21:39.029193
Sailors big call on assault charges,Brisbane Broncos and Wallabies great Wendell Sailor will fight allegations he assaulted two men a court has been told,News AU,2025-01-30T07:21:39.029193
Horror as WWE star rushed to hospital,A WWE star has suffered gruesome injuries after a sickening incident that saw him collapse on live television,News AU,2025-01-30T07:21:39.029193
Football fan on life support after horror fall,Philadelphia is always a dangerous place to be after the Eagles win a big game but its potentially turned deadly after a tragic accident,News AU,2025-01-30T07:21:39.029193
Tragedy as teen gymnast falls from pole dies,A rising gymnast was killed in tragic circumstances after falling from a pole during chaotic scenes in Philadelphia,News AU,2025-01-30T07:21:39.029193
Fans brawl in the stands at basketball game,A college basketball game had to be stopped as a wild brawl broke out in the stands leaving the commentators stunned,News AU,2025-01-30T07:21:39.029193
Ange the right man for Spurs,Tottenham can still do big things this season despite the pressure building on Spurs boss Ange Postecoglou,News AU,2025-01-30T07:21:39.029193
Socceroo impresses in Portsmouth debut,English Championship club Portsmouth has wasted no time in giving a debut to Socceroos defender Hayden Matthews,News AU,2025-01-30T07:21:39.029193
UFC 312 Volk teammate promises to get revenge on Topuria,Colby Thicknesse was listening to Triple Js Hottest 100 countdown when he received a message that changed his life Now the Wollongong fighter has vowed to get revenge,News AU,2025-01-30T07:21:39.029193
Aussie F1 star on borrowed time already,Australias Jack Doohan is under massive pressure to keep his spot in Formula 1 amid mounting speculation hes on borrowed time,News AU,2025-01-30T07:21:39.029193
We saw her F1 erupts at Lewis footage,F1 fans have gone into meltdown after spotting a major detail in footage of Lewis Hamiltons first test drive on track with Ferrari,News AU,2025-01-30T07:21:39.029193
Inside the life of the NBAs favourite content creator,Shes your favourite NBA players favourite photographer but Cassy Athenas impact is global The content queen shares how she built a trailblazing career that has the likes of Steph Curry calling her up,News AU,2025-01-30T07:21:39.029193
More penal Only answer to golf scourge,Most sports are speeding up to cater to the modern world but golf is slowing down and its a problem that only has one solution,News AU,2025-01-30T07:21:39.029193
Canterbury preview Smith colt can make an Impact on debut,Trainer Matthew Smith is both eager and proud to unveil the first Australian runner sired by his beloved triple Group 1 winner Fierce Impact at Canterbury on Friday night,News AU,2025-01-30T07:21:39.029193
Waugh Home World Cup is the Wallabies chance for redemption,Rugby Australia chief Phil Waugh declares the 2027 Rugby World Cup at home the Wallabies chance for redemption as Melbourne misses out on blockbuster games,News AU,2025-01-30T07:21:39.029193
Rugby World Cup final venue announced,Sydney is the big winner in the battle between Australian states to host matches at the 2027 Rugby World Cup,News AU,2025-01-30T07:21:39.029193
Olympian to learn familys pain in court,The heartbroken family of an Olympic cyclist are expected to deliver victim impact statements detailing their pain and grief to the court,News AU,2025-01-30T07:21:39.029193
