Title,Description,Source,Fetched Date,Combined Text,Score,Sentiment
Cotton Wildcats outclass Kings in pivotal NBL battle,Bryce Cotton continued his NBL MVP push with another standout performance as the Perth Wildcats get their toptwo hopes alive with a big win over the Sydney Kings Recap the action from the round here,News AU,2025-02-02T07:20:18.396068,cotton wildcat outclass king pivotal nbl battle . bryce cotton continued nbl mvp push another standout performance perth wildcat get toptwo hope alive big win sydney king recap action round,0.7717,Positive
Local flirts with history as McLeod edges closer to victory,Victorias Cameron John fell short of equalling a historic score while Jake McLeod edged closer to a droughtbreaking win on Day three of the Webex Players Series event on the Murray River,News AU,2025-02-02T07:20:18.396068,local flirt history mcleod edge closer victory . victoria cameron john fell short equalling historic score jake mcleod edged closer droughtbreaking win day three webex player series event murray river,0.5859,Positive
OShea eyes major spring riches with rising star Yorkshire,Yorkshire continued on winning ways at Rosehill Gardens on Saturday but the stable remain in no rush with the emerging star,News AU,2025-02-02T07:20:18.396068,oshea eye major spring rich rising star yorkshire . yorkshire continued winning way rosehill garden saturday stable remain rush emerging star,0.8481,Positive
Tahs suffer early Suaalii blow with injury icing debut,Superstar JosephAukuso Suaaliis hotly anticipated debut in the NSW Waratahs jersey has been cruelled by an injury,News AU,2025-02-02T07:20:18.396068,tahs suffer early suaalii blow injury icing debut . superstar josephaukuso suaaliis hotly anticipated debut nsw waratah jersey cruelled injury,-0.8442,Negative
Wallabies grudge match secured with Jones Japan,He left the Wallabies after a horror World Cup campaign to take a job in Japan some say hed already lined up and now Eddie Jones will have to coach against his former players,News AU,2025-02-02T07:20:18.396068,wallaby grudge match secured jones japan . left wallaby horror world cup campaign take job japan say hed already lined eddie jones coach former player,-0.25,Negative
Olympian to learn familys pain in court,The heartbroken family of an Olympic cyclist are expected to deliver victim impact statements detailing their pain and grief to the court,News AU,2025-02-02T07:20:18.396068,olympian learn family pain court . heartbroken family olympic cyclist expected deliver victim impact statement detailing pain grief court,-0.9451,Negative
