Title,Description,Source,Fetched Date
China announces retaliatory action as Trump tariffs take effect,Chinas tariffs on US goods due to begin on Monday include 15 on coal and 10 on crude oil and pickup trucks,BBC Business,2025-02-04T07:22:51.836833
Who won and lost as Trumps trade war is delayed for now,BBC reporters in the US Canada and Mexico assess the fallout after Trump gets border promises in return for a 30day pause on tariffs,BBC Business,2025-02-04T07:22:51.836833
World of Business,Gain the leading edge with global insights for the boardroom and beyond in your inbox every Wednesday,BBC Business,2025-02-04T07:22:51.836833
US and Mexico reach deal to put tariffs on hold for now,A trade war between the US and Mexico has been temporarily averted after the two sides agreed a deal,BBC Business,2025-02-04T07:22:51.836833
Ontario ends contract with Musks Starlink over US tariffs,It is part of Canadas response to sweeping tariffs levied by US President Donald Trump on its imports,BBC Business,2025-02-04T07:22:51.836833
Trump sows uncertainty and Xi Jinping sees an opportunity,President Xi Jinping has made no secret of his ambition for China to lead an alternate world order,BBC Business,2025-02-04T07:22:51.836833
US sovereign wealth fund could buy TikTok Trump says,The president has kickstarted the creation of a national fund which he says could buy the social media platform,BBC Business,2025-02-04T07:22:51.836833
Share falls ease after Trump tariff turmoil,US shares regained some ground after falling sharply in early trade as Trump paused tariffs on Mexico and Canada,BBC Business,2025-02-04T07:22:51.836833
How world responds to Trumps tariffs is what matters next,Retaliatory taxes against the US by other nations could lead global trade into uncharted territory,BBC Business,2025-02-04T07:22:51.836833
Tax relief for Indian middle class but will it boost economy,The finance minister announced steps to tackle slowing growth rising prices and low middleclass consumption,BBC Business,2025-02-04T07:22:51.836833
Tariffs bound to have a negative impact 3 Feb 2025,Matt Rowe from Nomura Capital Management says impact on markets depends on how long the tariffs are maintained,BBC Business,2025-02-04T07:22:51.836833
Good Bad Billionaire,Simon Jack and Zing Tsjeng find out how the worlds billionaires made their money and then judge them Are they good bad or just another billionaire Listen to season two New episodes released on Mondays,BBC Business,2025-02-04T07:22:51.836833
How one product made a multimillion dollar brand,Nell Diamond CEO of Hill House Home shares how her small business skyrocketed to global success with the launch of the Nap Dress in 2019,BBC Business,2025-02-04T07:22:51.836833
Six things that could get more expensive for Americans under Trump tariffs,Economists warn that the introduction of tariffs could lead to prices rising on a wide range of products,BBC Business,2025-02-04T07:22:51.836833
UK not choosing between US and EU says Starmer,US President Donald Trump threatens EU with trade taxes but hints he could reach a deal with the UK,BBC Business,2025-02-04T07:22:51.836833
What are tariffs and will prices rise,The cost of cars fruit and pharmaceuticals could increase because of Trumps tariff announcement,BBC Business,2025-02-04T07:22:51.836833
Bill Gates Weve given away 100bn but my children wont be poor when Im gone,The Microsoft cofounder says he enjoys giving away his fortune and it wont leave his kids poor,BBC Business,2025-02-04T07:22:51.836833
Chinese fashion giant Shein reenters India five years after ban,Sheins reentry to the Indian market comes with strict terms which include saving all data within the country,BBC Business,2025-02-04T07:22:51.836833
EU tariffs pretty soon but UK can be worked out Trump,Trump accuses the EU of taking advantage of the US but says UK PM Starmer has been very nice,BBC Business,2025-02-04T07:22:51.836833
Playing with FIRE How to quit work and retire in your 30s,A personal finance strategy popular among millennials is helping them to quit their job and retire decades early,BBC Business,2025-02-04T07:22:51.836833
Boomerang CEOs Do they ever succeed,Five years after being ousted from WeWork Adam Neumann wants to rebuy the nowbankrupt business,BBC Business,2025-02-04T07:22:51.836833
How industry leaders transformed their career,The BBCs Katty Kay has spoken to successful changemakers to ask what made them pivot in their career,BBC Business,2025-02-04T07:22:51.836833
Women were the original beer brewers what changed,Today the beer industry is maledominated but it wasnt always so,BBC Business,2025-02-04T07:22:51.836833
How waiting alters our perception of time,Expert advice on how to get through a waiting period,BBC Business,2025-02-04T07:22:51.836833
Do the superrich deserve their wealth,Should there be a cap on billionaires wealth and their inheritances,BBC Business,2025-02-04T07:22:51.836833
Four simple hacks to succeed in every conversation,A career coach a choreographer a chef and a dragon boat captain offer advice on giving critical feedback,BBC Business,2025-02-04T07:22:51.836833
Solo and hybrid work Navigating our future and new normal,Covid19 reshaped the way we live and work We rethink solo working and explore the future of worklife,BBC Business,2025-02-04T07:22:51.836833
Can supersonic flight ever be sustainable,How a new era of quiet net zero supersonic airliners could revolutionise the aviation industry,BBC Business,2025-02-04T07:22:51.836833
Commencement speech The surprising pitfall of your passions,Students are graduating in the US this week The commencement speeches might lead them into questionable choices,BBC Business,2025-02-04T07:22:51.836833
ASMR How whispering took over the internet,We meet the creators behind the current ASMR boom,BBC Business,2025-02-04T07:22:51.836833
A desk full of descriptions for your work colleagues,These are the long lost words youve been waiting for to describe your colleagues,BBC Business,2025-02-04T07:22:51.836833
Veterinarian suicide rates are very high Why,Veterinarian professionals are committing suicide at a higher rate than the general population,BBC Business,2025-02-04T07:22:51.836833
Canadian fans boo US anthem as tariffs spur buy local pledge,Canadians have begun booing the US anthem at sports games signalling the depth of anger at steep tariffs issued by Trump,BBC Business,2025-02-04T07:22:51.836833
Thames Water seeks court approval for emergency cash,Thames Water is hoping to secure an emergency cash injection or face runing out of money in weeks,BBC Business,2025-02-04T07:22:51.836833
Musk team given access to sensitive federal payment system reports,The Trump administration grants Musks team access to system that controls the flow of trillions of dollars in funds US media report,BBC Business,2025-02-04T07:22:51.836833
Canada imposes 25 tariffs in trade war with US,Canada announces retaliatory tariffs against the US in a move that is likely to be costly for both nations,BBC Business,2025-02-04T07:22:51.836833
Barclays working to update account balances after tech outage,The bank says a technical issue which began on Friday and impacted the its app online banking and payments has been resolved,BBC Business,2025-02-04T07:22:51.836833
Is it for a day or four years Tariff uncertainty spooks small businesses,Entrepreneurs in the US Mexico and Canada worry that even a short trade war could push up prices and cost jobs,BBC Business,2025-02-04T07:22:51.836833
Davey urges Starmer to start EU customs union talks,Sir Ed Davey calls for PM to use meeting with EU leaders to fire the starting gun on new trade deal,BBC Business,2025-02-04T07:22:51.836833
Why Dynasty Warriors makers scrapped sequel to reinvent series,Tomohiko Sho says the unreleased game was something fans were starting to get a bit bored of,BBC Business,2025-02-04T07:22:51.836833
Takeoff or bail out The airport even Ryanair thinks is a tough sell,After Rachel Reeves pledges her support is Doncaster Sheffield Airport clear for takeoff,BBC Business,2025-02-04T07:22:51.836833
Janelle Mone Says F You Nelly for Singers Trump Inauguration Performance You Sold Out,Mone rapped her comments during a Grammys afterparty where she sang a cover of Nellys Hot in Herre,Hollywood Reporter,2025-02-04T07:22:52.205486
Lil Nas X Joins Crush Music Management Roster,The charttopping rapper was previously signed to Adam Lebers Rebel Management,Hollywood Reporter,2025-02-04T07:22:52.205486
Grammys 2025 Inside the StarStudded Parties and Events,Though many of the celebrations surrounding musics biggest night were canceled following the LA fires there was still plenty of activity around Grammys weekend,Hollywood Reporter,2025-02-04T07:22:52.205486
Taylor Swifts Epic Night Beyoncs AList Cheering Squad and Chappell Roan Takes a Tumble 17 Things the Grammy Cameras Missed,Take a peek inside CryptoCom Arena during Sunday nights ceremony to see all the celebrity interactions that the broadcast cameras didnt catch during the starstudded show,Hollywood Reporter,2025-02-04T07:22:52.205486
Kendrick Lamar Dominated Grammys With Not Like Us Cementing His Place as West Coast Royalty,LAs native son swept five awards with his 2024 anthem celebrating his unmatched ability to bridge artistry commercial success and cultural commentary,Hollywood Reporter,2025-02-04T07:22:52.205486
Beyonc Announces Cowboy Carter Tour Dates After Grammys Big Night,The singersongwriter had a recordbreaking night at the 2025 Grammys,Hollywood Reporter,2025-02-04T07:22:52.205486
Grammys Snubs and Surprises Billie Eilish and Taylor Swift Shut Out as Bradley Coopers Maestro Wins,Other notable snubs include Post Malone failing to win an award this year despite seven nominations and Charli XCX winning only three awards all presented in the Premiere Ceremony,Hollywood Reporter,2025-02-04T07:22:52.205486
Sabrina Carpenter Scores Two Wins During Charismatic Grammy Debut,The Short n Sweet singer who had one of the biggest years musically in 2024 cemented her status as a pop superstar during the 2025 Grammys,Hollywood Reporter,2025-02-04T07:22:52.205486
Most Memorable Grammy Moments From Beyoncs Historic Wins to LA Wildfire Tributes to Kanye Wests Shocking Red Carpet Moment,From Lady Gaga and Bruno Mars beautiful tribute to Los Angeles following the devastating wildfires to The Weeknds surprise performance here are some of the nights highlights,Hollywood Reporter,2025-02-04T07:22:52.205486
Charli XCX Goes Full Brat Alongside Julia Fox and Alex Consani During Debut Grammys Performance,The British pop star won her first Grammys award earlier in the night for best pop dance recording with Von Dutch best danceelectronic album and best recording package with Brat,Hollywood Reporter,2025-02-04T07:22:52.205486
Grammys Reporter Apologizes for Disrespectful Babyface Interview,A red carpet interview between the 13time winner and journalists from the Associated Press went viral for all of the wrong reasons Sunday night,Hollywood Reporter,2025-02-04T07:22:52.205486
Beyonc Wins Album of the Year for First Time at 2025 Grammy Awards,The award presented by the Los Angeles Fire Department ended the singers longrunning streak as the most nominated female artist without a win in the category,Hollywood Reporter,2025-02-04T07:22:52.205486
NRLs big call on rule changes for new season,Given the chance to introduce rule changes around sinbins for head injuries the NRL has decided to have a look first,News AU,2025-02-04T07:22:55.646477
Stars shock death at 40 rocks AFL world,The shock death of AFL player and coach Troy Selwood has left the football community broken hearted with tributes pouring in,News AU,2025-02-04T07:22:55.646477
Kerr question Matildas coach wont answer,The interim Matildas coach was peppered with questions about Sam Kerr and her future on Tuesday and didnt have a lot of answers,News AU,2025-02-04T07:22:55.646477
Stars everywhere in NRL teams for preseason games,Everything in the world feels right again with the release of the first team list Tuesday of the season ahead of two key matches this weekend,News AU,2025-02-04T07:22:55.646477
Stars plea for more after award glory,After being crowned the best player in the country days after making history at the MCG Annabel Sutherland says her allconquering Australian team deserves more respect,News AU,2025-02-04T07:22:55.646477
More calls for Aussie star to be sent home,Calls are growing louder for Sam Konstas to return to Australia to play in the Sheffield Shield with the teen star set to miss out on the second Test squad,News AU,2025-02-04T07:22:55.646477
Villain Star smacks butt in Australias face,Tennis star Danielle Collins has chosen not to forgive and forget Australia after the nation turned on her in Melbourne,News AU,2025-02-04T07:22:55.646477
Tennis in uproar over unbelievable scenes,The tennis world has been left gobsmacked after a rogue shoulder charge celebration took out a player in wild scenes at the Davis Cup,News AU,2025-02-04T07:22:55.646477
Its massive Blues worst nightmare drops,A rival club is reportedly preparing a plot to make a Carlton star the highestpaid player in Australian football history,News AU,2025-02-04T07:22:55.646477
America loses it over Aussie megastar,Australias Rhea Ripley is taking wrestling by storm as one of WWEs biggest stars but her dominance has sparked debate,News AU,2025-02-04T07:22:55.646477
AllStars dealt in more NBA trade drama,A day after perhaps the biggest NBA trade of all time another megadeal has been done seeing two AllStars swap teams,News AU,2025-02-04T07:22:55.646477
Text message says it all in NBA bombshell,The NBA is in meltdown over one of the biggest trades in basketball history and the cloakanddagger deal has sparked bombshell rumours,News AU,2025-02-04T07:22:55.646477
Matildas call on fresh blood amid stars extended mystery absence,Interim Matildas coach Tom Sermanni has named his SheBelieves Cup squad bringing a fresh face into the mix amid Cortnee Vines continued unexplained absence,News AU,2025-02-04T07:22:55.646477
UFC boss Dana White en route to Sydney,UFC president Dana White is expected to touch down in Sydney this afternoon ahead of the citys UFC 312 pay per view event,News AU,2025-02-04T07:22:55.646477
Bathurst rocked by massive smash,The driver of this Mercedes was lucky to escape serious injuries after flying through the air at 200kmh,News AU,2025-02-04T07:22:55.646477
Supercars team owner airborne in terrifying Bathurst crash,Supercars team owner Stephen Grove has been hospitalised after a scary airborne crash at the top of Mount Panorama in the Bathurst 12 Hour,News AU,2025-02-04T07:22:55.646477
LPGA winners plan to honour idol and snare Aussie title,Australian LPGA winner Grace Kim has opened up on the pressure to achieve the WPGA Championship on home soil as she strives to honour her idol golfing icon Karrie Webb,News AU,2025-02-04T07:22:55.646477
Warwick Farm preview Smith can get off to Flyer,An exciting filly from the Matthew Smith stable can take the next stwp towards a stakes race with a win at Warwick Farm on Wednesday where she is the 150 favourite,News AU,2025-02-04T07:22:55.646477
Tahs suffer early Suaalii blow with injury icing debut,Superstar JosephAukuso Suaaliis hotly anticipated debut in the NSW Waratahs jersey has been cruelled by an injury,News AU,2025-02-04T07:22:55.646477
Wallabies grudge match secured with Jones Japan,He left the Wallabies after a horror World Cup campaign to take a job in Japan some say hed already lined up and now Eddie Jones will have to coach against his former players,News AU,2025-02-04T07:22:55.646477
Olympian to learn familys pain in court,The heartbroken family of an Olympic cyclist are expected to deliver victim impact statements detailing their pain and grief to the court,News AU,2025-02-04T07:22:55.646477
Anna Kournikova went from star to recluse,The Russian beauty had a cocktail and even computer virus named after her at height of fame before her horror stalking ordeal,News AU,2025-02-04T07:22:55.646477
