Title,Description,Source,Fetched Date,Combined Text,Score,Sentiment
About right Tiger innovation sparks debate,Slow play is becoming a scourge of golf around the world but an innovation unveiled in Tiger Woods indoor league is gathering support,News AU,2025-01-28T07:22:51.787864,right tiger innovation spark debate . slow play becoming scourge golf around world innovation unveiled tiger wood indoor league gathering support,0.8807,Positive
Kembla preview Ford test drive gives Parker hope thumbs up,Trainer Kerry Parker decided his threeyearold Wild Thoughts was ready for his debut after a glowing report from jockey Jay Ford,News AU,2025-01-28T07:22:51.787864,kembla preview ford test drive give parker hope thumb . trainer kerry parker decided threeyearold wild thought ready debut glowing report jockey jay ford,0.6597,Positive
Fiji to provide tough test for Wallabies,Wallabies coach Joe Schmidt has welcomed a match for Australia against Fiji ahead of the highly anticipated British and Irish Lions Test series,News AU,2025-01-28T07:22:51.787864,fiji provide tough test wallaby . wallaby coach joe schmidt welcomed match australia fiji ahead highly anticipated british irish lion test series,0.2263,Neutral
Absolutely awesome New star rises for Aussies,A new Aussie star stood up to deliver a victory on home soil for one of Australias best performed teams,News AU,2025-01-28T07:22:51.787864,absolutely awesome new star rise aussie . new aussie star stood deliver victory home soil one australia best performed team,0.8622,Positive
Olympian to learn familys pain in court,The heartbroken family of an Olympic cyclist are expected to deliver victim impact statements detailing their pain and grief to the court,News AU,2025-01-28T07:22:51.787864,olympian learn family pain court . heartbroken family olympic cyclist expected deliver victim impact statement detailing pain grief court,-0.9451,Negative
