Title,Description,Source,Fetched Date
US dockworkers suspend ports strike until January,The walkout threatened to plunge the holiday shopping season into turmoil and become an issue in next months presidential election,BBC Business,2024-10-04T07:22:48.986865
As communist China turns 75 can Xi fix its economy,Plans announced by officials sparked a stock market rally but economists are unsure it is enough,BBC Business,2024-10-04T07:22:48.986865
Musk faces regulators questions over X takeover but will he show up,Musk abruptly cancelled a deposition with government lawyers and now they fear hell ghost them again,BBC Business,2024-10-04T07:22:48.986865
Toyota delays US electric car plans as sales slow,The Japanese car maker has become the latest industry giant to scale back its EV plans,BBC Business,2024-10-04T07:22:48.986865
Google introduces new way to search by filming video,It is the latest move from the tech giant to change how people search online using artificial intelligence,BBC Business,2024-10-04T07:22:48.986865
Airlines look to cut time spent on the tarmac,Airlines are hoping to cut waiting times by using AI to allocate gates at airports,BBC Business,2024-10-04T07:22:48.986865
We load guns with one hand and make a game with the other,The Ukrainian studio behind the Stalker 2 video game shares why it keeps going despite the constant threat of being killed during Russias invasion,BBC Business,2024-10-04T07:22:48.986865
Oil price rise comes at a critical point,Any extended rise raises the possibility of higher petrol prices and gas and electricity bills,BBC Business,2024-10-04T07:22:48.986865
Musk under final pressure over X 3 Oct 2024,An expert explains the CEOs fractious relationship with financial regulators,BBC Business,2024-10-04T07:22:48.986865
Migrants with criminal records what new US data shows,BBC Verify looks into Donald Trumps claim that Kamala Harris allowed 13000 noncitizens convicted of homicide to enter the US,BBC Business,2024-10-04T07:22:48.986865
Its just a mess Left in limbo by US student loan logjam,As Democrats and Republicans fight over student debt borrowers are caught in the middle,BBC Business,2024-10-04T07:22:48.986865
Good Bad Billionaire,Simon Jack and Zing Tsjeng find out how the worlds billionaires made their money and then judge them Are they good bad or just another billionaire Listen to season two New episodes released on Mondays,BBC Business,2024-10-04T07:22:48.986865
How Microsoft is tackling AI bias,Microsoft is turning to AI to make its workplace more inclusive,BBC Business,2024-10-04T07:22:48.986865
The fierce battle over the Holy Grail of shipwrecks,Colombia and a US firm are fighting over a shipwreck in the Caribbean Sea that could be worth 18bn,BBC Business,2024-10-04T07:22:48.986865
The man behind Japans 170bn bid to prop up the yen,Masato Kanda unleashed an estimated 25 trillion yen to support the currency when it slumped against the dollar,BBC Business,2024-10-04T07:22:48.986865
How a mega dam has caused a mega power crisis for Zambia,A drought has caused an electricity crisis as Zambia heavily relies on the hydropowered Kariba Dam,BBC Business,2024-10-04T07:22:48.986865
OpenAI value surges to 157bn in funding deal,The deal makes the ChatGPTmaker one of the most valuable startups in the world,BBC Business,2024-10-04T07:22:48.986865
Blast from unexploded US bomb grounds flights at Japanese airport,The bomb is thought to have been dropped during World War Two to halt kamikaze missions,BBC Business,2024-10-04T07:22:48.986865
The gangster brought down by a shipment of bananas,Jamie Stevenson made a fortune from trafficking drugs linked to hundreds of deaths in Scotland,BBC Business,2024-10-04T07:22:48.986865
Playing with FIRE How to quit work and retire in your 30s,A personal finance strategy popular among millennials is helping them to quit their job and retire decades early,BBC Business,2024-10-04T07:22:48.986865
Boomerang CEOs Do they ever succeed,Five years after being ousted from WeWork Adam Neumann wants to rebuy the nowbankrupt business,BBC Business,2024-10-04T07:22:48.986865
How industry leaders transformed their career,The BBCs Katty Kay has spoken to successful changemakers to ask what made them pivot in their career,BBC Business,2024-10-04T07:22:48.986865
Women were the original beer brewers what changed,Today the beer industry is maledominated but it wasnt always so,BBC Business,2024-10-04T07:22:48.986865
How waiting alters our perception of time,Expert advice on how to get through a waiting period,BBC Business,2024-10-04T07:22:48.986865
Do the superrich deserve their wealth,Should there be a cap on billionaires wealth and their inheritances,BBC Business,2024-10-04T07:22:48.986865
Four simple hacks to succeed in every conversation,A career coach a choreographer a chef and a dragon boat captain offer advice on giving critical feedback,BBC Business,2024-10-04T07:22:48.986865
Solo and hybrid work Navigating our future and new normal,Covid19 reshaped the way we live and work We rethink solo working and explore the future of worklife,BBC Business,2024-10-04T07:22:48.986865
Can supersonic flight ever be sustainable,How a new era of quiet net zero supersonic airliners could revolutionise the aviation industry,BBC Business,2024-10-04T07:22:48.986865
Commencement speech The surprising pitfall of your passions,Students are graduating in the US this week The commencement speeches might lead them into questionable choices,BBC Business,2024-10-04T07:22:48.986865
ASMR How whispering took over the internet,We meet the creators behind the current ASMR boom,BBC Business,2024-10-04T07:22:48.986865
A desk full of descriptions for your work colleagues,These are the long lost words youve been waiting for to describe your colleagues,BBC Business,2024-10-04T07:22:48.986865
Veterinarian suicide rates are very high Why,Veterinarian professionals are committing suicide at a higher rate than the general population,BBC Business,2024-10-04T07:22:48.986865
UK chancellors carbon capture spend signals investment focus,The UK will prioritise and increase investment in major projects in the Budget Rachel Reeves says,BBC Business,2024-10-04T07:22:48.986865
Botched insulation means mushrooms grow on my walls,MPs and Citizens Advice urge the government to address regulation of the sector,BBC Business,2024-10-04T07:22:48.986865
When will interest rates go down again,Bank of England interest rates affect the mortgage loan and savings rates for millions of people,BBC Business,2024-10-04T07:22:48.986865
Banks to put fourday hold on suspicious payments,Rules allowing banks to delay payments to investigate fraud will come into force at the end of October,BBC Business,2024-10-04T07:22:48.986865
Postmaster jailed for wifes murder seeks appeal,Lawyers for Robin Garbutt argue the Post Office Inquiry has shed new light on his case,BBC Business,2024-10-04T07:22:48.986865
When is the Budget and what might be in it,Chancellor Rachel Reeves will set out the governments financial plans for the next year,BBC Business,2024-10-04T07:22:48.986865
Just pay up says Post Office scandal victim,Campaigners had called for a deadline of March 2025 for payments to be made to some subpostmasters,BBC Business,2024-10-04T07:22:48.986865
ExHarrods director wont take top job at Fenwick,Nigel Blow who worked for Mohamed Al Fayed at Harrods for 14 years was due to start the new role this month,BBC Business,2024-10-04T07:22:48.986865
More staff and new equipment for firm awarded 6m,The programme aims to make vehicles more sustainable and cheaper,BBC Business,2024-10-04T07:22:48.986865
Helene is deadliest mainland US hurricane since Katrina,Hundreds of people are still missing and nearly a million homes are without power a week after the storm tore across the US southeast,BBC Earth,2024-10-04T07:22:49.076959
The race to electrify the pickup truck,What will it take for Americas bestloved vehicle to go electric,BBC Earth,2024-10-04T07:22:49.076959
The UK coal plant that became a giant battery,With the closure of the last coalfired power station in the UK it raises questions about how old fossil fuel infrastructure can be repurposed,BBC Earth,2024-10-04T07:22:49.076959
New research aims to predict the big one,Seismic imaging off the Pacific Coast could reveal where the next big earthquake might strike,BBC Earth,2024-10-04T07:22:49.076959
Earth tides Why our planets crust has tides too,How do they differ from the ocean A geophysicist breaks it down for us,BBC Earth,2024-10-04T07:22:49.076959
The science behind the mini moon entering Earths orbit,An asteroid is going to circle our planet for two months this autumn before going on its way,BBC Earth,2024-10-04T07:22:49.076959
Icelands hightech farm turning algae into food,A facility near the Icelandic capital Reykjavik is using innovative farming technology to grow algae,BBC Earth,2024-10-04T07:22:49.076959
The Bahamas The last lighthouse of its kind,Reece Parkinson heads to the Bahamas where he meets a community adapting to unpredictable weather patterns,BBC Earth,2024-10-04T07:22:49.076959
Protecting Thailands famous paradise beach,Lucy Hedges is in Thailand where she explores the beach made worldfamous by Hollywood,BBC Earth,2024-10-04T07:22:49.076959
The scientists drilling into an active Icelandic volcano,Scientists are preparing to drill into the rock of an Icelandic volcano to learn more about how volcanoes behave,BBC Earth,2024-10-04T07:22:49.076959
Earths spectacular and remote capital of lightning,With storms occurring between 140 to 160 nights a year its no wonder the area is a world record holder,BBC Earth,2024-10-04T07:22:49.076959
Less is more Can degrowth save the world,The degrowth movement questions the feasibility of the idea of endless economic growth on a finite planet,BBC Earth,2024-10-04T07:22:49.076959
How fixing how we farm might stop the next pandemic,Land use for food and agriculture around the world is putting pressure on climate and biodiversity,BBC Earth,2024-10-04T07:22:49.076959
How electric vehicles could improve our mental health,Noise and air pollution are major threats and EVs can therefore offer a promising solution,BBC Earth,2024-10-04T07:22:49.076959
How greening our cities can reduce heat stress,Heat is the most deadly extreme weather phenomenon and cities are seeking ways to cool their urban cores,BBC Earth,2024-10-04T07:22:49.076959
How climate chaos is threatening the real Paddington bear,Drought forces the real Paddington Bear into deadly conflict with cattle farmers in the Andes,BBC Earth,2024-10-04T07:22:49.076959
Tidal kites New technology harnessing ocean energy,These mechanical creatures lurk beneath the waters surface and power homes in the Faroe Islands,BBC Earth,2024-10-04T07:22:49.076959
Malaysias adventure hotspot that crosses seven habitats,An 11mile hike in the Bako National Park in Malaysia transports travellers through seven distinct habitats,BBC Earth,2024-10-04T07:22:49.076959
The global phenomenon swallowing whole neighbourhoods,Giant ravines Entire communities are disappearing because of an extreme form of soil erosion,BBC Earth,2024-10-04T07:22:49.076959
A tale of the US through abandoned buildings,Two urban explorers stories of decay tell a tale of a changing American cultural landscape,BBC Earth,2024-10-04T07:22:49.076959
What makes the emperor penguin an eggcellent father,In the BBC Select documentary Penguins Spy in the Huddle we explore the world of penguin fathers,BBC Earth,2024-10-04T07:22:49.076959
The floating houses that are resilient to extreme weather,The floating houses built to withstand typhoons and flooding in the Philippines,BBC Earth,2024-10-04T07:22:49.076959
What its like to camp in Antarctica,Marc Cieslak spends a night on ice camping under the stars,BBC Earth,2024-10-04T07:22:49.076959
The logger who learned to love trees,Roberto Brito learned how to use a chainsaw at the age of 11 Now he uses his intimate knowledge of the Amazon rainforest to guide tourists around in his flipflops,BBC Earth,2024-10-04T07:22:49.076959
The shrinking habitat of a celebrity hippo,The illustrious Moo Deng has attracted a frenzy of attention But in the wild her species is quietly disappearing,BBC Earth,2024-10-04T07:22:49.076959
How climate change is supercharging storms,Fueled by heat from ocean waters hurricanes typhoons and tropical cyclones are sometimes known as natures steam engines We need to know how they are changing,BBC Earth,2024-10-04T07:22:49.076959
The feud that brought electricity to New York,When electricity was first rolled out in New York in the late 19th Century sparks flew between competitors Today the city is attempting to complete its electric evolution,BBC Earth,2024-10-04T07:22:49.076959
The worlds greatest unpaid debt,Should rich countries and fossil fuel companies pay for the climate losses and damages they have caused,BBC Earth,2024-10-04T07:22:49.076959
The former trash islands teeming with life,Sri Lankas capital city has transformed its polluted aquatic ecosystems into biodiverse havens for wildlife,BBC Earth,2024-10-04T07:22:49.076959
How Vienna prepared itself for a 5000year flood,The steps Vienna took to prepare for extreme rainfall may hold lessons for how other cities can face deluges to come,BBC Earth,2024-10-04T07:22:49.076959
Why rivers need their curves back,For centuries meandering rivers have been straightened but experts say restoring their natural bends and curves can prevent flooding and create healthy habitats for wildlife,BBC Earth,2024-10-04T07:22:49.076959
It smells like an overflowing food bin The weird biology of the enormous corpse plant,It stands metres high takes a decade to flower smells like death and draws huge crowds when it blooms But scientists are still unravelling the baffling lifecycle of the titan arum,BBC Earth,2024-10-04T07:22:49.076959
Garth Brooks Sued For Sexual Assault Over Alleged Rape of Employee,Last month the singer brought a lawsuit in federal court to block the accuser from suing,Hollywood Reporter,2024-10-04T07:22:49.432155
66 Percent of Current Grammy Voters Have Joined Since 2019 Most Diverse Representative Grammy Electorate Ever,In the past five years the Recording Academy underwent an accelerated renewal review process and some members did not requalify as a result That helped eliminate older voters and made way for newer voters helping create a major shift,Hollywood Reporter,2024-10-04T07:22:49.432155
Luke Bryan on Beyonces CMA Awards Snub If Youre Gonna Make Country Albums Come Into Our World,The country music singer chimed in on her Cowboy Carter album during a recent interview with Andy Cohen,Hollywood Reporter,2024-10-04T07:22:49.432155
Turmoil at Brentwoods Country Mart How Hamas Book Sparked Fiery Protest and Tense Fallout,The outdoor mall long a magnet for Brentwood residents including Kamala Harris Gwyneth Paltrow Reese Witherspoon and Jennifer Garner has faced unrest in recent days over a controversial book,Hollywood Reporter,2024-10-04T07:22:49.432155
Sabrina Carpenter on Grammy Ballot for Best New Artist Beyoncs Cowboy Carter Will Compete in Country Source Exclusive,The Espresso hitmaker qualifies for best new artist despite releasing her sixth album this year while Queen Bey could earn her first country nomination years after the Grammys rejected her twangy song Daddy Lessons,Hollywood Reporter,2024-10-04T07:22:49.432155
John Amos Daughter Reveals She Learned About His Death Through Media We Are Devastated and Left With Many Questions,Amos children were locked in a bitter battle over their fathers care and legacy before his death,Hollywood Reporter,2024-10-04T07:22:49.432155
Jan 6 Was Not Facebook Ads Cordial VP Debate Gets Testy Over Trumps 2020 Election Lies,Gov Tim Walz shut down Sen JD Vances comparison to Hillary Clintons statement about a Russian ad buy for Donald Trump in 2016 and then reminded him why he is even on CBS New York debate stage,Hollywood Reporter,2024-10-04T07:22:49.432155
Kamala Harris Record as California AG and at Border Takes Center Stage at Vice Presidential Debate,Sen JD Vance and Gov Tim Walz sparred over the records of their running mates at CBS meeting of the candidates in New York on Tuesday,Hollywood Reporter,2024-10-04T07:22:49.432155
Dakota Fanning Recalls Being Asked SuperInappropriate Questions as a Child Star,The actress opens up about her experience working in Hollywood as a child and facing people almost wanting me to fail,Hollywood Reporter,2024-10-04T07:22:49.432155
Henry Winkler and Chrissy Teigen Go KAMPing at Hammer Museum Fundraiser,The familyfocused event which raises money for free kids programs at the museum featured art activities and childrens book readings by artists and celebrity guests,Hollywood Reporter,2024-10-04T07:22:49.432155
Sean Diddy Combs to Face Lawsuits From 120 Additional Accusers,The complaints will start to be filed within 30 days in courts across the nation Combs whos already facing a dozen lawsuits over alleged sex crimes has been denied bail for sex trafficking and racketeering charges,Hollywood Reporter,2024-10-04T07:22:49.432155
Jon Bon Jovi to Join Stephen Colbert for Annual Montclair Film Festival Conversation Exclusive,The New Jersey rocker and subject of this years Hulu docuseries Thank You Goodnight will join the Late Show host for a ticketed event at the New Jersey Performing Arts Center,Hollywood Reporter,2024-10-04T07:22:49.432155
Mountain of work awaits Lions,Having seen Collingwood and Geelong flop the year after winning AFL premierships the Brisbane Lions are intent on not falling into the same trap,News AU,2024-10-04T07:22:51.483131
NRL stars disgusting GF diet revealed,The extraordinary borderline unhealthy game day diet fuelling a Penrith Panthers star has been uncovered and its a sight to behold,News AU,2024-10-04T07:22:51.483131
Schumachers best friend drops sad news,The sad reason Michael Schumachers best friend will never see the shut away Formula 1 legend again has come to light,News AU,2024-10-04T07:22:51.483131
WBOs stunning world title fight call triggers chaotic buildup,Friday nights world title fight has descended into farce with middleweight world champion Janibek Alimkhanuly fuming over a late ruling that seemingly put everything on the line,News AU,2024-10-04T07:22:51.483131
Free trade tracker Every move player linked with your club,Trade requests the latest rumours and every player linked with your club Stay across every big AFL trade story and see who could be on the move in our Trade Tracker,News AU,2024-10-04T07:22:51.483131
Phil Gould demoted by Nine amid bias claim,Rugby league supremo Phil Gould has been demoted by Channel 9 for the grand final after years of being called out by irate fans,News AU,2024-10-04T07:22:51.483131
Aussie could make shock Ashes defection,Two England legends have called for an Australianborn bowler to be a part of Brendon McCullums team for the next Ashes series,News AU,2024-10-04T07:22:51.483131
Aussies stifling World Cup test,The extra challenge of the elements in the United Arab Emirates demanded Australia go to extra lengths to prepare for their tilt at a fourthstraight T20 World Cup,News AU,2024-10-04T07:22:51.483131
Tennis world floored by chilling Dokic reveal,Australian tennis champion Jelena Dokic has a new documentary out and fans have labelled the glimpse into her career raw and chilling,News AU,2024-10-04T07:22:51.483131
Kyrgios drops bombshell amid return reveal,Nick Kyrgios return to the court is getting closer by the day but the Aussie has also cryptically teased an even bigger announcement,News AU,2024-10-04T07:22:51.483131
Broncos coachs unforgivable act of treason,Michael Maguire has been brutally called out over a gut punch inflicted on an entire state as the real losers of his bombshell move emerge,News AU,2024-10-04T07:22:51.483131
Elephant in the room in Grand Final loss,The Sydney Swans have let another golden opportunity slip and theres an inescapable truth their supporters wont want to hear,News AU,2024-10-04T07:22:51.483131
Infuriating detail on AFL premiership Cup,Its the trophy every team wants to lift on Grand Final day but one missing detail continues to baffle AFL fans Now its been explained,News AU,2024-10-04T07:22:51.483131
Ugly Ricciardo slap is most brutal yet,New comments from Red Bull paint an eyeopening picture on Daniel Ricciardos termination and why his failure was so spectacular,News AU,2024-10-04T07:22:51.483131
Map Australia will be obsessed with today,Two years after he won the hearts of Australia one man is attempting a completely bonkers new challenge that will blow your mind,News AU,2024-10-04T07:22:51.483131
Is it the year of the underdog NFL trends to watch,With four weeks of NFL chaos in the bag injuries causing havoc and underdogs reigning supreme what does Week 5 have in store,News AU,2024-10-04T07:22:51.483131
Actors shameless post after NBA icon dies,Hollywood star Rob Schneider has sparked a storm with an insensitive conspiracy theory claim over the death of an NBA legend,News AU,2024-10-04T07:22:51.483131
Shock retirement flip for Socceroo,An English Premier League midfielder has been named in the latest Socceroos squad by the new coach after coming out of international retirement,News AU,2024-10-04T07:22:51.483131
Matildas star saluted by peers,One of the Matildas most popular players has been recognised by her peers for her good form,News AU,2024-10-04T07:22:51.483131
Inconvenient Calls for Aus Open change,The ambitious move to a dualgender Australian Open has been lauded but one of the key issues has been made clear by a major champion,News AU,2024-10-04T07:22:51.483131
DJ Ice star as 36ers romp to first win of the NBL season,Isaac Humphries and Dejan Vasiljevic have starred to send the 36ers on their way to their first win of the new NBL season,News AU,2024-10-04T07:22:51.483131
Wallaby star to chase NFL dream,A Queensland Reds and Wallabies excitement machine has decided to chase a career in the NFL his team has confirmed,News AU,2024-10-04T07:22:51.483131
Reds and Blues set for Anzac Day battle,The Reds wont settle for just making the quarterfinals in next years Super Rugby Pacific competition,News AU,2024-10-04T07:22:51.483131
Wallers Group 1 sweep bid alive despite Glow noshow,Hall of Fame trainer Chris Waller is without Autumn Glow but can still repeat one of his most famous training feats with a clean sweep of the four Group 1 races at Royal Randwick and Flemington on Saturday,News AU,2024-10-04T07:22:51.483131
Teen cyclist dead after horror incident,The cycling community has been rocked with news of an 18yearold dying following a horror incident at the world championships,News AU,2024-10-04T07:22:51.483131
