Title,Description,Source,Fetched Date,Combined Text,Score,Sentiment
7Eleven owner rejects 38bn buyout offer,Japanese owner of convenience store giant says offer from Canadian rival grossly undervalues firm,BBC Business,2024-09-06T07:21:42.425373,7eleven owner reject 38bn buyout offer . japanese owner convenience store giant say offer canadian rival grossly undervalues firm,-0.5574,Negative
Telegram CEO Durov says his arrest misguided,Pavel Durov has hit back at French authorities following his arrest in Paris last week,BBC Business,2024-09-06T07:21:42.425373,telegram ceo durov say arrest misguided . pavel durov hit back french authority following arrest paris last week,-0.5423,Negative
Why this US jobs report matters and what to watch,The report is a key gauge of the US economy a top issue in the presidential election,BBC Business,2024-09-06T07:21:42.425373,u job report matter watch . report key gauge u economy top issue presidential election,0.2263,Neutral
Trump says Musk could head government efficiency force,In a speech at an economic club Thursday the former president endorsed the Tesla bosss idea for a task force on government spending,BBC Business,2024-09-06T07:21:42.425373,trump say musk could head government efficiency force . speech economic club thursday former president endorsed tesla boss idea task force government spending,0.5423,Positive
I worked two jobs at university to survive,BBC Scotland speaks to two careexperienced students about their time at university,BBC Business,2024-09-06T07:21:42.425373,worked two job university survive . bbc scotland speaks two careexperienced student time university,0.0,Neutral
A mega merger aims to reshape Indias entertainment landscape,The deal aims to create Indias largest entertainment company which will dominate the advertising market,BBC Business,2024-09-06T07:21:42.425373,mega merger aim reshape india entertainment landscape . deal aim create india largest entertainment company dominate advertising market,0.7351,Positive
Crash dummies and robot arms How airline seats are tested,Building hitech airline seats has become a huge business in Northern Ireland,BBC Business,2024-09-06T07:21:42.425373,crash dummy robot arm airline seat tested . building hitech airline seat become huge business northern ireland,-0.1027,Neutral
Why protecting Australias surf beaches is good for the economy,Surfing is estimated to be worth billions of dollars to the countrys economy,BBC Business,2024-09-06T07:21:42.425373,protecting australia surf beach good economy . surfing estimated worth billion dollar country economy,0.5859,Positive
Kakeibo The Japanese art of saving money,Kakeibo a centuryold Japanese technique for budgeting is a nononsense way to take charge of your finances,BBC Business,2024-09-06T07:21:42.425373,kakeibo japanese art saving money . kakeibo centuryold japanese technique budgeting nononsense way take charge finance,0.0,Neutral
Good Bad Billionaire,Simon Jack and Zing Tsjeng find out how the worlds billionaires made their money and then judge them Are they good bad or just another billionaire Listen to season two New episodes released on Mondays,BBC Business,2024-09-06T07:21:42.425373,good bad billionaire . simon jack zing tsjeng find world billionaire made money judge good bad another billionaire listen season two new episode released monday,-0.296,Negative
Why Zoom wants you to go back to the office,Zoom chief product officer Smita Hashim explains why even videochat innovators need the physical space with a little help from AI,BBC Business,2024-09-06T07:21:42.425373,zoom want go back office . zoom chief product officer smita hashim explains even videochat innovator need physical space little help ai,0.4033,Positive
Aly Raisman on competing at the highest level,The decorated US gymnast opened up to the BBCs Katty Kay about blocking out the noise trusting her training and her winning mindset,BBC Business,2024-09-06T07:21:42.425373,aly raisman competing highest level . decorated u gymnast opened bbcs katty kay blocking noise trusting training winning mindset,0.5423,Positive
Jackie JoynerKersees goldmedal attitude,The retired athlete and halloffamer opened up to the BBCs Katty Kay about the challenges she faced on the road to the Olympics and the winning mindset that saw her through them,BBC Business,2024-09-06T07:21:42.425373,jackie joynerkersees goldmedal attitude . retired athlete halloffamer opened bbcs katty kay challenge faced road olympics winning mindset saw,0.5719,Positive
YouTube restricts teenager access to fitness videos,The platform says it is acting on concerns about teens being overexposed to idealised body types,BBC Business,2024-09-06T07:21:42.425373,youtube restricts teenager access fitness video . platform say acting concern teen overexposed idealised body type,0.4404,Positive
Volvo gives up plan to sell only EVs by 2030,The car makers decision comes as industry faces slowing demand in some major markets for electric vehicles,BBC Business,2024-09-06T07:21:42.425373,volvo give plan sell ev 2030. car maker decision come industry face slowing demand major market electric vehicle,-0.128,Neutral
Hunter Biden makes lastminute guilty plea in tax case,The plea spares the US presidents son a trial and keeps his friends and family from having to testify,BBC Business,2024-09-06T07:21:42.425373,hunter biden make lastminute guilty plea tax case . plea spare u president son trial keep friend family testify,0.1027,Neutral
UK competition watchdog launches Oasis tickets probe,The Competition and Markets Authority is investigating if Ticketmaster breached consumer protection law,BBC Business,2024-09-06T07:21:42.425373,uk competition watchdog launch oasis ticket probe . competition market authority investigating ticketmaster breached consumer protection law,0.0772,Neutral
Fast fashion drove Bangladesh now its troubled economy needs more,The once booming garment industry faces an uncertain future amid political unrest and slowing demand,BBC Business,2024-09-06T07:21:42.425373,fast fashion drove bangladesh troubled economy need . booming garment industry face uncertain future amid political unrest slowing demand,-0.6908,Negative
Selloff erases Trump Media shares 2024 gains,Shares in Trump Media are now worth less than they were at the start of the year,BBC Business,2024-09-06T07:21:42.425373,selloff erases trump medium share 2024 gain . share trump medium worth less start year,0.8271,Positive
Playing with FIRE How to quit work and retire in your 30s,A personal finance strategy popular among millennials is helping them to quit their job and retire decades early,BBC Business,2024-09-06T07:21:42.425373,playing fire quit work retire 30 . personal finance strategy popular among millennials helping quit job retire decade early,0.5267,Positive
Boomerang CEOs Do they ever succeed,Five years after being ousted from WeWork Adam Neumann wants to rebuy the nowbankrupt business,BBC Business,2024-09-06T07:21:42.425373,boomerang ceo ever succeed . five year ousted wework adam neumann want rebuy nowbankrupt business,0.5423,Positive
How industry leaders transformed their career,The BBCs Katty Kay has spoken to successful changemakers to ask what made them pivot in their career,BBC Business,2024-09-06T07:21:42.425373,industry leader transformed career . bbcs katty kay spoken successful changemakers ask made pivot career,0.5859,Positive
Women were the original beer brewers what changed,Today the beer industry is maledominated but it wasnt always so,BBC Business,2024-09-06T07:21:42.425373,woman original beer brewer changed . today beer industry maledominated wasnt always,0.3182,Positive
How waiting alters our perception of time,Expert advice on how to get through a waiting period,BBC Business,2024-09-06T07:21:42.425373,waiting alters perception time . expert advice get waiting period,0.0,Neutral
Do the superrich deserve their wealth,Should there be a cap on billionaires wealth and their inheritances,BBC Business,2024-09-06T07:21:42.425373,superrich deserve wealth . cap billionaire wealth inheritance,0.7506,Positive
Four simple hacks to succeed in every conversation,A career coach a choreographer a chef and a dragon boat captain offer advice on giving critical feedback,BBC Business,2024-09-06T07:21:42.425373,four simple hack succeed every conversation . career coach choreographer chef dragon boat captain offer advice giving critical feedback,0.5106,Positive
Solo and hybrid work Navigating our future and new normal,Covid19 reshaped the way we live and work We rethink solo working and explore the future of worklife,BBC Business,2024-09-06T07:21:42.425373,solo hybrid work navigating future new normal . covid19 reshaped way live work rethink solo working explore future worklife,0.0,Neutral
Can supersonic flight ever be sustainable,How a new era of quiet net zero supersonic airliners could revolutionise the aviation industry,BBC Business,2024-09-06T07:21:42.425373,supersonic flight ever sustainable . new era quiet net zero supersonic airliner could revolutionise aviation industry,0.0,Neutral
Commencement speech The surprising pitfall of your passions,Students are graduating in the US this week The commencement speeches might lead them into questionable choices,BBC Business,2024-09-06T07:21:42.425373,commencement speech surprising pitfall passion . student graduating u week commencement speech might lead questionable choice,0.4404,Positive
ASMR How whispering took over the internet,We meet the creators behind the current ASMR boom,BBC Business,2024-09-06T07:21:42.425373,asmr whispering took internet . meet creator behind current asmr boom,0.0,Neutral
A desk full of descriptions for your work colleagues,These are the long lost words youve been waiting for to describe your colleagues,BBC Business,2024-09-06T07:21:42.425373,desk full description work colleague . long lost word youve waiting describe colleague,-0.3182,Negative
Veterinarian suicide rates are very high Why,Veterinarian professionals are committing suicide at a higher rate than the general population,BBC Business,2024-09-06T07:21:42.425373,veterinarian suicide rate high . veterinarian professional committing suicide higher rate general population,-0.8658,Negative
UK house prices hit twoyear high,The recent rate cut has boosted confidence among homebuyers the UKs largest mortgage lender says,BBC Business,2024-09-06T07:21:42.425373,uk house price hit twoyear high . recent rate cut boosted confidence among homebuyers uk largest mortgage lender say,0.5719,Positive
Towie star says sorting pension is a top priority,Gemma Collins says saving for retirement is important as she does not want to be hustling forever,BBC Business,2024-09-06T07:21:42.425373,towie star say sorting pension top priority . gemma collins say saving retirement important want hustling forever,0.4404,Positive
Second class letter deliveries on Saturdays could be cut,Changes to second class deliveries could be allowed to keep the first class service unchanged,BBC Business,2024-09-06T07:21:42.425373,second class letter delivery saturday could cut . change second class delivery could allowed keep first class service unchanged,-0.2732,Negative
John Lewis brings back never knowingly undersold,The Uturn comes as the High Street retailer tries to revive its fortunes and win back customers,BBC Business,2024-09-06T07:21:42.425373,john lewis brings back never knowingly undersold . uturn come high street retailer try revive fortune win back customer,0.7351,Positive
Rise in fines for termtime holidays wont stop us say parents,Some say the threat of prosecution is not enough to stop them going on holiday for cheaper prices,BBC Business,2024-09-06T07:21:42.425373,rise fine termtime holiday wont stop u say parent . say threat prosecution enough stop going holiday cheaper price,0.3348,Positive
Alert over potentially deadly counterfeit vodka in UK,The Food Standards Agency warns counterfeit bottles have been found to contain a dangerous substance,BBC Business,2024-09-06T07:21:42.425373,alert potentially deadly counterfeit vodka uk . food standard agency warns counterfeit bottle found contain dangerous substance,-0.3182,Negative
Mablethorpe permanent banking hub confirmed,Customers of all major banks will be able to carry out regular cash transactions on weekdays,BBC Business,2024-09-06T07:21:42.425373,mablethorpe permanent banking hub confirmed . customer major bank able carry regular cash transaction weekday,0.0,Neutral
Nvidia plunges almost 10 as global markets fall,The artificial intelligence chip giant saw 279bn wiped off its stock market value in New York,BBC Business,2024-09-06T07:21:42.425373,nvidia plunge almost 10 global market fall . artificial intelligence chip giant saw 279bn wiped stock market value new york,0.6705,Positive
Biggest UK housing firm to build fewer homes,The house building giant built 18 fewer homes last year as profits tumbled,BBC Business,2024-09-06T07:21:42.425373,biggest uk housing firm build fewer home . house building giant built 18 fewer home last year profit tumbled,0.4404,Positive
How good fire is reviving wildlife,The destruction a fire brings can be crucial for certain species to thrive Meet the conservationists reviving the ancient art of good fire,BBC Earth,2024-09-06T07:21:42.502108,good fire reviving wildlife . destruction fire brings crucial certain specie thrive meet conservationist reviving ancient art good fire,-0.4588,Negative
The largest dam removal in US history is complete,The Klamath River is free of four huge dams for the first time in generations But for the Yurok tribe the rivers restoration is only just beginning starting with 18 billion seeds,BBC Earth,2024-09-06T07:21:42.502108,largest dam removal u history complete . klamath river free four huge dam first time generation yurok tribe river restoration beginning starting 18 billion seed,0.6808,Positive
The giant vehicles pushing the limits of electric power,How much energy you can pack into a battery is one limit on how big an EV can get but meet the EVs ditching batteries altogether to attain mammoth proportions,BBC Earth,2024-09-06T07:21:42.502108,giant vehicle pushing limit electric power . much energy pack battery one limit big ev get meet ev ditching battery altogether attain mammoth proportion,0.2732,Positive
Protecting Thailands famous paradise beach,Lucy Hedges is in Thailand where she explores the beach made worldfamous by Hollywood,BBC Earth,2024-09-06T07:21:42.502108,protecting thailand famous paradise beach . lucy hedge thailand explores beach made worldfamous hollywood,0.6369,Positive
The scientists drilling into an active Icelandic volcano,Scientists are preparing to drill into the rock of an Icelandic volcano to learn more about how volcanoes behave,BBC Earth,2024-09-06T07:21:42.502108,scientist drilling active icelandic volcano . scientist preparing drill rock icelandic volcano learn volcano behave,0.4019,Positive
Earths spectacular and remote capital of lightning,With storms occurring between 140 to 160 nights a year its no wonder the area is a world record holder,BBC Earth,2024-09-06T07:21:42.502108,earth spectacular remote capital lightning . storm occurring 140 160 night year wonder area world record holder,0.0,Neutral
Less is more Can degrowth save the world,The degrowth movement questions the feasibility of the idea of endless economic growth on a finite planet,BBC Earth,2024-09-06T07:21:42.502108,less degrowth save world . degrowth movement question feasibility idea endless economic growth finite planet,0.6728,Positive
How fixing how we farm might stop the next pandemic,Land use for food and agriculture around the world is putting pressure on climate and biodiversity,BBC Earth,2024-09-06T07:21:42.502108,fixing farm might stop next pandemic . land use food agriculture around world putting pressure climate biodiversity,-0.5267,Negative
How electric vehicles could improve our mental health,Noise and air pollution are major threats and EVs can therefore offer a promising solution,BBC Earth,2024-09-06T07:21:42.502108,electric vehicle could improve mental health . noise air pollution major threat ev therefore offer promising solution,0.5423,Positive
How greening our cities can reduce heat stress,Heat is the most deadly extreme weather phenomenon and cities are seeking ways to cool their urban cores,BBC Earth,2024-09-06T07:21:42.502108,greening city reduce heat stress . heat deadly extreme weather phenomenon city seeking way cool urban core,-0.128,Neutral
How climate chaos is threatening the real Paddington bear,Drought forces the real Paddington Bear into deadly conflict with cattle farmers in the Andes,BBC Earth,2024-09-06T07:21:42.502108,climate chaos threatening real paddington bear . drought force real paddington bear deadly conflict cattle farmer andes,-0.8555,Negative
Tidal kites New technology harnessing ocean energy,These mechanical creatures lurk beneath the waters surface and power homes in the Faroe Islands,BBC Earth,2024-09-06T07:21:42.502108,tidal kite new technology harnessing ocean energy . mechanical creature lurk beneath water surface power home faroe island,0.0772,Neutral
Malaysias adventure hotspot that crosses seven habitats,An 11mile hike in the Bako National Park in Malaysia transports travellers through seven distinct habitats,BBC Earth,2024-09-06T07:21:42.502108,malaysia adventure hotspot cross seven habitat . 11mile hike bako national park malaysia transport traveller seven distinct habitat,0.3182,Positive
The global phenomenon swallowing whole neighbourhoods,Giant ravines Entire communities are disappearing because of an extreme form of soil erosion,BBC Earth,2024-09-06T07:21:42.502108,global phenomenon swallowing whole neighbourhood . giant ravine entire community disappearing extreme form soil erosion,0.0,Neutral
A tale of the US through abandoned buildings,Two urban explorers stories of decay tell a tale of a changing American cultural landscape,BBC Earth,2024-09-06T07:21:42.502108,tale u abandoned building . two urban explorer story decay tell tale changing american cultural landscape,-0.6908,Negative
What makes the emperor penguin an eggcellent father,In the BBC Select documentary Penguins Spy in the Huddle we explore the world of penguin fathers,BBC Earth,2024-09-06T07:21:42.502108,make emperor penguin eggcellent father . bbc select documentary penguin spy huddle explore world penguin father,0.0,Neutral
The floating houses that are resilient to extreme weather,The floating houses built to withstand typhoons and flooding in the Philippines,BBC Earth,2024-09-06T07:21:42.502108,floating house resilient extreme weather . floating house built withstand typhoon flooding philippine,0.0,Neutral
What its like to camp in Antarctica,Marc Cieslak spends a night on ice camping under the stars,BBC Earth,2024-09-06T07:21:42.502108,like camp antarctica . marc cieslak spends night ice camping star,0.3612,Positive
Why sunsets on Mars are tinted blue,The reason behind the Red Planets nickname is also why its sunrises and sunsets look pale blue,BBC Earth,2024-09-06T07:21:42.502108,sunset mar tinted blue . reason behind red planet nickname also sunrise sunset look pale blue,0.0,Neutral
Molossia A small unrecognised nation within the US,With its own currency and head of state this American micronation has become an odd tourist destination,BBC Earth,2024-09-06T07:21:42.502108,molossia small unrecognised nation within u . currency head state american micronation become odd tourist destination,-0.3182,Negative
Can these 3Dprinted sea walls protect marine wildlife,One team is on a mission to create 3D printed sea walls with environmental benefits,BBC Earth,2024-09-06T07:21:42.502108,3dprinted sea wall protect marine wildlife . one team mission create 3d printed sea wall environmental benefit,0.7717,Positive
Ghost towns What nature does without us,Ghost towns are remnants of lost communities but also a testament to natures persistence,BBC Earth,2024-09-06T07:21:42.502108,ghost town nature without u . ghost town remnant lost community also testament nature persistence,-0.7096,Negative
Spectacular Nasa footage of solar activity behind the aurora,Our stars activity is increasing and that could mean more supercharged light shows on Earth,BBC Earth,2024-09-06T07:21:42.502108,spectacular nasa footage solar activity behind aurora . star activity increasing could mean supercharged light show earth,0.0,Neutral
The fall foliage town that banned influencers,As hordes of photographers began descending on a small rural community to capture its vibrant autumnal colours local residents have been fighting back,BBC Earth,2024-09-06T07:21:42.502108,fall foliage town banned influencers . horde photographer began descending small rural community capture vibrant autumnal colour local resident fighting back,-0.2732,Negative
The factor making it difficult for bees to find flowers,Were only touching the tip of the iceberg in terms of how these effects are influencing these pollinators,BBC Earth,2024-09-06T07:21:42.502108,factor making difficult bee find flower . touching tip iceberg term effect influencing pollinator,-0.3612,Negative
The living tractors reviving Turkeys wastelands,When water buffalo make a home for themselves in abandoned spaces they can bring with them a rich array of frogs bats and plant life,BBC Earth,2024-09-06T07:21:42.502108,living tractor reviving turkey wasteland . water buffalo make home abandoned space bring rich array frog bat plant life,0.1531,Neutral
Baby boom prompts call to boost wild beaver population,A leading conservation group wants the government to give the goahead to bringing back beavers in the wild,BBC Earth,2024-09-06T07:21:42.502108,baby boom prompt call boost wild beaver population . leading conservation group want government give goahead bringing back beaver wild,0.4588,Positive
The reality of being homeless in a heatwave,IV drips cooling centres and gallons of free water are just some of the tactics used to help the homeless in the US survive deadly heat,BBC Earth,2024-09-06T07:21:42.502108,reality homeless heatwave . iv drip cooling centre gallon free water tactic used help homeless u survive deadly heat,0.7184,Positive
Surging seas are coming for us all warns UN chief,Speaking to the BBC at the Pacific Islands Forum Antnio Guterres says these islands are the most vulnerable,BBC Earth,2024-09-06T07:21:42.502108,surging sea coming u warns un chief . speaking bbc pacific island forum antnio guterres say island vulnerable,-0.3182,Negative
Why I cycled 1500km to avoid a flight,Looking for alternatives to flying Matilda Welin decided to embark on a longdistance cycle from London to Sweden Heres what she learned,BBC Earth,2024-09-06T07:21:42.502108,cycled 1500km avoid flight . looking alternative flying matilda welin decided embark longdistance cycle london sweden here learned,-0.296,Negative
Honey not marmalade is saving the real Paddington Bear,Drought and conflict with farmers are threatening Bolivias Andean bear the reallife Paddington Bear Now a beekeeping project is helping protect this endangered species,BBC Earth,2024-09-06T07:21:42.502108,honey marmalade saving real paddington bear . drought conflict farmer threatening bolivia andean bear reallife paddington bear beekeeping project helping protect endangered specie,-0.2263,Neutral
The flawed way we rank hurricanes,Scientists are racing to update the imperfect system we rely on to warn just how deadly a storm will be,BBC Earth,2024-09-06T07:21:42.502108,flawed way rank hurricane . scientist racing update imperfect system rely warn deadly storm,-0.4019,Negative
Michael Keaton Hints Hes Ready to Change His Name Professionally,Michael Keaton may be changing his name professionally The actor who was born as Michael Douglas wasnt able to use his birth name when he began his career as the Screen Actors Guild disallows its members from using the same name professionally as other actors Since both Michael Douglas and Mike Douglas were taken he,Hollywood Reporter,2024-09-06T07:21:42.875967,michael keaton hint he ready change name professionally . michael keaton may changing name professionally actor born michael douglas wasnt able use birth name began career screen actor guild disallows member using name professionally actor since michael douglas mike douglas taken,0.3612,Positive
Obama Praises Charli XCXs brat She Knows What Shes Doing,Former President Obama praised Charli XCXs brat this week the newest in a long line of politicians becoming part of the pop albums legacy this summer Obama included 365 the final track of brat on his annual summer playlist earlier this month It is a great album the former president said on the Ive Had,Hollywood Reporter,2024-09-06T07:21:42.875967,obama praise charli xcxs brat know shes . former president obama praised charli xcxs brat week newest long line politician becoming part pop album legacy summer obama included 365 final track brat annual summer playlist earlier month great album former president said ive,0.8979,Positive
Rich Homie Quan Type of Way Rapper Dies at 34 Report,Rich Homie Quan born Dequantes Lamar reportedly died Thursday Sept 5 at 34 years old The cause of the Atlanta rappers death remains unknown TMZ first confirmed the news citing family and the Fulton County Morgue and Rolling Stone confirmed with a family member Billboard has reached out to Quans manager and the,Hollywood Reporter,2024-09-06T07:21:42.875967,rich homie quan type way rapper dy 34 report . rich homie quan born dequantes lamar reportedly died thursday sept 5 34 year old cause atlanta rapper death remains unknown tmz first confirmed news citing family fulton county morgue rolling stone confirmed family member billboard reached quans manager,0.0258,Neutral
