Title,Description,Source,Fetched Date,Combined Text,Score,Sentiment
Melissa McCarthy Clive Owen to Star in JonBenet Ramsey Limited Series at Paramount,A pair of Oscar nominees will lead a limited series about the murder of JonBent Ramsey Melissa McCarthy and Clive Owen will star in the drama currently titled JonBent Ramsey which has scored a series order at Paramount The series comes from Yellowstone producers MTV Entertainment Studios and 101 Studios and showrunner Richard LaGravenese Behind,Hollywood Reporter,2024-09-06T07:21:42.875967,melissa mccarthy clive owen star jonbenet ramsey limited series paramount . pair oscar nominee lead limited series murder jonbent ramsey melissa mccarthy clive owen star drama currently titled jonbent ramsey scored series order paramount series come yellowstone producer mtv entertainment studio 101 studio showrunner richard lagravenese behind,-0.6908,Negative
Harvey Weinstein Indecent Assault Charges in UK Dropped Unrealistic Prospect of Conviction,Disgraced Hollywood mogul Harvey Weinstein has had two charges of indecent assault against him dropped by the UKs Crown Prosecution Service CPS In June 2022 the CPS authorized the charges against Weinstein for alleged offenses against a woman now in her mid50s in 1996 according to the Metropolitan Police On Thursday it was confirmed that,Hollywood Reporter,2024-09-06T07:21:42.875967,harvey weinstein indecent assault charge uk dropped unrealistic prospect conviction . disgraced hollywood mogul harvey weinstein two charge indecent assault dropped uk crown prosecution service cps june 2022 cps authorized charge weinstein alleged offense woman mid50s 1996 according metropolitan police thursday confirmed,-0.9274,Negative
DOJ Investigation Alleges Russia Sent 10M to US Media Company,The Department of Justice announced charges Wednesday against two Russian state media employees for funneling 10 million to an unidentified media company in the United States The criminal case names two defendants Kostiantyn Kalashnikov and Elena Afanasyeva both charged with conspiracy to commit money laundering and violating the Foreign Agents Registration Act Their scheme was,Hollywood Reporter,2024-09-06T07:21:42.875967,doj investigation alleges russia sent 10m u medium company . department justice announced charge wednesday two russian state medium employee funneling 10 million unidentified medium company united state criminal case name two defendant kostiantyn kalashnikov elena afanasyeva charged conspiracy commit money laundering violating foreign agent registration act scheme,-0.5859,Negative
Travis Kelce Says Taylor Swift Is Drafting Up Plays for Him Shes a Little Biased,Travis Kelce and Taylor Swift are always looking to support each other in their careers and that includes the pop star drawing up football plays for her boyfriend During a recent appearance on The Rich Eisen Show the Kansas City Chiefs tight end shared how Swift has been especially interested in learning more about the,Hollywood Reporter,2024-09-06T07:21:42.875967,travis kelce say taylor swift drafting play shes little biased . travis kelce taylor swift always looking support career includes pop star drawing football play boyfriend recent appearance rich eisen show kansa city chief tight end shared swift especially interested learning,0.9523,Positive
Documentary Crew Uses Venice Red Carpet to Spotlight Ukrainian Prisoners of War,A film crew took advantage of the Venice Film Festival spotlight Wednesday and wore clothing on its prestigious red carpet embroidered with the distances from the Lido to various locations where Russians are holding Ukrainian prisoners Their documentary Songs of Slow Burning Earth directed by Olha Zhurba celebrated its world premiere in the Out of,Hollywood Reporter,2024-09-06T07:21:42.875967,documentary crew us venice red carpet spotlight ukrainian prisoner war . film crew took advantage venice film festival spotlight wednesday wore clothing prestigious red carpet embroidered distance lido various location russian holding ukrainian prisoner documentary song slow burning earth directed olha zhurba celebrated world premiere,-0.4588,Negative
Masters of the Universe Alison Brie Nabs Key Villain Role of EvilLyn in Amazons HeMan Movie Exclusive,Alison Brie has nabbed the key villain role of EvilLyn in Amazon MGM Studios and Mattel Films liveaction take on Masters of the Universe The actress currently seen on Peacocks thriller limited series Apples Never Fall joins Nicholas Galitzine The Idea of You and Camila Mendes in the adaptation of the popular toy brand first introduced,Hollywood Reporter,2024-09-06T07:21:42.875967,master universe alison brie nabs key villain role evillyn amazon heman movie exclusive . alison brie nabbed key villain role evillyn amazon mgm studio mattel film liveaction take master universe actress currently seen peacock thriller limited series apple never fall join nicholas galitzine idea camila mendes adaptation popular toy brand first introduced,-0.5978,Negative
Queen Guitarist Brian May Reveals He Suffered a Minor Stroke Temporarily Lost Mobility in Left Arm,Queen guitarist Brian May is on the road to recovery after suffering a minor stroke which temporarily left him unable to move his left arm The musician took to Instagram and YouTube to share the update detailing his breakthrough following his health struggles Im here to bring youfirst of allsome good news I think he,Hollywood Reporter,2024-09-06T07:21:42.875967,queen guitarist brian may reveals suffered minor stroke temporarily lost mobility left arm . queen guitarist brian may road recovery suffering minor stroke temporarily left unable move left arm musician took instagram youtube share update detailing breakthrough following health struggle im bring youfirst allsome good news think,-0.7003,Negative
Megalopolis Finds a Fall Guy for AI Trailer Snafu and Hollywood Cries Foul,Megalopolis Finds a Fall Guy for AI Trailer Snafu Well find out whether Francis Ford Coppolas Megalopolis is a masterpiece or a stinker when it arrives in theaters on Sept 27 but the behindthescenes dramas have already been riveting The latest twist was the snafu over the scifi dramas trailer which was pulled by distributor Lionsgate,Hollywood Reporter,2024-09-06T07:21:42.875967,megalopolis find fall guy ai trailer snafu hollywood cry foul . megalopolis find fall guy ai trailer snafu well find whether francis ford coppola megalopolis masterpiece stinker arrives theater sept 27 behindthescenes drama already riveting latest twist snafu scifi drama trailer pulled distributor lionsgate,-0.872,Negative
Twilight Animated Series a Go at Netflix,Twilight is getting a second afterlife in the form of an animated series at Netflix The streamer has given a straighttoseries order and begun development on a show based on Midnight Sun author Stephenie Meyers companion novel to her megaselling Twilight series The book is a retelling of the events of Twilight from vampire Edward,Hollywood Reporter,2024-09-06T07:21:42.875967,twilight animated series go netflix . twilight getting second afterlife form animated series netflix streamer given straighttoseries order begun development show based midnight sun author stephenie meyers companion novel megaselling twilight series book retelling event twilight vampire edward,0.3182,Positive
Telegram quietly enables users to report private chats to moderators after founders arrest,Telegram has quietly updated its policy to allow users to report private chats to its moderators following the arrest of founder Pavel Durov in France last month over crimes committed,TechCrunch,2024-09-06T07:21:43.039496,telegram quietly enables user report private chat moderator founder arrest . telegram quietly updated policy allow user report private chat moderator following arrest founder pavel durov france last month crime committed,-0.6486,Negative
Stop harassing Starlink SpaceX president tells Brazilian judge,SpaceX President Gwynne Shotwell made a public plea to one of Brazils top judicial figures on Thursday asking him to please stop harassing Starlink amid the ongoing battle in the,TechCrunch,2024-09-06T07:21:43.039496,stop harassing starlink spacex president tell brazilian judge . spacex president gwynne shotwell made public plea one brazil top judicial figure thursday asking please stop harassing starlink amid ongoing battle,-0.872,Negative
Osom is shutting down on Friday as it had no customers for a mobile phone,OSOM always had a difficult road with plans to launch a privacyfocused handset,TechCrunch,2024-09-06T07:21:43.039496,osom shutting friday customer mobile phone . osom always difficult road plan launch privacyfocused handset,-0.3612,Negative
Salesforce acquires data management firm Own for 19B in cash,Salesforce has acquired Own Company a New Jerseybased provider of data management and protection solutions for 19 billion in cash Own is Salesforces biggest deal since buying Slack for 277,TechCrunch,2024-09-06T07:21:43.039496,salesforce acquires data management firm 19b cash . salesforce acquired company new jerseybased provider data management protection solution 19 billion cash salesforces biggest deal since buying slack 277,0.3182,Positive
US charges five Russian military hackers with targeting Ukraines government with destructive malware,The US government indictment demonstrated deep knowledge of the Russian spies activities including their realworld meetings at a cafe in Moscow,TechCrunch,2024-09-06T07:21:43.039496,u charge five russian military hacker targeting ukraine government destructive malware . u government indictment demonstrated deep knowledge russian spy activity including realworld meeting cafe moscow,-0.6124,Negative
Lyft restructures its micromobility business and Volkswagen brings ChatGPT to US vehicles,Welcome back to TechCrunch Mobility your central hub for news and insights on the future of transportation Sign up here for free just click TechCrunch Mobility Short week,TechCrunch,2024-09-06T07:21:43.039496,lyft restructures micromobility business volkswagen brings chatgpt u vehicle . welcome back techcrunch mobility central hub news insight future transportation sign free click techcrunch mobility short week,0.743,Positive
Microsoft gives deepfake porn victims a tool to scrub images from Bing search,The advancement of generative AI tools has created a new problem for the internet the proliferation of synthetic nude images resembling real people On Thursday Microsoft took a major step,TechCrunch,2024-09-06T07:21:43.039496,microsoft give deepfake porn victim tool scrub image bing search . advancement generative ai tool created new problem internet proliferation synthetic nude image resembling real people thursday microsoft took major step,-0.4215,Negative
Driverless carsharing startup Vay steers toward B2B services,The new businesstobusiness division is a bet on what cofounder and CEO Thomas von der Ohe thinks is the future of mobility,TechCrunch,2024-09-06T07:21:43.039496,driverless carsharing startup vay steer toward b2b service . new businesstobusiness division bet cofounder ceo thomas von der ohe think future mobility,0.0,Neutral
Drip Capital a fintech that provides working capital to SMBs picks up 113M,Drip Capital has raised 113 million in a combination of 23 million in equity and 90 million in debt to provide credit to more small businesses in India and the,TechCrunch,2024-09-06T07:21:43.039496,drip capital fintech provides working capital smbs pick 113m . drip capital raised 113 million combination 23 million equity 90 million debt provide credit small business india,0.0258,Neutral
Googles AIpowered Ask Photos feature begins US rollout,Google said the feature could be used for more than just photo retrieval alone users would also be able to ask questions to get helpful answers,TechCrunch,2024-09-06T07:21:43.039496,google aipowered ask photo feature begin u rollout . google said feature could used photo retrieval alone user would also able ask question get helpful answer,0.2023,Neutral
Endolith is using Olympiccaliber copper microbes to address the copper shortage,The stealthily operating startup thinks it can narrow the gap by helping miners extract more copper from their mines,TechCrunch,2024-09-06T07:21:43.039496,endolith using olympiccaliber copper microbe address copper shortage . stealthily operating startup think narrow gap helping miner extract copper mine,0.0772,Neutral
A comprehensive list of 2024 tech layoffs,A complete list of all the known layoffs in tech from Big Tech to startups broken down by month throughout 2024,TechCrunch,2024-09-06T07:21:43.039496,comprehensive list 2024 tech layoff . complete list known layoff tech big tech startup broken month throughout 2024,-0.2732,Negative
All Hands AI raises 5M to build open source agents for developers,As with many open source startups All Hands AI expects to monetize its service by offering paid closedsource enterprise features,TechCrunch,2024-09-06T07:21:43.039496,hand ai raise 5m build open source agent developer . many open source startup hand ai expects monetize service offering paid closedsource enterprise feature,0.7506,Positive
TechCrunch Minute This robotic wheelchair can climb stairs,Koreas Institute of Machinery and Materials unveiled a pretty cool robotic wheelchair this week By creating a compliant wheel that conforms to the terrain around,TechCrunch,2024-09-06T07:21:43.039496,techcrunch minute robotic wheelchair climb stair . korea institute machinery material unveiled pretty cool robotic wheelchair week creating compliant wheel conforms terrain around,0.7717,Positive
Mintlify is building a nextgen platform for writing software docs,Mintlify offers a collection of documentationauthoring tools including tools that can autogenerate docs from codebases,TechCrunch,2024-09-06T07:21:43.039496,mintlify building nextgen platform writing software doc . mintlify offer collection documentationauthoring tool including tool autogenerate doc codebases,0.0,Neutral
German LLM maker Aleph Alpha pivots to AI support,Europe doesnt have many large language model LLM makers but one of these rare AI beasts Germanys Aleph Alpha appears to be preparing to rule itself out of,TechCrunch,2024-09-06T07:21:43.039496,german llm maker aleph alpha pivot ai support . europe doesnt many large language model llm maker one rare ai beast germany aleph alpha appears preparing rule,0.4019,Positive
Rivians chief software designer is coming to TechCrunch Disrupt 2024,Every automaker is aiming to build and sell the socalled softwaredefined vehicle Rivian may have actually done it but getting there wasnt easy Just ask Rivians chief of software Wassym,TechCrunch,2024-09-06T07:21:43.039496,rivians chief software designer coming techcrunch disrupt 2024. every automaker aiming build sell socalled softwaredefined vehicle rivian may actually done getting wasnt easy ask rivians chief software wassym,-0.3412,Negative
The AI industry is obsessed with Chatbot Arena but it might not be the best benchmark,LMSYS Chatbot Arena is perhaps the most popular AI benchmark today and an industry obsession But its far from a perfect measure,TechCrunch,2024-09-06T07:21:43.039496,ai industry obsessed chatbot arena might best benchmark . lmsys chatbot arena perhaps popular ai benchmark today industry obsession far perfect measure,0.8225,Positive
Google expands AIpowered virtual tryon tool to include dresses,Google announced Thursday that it expanded its generative AIpowered virtual tryon tool to support dresses allowing users to virtually wear thousands of dresses from hundreds of brands including Boden Maje,TechCrunch,2024-09-06T07:21:43.039496,google expands aipowered virtual tryon tool include dress . google announced thursday expanded generative aipowered virtual tryon tool support dress allowing user virtually wear thousand dress hundred brand including boden maje,0.4767,Positive
Announcing the Startup Battlefield 200 at TechCrunch Disrupt 2024,TechCrunch Disrupt 2024 which takes place from October 2830 at Moscone West in San Francisco is rapidly approaching Today were thrilled to announce the 200 startups selected to participate in,TechCrunch,2024-09-06T07:21:43.039496,announcing startup battlefield 200 techcrunch disrupt 2024. techcrunch disrupt 2024 take place october 2830 moscone west san francisco rapidly approaching today thrilled announce 200 startup selected participate,0.0772,Neutral
Unthinkable final scenes stun NFL world,Truly unthinkable scenes have unfolded during the opening game of the NFLs season with viewers watching on left in disbelief,News AU,2024-09-06T07:21:44.462403,unthinkable final scene stun nfl world . truly unthinkable scene unfolded opening game nfls season viewer watching left disbelief,0.4404,Positive
Got a few weapons Blues ready for mission impossible,Carlton may be taking a risk bringing back six injured players for a sudden death final but the riskiest one actually gives coach Michael Voss the most confidence,News AU,2024-09-06T07:21:44.462403,got weapon blue ready mission impossible . carlton may taking risk bringing back six injured player sudden death final riskiest one actually give coach michael voss confidence,-0.765,Negative
Unbelievable Raygun photo emerges,After Rayguns interview on The Project a private photo of the Olympian has emerged that could break the internet,News AU,2024-09-06T07:21:44.462403,unbelievable raygun photo emerges . rayguns interview project private photo olympian emerged could break internet,0.2023,Neutral
Swifts partner horrifies with rogue new look,Travis Kelce the boyfriend of superstar Taylor Swift has been savaged on social media after displaying a new look for the NFL opener,News AU,2024-09-06T07:21:44.462403,swift partner horrifies rogue new look . travis kelce boyfriend superstar taylor swift savaged social medium displaying new look nfl opener,-0.6486,Negative
Gloomy Melbourne skies threaten to hand Hawks key advantage,The buildup has been about Western Bulldogs talls against Hawthorns smalls and the weather gods look set to hand the Hawks a huge advantage as clouds circle the MCG,News AU,2024-09-06T07:21:44.462403,gloomy melbourne sky threaten hand hawk key advantage . buildup western bulldog tall hawthorn small weather god look set hand hawk huge advantage cloud circle mcg,0.8625,Positive
NRL Live All eyes on Tigers and Eels in Spoon Bowl showdown,The rugby league world tonight turns to Campbelltown to watch the Tigers and Eels battle it out in the highly anticipated Spoon Bowl Follow along for live coverage and SuperCoach analysis from the thrilling showdown,News AU,2024-09-06T07:21:44.462403,nrl live eye tiger eel spoon bowl showdown . rugby league world tonight turn campbelltown watch tiger eel battle highly anticipated spoon bowl follow along live coverage supercoach analysis thrilling showdown,0.128,Neutral
Not even close Dragons coach debunks spray claims,There are two things Dragons fans would want to hear from coach Shane Flanagan and he delivered them both on Friday,News AU,2024-09-06T07:21:44.462403,even close dragon coach debunks spray claim . two thing dragon fan would want hear coach shane flanagan delivered friday,0.3818,Positive
Aussies shatter records in cricket demolition,Australian skipper Mitch Marsh and Travis Head have set fire to crickets record books in a blistering display against Scotland,News AU,2024-09-06T07:21:44.462403,aussie shatter record cricket demolition . australian skipper mitch marsh travis head set fire cricket record book blistering display scotland,-0.34,Negative
Marsh whacks 30 in an over as records tumble,The boundaries at The Grange in Edinburgh were no match for Travis Head and Mitchell Marsh who put Scotland back in their T20 place with an unforgettable effort,News AU,2024-09-06T07:21:44.462403,marsh whack 30 record tumble . boundary grange edinburgh match travis head mitchell marsh put scotland back t20 place unforgettable effort,0.0,Neutral
Never before seen angle of ball girl drama,A tennis star who became public enemy number one at the US Open has taken to social media to try and dispel the outrage,News AU,2024-09-06T07:21:44.462403,never seen angle ball girl drama . tennis star became public enemy number one u open taken social medium try dispel outrage,-0.7579,Negative
World No 1s US Open act leaves a bad taste,World No 1 Jannik Sinner is the only top 10 player left in the mens semis at the US Open but his charge has left a bad taste,News AU,2024-09-06T07:21:44.462403,world 1 u open act leaf bad taste . world 1 jannik sinner top 10 player left men semi u open charge left bad taste,-0.7351,Negative
Darts prodigy is here to win in Australia,Luke Littler has taken the darts world by storm this year and the teenager is in Australia this week determined to continue his red hot form,News AU,2024-09-06T07:21:44.462403,dart prodigy win australia . luke littler taken dart world storm year teenager australia week determined continue red hot form,0.7351,Positive
Absolutely hate it Aussies in Paris drama,A new rule at the Olympics athletics events is sure to divide athletes and fans and produce high drama in Paris writes Sally Pearson,News AU,2024-09-06T07:21:44.462403,absolutely hate aussie paris drama . new rule olympics athletics event sure divide athlete fan produce high drama paris writes sally pearson,-0.101,Neutral
Astonishing rise set to flip F1 in 215m race,Daniel Ricciardo has been given a reality check as the urgency mounts at Red Bull amid a threehorse race to replace a struggling driver,News AU,2024-09-06T07:21:44.462403,astonishing rise set flip f1 215m race . daniel ricciardo given reality check urgency mount red bull amid threehorse race replace struggling driver,-0.4215,Negative
Schumacher wifes rare public outburst,Corinna Schumacher has caused a scene in front of the Formula 1 world in a confrontation with a longtime friend surrounding her family,News AU,2024-09-06T07:21:44.462403,schumacher wife rare public outburst . corinna schumacher caused scene front formula 1 world confrontation longtime friend surrounding family,0.2263,Neutral
Was I a prick Ricciardo apologises for race incident,Australian F1 star Daniel Ricciardo has reached out to Nico Hulkenberg to apologise for an opening lap incident that did damage to both their races,News AU,2024-09-06T07:21:44.462403,prick ricciardo apologises race incident . australian f1 star daniel ricciardo reached nico hulkenberg apologise opening lap incident damage race,-0.2023,Neutral
Gold medallist as youve never seen her,Surviving a horrific cycling accident was a feat in itself for Alexa Leary After stealing the spotlight in Paris read about her incredible story,News AU,2024-09-06T07:21:44.462403,gold medallist youve never seen . surviving horrific cycling accident feat alexa leary stealing spotlight paris read incredible story,-0.6336,Negative
Aussies in near catastrophic lightning strike,Aussie sailor Jimmy Spithill was caught up in a terrifying lightning episode that struck in the middle of a competition,News AU,2024-09-06T07:21:44.462403,aussie near catastrophic lightning strike . aussie sailor jimmy spithill caught terrifying lightning episode struck middle competition,-0.8555,Negative
NFL about to see something never done before,A historic freakish feat seems destined to happen in the NFL this year and its something even Tom Brady could only dream of,News AU,2024-09-06T07:21:44.462403,nfl see something never done . historic freakish feat seems destined happen nfl year something even tom brady could dream,0.5505,Positive
Travis Kelce hits back over breakup contract,Travis Kelce has hit back after a breakup contract that surfaced online apppeared to show he and Taylor Swift are set to call it quits,News AU,2024-09-06T07:21:44.462403,travis kelce hit back breakup contract . travis kelce hit back breakup contract surfaced online apppeared show taylor swift set call quits,0.2023,Neutral
Socceroos star owns up after shocker,One of the Socceroos main attacking weapons has put his hand up for failing to deliver in Australias shoddy display against Bahrain,News AU,2024-09-06T07:21:44.462403,socceroos star owns shocker . one socceroos main attacking weapon put hand failing deliver australia shoddy display bahrain,-0.7096,Negative
Worlds worst team wins after 20year wait,There have been scenes of total insanity as the worlds worst football team snapped a 20 year 140game winless run,News AU,2024-09-06T07:21:44.462403,world worst team win 20year wait . scene total insanity world worst football team snapped 20 year 140game winless run,-0.8442,Negative
Whittaker eyes blockbuster Sydney world title fight,Rob Whittaker has his eyes on a middleweight title fight in Sydney next year and got in some highlevel sparring against Jai Opetaia on Friday,News AU,2024-09-06T07:21:44.462403,whittaker eye blockbuster sydney world title fight . rob whittaker eye middleweight title fight sydney next year got highlevel sparring jai opetaia friday,-0.5994,Negative
Definitely pushing Major move for LIV players,Theres one significant thing LIV Golf has done that an Australian gun thinks could have big ramifications for local events in the future,News AU,2024-09-06T07:21:44.462403,definitely pushing major move liv player . there one significant thing liv golf done australian gun think could big ramification local event future,0.2732,Positive
How players score points in SuperCoach NBL,The SuperCoach NBL scoring formula is simple enough to follow on TV or courtside Check out this quick explainer and who to consider for your team,News AU,2024-09-06T07:21:44.462403,player score point supercoach nbl . supercoach nbl scoring formula simple enough follow tv courtside check quick explainer consider team,0.0,Neutral
