Title,Description,Source,Fetched Date
Its one of the most rowdy US sporting events Heres what Preakness says about the economy,The Maryland tradition attracts a mix of socioeconomic classes But this year the tradition has been thrown into question,BBC Business,2025-05-18T07:24:25.214825
US loses last perfect credit rating amid rising debt,Moodys said successive US administrations had failed to reverse ballooning deficits and interest costs,BBC Business,2025-05-18T07:24:25.214825
World of Business,Gain the leading edge with global insights for the boardroom and beyond in your inbox every Wednesday,BBC Business,2025-05-18T07:24:25.214825
Doom One of gamings oldest series reckons with the challenges of 2025,Doom is one of the most wellknown series in gaming but it still has to work to find new players,BBC Business,2025-05-18T07:24:25.214825
US proposes dropping Boeing criminal charge,Families criticised the move which would avoid a trial that is due to begin in June,BBC Business,2025-05-18T07:24:25.214825
Why youth mobility and fishing are key issues ahead of UKEU summit,Youth mobility and fishing rights are key negotiating points between the UK and the EU as PM Keir Starmer attempts a postBrexit reset,BBC Business,2025-05-18T07:24:25.214825
Five House Republicans stall Trumps big beautiful tax bill,Lawmakers from the presidents own party joined all Democrats to reject a key domestic bill demanding deeper budget cuts,BBC Business,2025-05-18T07:24:25.214825
Four obstacles for Republican rebels in Trumps tax bill,Governmentfunded welfare programmes have become a major point of contention in Trumps tax bill,BBC Business,2025-05-18T07:24:25.214825
Week in Markets 16 May 2025,A weekly summary of the big stories from financial markets around the world,BBC Business,2025-05-18T07:24:25.214825
Indias electric car future,Tesla is rolling out in India Asias thirdlargest economy where EV sales grew 2000 over the last five years,BBC Business,2025-05-18T07:24:25.214825
Markets welcome USUK trade agreement,Wealth management expert says financial markets will be relieved the US is striking deals with trading partners,BBC Business,2025-05-18T07:24:25.214825
The exGoogle exec who wants to simplify your life,Marissa Mayer a former Google and Yahoo executive believes AI should simplify our lives,BBC Business,2025-05-18T07:24:25.214825
Billionaires fall as King rises in latest Sunday Times Rich List,The Kings personal wealth is now equal to former prime minister Rishi Sunak and his wife at 640m,BBC Business,2025-05-18T07:24:25.214825
Wegovy firm unexpectedly forces boss to step down,The decision described as a response to market challenges and a slide in its share price was unexpected,BBC Business,2025-05-18T07:24:25.214825
Nissan says it could share global plants with Chinese state firm,Nissan announced this week that it would lay off another 11000 workers and shut seven factories,BBC Business,2025-05-18T07:24:25.214825
Is Britain really inching back towards the EU,The summit between the UK and EU on 19 May will be the first since Brexit the very idea of it has polarised opinions,BBC Business,2025-05-18T07:24:25.214825
UK needs more nuclear to power AI says Amazon boss,The worlds largest cloud computing company plans to spend 8bn on new data centres in the UK over the next four years,BBC Business,2025-05-18T07:24:25.214825
Walmart says higher prices could hit this month due to tariffs,The retailer says it isnt able to absorb all the pressure from tariffs even at the reduced levels announced,BBC Business,2025-05-18T07:24:25.214825
Playing with FIRE How to quit work and retire in your 30s,A personal finance strategy popular among millennials is helping them to quit their job and retire decades early,BBC Business,2025-05-18T07:24:25.214825
Boomerang CEOs Do they ever succeed,Five years after being ousted from WeWork Adam Neumann wants to rebuy the nowbankrupt business,BBC Business,2025-05-18T07:24:25.214825
How industry leaders transformed their career,The BBCs Katty Kay has spoken to successful changemakers to ask what made them pivot in their career,BBC Business,2025-05-18T07:24:25.214825
Women were the original beer brewers what changed,Today the beer industry is maledominated but it wasnt always so,BBC Business,2025-05-18T07:24:25.214825
How waiting alters our perception of time,Expert advice on how to get through a waiting period,BBC Business,2025-05-18T07:24:25.214825
Do the superrich deserve their wealth,Should there be a cap on billionaires wealth and their inheritances,BBC Business,2025-05-18T07:24:25.214825
Four simple hacks to succeed in every conversation,A career coach a choreographer a chef and a dragon boat captain offer advice on giving critical feedback,BBC Business,2025-05-18T07:24:25.214825
Solo and hybrid work Navigating our future and new normal,Covid19 reshaped the way we live and work We rethink solo working and explore the future of worklife,BBC Business,2025-05-18T07:24:25.214825
Can supersonic flight ever be sustainable,How a new era of quiet net zero supersonic airliners could revolutionise the aviation industry,BBC Business,2025-05-18T07:24:25.214825
Commencement speech The surprising pitfall of your passions,Students are graduating in the US this week The commencement speeches might lead them into questionable choices,BBC Business,2025-05-18T07:24:25.214825
A desk full of descriptions for your work colleagues,These are the long lost words youve been waiting for to describe your colleagues,BBC Business,2025-05-18T07:24:25.214825
Veterinarian suicide rates are very high Why,Veterinarian professionals are committing suicide at a higher rate than the general population,BBC Business,2025-05-18T07:24:25.214825
ASMR How whispering took over the internet,We meet the creators behind the current ASMR boom,BBC Business,2025-05-18T07:24:25.214825
India disputes Trump claim it is ready to charge US no tariffs,Indias foreign minister countered Trump saying nothing is decided till everything is,BBC Business,2025-05-18T07:24:25.214825
Seventeen arrest warrants issued over Bangkok skyscraper collapse,The State Audit Office tower collapsed when Bangkok felt tremors of a massive earthquake in Myanmar,BBC Business,2025-05-18T07:24:25.214825
Leading crypto firm Coinbase faces up to 400m hit from cyber attack,The firm says hackers have obtained customer information by paying off employees,BBC Business,2025-05-18T07:24:25.214825
Analysis The UKs surprise resilience may not be temporary,These figures provide an opportune moment for some optimism and a hard sell of the UK to the rest of the world,BBC Business,2025-05-18T07:24:25.214825
Reeves says UK beginning to turn corner as growth beats forecasts,The economy grew faster than expected between January and March before UK and US tax rises were brought in during April,BBC Business,2025-05-18T07:24:25.214825
Ben Jerrys cofounder arrested after Senate Gaza protest,Ben Cohen and six others were arrested during the protest in the US Senate Capitol Police tells BBC News,BBC Business,2025-05-18T07:24:25.214825
Jaguar says it has no plans to build cars in the US,The comment came after the companys boss refused to rule out opening production plants in America,BBC Business,2025-05-18T07:24:25.214825
Letting off steam How Dominicas volcanoes will boost its green energy,The Caribbean island is building a power station that will use steam naturally heated by volcanic rock,BBC Business,2025-05-18T07:24:25.214825
Trumps critics and supporters unite against Qatar plane deal,The White House has doubled down on the proposed deal which has been criticised by some of the presidents top supporters,BBC Business,2025-05-18T07:24:25.214825
Jewish Rapper and Comedian Kosha Dillz Says His Films Canceled Screening Has Been Reinstated,Bring the Family Home will play its Chicago theater playdate in the coming weeks,Hollywood Reporter,2025-05-18T07:24:25.576782
How Simple Minds Gen X Anthem Dont You Forget About Me Almost Didnt Come to Be,Ahead of a US tour and 40 years after the song hit No 1 frontman Jim Kerr talks to THR about the bands legacy and the power of Pasadenas Cruel World festival,Hollywood Reporter,2025-05-18T07:24:25.576782
Sean Diddy Combs Ex Cassie Ventura Tells Court She Doesnt Hate Him Despite Decade of Abuse,The heavily pregnant RB singer detailed their violent and tumultuous relationship in grave detail in federal court this week as the prosecutions star witness,Hollywood Reporter,2025-05-18T07:24:25.576782
Hours After Release Morgan Wallens Im The Problem Is Already Spotifys MostStreamed Country Album of 2025,Spotify confirmed Wallens fourth album is the platforms moststreamed country album of the year just over half a day after it released on Friday,Hollywood Reporter,2025-05-18T07:24:25.576782
Foo Fighters Part Ways With Drummer Josh Freese,Im not angry just a bit shocked and disappointed said Freese who replaced the late Taylor Hawkins two years ago,Hollywood Reporter,2025-05-18T07:24:25.576782
Justin Bieber Denies Being One of Diddys Victims There Are Individuals Who Were Genuinely Harmed By Him,Bieber has long been speculated to be one of Combs victims after a clip of the hiphop mogul hanging out with the then15yearold singer resurfaced online after Combs arrest,Hollywood Reporter,2025-05-18T07:24:25.576782
Donald Trump Puts Bruce Springsteen on Notice Upon Return From European Tour Well See How It Goes for Him,In another unfiltered rant the presidents missive included a veiled threat concerning the rockers reentry to the US,Hollywood Reporter,2025-05-18T07:24:25.576782
Chris Brown Denied Bail After UK Arrest on Assault Charge,The controversial singer was ordered to be held until his next hearing on June 13 the same day hes set to take the stage in Frankfurt Germany on the third date of his world tour,Hollywood Reporter,2025-05-18T07:24:25.576782
Cassie Testimony Ends After Speaking About Diddys 2016 Hotel Attack in Day Two of CrossExamination,Sean Combs longtime exgirlfriend spent four days on the witness stand at the hiphop moguls sextrafficking trial,Hollywood Reporter,2025-05-18T07:24:25.576782
Damiano David Is ReLearning How to Trust His Gut,The Hollywood Reporters newest Person of Interest is the Italian singer and Mneskin frontman who hopes to inspire others to face their fears with his first solo album FUNNY little FEARS,Hollywood Reporter,2025-05-18T07:24:25.576782
Charli XCX Extends Brat Summer in Cannes With Magnum Party and Palais Premiere of The Plague,The superstar singer and indemand actress also updated her Letterboxd immediately after seeing Charlie Polingers Un Certain Regard film Feeling like Im reeling,Hollywood Reporter,2025-05-18T07:24:25.576782
Mens Style Expert Andrew Weitz Offers Fashion Tips for the South of France and Beyond,The goto Hollywood style consultant for top executives answers burning questions about how to select the right pieces for a fashionable festival or postCannes travel,Hollywood Reporter,2025-05-18T07:24:25.576782
Tears flow as club honour Adam Selwood,The West Coast Eagles have delivered a heartfelt tribute to Adam Selwood following the former AFL stars shock death on Saturday,News AU,2025-05-18T07:24:26.401121
Pathetic star slammed over Origin leaks,NRL legend Brad Fittler has delivered a scathing rant in the direction of a Wests Tigers star over his State of Origin bomb,News AU,2025-05-18T07:24:26.401121
Frenzy over horrible WTC Selwood comment,There has been outrage and some support for a local Elder after a Welcome to Country that addressed the death of AFL player Adam Selwood,News AU,2025-05-18T07:24:26.401121
F1 star in horror scene as car flips into cage,Formula 1 has been rocked after a star driver was flipped upside down at 240kmh in a terrifying incident at the Italian Grand Prix,News AU,2025-05-18T07:24:26.401121
Coaching masterstroke Brimson switch works a treat,Gold Coast Titans coach Des Hasler shook up his backline and its paid immediate dividends with AJ Brimson starring after a move to fullback,News AU,2025-05-18T07:24:26.401121
Clarry v Neale Goodwin throws Oliver another huge tag,Last week it was Jai Newcombe Now Clayton Oliver has the huge task of stopping Lachie Neale in Melbournes clash with Brisbane Lions FOLLOW LIVE,News AU,2025-05-18T07:24:26.401121
56 million reasons for Aussies to win WTC final,Taking the mantle as the worlds best Test team is motivation for Australia to win the World Test Championship final but a massive new carrot has been dangled,News AU,2025-05-18T07:24:26.401121
South Africans make WTC final demand,As players weigh up whether to return to India for the delayed IPL South African cricket bosses lost their bid to make a demand on their Test players that Cricket Australia didnt,News AU,2025-05-18T07:24:26.401121
Jelena Dokic drops huge baby news,Tennis star Jelena Dokic who survived horrific abuse at her fathers hands has spoken about her own plans to start a family,News AU,2025-05-18T07:24:26.401121
Call Roger Djokers shock coaching move,Just weeks out from the French Open and Wimbledon Novak Djokovic has announced a shock moving in his coaching ranks,News AU,2025-05-18T07:24:26.401121
Massive gamble to blow up in AFL clubs face,A fallen AFL dynasty has suddenly turned its fortunes around as a massive gamble looks set to blow up in a rival clubs face,News AU,2025-05-18T07:24:26.401121
Lose my s Piastri exposed by message,Oscar Piastri told the world how he really felt after he was compromised during a qualifying incident at the Italian Grand Prix,News AU,2025-05-18T07:24:26.401121
Brumbies backrower ends Reds home final fairytale,Brumbies backrower Tuaina Tualima ended the Reds dream of a home final putting the finishing touch on Queenslands loss in the nations capital,News AU,2025-05-18T07:24:26.401121
Doordie for Reds against Brumbies,If the Queensland Reds want to host a match in this years Super Rugby Pacific finals series a win over the ACT Brumbies on Saturday night looms as a must,News AU,2025-05-18T07:24:26.401121
Celebrities lose it after huge NBA victory,The stars were out in force as the New York Knicks sealed a droughtbreaking NBA win sparking wild celebrations across the city,News AU,2025-05-18T07:24:26.401121
Baseball world rocked by Aussie icons death,A massive outpouring of shock and loss has swept through the Australian sporting world after the unexpected death of an Aussie Olympian,News AU,2025-05-18T07:24:26.401121
City stunned as PL battlers win first trophy in 120 years,Crystal Palace has stunned Manchester City in the FA Cup final to lay hands on major silverware for the first time in the clubs existence,News AU,2025-05-18T07:24:26.401121
Rogerson hands Auckland crucial away win in Melbourne,Logan Rogerson found the back of the net to score the decisive goal in Auckland FCs crucial 10 win against Melbourne Victory in the first leg of the ALeague semi finals,News AU,2025-05-18T07:24:26.401121
Knockout of the year stuns boxing world,An English boxer has left jaws on the floor after delivering one of the nastiest knockouts youre ever likely to see on Sunday,News AU,2025-05-18T07:24:26.401121
From broomsticks to golf clubs The man who leads the PGA,Jhonattan Vegas learned golf by hitting rocks with broomsticks in Venezuela and he now finds himself in command of a major championship He is well clear of the likes of Rory McIlroy who only just made the cut,News AU,2025-05-18T07:24:26.401121
Gais 27m import shows he is Melbourne Cup quality,Sir Delius a 27m purchase rubberstamped his Melbourne Cup credentials with an impressive victory at Doomben in his debut for Gai Waterhouse and Adrian Bott,News AU,2025-05-18T07:24:26.401121
Aussies epic solo escape to claim maiden Grand Tour stage win,Aussie cyclist Luke Plapp held a bottle of bubbly as he revealed the emotional roller coaster of his season so far after taking out his maiden Grand Tour stage win,News AU,2025-05-18T07:24:26.401121
Olympians apology will break your heart,Rohan Denniss heartwrenching apology letter to his late wife has emerged after the Olympic cyclist was sentenced for his role in her death,News AU,2025-05-18T07:24:26.401121
Heart broken WWE legend dead at age 60,An icon of the wrestling world has died just weeks after his final match with stars of the industry left heartbroken,News AU,2025-05-18T07:24:26.401121
