Title,Description,Source,Fetched Date
NRL Live All eyes on Tigers and Eels in Spoon Bowl showdown,The rugby league world tonight turns to Campbelltown to watch the Tigers and Eels battle it out in the highly anticipated Spoon Bowl Follow along for live coverage and SuperCoach analysis from the thrilling showdown,News AU,2024-09-06T07:21:44.462403
Not even close Dragons coach debunks spray claims,There are two things Dragons fans would want to hear from coach Shane Flanagan and he delivered them both on Friday,News AU,2024-09-06T07:21:44.462403
Aussies shatter records in cricket demolition,Australian skipper Mitch Marsh and Travis Head have set fire to crickets record books in a blistering display against Scotland,News AU,2024-09-06T07:21:44.462403
Marsh whacks 30 in an over as records tumble,The boundaries at The Grange in Edinburgh were no match for Travis Head and Mitchell Marsh who put Scotland back in their T20 place with an unforgettable effort,News AU,2024-09-06T07:21:44.462403
Never before seen angle of ball girl drama,A tennis star who became public enemy number one at the US Open has taken to social media to try and dispel the outrage,News AU,2024-09-06T07:21:44.462403
World No 1s US Open act leaves a bad taste,World No 1 Jannik Sinner is the only top 10 player left in the mens semis at the US Open but his charge has left a bad taste,News AU,2024-09-06T07:21:44.462403
Darts prodigy is here to win in Australia,Luke Littler has taken the darts world by storm this year and the teenager is in Australia this week determined to continue his red hot form,News AU,2024-09-06T07:21:44.462403
Absolutely hate it Aussies in Paris drama,A new rule at the Olympics athletics events is sure to divide athletes and fans and produce high drama in Paris writes Sally Pearson,News AU,2024-09-06T07:21:44.462403
Astonishing rise set to flip F1 in 215m race,Daniel Ricciardo has been given a reality check as the urgency mounts at Red Bull amid a threehorse race to replace a struggling driver,News AU,2024-09-06T07:21:44.462403
Schumacher wifes rare public outburst,Corinna Schumacher has caused a scene in front of the Formula 1 world in a confrontation with a longtime friend surrounding her family,News AU,2024-09-06T07:21:44.462403
Was I a prick Ricciardo apologises for race incident,Australian F1 star Daniel Ricciardo has reached out to Nico Hulkenberg to apologise for an opening lap incident that did damage to both their races,News AU,2024-09-06T07:21:44.462403
Gold medallist as youve never seen her,Surviving a horrific cycling accident was a feat in itself for Alexa Leary After stealing the spotlight in Paris read about her incredible story,News AU,2024-09-06T07:21:44.462403
Aussies in near catastrophic lightning strike,Aussie sailor Jimmy Spithill was caught up in a terrifying lightning episode that struck in the middle of a competition,News AU,2024-09-06T07:21:44.462403
NFL about to see something never done before,A historic freakish feat seems destined to happen in the NFL this year and its something even Tom Brady could only dream of,News AU,2024-09-06T07:21:44.462403
Travis Kelce hits back over breakup contract,Travis Kelce has hit back after a breakup contract that surfaced online apppeared to show he and Taylor Swift are set to call it quits,News AU,2024-09-06T07:21:44.462403
Socceroos star owns up after shocker,One of the Socceroos main attacking weapons has put his hand up for failing to deliver in Australias shoddy display against Bahrain,News AU,2024-09-06T07:21:44.462403
Worlds worst team wins after 20year wait,There have been scenes of total insanity as the worlds worst football team snapped a 20 year 140game winless run,News AU,2024-09-06T07:21:44.462403
Whittaker eyes blockbuster Sydney world title fight,Rob Whittaker has his eyes on a middleweight title fight in Sydney next year and got in some highlevel sparring against Jai Opetaia on Friday,News AU,2024-09-06T07:21:44.462403
Definitely pushing Major move for LIV players,Theres one significant thing LIV Golf has done that an Australian gun thinks could have big ramifications for local events in the future,News AU,2024-09-06T07:21:44.462403
How players score points in SuperCoach NBL,The SuperCoach NBL scoring formula is simple enough to follow on TV or courtside Check out this quick explainer and who to consider for your team,News AU,2024-09-06T07:21:44.462403
Rugby greats wife disappears declared dead,The shattered family of a former rugby star has released a heartbreaking message after the search for his wife was called off,News AU,2024-09-06T07:21:44.462403
Epic feat for ultimate team man,An alltime Wallabies playing record will be broken during the Bledisloe Cup after James Slipper was recalled to play Argentina,News AU,2024-09-06T07:21:44.462403
Theyve elevated her Willo Bella to relish Giga clash,Bella Nipotina continues to leave jockey Craig Williams in awe and hes expecting the brilliant sprinter to pick up where she left off in the Group 3 Concorde Stakes at Randwick,News AU,2024-09-06T07:21:44.462403
ExAussie comes clean on shock defection,Threetime Olympic medallist Matthew Richardson has spoken out after he turned his back on Australia weeks after the Olympics finished,News AU,2024-09-06T07:21:44.462403
