Title,Description,Source,Fetched Date,Combined Text,Score,Sentiment
Went crazy Aussie golden girls sad reveal,Aussie swimming star Ariarne Titmus has opened up on a major health scare revealing she would give up her Olympic medals for one thing,News AU,2024-10-27T07:22:24.924328,went crazy aussie golden girl sad reveal . aussie swimming star ariarne titmus opened major health scare revealing would give olympic medal one thing,-0.6808,Negative
Menendez detail in innocent pic goes viral,With the convicted killers inching closer to freedom in the US a notorious image of the brothers has gone viral once again,News AU,2024-10-27T07:22:24.924328,menendez detail innocent pic go viral . convicted killer inching closer freedom u notorious image brother gone viral,-0.1531,Neutral
United playing with no pressure,Western United is ignoring outside noise in the ALeague clubs bid to prove its doubters wrong,News AU,2024-10-27T07:22:24.924328,united playing pressure . western united ignoring outside noise aleague club bid prove doubter wrong,-0.4939,Negative
WATCH Stud drama horror own goal light up crazy derby,A devastating opening 25 minutes from the Victory has helped them register a comfortable victory over arch rivals City with a shocking goalkeeper error gifting Ryan Teague his second goal of the season Watch it here,News AU,2024-10-27T07:22:24.924328,watch stud drama horror goal light crazy derby . devastating opening 25 minute victory helped register comfortable victory arch rival city shocking goalkeeper error gifting ryan teague second goal season watch,-0.91,Negative
OMG Aussie UFC star has jaw shattered,GRAPHIC WARNING A gruesome photo has emerged showing just how badly Australias Rob Whittaker was mutilated in his UFC loss,News AU,2024-10-27T07:22:24.924328,omg aussie ufc star jaw shattered . graphic warning gruesome photo emerged showing badly australia rob whittaker mutilated ufc loss,-0.926,Negative
Rankin on track for Webex Players Series triumph,A new grip and putter has helped to turn Brett Rankins career around with the new father on the path for a droughtbreaking victory at the Webex Players Series in South Australia,News AU,2024-10-27T07:22:24.924328,rankin track webex player series triumph . new grip putter helped turn brett rankin career around new father path droughtbreaking victory webex player series south australia,0.4767,Positive
NRL convert in shock Wallabies call,His last game was in an NRL final and now JosephAukuso Suaalii is set to play his next match as a Wallaby in the UK after a rapid elevation and confirmation hes not going to England just for a ride,News AU,2024-10-27T07:22:24.924328,nrl convert shock wallaby call . last game nrl final josephaukuso suaalii set play next match wallaby uk rapid elevation confirmation he going england ride,-0.0516,Neutral
Im ready Sad sight for NRL lovers,Less than a month after playing in an NRL preliminary final the newest multimilliondollar signing for Australian rugby declared himself ready to wear Wallaby gold,News AU,2024-10-27T07:22:24.924328,im ready sad sight nrl lover . less month playing nrl preliminary final newest multimilliondollar signing australian rugby declared ready wear wallaby gold,0.7369,Positive
On The Punt Tips for Monday at Benalla,Herald Sun racing writer Gilbert Gardiners selections for Benalla on Monday,News AU,2024-10-27T07:22:24.924328,punt tip monday benalla . herald sun racing writer gilbert gardiner selection benalla monday,0.0,Neutral
Second tragedy hits Olympian icon after reveal,After dropping heartbreaking news about his terminal diagnosis Sir Chris Hoy has gone public with his familys second secret tragedy,News AU,2024-10-27T07:22:24.924328,second tragedy hit olympian icon reveal . dropping heartbreaking news terminal diagnosis sir chris hoy gone public family second secret tragedy,-0.9153,Negative
