Title,Description,Source,Fetched Date,Combined Text,Score,Sentiment
Liverpool deepen Man City crisis to extend Premier League lead,Liverpool has opened up a ninepoint lead at the top of the Premier League after beating Manchester City 20 while Ange Postecoglous Tottenham have come back to earth EPL WRAP,News AU,2024-12-02T07:27:54.877570,liverpool deepen man city crisis extend premier league lead . liverpool opened ninepoint lead top premier league beating manchester city 20 ange postecoglous tottenham come back earth epl wrap,-0.6808,Negative
Most fixed thing ever Boxing farce stuns,Boxing fans have been left bewildered and horrified after an utter debacle of a fight finished in farcical scenes that many believe was fixed,News AU,2024-12-02T07:27:54.877570,fixed thing ever boxing farce stuns . boxing fan left bewildered horrified utter debacle fight finished farcical scene many believe fixed,-0.7506,Negative
Legend survives scare in big Aus Open win,A day that started with high hopes for a decadelong winning drought coming to an end finished with something completely different,News AU,2024-12-02T07:27:54.877570,legend survives scare big au open win . day started high hope decadelong winning drought coming end finished something completely different,0.7845,Positive
SuperCoach NBL fast trades tips for Round 11,The biggest star in SuperCoach NBL is smashing records and one of the best picks of the year is back on the trade radar Heres how to maximise your score for round 11,News AU,2024-12-02T07:27:54.877570,supercoach nbl fast trade tip round 11. biggest star supercoach nbl smashing record one best pick year back trade radar here maximise score round 11,0.6369,Positive
World stunned by craziest injury ever,A rugby player has suffered a seriously nasty injury after copping a blow in one of the craziest incidents ever seen on a sporting field,News AU,2024-12-02T07:27:54.877570,world stunned craziest injury ever . rugby player suffered seriously nasty injury copping blow one craziest incident ever seen sporting field,-0.9313,Negative
On the verge of tears Stars late heroics,Australias heartbreak at the Olympics feels like a distant memory after they produced some late magic against New Zealand,News AU,2024-12-02T07:27:54.877570,verge tear star late heroic . australia heartbreak olympics feel like distant memory produced late magic new zealand,0.34,Positive
Taree preview Highway prospect has Golden Slipperwinning connections,Trainer Wayne Wilkes is hoping his lightlyraced mare Sheilas Fanta Sea can keep on her upward trajectory when he steps out at Taree on Tuesday,News AU,2024-12-02T07:27:54.877570,taree preview highway prospect golden slipperwinning connection . trainer wayne wilkes hoping lightlyraced mare sheilas fanta sea keep upward trajectory step taree tuesday,0.6124,Positive
Australia bans Olympic medallist for life,Australian cycling has thrown the book at Olympic medallist Matthew Richardson slamming the door shut after his shock defection,News AU,2024-12-02T07:27:54.877570,australia ban olympic medallist life . australian cycling thrown book olympic medallist matthew richardson slamming door shut shock defection,-0.8225,Negative
