Title,Description,Source,Fetched Date,Combined Text,Score,Sentiment
Aussie golf fans could share in a million dollars,The PGA has teamed up with a sports bookmaker for an Australian first offering golf fans a chance to share in a million dollars if a player scores a holeinone,News AU,2024-10-13T07:20:59.383328,aussie golf fan could share million dollar . pga teamed sport bookmaker australian first offering golf fan chance share million dollar player score holeinone,0.8402,Positive
Kings dominate weakened Taipans as Bullets get off the mark,The Sydney Kings didnt miss their star point guard as they cruised to victory over Cairns as the Brisbane Bullets claimed its first win of the NBL season over the only remaining winless team,News AU,2024-10-13T07:20:59.383328,king dominate weakened taipan bullet get mark . sydney king didnt miss star point guard cruised victory cairn brisbane bullet claimed first win nbl season remaining winless team,0.3493,Positive
Arrest warrant out for exWallabies captain,An international arrest warrant has been issued for a Wallabies captain over his conduct during his time in charge of a French club,News AU,2024-10-13T07:20:59.383328,arrest warrant exwallabies captain . international arrest warrant issued wallaby captain conduct time charge french club,-0.5859,Negative
Exposed Axed teams fight for 30m,After being shuttered by Rugby Australia and dumped from Super Rugby the Melbourne Rebels have taken this action,News AU,2024-10-13T07:20:59.383328,exposed axed team fight 30m . shuttered rugby australia dumped super rugby melbourne rebel taken action,-0.5574,Negative
Gollan resists Cox Plate temptation after Toorak demolition,Tony Gollan has labelled Antino the best horse he has ever trained and admits he has never been more nervous on a racetrack than what he was on Saturday as his stable star broke his Group 1 drought in dramatic style,News AU,2024-10-13T07:20:59.383328,gollan resists cox plate temptation toorak demolition . tony gollan labelled antino best horse ever trained admits never nervous racetrack saturday stable star broke group 1 drought dramatic style,0.7659,Positive
Teen cyclist dead after horror incident,The cycling community has been rocked with news of an 18yearold dying following a horror incident at the world championships,News AU,2024-10-13T07:20:59.383328,teen cyclist dead horror incident . cycling community rocked news 18yearold dying following horror incident world championship,-0.8689,Negative
