Title,Description,Source,Fetched Date
China bets on kitchen appliances to boost economy,A list of subsidised household goods has been expanded as Beijing tries to increase domestic spending,BBC Business,2025-01-09T07:24:49.647390
Trump 20 looms large over the global economy,Donald Trumps planned tariffs are expected to greatly impact international trade in 2025,BBC Business,2025-01-09T07:24:49.647390
World of Business,Gain the leading edge with global insights for the boardroom and beyond in your inbox every Wednesday,BBC Business,2025-01-09T07:24:49.647390
People smugglers to have finances targeted with sanctions,The planned measures will target the finances of illegal smuggling networks the Home Office says,BBC Business,2025-01-09T07:24:49.647390
ChatGPT creator denies sisters childhood rape claim,Ann Altman filed a lawsuit alleging her brother sexually abused her between 1997 and 2006,BBC Business,2025-01-09T07:24:49.647390
H1B Visa row under Trump fuels anxiety for Indian dreamers,Visa woes and an immigration row are sparking uncertainty for Indians who want to work in the US,BBC Business,2025-01-09T07:24:49.647390
Pound falls as borrowing costs hit highest since 2008,Economists have warned the rise could mean further tax hikes or spending cuts as Treasury seeks to reassure markets,BBC Business,2025-01-09T07:24:49.647390
Huge problems with axing factcheckers Meta oversight board says,The bodys cochair says moving to community notes could have a big impact on gender rights and minority groups,BBC Business,2025-01-09T07:24:49.647390
Why influencers are facing a pushback,Rejecting the haul culture of excessive shopping and promoting conscious consuming the deinfluencer movement is going mainstream heres why,BBC Business,2025-01-09T07:24:49.647390
Cryptocurrencies and personal AI Tech to watch out for in 2025,Will 2025 be a hinge year for cryptocurrency and will personalised AI appear on your phone,BBC Business,2025-01-09T07:24:49.647390
Meta ending factchecking a political play 8 Jan 2025,Expert says Metas new policy to end third party factchecking on its platforms is a political play,BBC Business,2025-01-09T07:24:49.647390
Good Bad Billionaire,Simon Jack and Zing Tsjeng find out how the worlds billionaires made their money and then judge them Are they good bad or just another billionaire Listen to season two New episodes released on Mondays,BBC Business,2025-01-09T07:24:49.647390
How one product made a multimillion dollar brand,Nell Diamond CEO of Hill House Home shares how her small business skyrocketed to global success with the launch of the Nap Dress in 2019,BBC Business,2025-01-09T07:24:49.647390
RollsRoyce to build bespoke cars for superrich,The luxury carmaker will almost double the size of its factory to build more oneoffs,BBC Business,2025-01-09T07:24:49.647390
Bezosowned Washington Post cuts more jobs,Layoffs come at a time of growing losses and turmoil over editorial decisions at the US newspaper,BBC Business,2025-01-09T07:24:49.647390
Musks disinformation endangering me says UK MP,The tech billionaire and Trump adviser has fiercely criticised the safeguarding minister in recent days,BBC Business,2025-01-09T07:24:49.647390
Music is back as sales in UK hit a 20year high,Albums by Billie Eilish Taylor Swift and Coldplay pushed sales of recorded music to a record 24bn,BBC Business,2025-01-09T07:24:49.647390
Trump ramps up threats to gain control of Greenland and Panama Canal,The presidentelect said he would not rule out the use of military force to seize control of the Panama Canal and Greenland,BBC Business,2025-01-09T07:24:49.647390
US launches probe of Teslas smart summon driverless tech,Safety regulators launched the investigation after reports of crashes involving the feature which allows drivers to summon parked cars,BBC Business,2025-01-09T07:24:49.647390
Playing with FIRE How to quit work and retire in your 30s,A personal finance strategy popular among millennials is helping them to quit their job and retire decades early,BBC Business,2025-01-09T07:24:49.647390
Boomerang CEOs Do they ever succeed,Five years after being ousted from WeWork Adam Neumann wants to rebuy the nowbankrupt business,BBC Business,2025-01-09T07:24:49.647390
How industry leaders transformed their career,The BBCs Katty Kay has spoken to successful changemakers to ask what made them pivot in their career,BBC Business,2025-01-09T07:24:49.647390
Women were the original beer brewers what changed,Today the beer industry is maledominated but it wasnt always so,BBC Business,2025-01-09T07:24:49.647390
How waiting alters our perception of time,Expert advice on how to get through a waiting period,BBC Business,2025-01-09T07:24:49.647390
Do the superrich deserve their wealth,Should there be a cap on billionaires wealth and their inheritances,BBC Business,2025-01-09T07:24:49.647390
Four simple hacks to succeed in every conversation,A career coach a choreographer a chef and a dragon boat captain offer advice on giving critical feedback,BBC Business,2025-01-09T07:24:49.647390
Solo and hybrid work Navigating our future and new normal,Covid19 reshaped the way we live and work We rethink solo working and explore the future of worklife,BBC Business,2025-01-09T07:24:49.647390
Can supersonic flight ever be sustainable,How a new era of quiet net zero supersonic airliners could revolutionise the aviation industry,BBC Business,2025-01-09T07:24:49.647390
Commencement speech The surprising pitfall of your passions,Students are graduating in the US this week The commencement speeches might lead them into questionable choices,BBC Business,2025-01-09T07:24:49.647390
ASMR How whispering took over the internet,We meet the creators behind the current ASMR boom,BBC Business,2025-01-09T07:24:49.647390
A desk full of descriptions for your work colleagues,These are the long lost words youve been waiting for to describe your colleagues,BBC Business,2025-01-09T07:24:49.647390
Veterinarian suicide rates are very high Why,Veterinarian professionals are committing suicide at a higher rate than the general population,BBC Business,2025-01-09T07:24:49.647390
Europe leaders criticise Musk attacks,Although some of Europes leaders have found favour with the billionaire others are worried by his interventions,BBC Business,2025-01-09T07:24:49.647390
Facebook and Instagram get rid of fact checkers,Meta says its platforms will instead rely on community notes from its users an approach pioneered by X,BBC Business,2025-01-09T07:24:49.647390
Andrew reported after false business name claim,Prince Andrew has been accused of using a false name in how a business was registered,BBC Business,2025-01-09T07:24:49.647390
Bangladesh authorities seek Siddiq account details,It comes after the Treasury minister was named in an anticorruption probe in the country,BBC Business,2025-01-09T07:24:49.647390
Shein lawyer refuses to say if it uses Chinese cotton,Yinan Zhu declined to say whether it retailers suppliers used Chinese cotton amid concerns over forced labour,BBC Business,2025-01-09T07:24:49.647390
Apple urged to withdraw out of control AI news alerts,Apple has pledged improvements to its news summarising tool but critics say it is dangerous and needs to be withdrawn,BBC Business,2025-01-09T07:24:49.647390
US designates Tencent a Chinese military company,Chinas embassy in Washington branded the move as an unreasonable suppression of its firms,BBC Business,2025-01-09T07:24:49.647390
Nvidia unveils robot ambitions and powerful new gaming chips,The announcement was part of Mr Huangs address at CES an annual technology show in Las Vegas,BBC Business,2025-01-09T07:24:49.647390
UFC boss to join board of Facebook owner Meta,It comes days after former UK deputy PM Sir Nick Clegg left his top job at the social media giant,BBC Business,2025-01-09T07:24:49.647390
Fire Breaks Out in Hollywood Hills Threatening Hollywood Bowl Walk of Fame,A new blaze lit up near Runyon Canyon which is in the vicinity of iconic Los Angeles locations and tourist destinations,Hollywood Reporter,2025-01-09T07:24:50.121020
OpenAI CEO Sam Altman Accused of Years of Sexual Abuse by Younger Sister,The tech leader and his family denied Ann Altmans accusations in a statement that was posted online just as the lawsuit went public,Hollywood Reporter,2025-01-09T07:24:50.121020
Paris Hilton Is Heartbroken After Losing Malibu Home in Wildfires The Devastation Is Unimaginable,My heart and prayers are going out to every family affected by these fires To all the people who have lost their homes their memories and their beloved pets she wrote in a lengthy social media post,Hollywood Reporter,2025-01-09T07:24:50.121020
Music Publisher Kobalt Appoints Rani Hancock EVP and Head of US Creative,An AR veteran Hancock has previously worked at Columbia Records RCA Records and Arista Records,Hollywood Reporter,2025-01-09T07:24:50.121020
Billy Crystal and Wife Janice Confirm Pacific Palisades Fire Destroyed Home of 46 Years,Words cannot describe the enormity of the devastation we are witnessing and experiencing Billy and Janice Crystal said We ache for our friends and neighbors who have also lost their homes and businesses in this tragedy,Hollywood Reporter,2025-01-09T07:24:50.121020
We Are Absolutely Not Out of Danger Yet 5 People Dead From LA Fires Amid Zero Containment,Officials say the worst has not yet been seen as apocalyptic blazes tear across Los Angeles County sending celebrities and local residents fleeing for their lives,Hollywood Reporter,2025-01-09T07:24:50.121020
Mandy Moore Says LA House Burned Down in Eaton Wildfire Im Absolutely Numb,This is Altadena Leveled My sweet home she wrote on her Instagram Story on Wednesday,Hollywood Reporter,2025-01-09T07:24:50.121020
Hollywood Consumed By Apocalypse Vibes as Wildfires Rage,Apocalyptic angst has swept Hollywood in recent years but those fears became frighteningly real amid the devastating wildfires that have swept across the Southland Is this time different or does it just feel that way,Hollywood Reporter,2025-01-09T07:24:50.121020
Iconic Malibu Eateries Destroyed in LA Wildfires,Malibus Reel Inn Moonshadows and Cholada Thai are among the restaurants that have been destroyed in the Pacific Palisades fire,Hollywood Reporter,2025-01-09T07:24:50.121020
Diane Warren Says the Beach House Shes Had for 30 Years Burned Down in LA Wildfires,The 15time Oscarnominated songwriter also wrote on Instagram that her animals and the rescue ranch are OK tho which is the most important thing,Hollywood Reporter,2025-01-09T07:24:50.121020
LA Wildfires How to Help,Entertainment industry groups including the Screen Actors Guild and the Entertainment Industry Foundation EIF have launched wildfire relief efforts in Southern California geared toward helping first responders and members of the entertainment industry community,Hollywood Reporter,2025-01-09T07:24:50.121020
Critics Choice Awards Postponed Amid Los Angeles Fires,The awards show was set for Sunday in Santa Monica and has been rescheduled for Jan 26,Hollywood Reporter,2025-01-09T07:24:50.121020
Broncos hard man keen for starting spot,Michael Maguire could face a selection headache in round 1 after the man he fought so hard to keep declared he wants to start matches for the Broncos this year,News AU,2025-01-09T07:24:52.277331
Cummins injury reveal as stars return locked in,As the future of one Australian allrounder hangs in the balance another looks set to return just in time for the World Test Championship,News AU,2025-01-09T07:24:52.277331
Healy fires early Ashes warning shot,Not even Sydneys wet weather could stop Alyssa Healy from firing a warning shot to England on the eve of the Ashes before rain stopped her from a return to a familiar role,News AU,2025-01-09T07:24:52.277331
Kyrgios Demons Aus Open paths revealed amid champs nightmare,The Australian Open draw landed some telling blows including on the defending champions and an alltime great See how it treated Australian stars Alex de Minaur and Nick Kyrgios,News AU,2025-01-09T07:24:52.277331
Aussie seals emotional Open comeback,An Australian qualifier has overcome bodyshaming online trolls and a gruelling schedule to seal a main draw berth at Melbourne Park,News AU,2025-01-09T07:24:52.277331
Tigers hand down huge ban to wayward star,The Richmond gun who signed a massive contract last season will miss the beginning of 2025 as he awaits a court date in NSW,News AU,2025-01-09T07:24:52.277331
Lewd photo sext scandal rocks AFL,The boss of one of the biggest football clubs in Australia says he was the victim of a hacking attack as a lewd photo spreads across cyberspace,News AU,2025-01-09T07:24:52.277331
Fitness freak smashes club record,Their fitness standards were in the headlines for all the wrong reasons last year but a young gun is helping the Wests Tigers make a splash in 2025,News AU,2025-01-09T07:24:52.277331
Reporter comes clean on Messi affair rumour,A sports presenter has broken her silence on Lionel Messi and affair rumours after a flirty look between the pair went viral,News AU,2025-01-09T07:24:52.277331
Elon Musk torn to shreds by F1 great,F1 great Martin Brundle has teed off on X owner Elon Musk using a threeword insult to slap down the billionaire,News AU,2025-01-09T07:24:52.277331
Aussie legends stunning NBA milestone,An Australian Olympic hero has just reached a jawdropping milestone in the NBA,News AU,2025-01-09T07:24:52.277331
NBA star banned by own team in ugly saga,An NBA trade saga has taken an ugly turn with the Miami Heat confirming it was suspending its own star player after he spoke out,News AU,2025-01-09T07:24:52.277331
Futsal National Championships Hub How to watch live stream schedule,The National Futsal Championships continue on Thursday with a huge day of action ahead Watch seven pitches LIVE See the full schedule,News AU,2025-01-09T07:24:52.277331
Liverpool enraged as Ange takes title step,Ange Postecoglou has taken down a Premier League giant to take a step towards another title but the win was overshadowed by a scary moment,News AU,2025-01-09T07:24:52.277331
Huge brawl breaks out at Aussie fight night,Ugly footage shows punches being thrown as a brawl erupted in the grandstand during Jai Opetaias fight on the Gold Coast,News AU,2025-01-09T07:24:52.277331
Ricciardos harshest F1 critic proven right,The fortunes of Daniel Ricciardo have mirrored Australias battle with a nation that thoroughly outclassed Australia in sport in 2024,News AU,2025-01-09T07:24:52.277331
SuperCoach NBL fast trades tips for Round 16,Round 16 of SuperCoach NBL starts Thursday night and every team plays twice Here are the top trades and everything you need to know,News AU,2025-01-09T07:24:52.277331
Smiths nextlevel Australian Open spray,Cam Smith has gone on the attack over the Australian Open format saying exactly what he thinks about the dualgender event,News AU,2025-01-09T07:24:52.277331
Newcastle Orange previews Minervini filly looks the real deal,Trainer Mark Minervini could have a genuine 2025 Queensland Oaks contender in his barn in the shape of Alideel who steps out at her home track of Newcastle,News AU,2025-01-09T07:24:52.277331
Sales pitch begins to keep Wallabies coach,Public lauding of Wallabies coach Joe Schmidt will be the players way of convincing him to stay rather than private urgings that could put unwanted pressure on him,News AU,2025-01-09T07:24:52.277331
Reds star aiming for stellar Super season,Queensland Reds star Tom Lynagh knows his best chance of regaining a Wallabies jersey is to shine for the Queensland Reds this year,News AU,2025-01-09T07:24:52.277331
Olympians tragic final moments emerge,Distressing CCTV footage reportedly shows the tragic final moments before Aussie world champ Melissa Hoskins was fatally struck,News AU,2025-01-09T07:24:52.277331
