Title,Description,Source,Fetched Date,Combined Text,Score,Sentiment
Easier than having a mate Why Doulls partner was perfect caddy,Jordan Doulls girlfriend Kathryn Norris put her own on course disappointment behind her to play an instrumental role in his remarkable win at the Webex Players Series Heres how it played out in WA,News AU,2025-01-13T07:24:19.001481,easier mate doulls partner perfect caddy . jordan doulls girlfriend kathryn norris put course disappointment behind play instrumental role remarkable win webex player series here played wa,0.9371,Positive
Son of Testa Rossas jockey driving for Olympic gold,Eddie Cassar hit great heights in the saddle aboard the super galloper Testa Rossa in 1999 but gets a much bigger thrill watching his son on the trail of Commonwealth Games and Olympic gold in the boxing ring,News AU,2025-01-13T07:24:19.001481,son testa rossas jockey driving olympic gold . eddie cassar hit great height saddle aboard super galloper testa rossa 1999 get much bigger thrill watching son trail commonwealth game olympic gold boxing ring,0.891,Positive
Sales pitch begins to keep Wallabies coach,Public lauding of Wallabies coach Joe Schmidt will be the players way of convincing him to stay rather than private urgings that could put unwanted pressure on him,News AU,2025-01-13T07:24:19.001481,sale pitch begin keep wallaby coach . public lauding wallaby coach joe schmidt player way convincing stay rather private urging could put unwanted pressure,-0.1027,Neutral
Reds star aiming for stellar Super season,Queensland Reds star Tom Lynagh knows his best chance of regaining a Wallabies jersey is to shine for the Queensland Reds this year,News AU,2025-01-13T07:24:19.001481,red star aiming stellar super season . queensland red star tom lynagh know best chance regaining wallaby jersey shine queensland red year,0.8779,Positive
Olympians tragic final moments emerge,Distressing CCTV footage reportedly shows the tragic final moments before Aussie world champ Melissa Hoskins was fatally struck,News AU,2025-01-13T07:24:19.001481,olympian tragic final moment emerge . distressing cctv footage reportedly show tragic final moment aussie world champ melissa hoskins fatally struck,-0.8957,Negative
