Title,Description,Source,Fetched Date,Combined Text,Score,Sentiment
The truth behind your 10 dress Inside the Chinese factories fuelling Sheins success,Workers making clothes for the fast fashion giant tell the BBC they labour for up to 75 hours a week,BBC Business,2025-01-13T07:24:16.437569,truth behind 10 dress inside chinese factory fuelling sheins success . worker making clothes fast fashion giant tell bbc labour 75 hour week,0.7184,Positive
Apple board pushes against diversity rollback call,The tech giant has asked investors to reject a proposal from a conservative group to end its DEI policies,BBC Business,2025-01-13T07:24:16.437569,apple board push diversity rollback call . tech giant asked investor reject proposal conservative group end dei policy,-0.4019,Negative
World of Business,Gain the leading edge with global insights for the boardroom and beyond in your inbox every Wednesday,BBC Business,2025-01-13T07:24:16.437569,world business . gain leading edge global insight boardroom beyond inbox every wednesday,0.5267,Positive
More people in late 20s still living with parents,The rising cost of buying or renting home in the UK has led more to remain in the family home a thinktank says,BBC Business,2025-01-13T07:24:16.437569,people late 20 still living parent . rising cost buying renting home uk led remain family home thinktank say,0.0,Neutral
Meta and Amazon axe diversity initiatives joining US corporate rollback,The companies are among the latest major corporations to alter their diversity programmes since Trumps reelection,BBC Business,2025-01-13T07:24:16.437569,meta amazon axe diversity initiative joining u corporate rollback . company among latest major corporation alter diversity programme since trump reelection,0.0772,Neutral
Online safety laws unsatisfactory minister says,Peter Kyle responds as internet safety campaigner Ian Russell says laws to protect children need fixing,BBC Business,2025-01-13T07:24:16.437569,online safety law unsatisfactory minister say . peter kyle responds internet safety campaigner ian russell say law protect child need fixing,0.802,Positive
Watch I will work with Trump for low whisky tarriffs Swinney,John Swinney says he will capitalise on Donald Trumps Scottish connection in an attempt to avoid tariffs being applied on imports to the US,BBC Business,2025-01-13T07:24:16.437569,watch work trump low whisky tarriffs swinney . john swinney say capitalise donald trump scottish connection attempt avoid tariff applied import u,-0.5106,Negative
Reeves defends China visit and hails 600m boost to UK,The chancellor has been criticised for making the trip while the UK government is under pressure from rising borrowing costs,BBC Business,2025-01-13T07:24:16.437569,reef defends china visit hail 600m boost uk . chancellor criticised making trip uk government pressure rising borrowing cost,-0.25,Negative
How a viral post saved a Chinese actor from Myanmars scam centres,Many Chinese are now asking what about their loved ones still trapped in scam centres,BBC Business,2025-01-13T07:24:16.437569,viral post saved chinese actor myanmar scam centre . many chinese asking loved one still trapped scam centre,-0.6249,Negative
Trump 20 looms large over the global economy,Donald Trumps planned tariffs are expected to greatly impact international trade in 2025,BBC Business,2025-01-13T07:24:16.437569,trump 20 loom large global economy . donald trump planned tariff expected greatly impact international trade 2025,-0.2263,Neutral
US stocks under pressure after jobs report 10 Jan 2025,The latest healthy US jobs report adds more uncertainty about whether the Fed will cut its key interest rate,BBC Business,2025-01-13T07:24:16.437569,u stock pressure job report 10 jan 2025. latest healthy u job report add uncertainty whether fed cut key interest rate,0.0,Neutral
Good Bad Billionaire,Simon Jack and Zing Tsjeng find out how the worlds billionaires made their money and then judge them Are they good bad or just another billionaire Listen to season two New episodes released on Mondays,BBC Business,2025-01-13T07:24:16.437569,good bad billionaire . simon jack zing tsjeng find world billionaire made money judge good bad another billionaire listen season two new episode released monday,-0.296,Negative
How one product made a multimillion dollar brand,Nell Diamond CEO of Hill House Home shares how her small business skyrocketed to global success with the launch of the Nap Dress in 2019,BBC Business,2025-01-13T07:24:16.437569,one product made multimillion dollar brand . nell diamond ceo hill house home share small business skyrocketed global success launch nap dress 2019,0.8074,Positive
US and UK toughen sanctions on Russian oil industry,The actions are aimed at cutting off revenue Moscow is using to fund its war in Ukraine,BBC Business,2025-01-13T07:24:16.437569,u uk toughen sanction russian oil industry . action aimed cutting revenue moscow using fund war ukraine,-0.6486,Negative
Fewer rate cuts and higher loan costs how US jobs surprise affects you,Jobs growth in the US surged unexpected last month Thats good news for the worlds largest economy but could be punishing for the UK,BBC Business,2025-01-13T07:24:16.437569,fewer rate cut higher loan cost u job surprise affect . job growth u surged unexpected last month thats good news world largest economy could punishing uk,0.2263,Neutral
I dont like this Musk chap Reform members say theyre unbothered by spat,Activists gathering at a regional conference assess whether the US billionaire could help or hinder the party,BBC Business,2025-01-13T07:24:16.437569,dont like musk chap reform member say theyre unbothered spat . activist gathering regional conference assess whether u billionaire could help hinder party,0.509,Positive
US top court leans towards TikTok ban over security concerns,The platform with nearly 170 million American users is challenging a law that would see it banned in the US in a matter of days,BBC Business,2025-01-13T07:24:16.437569,u top court lean towards tiktok ban security concern . platform nearly 170 million american user challenging law would see banned u matter day,-0.4019,Negative
UK MPs urge checks as Shein refuses to answer questions,The chair of a committee of MPs has written to the London Stock Exchange with concerns over the fashion retailer,BBC Business,2025-01-13T07:24:16.437569,uk mp urge check shein refuse answer question . chair committee mp written london stock exchange concern fashion retailer,-0.296,Negative
Can young Americans live without TikTok,The BBC spoke to young people as the Supreme Court discusses a potential ban on the social media platform,BBC Business,2025-01-13T07:24:16.437569,young american live without tiktok . bbc spoke young people supreme court discusses potential ban social medium platform,0.0,Neutral
Playing with FIRE How to quit work and retire in your 30s,A personal finance strategy popular among millennials is helping them to quit their job and retire decades early,BBC Business,2025-01-13T07:24:16.437569,playing fire quit work retire 30 . personal finance strategy popular among millennials helping quit job retire decade early,0.5267,Positive
Boomerang CEOs Do they ever succeed,Five years after being ousted from WeWork Adam Neumann wants to rebuy the nowbankrupt business,BBC Business,2025-01-13T07:24:16.437569,boomerang ceo ever succeed . five year ousted wework adam neumann want rebuy nowbankrupt business,0.5423,Positive
How industry leaders transformed their career,The BBCs Katty Kay has spoken to successful changemakers to ask what made them pivot in their career,BBC Business,2025-01-13T07:24:16.437569,industry leader transformed career . bbcs katty kay spoken successful changemakers ask made pivot career,0.5859,Positive
Women were the original beer brewers what changed,Today the beer industry is maledominated but it wasnt always so,BBC Business,2025-01-13T07:24:16.437569,woman original beer brewer changed . today beer industry maledominated wasnt always,0.3182,Positive
How waiting alters our perception of time,Expert advice on how to get through a waiting period,BBC Business,2025-01-13T07:24:16.437569,waiting alters perception time . expert advice get waiting period,0.0,Neutral
Do the superrich deserve their wealth,Should there be a cap on billionaires wealth and their inheritances,BBC Business,2025-01-13T07:24:16.437569,superrich deserve wealth . cap billionaire wealth inheritance,0.7506,Positive
Four simple hacks to succeed in every conversation,A career coach a choreographer a chef and a dragon boat captain offer advice on giving critical feedback,BBC Business,2025-01-13T07:24:16.437569,four simple hack succeed every conversation . career coach choreographer chef dragon boat captain offer advice giving critical feedback,0.5106,Positive
Solo and hybrid work Navigating our future and new normal,Covid19 reshaped the way we live and work We rethink solo working and explore the future of worklife,BBC Business,2025-01-13T07:24:16.437569,solo hybrid work navigating future new normal . covid19 reshaped way live work rethink solo working explore future worklife,0.0,Neutral
Can supersonic flight ever be sustainable,How a new era of quiet net zero supersonic airliners could revolutionise the aviation industry,BBC Business,2025-01-13T07:24:16.437569,supersonic flight ever sustainable . new era quiet net zero supersonic airliner could revolutionise aviation industry,0.0,Neutral
Commencement speech The surprising pitfall of your passions,Students are graduating in the US this week The commencement speeches might lead them into questionable choices,BBC Business,2025-01-13T07:24:16.437569,commencement speech surprising pitfall passion . student graduating u week commencement speech might lead questionable choice,0.4404,Positive
ASMR How whispering took over the internet,We meet the creators behind the current ASMR boom,BBC Business,2025-01-13T07:24:16.437569,asmr whispering took internet . meet creator behind current asmr boom,0.0,Neutral
A desk full of descriptions for your work colleagues,These are the long lost words youve been waiting for to describe your colleagues,BBC Business,2025-01-13T07:24:16.437569,desk full description work colleague . long lost word youve waiting describe colleague,-0.3182,Negative
Veterinarian suicide rates are very high Why,Veterinarian professionals are committing suicide at a higher rate than the general population,BBC Business,2025-01-13T07:24:16.437569,veterinarian suicide rate high . veterinarian professional committing suicide higher rate general population,-0.8658,Negative
Boeing and Google each give 1m for Trump inauguration,The US companies join other major firms donating funds for the ceremony on 20 January,BBC Business,2025-01-13T07:24:16.437569,boeing google give 1m trump inauguration . u company join major firm donating fund ceremony 20 january,0.296,Positive
LA wildfire damages set to cost record 135bn,Some of the most expensive properties in the US have been wiped out by the fires,BBC Business,2025-01-13T07:24:16.437569,la wildfire damage set cost record 135bn . expensive property u wiped fire,-0.6808,Negative
Man told he cant recover 598m of Bitcoin from tip,James Howells tried to sue a council for access to the site or get 495m in compensation,BBC Business,2025-01-13T07:24:16.437569,man told cant recover 598m bitcoin tip . james howells tried sue council access site get 495m compensation,0.0,Neutral
UK Chancellor heads to China amid market trouble at home,The warning from a former Bank of England official comes in the wake of rising UK borrowing costs,BBC Business,2025-01-13T07:24:16.437569,uk chancellor head china amid market trouble home . warning former bank england official come wake rising uk borrowing cost,-0.6249,Negative
Price of resale tickets to be capped under UK plans to tackle touts,The UK government is suggesting a cap on the cost of resold tickets potentially up to 30 on top of the original price,BBC Business,2025-01-13T07:24:16.437569,price resale ticket capped uk plan tackle tout . uk government suggesting cap cost resold ticket potentially 30 top original price,0.3818,Positive
ExUK PM Truss sends legal threat to Starmer over claim she crashed economy,No 10 insists millions of people share Sir Keirs view of the Truss governments economic record,BBC Business,2025-01-13T07:24:16.437569,exuk pm truss sends legal threat starmer claim crashed economy . 10 insists million people share sir keirs view truss government economic record,-0.1779,Neutral
Pound falls to lowest in over a year as UK borrowing costs soar,Economists have warned the rise could mean further tax hikes or spending cuts by the UK government,BBC Business,2025-01-13T07:24:16.437569,pound fall lowest year uk borrowing cost soar . economist warned rise could mean tax hike spending cut uk government,-0.7003,Negative
China bets on kitchen appliances to boost economy,A list of subsidised household goods has been expanded as Beijing tries to increase domestic spending,BBC Business,2025-01-13T07:24:16.437569,china bet kitchen appliance boost economy . list subsidised household good expanded beijing try increase domestic spending,0.7845,Positive
Lloyds Halifax and Bank of Scotland to share branches,The move is intended to make it easier for people to access banking services but some warn it will lead to more branch closures,BBC Business,2025-01-13T07:24:16.437569,lloyd halifax bank scotland share branch . move intended make easier people access banking service warn lead branch closure,0.5574,Positive
Death Toll Rises in Los Angeles as Firefighters Brace For Return of Inferno Brought by Strong Winds,Reports of missing people are rising across the city hour by hour according to the county sheriff,Hollywood Reporter,2025-01-13T07:24:17.338548,death toll rise los angeles firefighter brace return inferno brought strong wind . report missing people rising across city hour hour according county sheriff,-0.4215,Negative
Kim Kardashian Advocates for Incarcerated Firefighters Pay Raise as Fires Devastate LA,The 44yearold reality TV superstar and business mogul has been dipping into prison law reform since 2018,Hollywood Reporter,2025-01-13T07:24:17.338548,kim kardashian advocate incarcerated firefighter pay raise fire devastate la . 44yearold reality tv superstar business mogul dipping prison law reform since 2018,-0.8807,Negative
Jackie Farry 90s Music Figure and Francis Bean Cobains First Nanny Dies at 58,Raised in the controversial Synanon community she also served as tour manager for Elliott Smith the Lemonheads and other indie rock acts,Hollywood Reporter,2025-01-13T07:24:17.338548,jackie farry 90 music figure francis bean cobains first nanny dy 58. raised controversial synanon community also served tour manager elliott smith lemonheads indie rock act,-0.2023,Neutral
LA Private Firefighters Are a Class War Flashpoint But the Reality Is More Complicated,While social media amplifies and attacks wealthy homeowners offering to pay any amount for mitigation and such outfits do certainly exist most private firefighters work for utilities insurers or independent jurisdictions,Hollywood Reporter,2025-01-13T07:24:17.338548,la private firefighter class war flashpoint reality complicated . social medium amplifies attack wealthy homeowner offering pay amount mitigation outfit certainly exist private firefighter work utility insurer independent jurisdiction,-0.5423,Negative
Jamie Chung and Bryan Greenbergs House Destroyed in LA Fires Was Supposed to Be Our Forever Home,The couple who share two twin boys said their family was safe,Hollywood Reporter,2025-01-13T07:24:17.338548,jamie chung bryan greenberg house destroyed la fire supposed forever home . couple share two twin boy said family safe,-0.128,Neutral
Los Angeles Wildfire Death Toll Rises to 16 as More Threats Loom,Five of the deaths were attributed to the Palisades Fire and 11 resulted from the Eaton Fire the coroners office said,Hollywood Reporter,2025-01-13T07:24:17.338548,los angeles wildfire death toll rise 16 threat loom . five death attributed palisade fire 11 resulted eaton fire coroner office said,-0.9509,Negative
Dennis Quaid Says So Many Friends Lost Homes in Devastating LA Wildfires,Were fighting as hard as we can to save our city Gosh I never thought Id say that But thats whats going on the actor said,Hollywood Reporter,2025-01-13T07:24:17.338548,dennis quaid say many friend lost home devastating la wildfire . fighting hard save city gosh never thought id say thats whats going actor said,-0.4767,Negative
Former Child Star and Motivational Speaker Rory Sykes Dies in LA Fires Mother Says,Sykes who was born blind and living with cerebral palsy reportedly died at his family home in Malibu,Hollywood Reporter,2025-01-13T07:24:17.338548,former child star motivational speaker rory sykes dy la fire mother say . sykes born blind living cerebral palsy reportedly died family home malibu,-0.8271,Negative
Will Grammy Awards Be Postponed Due to LA Wildfires Discussions Are Underway,As devastation continues to move through Los Angeles the broadcast may pivot to a fundraiser sources reveal,Hollywood Reporter,2025-01-13T07:24:17.338548,grammy award postponed due la wildfire discussion underway . devastation continues move los angeles broadcast may pivot fundraiser source reveal,-0.0258,Neutral
SAGAFTRA Donates 1 Million for LA Fires Relief,The performers union earmarked the funds for the SAGAFTRA Foundation a nonprofit that offers emergency financial aid and education to members,Hollywood Reporter,2025-01-13T07:24:17.338548,sagaftra donates 1 million la fire relief . performer union earmarked fund sagaftra foundation nonprofit offer emergency financial aid education member,-0.2263,Neutral
Chateau Marmont Sunset Tower Offer Refuge to Firefighters and Angelenos Amid LA Fires,The historic Hollywood hangouts are opening their doors to first responders and evacuees during the wildfires that have killed at least 11 people and destroyed more than 12000 structures,Hollywood Reporter,2025-01-13T07:24:17.338548,chateau marmont sunset tower offer refuge firefighter angelenos amid la fire . historic hollywood hangout opening door first responder evacuee wildfire killed least 11 people destroyed 12000 structure,-0.8779,Negative
Lesli Linka Glatter Loses Home in LA Fires,The DGA president and top TV directorproducer is just the latest highprofile figure to see her house destroyed by the wildfires across southern California,Hollywood Reporter,2025-01-13T07:24:17.338548,lesli linka glatter loses home la fire . dga president top tv directorproducer latest highprofile figure see house destroyed wildfire across southern california,-0.7269,Negative
Kokkinakis in nightmare Aus Open scenes,Thanasi Kokkinakis is fighting to stay alive at the Australian Open as a tennis legends call about the fan favourite eerily came true,News AU,2025-01-13T07:24:19.001481,kokkinakis nightmare au open scene . thanasi kokkinakis fighting stay alive australian open tennis legend call fan favourite eerily came true,0.6369,Positive
James Hird splits from wife after 27 years,AFL legend James Hird and wife Tania have reportedly separated after keeping a secret for more than a year,News AU,2025-01-13T07:24:19.001481,james hird split wife 27 year . afl legend james hird wife tania reportedly separated keeping secret year,0.0,Neutral
Not qualified LA Olympics now impossible,As wildfires continue to wreak havoc and cause devastation across Los Angeles experts have questioned whether the events future will go up in smoke,News AU,2025-01-13T07:24:19.001481,qualified la olympics impossible . wildfire continue wreak havoc cause devastation across los angeles expert questioned whether event future go smoke,-0.7964,Negative
No idea Cummins questions as dynamo axed,Pat Cummins ankle injury remains a mystery but what is less certain is the fate of the young gun trumpeted as the future and the next Glenn Maxwell,News AU,2025-01-13T07:24:19.001481,idea cummins question dynamo axed . pat cummins ankle injury remains mystery less certain fate young gun trumpeted future next glenn maxwell,-0.6901,Negative
Test cult hero discard on standby for shock Champs Trophy callups,Sydney redball sensation Beau Webster and the man he replaced for the fifth India Test are in the frame for a oneday callup if Australia makes a late change to its Champions Trophy squad SEE THE 15MAN SQUAD,News AU,2025-01-13T07:24:19.001481,test cult hero discard standby shock champ trophy callups . sydney redball sensation beau webster man replaced fifth india test frame oneday callup australia make late change champion trophy squad see 15man squad,0.7906,Positive
Proud of my guy Aussies shock hype man,Fans on a small outside court were shocked to see a global sports star in an Aussie wildcards box as he claimed a milestone win,News AU,2025-01-13T07:24:19.001481,proud guy aussie shock hype man . fan small outside court shocked see global sport star aussie wildcards box claimed milestone win,0.6486,Positive
Absolutely rocking Eddies son in title game,The sons of wellknown AFL figures Eddie McGuire and Matt Rendell are going to face off in the national championship decider,News AU,2025-01-13T07:24:19.001481,absolutely rocking eddy son title game . son wellknown afl figure eddie mcguire matt rendell going face national championship decider,0.4404,Positive
Dragons make shock captaincy call,Two players who joined St George Illawarra from other clubs after the 2024 season have been named as cocaptains in their first season for the Dragons,News AU,2025-01-13T07:24:19.001481,dragon make shock captaincy call . two player joined st george illawarra club 2024 season named cocaptains first season dragon,-0.3818,Negative
NRL trials Firstlook at new signings and positional puzzles,The countdown is on for NRL action with trials less than a month away Find out when and where your team is playing and read every clubs indepth season preview inside,News AU,2025-01-13T07:24:19.001481,nrl trial firstlook new signing positional puzzle . countdown nrl action trial less month away find team playing read every club indepth season preview inside,0.2023,Neutral
Steph Rice shocks fans with second wedding,Stephanie Rices friends were all saying the same thing when the swimming champ and her new husband did it all again,News AU,2025-01-13T07:24:19.001481,steph rice shock fan second wedding . stephanie rice friend saying thing swimming champ new husband,0.7184,Positive
Strongman suffers horrific training injury,WATCH Englands Strongest Man faces a long road to recovery after sustaining a horrendous injury lifting 172kg in training,News AU,2025-01-13T07:24:19.001481,strongman suffers horrific training injury . watch england strongest man face long road recovery sustaining horrendous injury lifting 172kg training,-0.9231,Negative
World losing its mind over Shaq footage,Video of NBA legend Shaquille ONeal left looking tiny next to a recordbreaking teenager is racing across the internet,News AU,2025-01-13T07:24:19.001481,world losing mind shaq footage . video nba legend shaquille oneal left looking tiny next recordbreaking teenager racing across internet,-0.3818,Negative
Ange cracks over historic embarrassment,A brutal viral fan video said it all as Ange Postecoglous team blundered its way to something only seen four times in history,News AU,2025-01-13T07:24:19.001481,ange crack historic embarrassment . brutal viral fan video said ange postecoglous team blundered way something seen four time history,-0.6908,Negative
Liverpool stars unbelievable goal PL side stunned FA Cup Wrap,Manchester City dashed the dreams of Salfords former Manchester United star owners with an 80 FA Cup rout while Liverpool also cruised into the fourth round with a 40 victory over Accrington Stanley,News AU,2025-01-13T07:24:19.001481,liverpool star unbelievable goal pl side stunned fa cup wrap . manchester city dashed dream salfords former manchester united star owner 80 fa cup rout liverpool also cruised fourth round 40 victory accrington stanley,0.6369,Positive
Racism drama as UFC icon kicked off flight,Former UFC champion Khabib Nurmagomedov has questioned whether the airline saga was driven by racial or national bias,News AU,2025-01-13T07:24:19.001481,racism drama ufc icon kicked flight . former ufc champion khabib nurmagomedov questioned whether airline saga driven racial national bias,-0.25,Negative
Sour taste Aussie F1 gun in huge trouble,A rare thinlyveiled driver move could spell trouble for Australias newest F1 driver Jack Doohan with eyebrows raised,News AU,2025-01-13T07:24:19.001481,sour taste aussie f1 gun huge trouble . rare thinlyveiled driver move could spell trouble australia newest f1 driver jack doohan eyebrow raised,-0.6705,Negative
Elon Musk torn to shreds by F1 great,F1 great Martin Brundle has teed off on X owner Elon Musk using a threeword insult to slap down the billionaire,News AU,2025-01-13T07:24:19.001481,elon musk torn shred f1 great . f1 great martin brundle teed x owner elon musk using threeword insult slap billionaire,0.6705,Positive
NBL star stood down following assault charges,Cairns Taipans guard Jackson Makoi has been stood down after being arrested and charged by NSW Police over an alleged domestic incident in 2023 CONTENT WARNING,News AU,2025-01-13T07:24:19.001481,nbl star stood following assault charge . cairn taipan guard jackson makoi stood arrested charged nsw police alleged domestic incident 2023 content warning,-0.8779,Negative
