Title,Description,Source,Fetched Date
20k spent to fly didgeridoo player to India,Australian diplomats spent nearly 20000 of taxpayer money to fly a didgeridoo performer to India for a brief performance earlier this year,News AU,2024-09-01T07:20:15.377221
Aussie oneTest prodigy forced to retire at 26,Luckless oneTest Australian cricketer Will Pucovski will forever be one of the sports biggest what ifs after a heartbreaking decision,News AU,2024-09-01T07:20:15.377221
World says the same thing as Novak stunned,Aussie Alexei Popyrins wild victory over Novak Djokovic has triggered a moment the tennis world has been waiting for for over two decades,News AU,2024-09-01T07:20:15.377221
Darts prodigy is here to win in Australia,Luke Littler has taken the darts world by storm this year and the teenager is in Australia this week determined to continue his red hot form,News AU,2024-09-01T07:20:15.377221
Absolutely hate it Aussies in Paris drama,A new rule at the Olympics athletics events is sure to divide athletes and fans and produce high drama in Paris writes Sally Pearson,News AU,2024-09-01T07:20:15.377221
Astonishing rise set to flip F1 in 215m race,Daniel Ricciardo has been given a reality check as the urgency mounts at Red Bull amid a threehorse race to replace a struggling driver,News AU,2024-09-01T07:20:15.377221
Lewis Hamiltons F1 replacement revealed,Mercedes have locked in their driver line up for the 2025 F1 season with Lewis Hamiltons replacement finally revealed,News AU,2024-09-01T07:20:15.377221
Stars message pours fuel all over F1 feud,A Formula 1 star has poured fuel all over his ongoing feud with a rival as their championship battle looks set to go down to the wire,News AU,2024-09-01T07:20:15.377221
Teen dies in her sleep aged 19 So sad,A promising law student and football player died suddenly last month leaving her community reeling in shock,News AU,2024-09-01T07:20:15.377221
Former AFL rookie wins NFL spot,There was a guarantee an Australian would be punting for the New Orleans Saints this NFL season and it was a former AFL draftee who took the spot,News AU,2024-09-01T07:20:15.377221
Worst red card ever Piers Morgan erupts,Veteran broadcaster Piers Morgan led a chorus of backlash after an Arsenal star was sent off following an innocuous act on Sunday,News AU,2024-09-01T07:20:15.377221
Life ban Huge twist in ugly Zerafa drama,The brother of Michael Zerafa has been banned for life after the ugly scenes on Wednesday night but Team Zerafa has hit back,News AU,2024-09-01T07:20:15.377221
Where Aussie fans can see Cameron Smith play,Australian golf fans are set to have more chances to see Cam Smith in action this summer,News AU,2024-09-01T07:20:15.377221
Stepbystep guide to picking a gun SuperCoach NBL team,Playing SuperCoach NBL for the first time or need a quick refresher Youve come to the right place See where to start and the players you need to piece together a winning side,News AU,2024-09-01T07:20:15.377221
Another new captain 15th debutant for Wallabies,After two thrashings by South Africa Wallabies coach Joe Schmidt has made another five changes as his team seeks redemption in Argentina,News AU,2024-09-01T07:20:15.377221
Hurting us Wallabies narrow focus,The Wallabies are still adjusting to the style of rugby coach Joe Schmidt wants them to play,News AU,2024-09-01T07:20:15.377221
Sure Thing Captain storms into Eureka with Racenet Discovery romp,The final piece of the TAB Eureka puzzle has been solved with Sure Thing Captain booking a place in the worlds richest harness racing with victory in the Racenet Discovery at Menangle on Saturday night,News AU,2024-09-01T07:20:15.377221
ExAussie comes clean on shock defection,Threetime Olympic medallist Matthew Richardson has spoken out after he turned his back on Australia weeks after the Olympics finished,News AU,2024-09-01T07:20:15.377221
