Title,Description,Source,Fetched Date,Combined Text,Score,Sentiment
Team first still mantra for retiring Matilda,Clare Polkinghornes decorated Matildas career will come to an end in her hometown of Brisbane on Thursday night,News AU,2024-11-27T07:26:36.700298,team first still mantra retiring matilda . clare polkinghornes decorated matildas career come end hometown brisbane thursday night,0.0,Neutral
Boxings civil war is over Fenech reunites with rising star,18 months after a messy falling out Jeff Fenech is set to reunite with one of Australian boxings young guns for a huge No Limit Boxing fight night,News AU,2024-11-27T07:26:36.700298,boxing civil war fenech reunites rising star . 18 month messy falling jeff fenech set reunite one australian boxing young gun huge limit boxing fight night,-0.8658,Negative
LIfe ban for NBL fan after ugly scenes,The NBL has sent a clear message to courtside fans after one spectator received a lifetime ban for an ugly altercation involving 36ers star Montrezl Harrell,News AU,2024-11-27T07:26:36.700298,life ban nbl fan ugly scene . nbl sent clear message courtside fan one spectator received lifetime ban ugly altercation involving 36ers star montrezl harrell,-0.8225,Negative
Coach wont let Wallabies off the hook,The Wallabies want to finish their spring tour on the high of a win over Ireland following a disappointing loss to Scotland,News AU,2024-11-27T07:26:36.700298,coach wont let wallaby hook . wallaby want finish spring tour high win ireland following disappointing loss scotland,-0.1027,Neutral
Huge news drops after Suaalii injury,After sending a massive scare through the Wallabies camp their 5 million crosscode star has received positive injury news,News AU,2024-11-27T07:26:36.700298,huge news drop suaalii injury . sending massive scare wallaby camp 5 million crosscode star received positive injury news,-0.6124,Negative
Cup winner Dolan produces ace ride at Doomben,It was nowhere near as big as the Melbourne Cup but Robbie Dolan produced his latest fabulous ride to win the Recognition Stakes at Doomben on Wednesday,News AU,2024-11-27T07:26:36.700298,cup winner dolan produce ace ride doomben . nowhere near big melbourne cup robbie dolan produced latest fabulous ride win recognition stake doomben wednesday,0.9001,Positive
Defectors blunt response to lifetime ban,A former Australian Olympian who defected to Great Britain has delivered a blunt response to being handed a lifetime punishment,News AU,2024-11-27T07:26:36.700298,defector blunt response lifetime ban . former australian olympian defected great britain delivered blunt response handed lifetime punishment,-0.8074,Negative
