Title,Description,Source,Fetched Date,Combined Text,Score,Sentiment
Noone will win Canada Mexico and China respond to Trump tariff threats,Mexico said it would slap titfortat tariffs on the US while China said Trumps fingerpointing runs completely counter to facts,BBC Business,2024-11-27T07:26:33.404147,noone win canada mexico china respond trump tariff threat . mexico said would slap titfortat tariff u china said trump fingerpointing run completely counter fact,0.25,Positive
Aston Martin issues second profit warning in two months,The iconic firm blames minor delay in deliveries of its ultraexclusive Valiant cars for the shortfall,BBC Business,2024-11-27T07:26:33.404147,aston martin issue second profit warning two month . iconic firm blame minor delay delivery ultraexclusive valiant car shortfall,-0.4939,Negative
World of Business,Gain the leading edge with global insights for the boardroom and beyond in your inbox every Wednesday,BBC Business,2024-11-27T07:26:33.404147,world business . gain leading edge global insight boardroom beyond inbox every wednesday,0.5267,Positive
General Motors agrees deal to enter F1 in 2026,US car giant General Motors reaches an agreement in principle to enter Formula 1 in 2026 with its Cadillac brand,BBC Business,2024-11-27T07:26:33.404147,general motor agrees deal enter f1 2026. u car giant general motor reach agreement principle enter formula 1 2026 cadillac brand,0.6249,Positive
From eyesore to asset How a smelly seaweed could fuel cars,Scientists in the Caribbean are turning algae that have been choking beaches into biofuel,BBC Business,2024-11-27T07:26:33.404147,eyesore asset smelly seaweed could fuel car . scientist caribbean turning algae choking beach biofuel,-0.128,Neutral
Black Friday shoppers warned to be wary of deals,Nine out of 10 Black Friday offers are cheaper or the same price at other times of the year Which finds,BBC Business,2024-11-27T07:26:33.404147,black friday shopper warned wary deal . nine 10 black friday offer cheaper price time year find,-0.2732,Negative
Trump proves he is serious on tariffs but its not about trade,The US presidentelect is using tariffs as a weapon of diplomacy even coercion says BBC economics editor Faisal Islam,BBC Business,2024-11-27T07:26:33.404147,trump prof serious tariff trade . u presidentelect using tariff weapon diplomacy even coercion say bbc economics editor faisal islam,-0.3612,Negative
LinkedIn Were too boring for kids for social media ban,It is one of a number of tech firms pushing back against Australias plan to ban social media for under16s,BBC Business,2024-11-27T07:26:33.404147,linkedin boring kid social medium ban . one number tech firm pushing back australia plan ban social medium under16s,-0.8481,Negative
Inside South Africas ruthless gangcontrolled gold mines,Illegal miners live dangerously but make roaring profits selling gold on the black market,BBC Business,2024-11-27T07:26:33.404147,inside south africa ruthless gangcontrolled gold mine . illegal miner live dangerously make roaring profit selling gold black market,-0.5719,Negative
Is nuclear power gaining new energy,Countries around the world are building new nuclear power stations,BBC Business,2024-11-27T07:26:33.404147,nuclear power gaining new energy . country around world building new nuclear power station,0.5994,Positive
Trump has mandate to pursue tariffs expert 26 Nov 2024,Exofficial says Donald Trump would be willing to drop his tariff plans if steps are taken to address the issues,BBC Business,2024-11-27T07:26:33.404147,trump mandate pursue tariff expert 26 nov 2024. exofficial say donald trump would willing drop tariff plan step taken address issue,-0.2732,Negative
Good Bad Billionaire,Simon Jack and Zing Tsjeng find out how the worlds billionaires made their money and then judge them Are they good bad or just another billionaire Listen to season two New episodes released on Mondays,BBC Business,2024-11-27T07:26:33.404147,good bad billionaire . simon jack zing tsjeng find world billionaire made money judge good bad another billionaire listen season two new episode released monday,-0.296,Negative
The business of transforming mental health at work,Cherie Clonan CEO of The Digital Picnic explains how free dinners burnoutpreventing days off and even ADHD assessments have boosted employee wellbeing and her bottom line,BBC Business,2024-11-27T07:26:33.404147,business transforming mental health work . cherie clonan ceo digital picnic explains free dinner burnoutpreventing day even adhd assessment boosted employee wellbeing bottom line,0.7003,Positive
Macys employee hid more than 130m in delivery expenses,An employee intentionally concealed expenses related to package deliveries the retailer says,BBC Business,2024-11-27T07:26:33.404147,macys employee hid 130m delivery expense . employee intentionally concealed expense related package delivery retailer say,-0.1027,Neutral
Wicked proves popular as opening set to be biggest for Broadway film,Wicked is also expected to have the topgrossing opening weekend in UK and Ireland of 2024,BBC Business,2024-11-27T07:26:33.404147,wicked prof popular opening set biggest broadway film . wicked also expected topgrossing opening weekend uk ireland 2024,-0.6124,Negative
Nominee for agriculture secretary completes Trump cabinet,Brooke Rollins head of a proTrump rightwing think tank is his pick for agriculture secretary,BBC Business,2024-11-27T07:26:33.404147,nominee agriculture secretary completes trump cabinet . brooke rollins head protrump rightwing think tank pick agriculture secretary,0.0,Neutral
Can RFK Jr make Americas diet healthy again,Kennedys plans to ban dyes in cereals and fluoride in water could get major pushback from the food industry,BBC Business,2024-11-27T07:26:33.404147,rfk jr make america diet healthy . kennedy plan ban dye cereal fluoride water could get major pushback food industry,-0.2263,Neutral
UK perfume boss admitted he ignored Russia sanctions,David Crisp told undercover agent he had ignored government edicts to sell 17m of his luxury Boadicea the Victorious product,BBC Business,2024-11-27T07:26:33.404147,uk perfume bos admitted ignored russia sanction . david crisp told undercover agent ignored government edict sell 17m luxury boadicea victorious product,-0.4939,Negative
We had to break rules says Jaguar as radical rebrand stirs debate,The iconic carmakers rebrand has certainly caught peoples attention but will it pay off,BBC Business,2024-11-27T07:26:33.404147,break rule say jaguar radical rebrand stir debate . iconic carmaker rebrand certainly caught people attention pay,0.25,Positive
Playing with FIRE How to quit work and retire in your 30s,A personal finance strategy popular among millennials is helping them to quit their job and retire decades early,BBC Business,2024-11-27T07:26:33.404147,playing fire quit work retire 30 . personal finance strategy popular among millennials helping quit job retire decade early,0.5267,Positive
Boomerang CEOs Do they ever succeed,Five years after being ousted from WeWork Adam Neumann wants to rebuy the nowbankrupt business,BBC Business,2024-11-27T07:26:33.404147,boomerang ceo ever succeed . five year ousted wework adam neumann want rebuy nowbankrupt business,0.5423,Positive
How industry leaders transformed their career,The BBCs Katty Kay has spoken to successful changemakers to ask what made them pivot in their career,BBC Business,2024-11-27T07:26:33.404147,industry leader transformed career . bbcs katty kay spoken successful changemakers ask made pivot career,0.5859,Positive
Women were the original beer brewers what changed,Today the beer industry is maledominated but it wasnt always so,BBC Business,2024-11-27T07:26:33.404147,woman original beer brewer changed . today beer industry maledominated wasnt always,0.3182,Positive
How waiting alters our perception of time,Expert advice on how to get through a waiting period,BBC Business,2024-11-27T07:26:33.404147,waiting alters perception time . expert advice get waiting period,0.0,Neutral
Do the superrich deserve their wealth,Should there be a cap on billionaires wealth and their inheritances,BBC Business,2024-11-27T07:26:33.404147,superrich deserve wealth . cap billionaire wealth inheritance,0.7506,Positive
Four simple hacks to succeed in every conversation,A career coach a choreographer a chef and a dragon boat captain offer advice on giving critical feedback,BBC Business,2024-11-27T07:26:33.404147,four simple hack succeed every conversation . career coach choreographer chef dragon boat captain offer advice giving critical feedback,0.5106,Positive
Solo and hybrid work Navigating our future and new normal,Covid19 reshaped the way we live and work We rethink solo working and explore the future of worklife,BBC Business,2024-11-27T07:26:33.404147,solo hybrid work navigating future new normal . covid19 reshaped way live work rethink solo working explore future worklife,0.0,Neutral
Can supersonic flight ever be sustainable,How a new era of quiet net zero supersonic airliners could revolutionise the aviation industry,BBC Business,2024-11-27T07:26:33.404147,supersonic flight ever sustainable . new era quiet net zero supersonic airliner could revolutionise aviation industry,0.0,Neutral
Commencement speech The surprising pitfall of your passions,Students are graduating in the US this week The commencement speeches might lead them into questionable choices,BBC Business,2024-11-27T07:26:33.404147,commencement speech surprising pitfall passion . student graduating u week commencement speech might lead questionable choice,0.4404,Positive
ASMR How whispering took over the internet,We meet the creators behind the current ASMR boom,BBC Business,2024-11-27T07:26:33.404147,asmr whispering took internet . meet creator behind current asmr boom,0.0,Neutral
A desk full of descriptions for your work colleagues,These are the long lost words youve been waiting for to describe your colleagues,BBC Business,2024-11-27T07:26:33.404147,desk full description work colleague . long lost word youve waiting describe colleague,-0.3182,Negative
Veterinarian suicide rates are very high Why,Veterinarian professionals are committing suicide at a higher rate than the general population,BBC Business,2024-11-27T07:26:33.404147,veterinarian suicide rate high . veterinarian professional committing suicide higher rate general population,-0.8658,Negative
I was scammed out of 75k by Martin Lewis deepfake advert,Des Healey lost 76000 in a scam using a deepfake of Martin Lewis and Elon Musk,BBC Business,2024-11-27T07:26:33.404147,scammed 75k martin lewis deepfake advert . de healey lost 76000 scam using deepfake martin lewis elon musk,-0.7184,Negative
UK wants to hire EU negotiator to reset relations,The role will prepare and lead negotiations with the EU on key UK interests the job posting said,BBC Business,2024-11-27T07:26:33.404147,uk want hire eu negotiator reset relation . role prepare lead negotiation eu key uk interest job posting said,0.5106,Positive
Spain fines budget airlines including Ryanair 179m,The government says charging for hand luggage and printing boarding passes at the airport are abusive practices,BBC Business,2024-11-27T07:26:33.404147,spain fine budget airline including ryanair 179m . government say charging hand luggage printing boarding pass airport abusive practice,-0.0516,Neutral
Trump nominates Bessent to lead US Treasury in flurry of announcements,He also announces nominees for labour secretary housing secretary and surgeon general,BBC Business,2024-11-27T07:26:33.404147,trump nominates bessent lead u treasury flurry announcement . also announces nominee labour secretary housing secretary surgeon general,0.2023,Neutral
How could the Apple tax windfall be spent in Ireland,The EUs highest court ruled that Apple had to pay more than 14bn to the Republic of Ireland,BBC Business,2024-11-27T07:26:33.404147,could apple tax windfall spent ireland . eu highest court ruled apple pay 14bn republic ireland,-0.1027,Neutral
Analysis Will UK chancellors difficult week cause her lasting damage,BBCs Ben Wright looks at the impact of a tricky week of scrutiny for the chancellor,BBC Business,2024-11-27T07:26:33.404147,analysis uk chancellor difficult week cause lasting damage . bbcs ben wright look impact tricky week scrutiny chancellor,-0.743,Negative
Satellite images show Russia giving N Korea oil breaking sanctions,Satellite image analysis shows several North Korean tankers visiting Russia dozens of times since March,BBC Business,2024-11-27T07:26:33.404147,satellite image show russia giving n korea oil breaking sanction . satellite image analysis show several north korean tanker visiting russia dozen time since march,0.34,Positive
The mighty material that supercharges jet engines,Hitech coatings make all sorts of high performance engineering like jet engines possible,BBC Business,2024-11-27T07:26:33.404147,mighty material supercharges jet engine . hitech coating make sort high performance engineering like jet engine possible,0.3612,Positive
Gary Gensler to leave role as SEC chairman,Donald Trump revealed plans to sack Mr Gensler on day one of his new administration,BBC Business,2024-11-27T07:26:33.404147,gary gensler leave role sec chairman . donald trump revealed plan sack mr gensler day one new administration,-0.0516,Neutral
Rod Stewart Will Play Coveted Legends Slot at Glastonbury Festival 2025,After all these years Im proud and ready and more than able to take the stage again to pleasure and titillate my friends at Glastonbury in June the rock star said Tuesday,Hollywood Reporter,2024-11-27T07:26:34.593404,rod stewart play coveted legend slot glastonbury festival 2025. year im proud ready able take stage pleasure titillate friend glastonbury june rock star said tuesday,0.9524,Positive
Gavin Creel Memorial to Include US and UK Livestream,The memorial will be held in New York City on Dec 2 with Broadway set to dim lights in honor of the late star on Dec 3,Hollywood Reporter,2024-11-27T07:26:34.593404,gavin creel memorial include u uk livestream . memorial held new york city dec 2 broadway set dim light honor late star dec 3,0.4939,Positive
Menendez Resentencing Hearing Delayed Until January,During Mondays court proceeding the brothers attorneys asked a judge to reconsider their convictions,Hollywood Reporter,2024-11-27T07:26:34.593404,menendez resentencing hearing delayed january . monday court proceeding brother attorney asked judge reconsider conviction,-0.1779,Neutral
Shaboozeys A Bar Song Ties Old Town Road for Most Weeks at No1 on Billboard Hot 100 Chart,The countryrap smash is spending its 19th week on top of the chart matching a record set by Lil Nas X and Billy Ray Cyrus in 2019,Hollywood Reporter,2024-11-27T07:26:34.593404,shaboozeys bar song tie old town road week no1 billboard hot 100 chart . countryrap smash spending 19th week top chart matching record set lil na x billy ray cyrus 2019,0.2023,Neutral
Queen Latifah to Host 47th Annual Kennedy Center Honors,The ceremony which will air Dec 22 on CBS will honor Francis Ford Coppola the Grateful Dead Bonnie Raitt Arturo Sandoval and The Apollo,Hollywood Reporter,2024-11-27T07:26:34.593404,queen latifah host 47th annual kennedy center honor . ceremony air dec 22 cbs honor francis ford coppola grateful dead bonnie raitt arturo sandoval apollo,0.6249,Positive
2024 Billboard Awards Zach Bryan Leads With 21 Nominations Taylor Swift Follows With 17,See the full list of nominations as Morgan Wallen and Sabrina Carpenter also scored multiple nods ahead of the Dec 12 event airing live on FOX Paramount and Amazons Fire TV Channels,Hollywood Reporter,2024-11-27T07:26:34.593404,2024 billboard award zach bryan lead 21 nomination taylor swift follows 17. see full list nomination morgan wallen sabrina carpenter also scored multiple nod ahead dec 12 event airing live fox paramount amazon fire tv channel,0.5574,Positive
Alec Baldwin Says Americans Know Little or Nothing About the World at Turin Film Festival,The actor was the festivals guest of honor and appeared at a press conference on the condition that the Rust shooting where cinematographer Halyna Hutchins was killed with a prop gun was not to be brought up at any point,Hollywood Reporter,2024-11-27T07:26:34.593404,alec baldwin say american know little nothing world turin film festival . actor festival guest honor appeared press conference condition rust shooting cinematographer halyna hutchins killed prop gun brought point,0.4019,Positive
Barbara Taylor Bradford Author of BestSelling Novel A Woman of Substance Dies at 91,The book sold more than 30 million copies worldwide and was adapted into an Emmynominated Channel 4 miniseries,Hollywood Reporter,2024-11-27T07:26:34.593404,barbara taylor bradford author bestselling novel woman substance dy 91. book sold 30 million copy worldwide adapted emmynominated channel 4 miniseries,0.3182,Positive
Alice Brock Who Helped Inspire Arlo Guthries Classic Song Alices Restaurant Dies at 83,Alices Restaurant also was the title of his millionselling debut album and the basis of a movie and cookbook of the same name,Hollywood Reporter,2024-11-27T07:26:34.593404,alice brock helped inspire arlo guthrie classic song alices restaurant dy 83. alices restaurant also title millionselling debut album basis movie cookbook name,0.5719,Positive
Adele Doesnt Have Any Fing Plans Upon Vegas Residency Finish but Says Shell Be Back Eventually,The singer took a moment during her final show to thank her son her partner and Celine Dion,Hollywood Reporter,2024-11-27T07:26:34.593404,adele doesnt fing plan upon vega residency finish say shell back eventually . singer took moment final show thank son partner celine dion,0.3612,Positive
Larry Auerbach Longtime William Morris Agent and USC Cinematic Arts Industry Relations Head Dies at 95,Known as the man with the golden Rolodex the agent who got his start working part time at WMA while he was still in high school booked Elvis Presleys first TV performance and worked with Aretha Franklin Sam Cooke and Sammy Davis Jr,Hollywood Reporter,2024-11-27T07:26:34.593404,larry auerbach longtime william morris agent usc cinematic art industry relation head dy 95. known man golden rolodex agent got start working part time wma still high school booked elvis presley first tv performance worked aretha franklin sam cooke sammy davis jr,0.0,Neutral
Conor McGregor Must Pay 250000 to Woman Who Says He Raped Her Civil Jury Rules,The woman claims the 2018 assault after a night of partying left her heavily bruised and suffering from posttraumatic stress disorder,Hollywood Reporter,2024-11-27T07:26:34.593404,conor mcgregor must pay 250000 woman say raped civil jury rule . woman claim 2018 assault night partying left heavily bruised suffering posttraumatic stress disorder,-0.9413,Negative
Abbotts brave effort as Tassie wins Shield thriller,Sean Abbotts courageous spell following a tribute to mark the anniversary of Phillip Hughes death brought a Sheffield Shield clash down to the wire,News AU,2024-11-27T07:26:36.700298,abbotts brave effort tassie win shield thriller . sean abbotts courageous spell following tribute mark anniversary phillip hughes death brought sheffield shield clash wire,0.7964,Positive
Serious questions over Open future,A location for the 2025 Australian Open wont be confirmed any time soon with a strong player push to lock in a key piece of the 120yearold event,News AU,2024-11-27T07:26:36.700298,serious question open future . location 2025 australian open wont confirmed time soon strong player push lock key piece 120yearold event,0.4588,Positive
Aussie star claps back at damning allegation,Star batter Travis Head is the latest to respond to allegations of a fractured Aussie side after the first Test hammering against India,News AU,2024-11-27T07:26:36.700298,aussie star clap back damning allegation . star batter travis head latest respond allegation fractured aussie side first test hammering india,-0.34,Negative
Football world loses it as star gets banned,The internet has lost it after a popular football commentator was banned from discussing one team during a live segment on Wednesday,News AU,2024-11-27T07:26:36.700298,football world loses star get banned . internet lost popular football commentator banned discussing one team live segment wednesday,-0.7783,Negative
Fingerprints Humble coach wins top gong,Coaches have had their say on who the best performing AFLW boss was this season in an early grand final week victory for one mentor,News AU,2024-11-27T07:26:36.700298,fingerprint humble coach win top gong . coach say best performing aflw bos season early grand final week victory one mentor,0.9153,Positive
ExAFL star faces manslaughter charges,Former Collingwood star Shannon John Cox faces manslaughter charges over a car crash that killed two elderly women in June,News AU,2024-11-27T07:26:36.700298,exafl star face manslaughter charge . former collingwood star shannon john cox face manslaughter charge car crash killed two elderly woman june,-0.802,Negative
Broncos brutal demand for Ezra Mam,Broncos fiveeighth Ezra Mam has been handed a brutal reality check by new Brisbane coach Michael Maguire with his career in limbo,News AU,2024-11-27T07:26:36.700298,bronco brutal demand ezra mam . bronco fiveeighth ezra mam handed brutal reality check new brisbane coach michael maguire career limbo,-0.8658,Negative
NRL transfer tracker Every signing player linked with your club,The NRL player market is already in overdrive with a host of big names led by Ben Hunt and Josh AddoCarr on the move Keep up to date with all the player movement in our transfer tracker,News AU,2024-11-27T07:26:36.700298,nrl transfer tracker every signing player linked club . nrl player market already overdrive host big name led ben hunt josh addocarr move keep date player movement transfer tracker,0.0,Neutral
Aussies fuelled by United Cup heartbreak,They were a point away from reaching the United Cup final and fell just short at the Davis Cup Its why theres still belief in the Aussie camp,News AU,2024-11-27T07:26:36.700298,aussie fuelled united cup heartbreak . point away reaching united cup final fell short davis cup there still belief aussie camp,0.4019,Positive
Tennis world broken hearted by reveal,A former grand slam champion has broken hearts after detailing the nightmare toll injuries continue to have on his daytoday life,News AU,2024-11-27T07:26:36.700298,tennis world broken hearted reveal . former grand slam champion broken heart detailing nightmare toll injury continue daytoday life,-0.5719,Negative
Damning reasons for Aussie failure exposed,Cricket greats are making damning calls on the state of Australian cricket after the Aussies were embarrassed in the first Test,News AU,2024-11-27T07:26:36.700298,damning reason aussie failure exposed . cricket great making damning call state australian cricket aussie embarrassed first test,-0.7003,Negative
Primed Scary prediction for Test whitewash,Cricket legends are tipping Australia to dominate the Test summer as one players answer revealed the flaw in Indias team,News AU,2024-11-27T07:26:36.700298,primed scary prediction test whitewash . cricket legend tipping australia dominate test summer one player answer revealed flaw india team,-0.5574,Negative
Calls for Piastri change after No 2 furore,There is growing scrutiny on the dynamic between McLarens Oscar Piastri and Lando heading into this weekends Las Vegas Grand Prix,News AU,2024-11-27T07:26:36.700298,call piastri change 2 furore . growing scrutiny dynamic mclarens oscar piastri lando heading weekend la vega grand prix,0.743,Positive
Truth about Schumacher wedding rumour,A former F1 driver and one of Michael Schumachers friends has debunked a rumour that surfaced about the seventime world champion,News AU,2024-11-27T07:26:36.700298,truth schumacher wedding rumour . former f1 driver one michael schumachers friend debunked rumour surfaced seventime world champion,0.8555,Positive
Chaos erupts as F1 announces new team,Formula One has finally announced an 11th team will join the grid sparking speculation over which drivers will suit up for the new outfit,News AU,2024-11-27T07:26:36.700298,chaos erupts f1 announces new team . formula one finally announced 11th team join grid sparking speculation driver suit new outfit,-0.3612,Negative
Ring girls fame reaches absurd heights,Boxings latest viral sensation continues to take the internet by storm with Sydney Thomas left overwhelmed by her newfound fame,News AU,2024-11-27T07:26:36.700298,ring girl fame reach absurd height . boxing latest viral sensation continues take internet storm sydney thomas left overwhelmed newfound fame,0.7269,Positive
Olympic champ hid secret as tears fell,Australias most decorated Olympian has spoken about the moment she was overcome with emotion during the Paris Games,News AU,2024-11-27T07:26:36.700298,olympic champ hid secret tear fell . australia decorated olympian spoken moment overcome emotion paris game,0.4019,Positive
166kg Aussie ragdolled in viral NFL scenes,Aussie Jordan Mailata has come a long way in his NFL development but the hulking star has gone viral after he was monstered,News AU,2024-11-27T07:26:36.700298,166kg aussie ragdolled viral nfl scene . aussie jordan mailata come long way nfl development hulking star gone viral monstered,0.0,Neutral
Not an NBA player Simmons torn to shreds,Aussie NBA star Ben Simmons has hit rock bottom after a disastrous moment saw him go viral for all the wrong reasons,News AU,2024-11-27T07:26:36.700298,nba player simmons torn shred . aussie nba star ben simmons hit rock bottom disastrous moment saw go viral wrong reason,-0.8402,Negative
