Title,Description,Source,Fetched Date,Combined Text,Sentiment,Score
Nicole Avant Reflects on Resilience and Coping with Loss No One Is Exempt,Nicole Avant spent much of her childhood summers in holiday enclaves like Oak Bluffs in Marthas Vineyard and Sag Harbor in Long Island vacation havens created by the Black middleclass elites as they were often denied entry elsewhere My parents took me there and it was great for me growing up to see Black doctors,Hollywood Reporter,2024-08-24T11:50:30.351390,nicole avant reflects resilience coping loss one exempt . nicole avant spent much childhood summer holiday enclave like oak bluff marthas vineyard sag harbor long island vacation haven created black middleclass elite often denied entry elsewhere parent took great growing see black doctor,0.802,Positive
Kamala Harris Is Campaigning as a Prosecutor Popular Entertainment Has Long Favored Their Antagonist,As she accepted the Democratic nomination Thursday night Kamala Harris played up her attorneygeneral past As a prosecutor when I had a case I charged it not in the name of the victim but in the name of the people she told the United Center crowd This follows a strategy she has pursued since ramping up,Hollywood Reporter,2024-08-24T11:50:30.351390,kamala harris campaigning prosecutor popular entertainment long favored antagonist . accepted democratic nomination thursday night kamala harris played attorneygeneral past prosecutor case charged name victim name people told united center crowd follows strategy pursued since ramping,0.836,Positive
DNC Day 4 Kamala Harris Accepts Nomination Capping FourNight Reintroduction to Voters,Vice President Kamala Harris strode onto the DNC stage at 1030 pm on the conventions closing night just after her beloved sister laid a firm foundation for her reintroduction to America something dozens of the most powerful people in the Democratic party also spent the past four nights doing Harris presented herself to the,Hollywood Reporter,2024-08-24T11:50:30.351390,dnc day 4 kamala harris accepts nomination capping fournight reintroduction voter . vice president kamala harris strode onto dnc stage 1030 pm convention closing night beloved sister laid firm foundation reintroduction america something dozen powerful people democratic party also spent past four night harris presented,0.8779,Positive
Kerry Washington Invokes Olivia Pope at DNC Has Scandal Reunion With Tony Goldwyn Onstage,The Democratic National Convention delighted Scandal fans everywhere when it announced that Kerry Washington and Tony Goldwyn would be among the weeks lineup of nightly Hollywood hosts The pair played out having proximity to the White House onscreen when they starred opposite each other as Washington DC fixer Olivia Pope and President Fitzgerald Fitz Grant,Hollywood Reporter,2024-08-24T11:50:30.351390,kerry washington invokes olivia pope dnc scandal reunion tony goldwyn onstage . democratic national convention delighted scandal fan everywhere announced kerry washington tony goldwyn would among week lineup nightly hollywood host pair played proximity white house onscreen starred opposite washington dc fixer olivia pope president fitzgerald fitz grant,0.5719,Positive
Rep Beyonc Is Not Performing at DNC Was Never Scheduled to Attend Exclusive,A representative for Beyonc says the singer will not attend the 2024 Democratic National Convention Beyonc was never scheduled to be there the Grammywinning stars rep tells The Hollywood Reporter The report of a performance is untrue Rumors about the pop star attending and performing at this years DNC celebrating Vice President Kamala Harris historic,Hollywood Reporter,2024-08-24T11:50:30.351390,rep beyonc performing dnc never scheduled attend exclusive . representative beyonc say singer attend 2024 democratic national convention beyonc never scheduled grammywinning star rep tell hollywood reporter report performance untrue rumor pop star attending performing year dnc celebrating vice president kamala harris historic,0.5155,Positive
Guillermo del Toro Spooked by Something Angry and Territorial in Haunted Hotel Room While Filming Frankenstein,Guillermo del Toros time filming Frankenstein in Aberdeen Scotland has been an interesting one or should I say a spooky one The Oscarwinning filmmaker has been taking to his X formerly Twitter account this week to document his stay in what he called the most haunted room at his hotel There have been so many,Hollywood Reporter,2024-08-24T11:50:30.351390,guillermo del toro spooked something angry territorial haunted hotel room filming frankenstein . guillermo del toros time filming frankenstein aberdeen scotland interesting one say spooky one oscarwinning filmmaker taking x formerly twitter account week document stay called haunted room hotel many,-0.7783,Negative
Ana Navarro Slams Ann Coulter for Mocking Tim Walzs Son Gus After Emotional DNC Moment,Democratic National Convention host Ana Navarro slammed Ann Coulter for mocking Gus Walz the 17yearold son of Democratic vice presidential nominee Tim Walz At the DNCs third night in Chicago Gus went viral for his emotional reaction to his father praising him his sister Hope and mother Gwen During his speech onstage accepting the nomination,Hollywood Reporter,2024-08-24T11:50:30.351390,ana navarro slam ann coulter mocking tim walzs son gu emotional dnc moment . democratic national convention host ana navarro slammed ann coulter mocking gu walz 17yearold son democratic vice presidential nominee tim walz dncs third night chicago gu went viral emotional reaction father praising sister hope mother gwen speech onstage accepting nomination,0.4939,Positive
How to Stream the Fourth and Final Night of the Democratic National Convention Online,The Democratic National Convention is on its fourth and final day with Vice President Kamala Harris set to accept the partys nomination Thursday night Kerry Washington hosts tonights festivities which feature performances by Pink and the Chicks and speakers including Massachusetts Sen Elizabeth Warren Rev Al Sharpton Meena Harris Ella Emhoff and more The fourday,Hollywood Reporter,2024-08-24T11:50:30.351390,stream fourth final night democratic national convention online . democratic national convention fourth final day vice president kamala harris set accept party nomination thursday night kerry washington host tonight festivity feature performance pink chick speaker including massachusetts sen elizabeth warren rev al sharpton meena harris ella emhoff fourday,0.8176,Positive
Oprah Spike Lee Julia LouisDreyfus Lil Jon and More Stars at the 2024 DNC,After Julys Republican National Convention attracted such luminaries as Hulk Hogan Kid Rock and Amber Rose this years Democratic National Convention is drawing arguably bigger stars like Oprah Spike Lee Julia LouisDreyfus and Stevie Wonder This years DNC celebrating Vice President Kamala Harris historic presidential nomination was hosted by Tony Goldwyn Ana Navarro Mindy Kaling,Hollywood Reporter,2024-08-24T11:50:30.351390,oprah spike lee julia louisdreyfus lil jon star 2024 dnc . july republican national convention attracted luminary hulk hogan kid rock amber rose year democratic national convention drawing arguably bigger star like oprah spike lee julia louisdreyfus stevie wonder year dnc celebrating vice president kamala harris historic presidential nomination hosted tony goldwyn ana navarro mindy kaling,0.7906,Positive
Disappointed but not surprised Former employees speak on OpenAIs opposition to SB 1047,Two former OpenAI researchers who resigned this year over safety concerns say they are disappointed but not surprised by OpenAIs decision to oppose Californias bill to prevent AI disasters SB,TechCrunch,2024-08-24T11:50:31.795308,disappointed surprised former employee speak openais opposition sb 1047. two former openai researcher resigned year safety concern say disappointed surprised openais decision oppose california bill prevent ai disaster sb,-0.765,Negative
VC Neil Mehta whos quietly nabbing prized SF property plans a Y Combinator for restaurants,Neil Mehta the VC behind the acquisition of a string of properties on San Franciscos tony Fillmore Street made waves earlier this week for reportedly throwing longestablished local restaurants to,TechCrunch,2024-08-24T11:50:31.795308,vc neil mehta who quietly nabbing prized sf property plan combinator restaurant . neil mehta vc behind acquisition string property san franciscos tony fillmore street made wave earlier week reportedly throwing longestablished local restaurant,0.5267,Positive
Justice Department sues RealPage over allegedly helping landlords collude to drive up rents,RealPage which makes property management software was sued Friday by the US Justice Department and eight attorneys general for allegedly helping apartment and building managers around the country collude to,TechCrunch,2024-08-24T11:50:31.795308,justice department sue realpage allegedly helping landlord collude drive rent . realpage make property management software sued friday u justice department eight attorney general allegedly helping apartment building manager around country collude,0.8807,Positive
Colorful Capital will stop trying to raise for a fund,Colorful Capitals cofounders William Burckart and Megan Kashner declined to comment,TechCrunch,2024-08-24T11:50:31.795308,colorful capital stop trying raise fund . colorful capital cofounder william burckart megan kashner declined comment,-0.296,Negative
Andrew Ng steps back at Landing AI after announcing new fund,Andrew Ng is stepping down from his role as CEO at Landing AI the computer vision platform he founded in 2017 Dan Maloney formerly the COO will take the reins,TechCrunch,2024-08-24T11:50:31.795308,andrew ng step back landing ai announcing new fund . andrew ng stepping role ceo landing ai computer vision platform founded 2017 dan maloney formerly coo take rein,0.25,Positive
Piramidals foundation model for brainwaves could supercharge EEGs,AI models are being applied to every dataset under the sun but are inconsistent in their outcomes This is as true in the medical world as anywhere else but a,TechCrunch,2024-08-24T11:50:31.795308,piramidals foundation model brainwave could supercharge eeg . ai model applied every dataset sun inconsistent outcome true medical world anywhere else,0.4215,Positive
MA can open up the playing field for the competition,No two businesses are the same and thats good news As we saw again this week it opens up space for companies to try opposite approaches join forces or challenge,TechCrunch,2024-08-24T11:50:31.795308,open playing field competition . two business thats good news saw week open space company try opposite approach join force challenge,0.7351,Positive
Marc Andreessens family plans to build a visionary subdivision near the proposed California Forever utopia city,Marc Andreessens family is planning to build a large housing development near the proposed California Forever city,TechCrunch,2024-08-24T11:50:31.795308,marc andreessens family plan build visionary subdivision near proposed california forever utopia city . marc andreessens family planning build large housing development near proposed california forever city,0.5267,Positive
Canoos chief technology officer is out amid wider reorg,EV startup Canoos chief technology officer Sohel Merchant has left the company two people familiar with his departure have told TechCrunch Merchant was one of the members of Canoos founding,TechCrunch,2024-08-24T11:50:31.795308,canoos chief technology officer amid wider reorg . ev startup canoos chief technology officer sohel merchant left company two people familiar departure told techcrunch merchant one member canoos founding,0.0,Neutral
Halliburton shuts down systems after cyberattack,A company spokesperson for the oil drilling and fracking giant declined to name the executive overseeing cybersecurity if any,TechCrunch,2024-08-24T11:50:31.795308,halliburton shuts system cyberattack . company spokesperson oil drilling fracking giant declined name executive overseeing cybersecurity,0.0,Neutral
Peloton adds 95 activation fee for used equipment,The move is an effort to squeeze additional revenue from secondhand products over concerns that cheaper slightly used bikes treadmills and rowers could cannibalize used sales,TechCrunch,2024-08-24T11:50:31.795308,peloton add 95 activation fee used equipment . move effort squeeze additional revenue secondhand product concern cheaper slightly used bike treadmill rower could cannibalize used sale,0.0,Neutral
Last day for massive ticket savings to TechCrunch Disrupt 2024,Time is running out These are the last hours to save up to 600 on TechCrunch Disrupt 2024 tickets offer ends tonight at 1159 pm PT Join 10000 startup,TechCrunch,2024-08-24T11:50:31.795308,last day massive ticket saving techcrunch disrupt 2024. time running last hour save 600 techcrunch disrupt 2024 ticket offer end tonight 1159 pm pt join 10000 startup,0.6597,Positive
Meta and Spotify CEOs criticize AI regulation in the EU,Meta and Spotify are once again teaming up this time on the matter of open source or to be precise openweight AI which the companies claim are being hampered,TechCrunch,2024-08-24T11:50:31.795308,meta spotify ceo criticize ai regulation eu . meta spotify teaming time matter open source precise openweight ai company claim hampered,-0.3612,Negative
AI talent managers technocapitalist college towns and a rise in defense tech acquisitions,This week on Equity are some deals that are unusual for a few reasons some good some well well find out First up is,TechCrunch,2024-08-24T11:50:31.795308,ai talent manager technocapitalist college town rise defense tech acquisition . week equity deal unusual reason good well well find first,0.8555,Positive
Tingit is building a marketplace for zeroeffort repairs starting with fashion,Tingit a startup out of Lithuania wants to help people restore their used clothing to their former glory with its newly launched repairs marketplace,TechCrunch,2024-08-24T11:50:31.795308,tingit building marketplace zeroeffort repair starting fashion . tingit startup lithuania want help people restore used clothing former glory newly launched repair marketplace,0.8481,Positive
After changing its license Redis drops its biggest release yet,Redis the company behind the popular inmemory data store which is often used as a cache vector database or streaming engine today announced the launch of Redis 8 With this,TechCrunch,2024-08-24T11:50:31.795308,changing license redis drop biggest release yet . redis company behind popular inmemory data store often used cache vector database streaming engine today announced launch redis 8,0.1779,Neutral
360 One lifts its valuation of Indias National Stock Exchange to 299B,360 One Asset an investor in National Stock Exchange NSE has increased its valuation for Indias top stock exchange to 299 billion,TechCrunch,2024-08-24T11:50:31.795308,360 one lift valuation india national stock exchange 299b . 360 one asset investor national stock exchange nse increased valuation india top stock exchange 299 billion,0.6597,Positive
Get in on the ground floor with Teslas humanoid by pretending to be one for pay,Tesla is hiring individuals standing between 57 and 511 to carry up to 30 pounds for seven hours a day to train its Optimus robot,TechCrunch,2024-08-24T11:50:31.795308,get ground floor tesla humanoid pretending one pay . tesla hiring individual standing 57 511 carry 30 pound seven hour day train optimus robot,0.0,Neutral
DeepMind workers sign letter in protest of Googles defense contracts,At least 200 workers at DeepMind Googles AI RD division are displeased with Googles reported defense contracts and according to Time they circulated a letter internally back in May,TechCrunch,2024-08-24T11:50:31.795308,deepmind worker sign letter protest google defense contract . least 200 worker deepmind google ai rd division displeased google reported defense contract according time circulated letter internally back may,-0.4404,Negative
NASA to decide Saturday whether astronauts will ride Boeings Starliner home or use SpaceXs Dragon instead,NASA officials will announce their final decision on Saturday as to whether two NASA astronauts Butch Wilmore and Sunita Williams will return to Earth on Boeings Starliner spacecraft,TechCrunch,2024-08-24T11:50:31.795308,nasa decide saturday whether astronaut ride boeings starliner home use spacexs dragon instead . nasa official announce final decision saturday whether two nasa astronaut butch wilmore sunita williams return earth boeings starliner spacecraft,0.0,Neutral
Influencers go to war in heated feud,Two sporting social media influencers are engaged in an ugly online spat after one called out the other for stealing her content,News AU,2024-08-24T11:50:34.960528,influencers go war heated feud . two sporting social medium influencers engaged ugly online spat one called stealing content,-0.891,Negative
Coach goes nuclear as star faces NRL ban,An NRL coach has delivered a blistering takedown of match officials in the wake of a stars act that went unpunished on Friday,News AU,2024-08-24T11:50:34.960528,coach go nuclear star face nrl ban . nrl coach delivered blistering takedown match official wake star act went unpunished friday,-0.5574,Negative
Should be cancelled Stars shock admission,Former UFC and WWE star Ronda Rousey has delivered a stunning admission after sharing a conspiracy theory video online,News AU,2024-08-24T11:50:34.960528,cancelled star shock admission . former ufc wwe star ronda rousey delivered stunning admission sharing conspiracy theory video online,-0.3818,Negative
Daniel Ricciardo act caught on camera,Australian Formula 1 driver Daniel Ricciardo has gone viral after one sneaky act was caught on camera in the middle of a session,News AU,2024-08-24T11:50:34.960528,daniel ricciardo act caught camera . australian formula 1 driver daniel ricciardo gone viral one sneaky act caught camera middle session,-0.2263,Neutral
Blowing up the club AFL star called out,After Melbournes seasonconcluding loss to Collingwood an injured superstar was called out as the club risks a major drop off,News AU,2024-08-24T11:50:34.960528,blowing club afl star called . melbourne seasonconcluding loss collingwood injured superstar called club risk major drop,-0.802,Negative
Outrageous Legend erupts over banner,An AFL legend has taken aim at Melbourne over one detail in their banner ahead of their final game of the season on Friday,News AU,2024-08-24T11:50:34.960528,outrageous legend erupts banner . afl legend taken aim melbourne one detail banner ahead final game season friday,-0.4588,Negative
NRLW Rd 5 Cowboys heap more misery on Raiders,The Cowboys have kept in touch with the top four after heaping more misery on the Raiders while the Knights overcame a bizarre delay to beat Parramatta See all the NRLW Round 5 news,News AU,2024-08-24T11:50:34.960528,nrlw rd 5 cowboy heap misery raider . cowboy kept touch top four heaping misery raider knight overcame bizarre delay beat parramatta see nrlw round 5 news,-0.8807,Negative
NRL Live Raiders keeping ahead of struggling Panthers,Canberra weathered a storm of Panthers attack and have regained the lead through superstar youngster Kaeo Weekes Follow along for live score updates and SuperCoach news,News AU,2024-08-24T11:50:34.960528,nrl live raider keeping ahead struggling panther . canberra weathered storm panther attack regained lead superstar youngster kaeo weekes follow along live score update supercoach news,-0.7096,Negative
World Cup shift after Aussie skippers fears,As trouble continues to make Bangladesh unsafe for travel the ICC has heeded player wishes and moved Octobers T20 World Cup,News AU,2024-08-24T11:50:34.960528,world cup shift aussie skipper fear . trouble continues make bangladesh unsafe travel icc heeded player wish moved october t20 world cup,-0.4939,Negative
No idea Smiths frank Test admission,While he locked in his Big Bash future there are still a few questions Australian batting dynamo Steve Smith cant answer,News AU,2024-08-24T11:50:34.960528,idea smith frank test admission . locked big bash future still question australian batting dynamo steve smith cant answer,0.0,Neutral
Federers iconic tennis coach dead at 59,The tennis world has paid tribute after the man who coached Swiss maestro Roger Federer to his first Wimbledon title died,News AU,2024-08-24T11:50:34.960528,federers iconic tennis coach dead 59. tennis world paid tribute man coached swiss maestro roger federer first wimbledon title died,-0.836,Negative
Aussies in 46year US Open first,Its been nearly half a century since there were as many Australians in the main draw of the US Open as there are now with two seeded men leading the charge,News AU,2024-08-24T11:50:34.960528,aussie 46year u open first . nearly half century since many australian main draw u open two seeded men leading charge,0.0,Neutral
Darts prodigy is here to win in Australia,Luke Littler has taken the darts world by storm this year and the teenager is in Australia this week determined to continue his red hot form,News AU,2024-08-24T11:50:34.960528,dart prodigy win australia . luke littler taken dart world storm year teenager australia week determined continue red hot form,0.7351,Positive
Absolutely hate it Aussies in Paris drama,A new rule at the Olympics athletics events is sure to divide athletes and fans and produce high drama in Paris writes Sally Pearson,News AU,2024-08-24T11:50:34.960528,absolutely hate aussie paris drama . new rule olympics athletics event sure divide athlete fan produce high drama paris writes sally pearson,-0.101,Neutral
Astonishing rise set to flip F1 in 215m race,Daniel Ricciardo has been given a reality check as the urgency mounts at Red Bull amid a threehorse race to replace a struggling driver,News AU,2024-08-24T11:50:34.960528,astonishing rise set flip f1 215m race . daniel ricciardo given reality check urgency mount red bull amid threehorse race replace struggling driver,-0.4215,Negative
Son of Aussie legends massive F1 promotion,Australia could have three drivers in Formula One next season after the son of an Aussie legend was promoted to the big time,News AU,2024-08-24T11:50:34.960528,son aussie legend massive f1 promotion . australia could three driver formula one next season son aussie legend promoted big time,0.4215,Positive
Sleazy Hawk Tuah girls latest act slammed,A legendary US sports broadcaster has savaged the Hawk Tuah girl after the viral star continued to milk her 15 minutes of fame,News AU,2024-08-24T11:50:34.960528,sleazy hawk tuah girl latest act slammed . legendary u sport broadcaster savaged hawk tuah girl viral star continued milk 15 minute fame,-0.0258,Neutral
Patty Mills 5m NBA lifeline revealed,A standout Olympic performance from Patty Mills has seemingly landed the 36yearold Aussie another lifeline to stay in the NBA,News AU,2024-08-24T11:50:34.960528,patty mill 5m nba lifeline revealed . standout olympic performance patty mill seemingly landed 36yearold aussie another lifeline stay nba,0.0,Neutral
ExSocceroo returns to ALeague,Central Coast Mariners ALeague title defence will be boosted by the return of a former Socceroo,News AU,2024-08-24T11:50:34.960528,exsocceroo return aleague . central coast mariner aleague title defence boosted return former socceroo,0.4404,Positive
Socceroo extends stay at German club,On the eve of his likely Bundesliga debut a Socceroos star has secured his longterm future at his German club,News AU,2024-08-24T11:50:34.960528,socceroo extends stay german club . eve likely bundesliga debut socceroos star secured longterm future german club,0.4939,Positive
How boxing helped Mazoudier out of mental health nightmare,Just days ahead of his payperview main event against Nikita Tszyu Koen Mazoudier has opened up on his drug and mental health anguish and how boxing saved him,News AU,2024-08-24T11:50:34.960528,boxing helped mazoudier mental health nightmare . day ahead payperview main event nikita tszyu koen mazoudier opened drug mental health anguish boxing saved,-0.2732,Negative
Scotts 390m monster in 30m surge,Playing at high altitude in Colorado the worlds best golfers are smacking the ball a mile and the Aussie star didnt miss out,News AU,2024-08-24T11:50:34.960528,scott 390m monster 30m surge . playing high altitude colorado world best golfer smacking ball mile aussie star didnt miss,0.7539,Positive
A SuperCoach NRL fans quick guide to SuperCoach NBL,If you love playing SuperCoach NRL youre going to have a blast with SuperCoach NBL Check out all the features you know and love and whats new,News AU,2024-08-24T11:50:34.960528,supercoach nrl fan quick guide supercoach nbl . love playing supercoach nrl youre going blast supercoach nbl check feature know love whats new,0.91,Positive
Folaus bombshell claims on viral post,Israel Folau has opened up about the social media post that ended his Wallabies career slamming the media and calling his treatment unfair,News AU,2024-08-24T11:50:34.960528,folaus bombshell claim viral post . israel folau opened social medium post ended wallaby career slamming medium calling treatment unfair,-0.4767,Negative
Wallaby keen to build on bittersweet comeback,Having finally made his return from injury a Wallabies prop wants to take his game to the next level on Australias tour of Argentina,News AU,2024-08-24T11:50:34.960528,wallaby keen build bittersweet comeback . finally made return injury wallaby prop want take game next level australia tour argentina,-0.0772,Neutral
