Title,Description,Source,Fetched Date
Boeing plea deal over fatal Max crashes rejected,The deal undermines the court and involves contradictory diversity requirements a judge ruled,BBC Business,2024-12-06T07:26:39.279921
Trump tariff threat puts a strain on CanadaMexico ties,Canadian officials have suggested striking their own trade agreements with the US and Mexico has taken notice,BBC Business,2024-12-06T07:26:39.279921
World of Business,Gain the leading edge with global insights for the boardroom and beyond in your inbox every Wednesday,BBC Business,2024-12-06T07:26:39.279921
What we know about Musks costcutting mission,Elon Musk and Vivek Ramaswamy are on Capitol Hill to discuss their new advisory body So what will it do,BBC Business,2024-12-06T07:26:39.279921
Illegal Ghana gold mining causing widespread disruption,Illegal gold mining in Ghana picked up this year following an almost 30 rise in global gold prices despite military operations to shut them down,BBC Business,2024-12-06T07:26:39.279921
New photos released as NYPD hunt insurance boss killer,Police are still working to determine a motive in the slaying of insurance executive Brian Thompson,BBC Business,2024-12-06T07:26:39.279921
Who was Brian Thompson healthcare CEO gunned down in New York,Police are still searching for the suspect who shot dead the UnitedHealthcare CEO in Manhattan on Wednesday,BBC Business,2024-12-06T07:26:39.279921
What next for Bitcoin after bursting 100k barrier,The rapid increase in price has been attributed to Donald Trumps election victory can it continue,BBC Business,2024-12-06T07:26:39.279921
Why are doctors wary of wearables,Wearable tech claims to help monitor our health but many doctors remain sceptical,BBC Business,2024-12-06T07:26:39.279921
Why is vintage audio equipment booming,Music lovers are buying up old cassette CD and record players and getting them fixed,BBC Business,2024-12-06T07:26:39.279921
Markets react to Trumps pick to run SEC 5 Dec 2024,Markets react to crypto advocate Paul Atkins nomination to lead the SEC the US financial regulator,BBC Business,2024-12-06T07:26:39.279921
Good Bad Billionaire,Simon Jack and Zing Tsjeng find out how the worlds billionaires made their money and then judge them Are they good bad or just another billionaire Listen to season two New episodes released on Mondays,BBC Business,2024-12-06T07:26:39.279921
How one product made a multimillion dollar brand,Nell Diamond CEO of Hill House Home shares how her small business skyrocketed to global success with the launch of the Nap Dress in 2019,BBC Business,2024-12-06T07:26:39.279921
Mattel sued over porn site misprint on Wicked dolls,A South Carolina mother claims her daughter visited the adult website on the dolls packaging,BBC Business,2024-12-06T07:26:39.279921
Shell and Equinor to combine forces in North Sea,The energy firms say the deal will see the creation of the North Seas biggest oil and gas producer,BBC Business,2024-12-06T07:26:39.279921
Selling sex for gold in the Amazons illegal mines,Life for women among the Amazons illegal gold miners is harsh violent and can be deadly,BBC Business,2024-12-06T07:26:39.279921
NYPD hunts gunwielding assailant who killed UnitedHealthcare CEO outside hotel,Brian Thompson was targeted by a masked suspect who fled first on foot before grabbing an ebike and heading towards Central Park,BBC Business,2024-12-06T07:26:39.279921
Airbus cuts nearly 500 UK jobs to reduce costs,It has made the cuts mostly to its space division and says there are no compulsory losses planned,BBC Business,2024-12-06T07:26:39.279921
Guinness supplies in UK being limited after demand soars,Guinnessmaker Diageo has placed limits on wholesale distribution of the stout to pubs in Great Britain after exceptional demand,BBC Business,2024-12-06T07:26:39.279921
Playing with FIRE How to quit work and retire in your 30s,A personal finance strategy popular among millennials is helping them to quit their job and retire decades early,BBC Business,2024-12-06T07:26:39.279921
Boomerang CEOs Do they ever succeed,Five years after being ousted from WeWork Adam Neumann wants to rebuy the nowbankrupt business,BBC Business,2024-12-06T07:26:39.279921
How industry leaders transformed their career,The BBCs Katty Kay has spoken to successful changemakers to ask what made them pivot in their career,BBC Business,2024-12-06T07:26:39.279921
Women were the original beer brewers what changed,Today the beer industry is maledominated but it wasnt always so,BBC Business,2024-12-06T07:26:39.279921
How waiting alters our perception of time,Expert advice on how to get through a waiting period,BBC Business,2024-12-06T07:26:39.279921
Do the superrich deserve their wealth,Should there be a cap on billionaires wealth and their inheritances,BBC Business,2024-12-06T07:26:39.279921
Four simple hacks to succeed in every conversation,A career coach a choreographer a chef and a dragon boat captain offer advice on giving critical feedback,BBC Business,2024-12-06T07:26:39.279921
Solo and hybrid work Navigating our future and new normal,Covid19 reshaped the way we live and work We rethink solo working and explore the future of worklife,BBC Business,2024-12-06T07:26:39.279921
Can supersonic flight ever be sustainable,How a new era of quiet net zero supersonic airliners could revolutionise the aviation industry,BBC Business,2024-12-06T07:26:39.279921
Commencement speech The surprising pitfall of your passions,Students are graduating in the US this week The commencement speeches might lead them into questionable choices,BBC Business,2024-12-06T07:26:39.279921
ASMR How whispering took over the internet,We meet the creators behind the current ASMR boom,BBC Business,2024-12-06T07:26:39.279921
A desk full of descriptions for your work colleagues,These are the long lost words youve been waiting for to describe your colleagues,BBC Business,2024-12-06T07:26:39.279921
Veterinarian suicide rates are very high Why,Veterinarian professionals are committing suicide at a higher rate than the general population,BBC Business,2024-12-06T07:26:39.279921
Why are people in UK pouring milk down the drain over a cow feed additive,The new additive aims to cut down on methane emissions from cows but some have raised safety concerns,BBC Business,2024-12-06T07:26:39.279921
Swedens soft girl trend that celebrates women quitting work,Sweden has a reputation for strong gender equality but some young women are giving up their jobs,BBC Business,2024-12-06T07:26:39.279921
Niger junta takes control of French uranium mine,Since the coup last year the junta has been trying to reduce French influence in the country,BBC Business,2024-12-06T07:26:39.279921
India police seek Starlink help over 425bn drug haul,Police say this is the first known case of the devices use to navigate and reach Indian waters,BBC Business,2024-12-06T07:26:39.279921
Telegram Uturns and joins child safety scheme,It is the latest in a series of changes announced by the platform since its founder Pavel Durov was arrested,BBC Business,2024-12-06T07:26:39.279921
Guardian and Observer journalists go on strike,Their first strike in more than 50 years concerns the proposed sale of the Sunday title to Tortoise,BBC Business,2024-12-06T07:26:39.279921
India taxi service sorry for drivers gunpoint robbery,A 30yearold woman said she was travelling with her sixyearold son when the driver pulled out a gun,BBC Business,2024-12-06T07:26:39.279921
Bank boss takes pay cut after employee tried to kill clients,The bank apologised after the former worker was charged with robbery of clients attempted murder and arson,BBC Business,2024-12-06T07:26:39.279921
Bitcoin miner sues over 600m lost in tip,James Howells believes the hard drive is now worth about 600m since the recent Bitcoin surge,BBC Business,2024-12-06T07:26:39.279921
Natasha Lyonne Says Jennifer Coolidge Once Mistook Her for Hilary Duff,The Poker Face star recalled seeing Coolidge at the Chateau Marmont when Coolidge though she was Duff I was so confused,Hollywood Reporter,2024-12-06T07:26:40.265905
Jake Paul Joins Undisputed Boxing Video Game While Mike Tyson Does Not,The influencer turned fighter is part of a downloadable player pack available Dec 12,Hollywood Reporter,2024-12-06T07:26:40.265905
Brandi Carlile on Writing Elton John Doc Song I Wanted People to Understand What I See in Elton Exclusive Video,Never Too Late plays over the credits of the documentary of the same name which streams on Disney on Dec 13,Hollywood Reporter,2024-12-06T07:26:40.265905
Has Sky Ferreira Finally Been Freed,On Thursday the musical cult hero puts our her first song away from nemesis Capitol Records in more than a decade a cut from the Babygirl soundtrack It only deepens the mystery,Hollywood Reporter,2024-12-06T07:26:40.265905
Taylor Swift Eras Tiein Book Sells More Than 800000 Copies in First Weekend,The only bigger nonfiction launch was the first volume of Barack Obamas presidential memoirs A Promised Land,Hollywood Reporter,2024-12-06T07:26:40.265905
Bob Dylan Is Sure Timothe Chalamet Will Be Completely Believable as Me in A Complete Unknown,Chalamet plays the music legend in a biopic set for release on Christmas Day,Hollywood Reporter,2024-12-06T07:26:40.265905
JonBent Ramseys Father Says Theres a Really Good Chance Her Murder Could Be Solved,The father of the child beauty queen hopes that the latest DNA technology and familial genealogy research can help solve the cold case that is recaptivating the nation 28 years later,Hollywood Reporter,2024-12-06T07:26:40.265905
Marvin Laird Broadway and Film Composer and Musical Director for Bernadette Peters Dies at 85,His credits in Hollywood included Hello Dolly New York New York Maude Dynasty and The Love Boat,Hollywood Reporter,2024-12-06T07:26:40.265905
Nicole Kidman Honors Her Mother Daughters and Female Mentors Who Have Shown Up at THRs Women in Entertainment Gala,Even though I dont have my mom anymore I have my daughters Faith was my mentor my guide said the Oscarwinning actress while accepting the Sherry Lansing Leadership Award at The Hollywood Reporters annual event,Hollywood Reporter,2024-12-06T07:26:40.265905
Shareholders at Romes Cinecitt Studios to Approve Restated Financial Records,The move comes following the discovery of errors in the iconic studios 2023 accounts under former CEO Nicola Maccanico,Hollywood Reporter,2024-12-06T07:26:40.265905
Jennifer Lawrence Kerry Washington Amanda Zurawski Present 1M in College Scholarships to High School Seniors at THR Women in Entertainment Gala,Scholarships were presented to mentees in the WIE Mentorship Program during Wednesdays starstudded event at the Beverly Hills Hotel,Hollywood Reporter,2024-12-06T07:26:40.265905
Nikki Glaser Skewers Hollywood Beauty Standards Jokes About Focus on Colin Farrells Penguin Transformation at THR Women in Entertainment Gala,Thats how long it takes me every day to make sure I dont look like The Penguin the comedian said of the actors reported three hours in the makeup chair for his role as the Batman villain now the subject of an HBO series,Hollywood Reporter,2024-12-06T07:26:40.265905
Gout obliterates record books all over again,The legend of teenage sensation Gout Gout is continuing to grow after the prodigy once again rewrote the record books,News AU,2024-12-06T07:26:41.171045
FLAT TRACK BULLY Fans turn on Indian batting superstar,Just when India was looking settled in the second Test three quick wickets had fans turning on the Indian batting line up,News AU,2024-12-06T07:26:41.171045
Wayne Bennett alpha move is pure savagery,Wayne Bennett has produced a masterclass in savagery bringing South Sydneys star signing down to earth with a classic alpha move,News AU,2024-12-06T07:26:41.171045
Totally wild Raygun item says it all,Aussie cult figure Rachael Raygun Gunn has done it again with a crazy trend emerging about the muchmaligned Olympian,News AU,2024-12-06T07:26:41.171045
Best fit Saints stick with great in key role,St Kilda says its AFLW program is heading in the right direction under a club great urging fans to stay the course,News AU,2024-12-06T07:26:41.171045
Eddies unthinkable move as secret revealed,If viewers ever thought Eddie McGuires days of being a media mogul were done think again The star presenters new move has shocked many,News AU,2024-12-06T07:26:41.171045
Origin star set for new home in 2026,The Cowboys have lost a key player to a rival club with the representative star joining the Roosters in 2026,News AU,2024-12-06T07:26:41.171045
Munsters warning to NSW over Bellamy move,Craig Bellamy has often said how much he hated coaching against his Storm players when he was at the Blues but its something hell have to get used to,News AU,2024-12-06T07:26:41.171045
Runs for Inglis after surprise Shield dash,Cricket Australia found a way to get Josh Inglis time in the middle as a South Australian recruit made an impressive Shield ton,News AU,2024-12-06T07:26:41.171045
Path to Aus Open return clears for Kyrgios,A key question has been answered over Nick Kyrgios Australian Open comeback plans as the tournament released the full list of entrants,News AU,2024-12-06T07:26:41.171045
Brisbane options limited for Tomic,If Bernard Tomic wants to try to qualify for the Brisbane International he will need some help from tournament organisers,News AU,2024-12-06T07:26:41.171045
Radical plan will flip cricket on its head,A cricket great has a radical plan to shake up world cricket and the one trophy England seemingly has no chance of winning,News AU,2024-12-06T07:26:41.171045
Nervy time Why Buckley fears for his job,Nathan Buckley says he and his colleagues are worried for their jobs at an AFL broadcaster declaring its a nervy time for them,News AU,2024-12-06T07:26:41.171045
Damning reasons for Aussie failure exposed,Cricket greats are making damning calls on the state of Australian cricket after the Aussies were embarrassed in the first Test,News AU,2024-12-06T07:26:41.171045
F1 photo goes viral as feud goes nuclear,A photo of the F1 grid has sent fans into meltdown as George Russell hit back at Max Verstappen and their feud went nuclear,News AU,2024-12-06T07:26:41.171045
F1 photo goes viral for worst reason possible,A photo featuring Aussie Oscar Piastri has gone viral in F1 circles this week as a teams brutal transformation stunned commentators,News AU,2024-12-06T07:26:41.171045
Jess Fox quietly splits from longtime partner,Australias Olympic golden girl Jessica Fox has reportedly split from her longtime partner at the end of a career best year,News AU,2024-12-06T07:26:41.171045
Dude is ridiculous Aussie wins NBA gong,Aussie guard Dyson Daniels has claimed a huge NBA award and earned massive plaudits from his Atlanta Hawks teammates,News AU,2024-12-06T07:26:41.171045
Whos the new NFL MVP frontrunner with the superstar fiance,It was a Thanksgiving Week for the ages for the new MVP frontrunner and can anyone outside the top 4 contend for the Super Bowl,News AU,2024-12-06T07:26:41.171045
Legend to start in Matildas farewell game,The Matildas alltime games record holder will get a surprise bonus farewell appearance as intrigue remains over the search for a new coach,News AU,2024-12-06T07:26:41.171045
Coachs plea to ALeague clubs,An international coach has urged ALeague Women clubs to back in talented Taiwanese players who briefly threatened a boilover in Melbourne,News AU,2024-12-06T07:26:41.171045
The UFC fighter channelling the spirit of Elvis,At 57kg wringing wet theres little comparison between the physiques of the late Elvis Presley and UFC pocketrocket Alexandre Pantoja But they share one bizarre dietary trait,News AU,2024-12-06T07:26:41.171045
How Cameron Smith could help golf cult hero to first pro win,He went toe to toe with Cameron Smith for the biggest moment of his young professional career and now cult hero Corey Lamb is using it as motivation for his first professional win,News AU,2024-12-06T07:26:41.171045
Basketball Australia Schools Championships HUB,Champions will be crowned on what promises to be a huge final day at the BA Schools Championships Watch three courts LIVE Click on the links below to go through to the day four action,News AU,2024-12-06T07:26:41.171045
Rugby moves to secure Wallabies stars as NRL poachers circle,Rugby Australia has moved to secure the futures of several offcontract Wallabies as the NRL considers salary cap concessions to raid the 15man codes biggest stars Find out more inside,News AU,2024-12-06T07:26:41.171045
Wallaby gut punch as star makes NFL move,One of the Wallabies most exciting players has announced he is gambling everything to chase his dream in the United States,News AU,2024-12-06T07:26:41.171045
Corey Brown gets pain relief after back surgery,Former champion jockey Corey Brown feels almost back to normal after back surgery to remove rods and screws that were inserted after a race fall that ended his career,News AU,2024-12-06T07:26:41.171045
Olympian deathly pale after ugly crash,A double Olympic road cycling champ suffered horror injuries after a postal van worker opened their car door in front of him on a ride,News AU,2024-12-06T07:26:41.171045
