Title,Description,Source,Fetched Date,Combined Text,Score,Sentiment
Reds coach wants Unite Round shared,An ALeague coach wants Unite Round to be moved around Australia rather than be held each year in Sydney,News AU,2024-11-23T07:24:10.997557,red coach want unite round shared . aleague coach want unite round moved around australia rather held year sydney,0.4588,Positive
McGregor speaks after verdict in rape case,The martial arts fighter was accused of brutally raping and battering Nikita Hand in December 2018,News AU,2024-11-23T07:24:10.997557,mcgregor speaks verdict rape case . martial art fighter accused brutally raping battering nikita hand december 2018,-0.9062,Negative
Wallabies make mass changes for crunch game,Joseph Suaalii has been named in the Wallabies starting lineup as one of several changes for Monday mornings clash with Scotland,News AU,2024-11-23T07:24:10.997557,wallaby make mass change crunch game . joseph suaalii named wallaby starting lineup one several change monday morning clash scotland,0.0,Neutral
One that got away Wallabies stumbling block,The Wallabies are a man down in their quest to create a 40year first with a former Junior Wallabies star now standing in their way,News AU,2024-11-23T07:24:10.997557,one got away wallaby stumbling block . wallaby man quest create 40year first former junior wallaby star standing way,-0.2023,Neutral
Maher sprinter bolts home in The Meteorite,Exciting sprinter Nadal showed his Group 1 potential with a blistering win in The Meteorite at Cranbourne on Saturday,News AU,2024-11-23T07:24:10.997557,maher sprinter bolt home meteorite . exciting sprinter nadal showed group 1 potential blistering win meteorite cranbourne saturday,0.7906,Positive
Sixtime world champion dead at 65,A sixtime world champion has died suddenly in hospital as tributes came pouring in from the cycling community,News AU,2024-11-23T07:24:10.997557,sixtime world champion dead 65. sixtime world champion died suddenly hospital tribute came pouring cycling community,-0.0258,Neutral
