Title,Description,Source,Fetched Date
UKUS tariff deal begins but still no news on steel,The UKs trade agreement is the first among nations since Trumps Liberation Day tariffs,BBC Business,2025-06-30T07:29:31.573600
China partially lifts ban on Japanese seafood imports,It imposed the ban in 2023 over Japans release of treated waste water from the Fukushima nuclear plant,BBC Business,2025-06-30T07:29:31.573600
World of Business,Gain the leading edge with global insights for the boardroom and beyond in your inbox every Wednesday,BBC Business,2025-06-30T07:29:31.573600
Nearly 12 million estimated to lose health coverage under Trump budget bill,The spending plan could also add nearly 33tn 24tn in debt according to nonpartisan analysis,BBC Business,2025-06-30T07:29:31.573600
A look at the key items in Trumps big beautiful bill,The tax and spending bill which is set for a Senate vote includes sweeping changes to taxes Social Security and more,BBC Business,2025-06-30T07:29:31.573600
The global environmental award hit by accusations of greenwashing,US business Dr Bronners has criticised the B Corp scheme for allowing in too many multinationals,BBC Business,2025-06-30T07:29:31.573600
Boeings 787 Dreamliner was deemed the safest of planes The whistleblowers were always less sure,Long before the Air India tragedy the cause of which is still to be determined people who had worked on the 787 had raised concerns about the production standards,BBC Business,2025-06-30T07:29:31.573600
Trump says he has a group of very wealthy people to buy TikTok,Trump says he thinks Chinas president will probably approve a sale to the unidentified group,BBC Business,2025-06-30T07:29:31.573600
Why your old mobile phone may be polluting Thailand,The Asian nation is importing thousands of tonnes of electronic waste per year despite a ban,BBC Business,2025-06-30T07:29:31.573600
Russias economy is down but not out,The countrys economy has been surprisingly resilient but there are underlying problems,BBC Business,2025-06-30T07:29:31.573600
Markets near record highs despite headwinds 26 Jun 2025,Expert says investors are buying into reduced uncertainty,BBC Business,2025-06-30T07:29:31.573600
Should we be letting flies eat our food waste,In Lithuania and Australia hungry fly larvae are used to process food waste into useful protein,BBC Business,2025-06-30T07:29:31.573600
In business indecision is killer Canadian firms seek certainty in tariff war,Intense USCanada negotiations for a potential new trade and security deal have hit a snag ahead of a midJuly deadline,BBC Business,2025-06-30T07:29:31.573600
We have all the cards Trump says he is ending Canada trade talks,Canada had been hoping to secure a trade deal with the US next month to avoid steep tariffs,BBC Business,2025-06-30T07:29:31.573600
I tell my children not to play so we save money on soap,High inflation and a costofliving crisis means many Malawians like Suzanna Kathumba face tough choices,BBC Business,2025-06-30T07:29:31.573600
Japan loves them And now theyre in the UK strawberries and cream sandwiches,Serving strawberries in a sandwich might sound unusual in the UK but its nothing new in Japan,BBC Business,2025-06-30T07:29:31.573600
We cant do without these people Trumps migrant crackdown has businesses worried,President Donald Trumps crackdown on immigrants could have serious economic repercussions,BBC Business,2025-06-30T07:29:31.573600
Lotus considering shifting UK production to US,The BBC understands the car maker is considering the move amid the introduction of US tariffs,BBC Business,2025-06-30T07:29:31.573600
Playing with FIRE How to quit work and retire in your 30s,A personal finance strategy popular among millennials is helping them to quit their job and retire decades early,BBC Business,2025-06-30T07:29:31.573600
Boomerang CEOs Do they ever succeed,Five years after being ousted from WeWork Adam Neumann wants to rebuy the nowbankrupt business,BBC Business,2025-06-30T07:29:31.573600
How industry leaders transformed their career,The BBCs Katty Kay has spoken to successful changemakers to ask what made them pivot in their career,BBC Business,2025-06-30T07:29:31.573600
Women were the original beer brewers what changed,Today the beer industry is maledominated but it wasnt always so,BBC Business,2025-06-30T07:29:31.573600
How waiting alters our perception of time,Expert advice on how to get through a waiting period,BBC Business,2025-06-30T07:29:31.573600
Do the superrich deserve their wealth,Should there be a cap on billionaires wealth and their inheritances,BBC Business,2025-06-30T07:29:31.573600
Four simple hacks to succeed in every conversation,A career coach a choreographer a chef and a dragon boat captain offer advice on giving critical feedback,BBC Business,2025-06-30T07:29:31.573600
Solo and hybrid work Navigating our future and new normal,Covid19 reshaped the way we live and work We rethink solo working and explore the future of worklife,BBC Business,2025-06-30T07:29:31.573600
Can supersonic flight ever be sustainable,How a new era of quiet net zero supersonic airliners could revolutionise the aviation industry,BBC Business,2025-06-30T07:29:31.573600
Commencement speech The surprising pitfall of your passions,Students are graduating in the US this week The commencement speeches might lead them into questionable choices,BBC Business,2025-06-30T07:29:31.573600
A desk full of descriptions for your work colleagues,These are the long lost words youve been waiting for to describe your colleagues,BBC Business,2025-06-30T07:29:31.573600
Veterinarian suicide rates are very high Why,Veterinarian professionals are committing suicide at a higher rate than the general population,BBC Business,2025-06-30T07:29:31.573600
ASMR How whispering took over the internet,We meet the creators behind the current ASMR boom,BBC Business,2025-06-30T07:29:31.573600
UK car production plunges to 76year low for May,Exports to the US halved as President Donald Trumps tariffs caused some UK car makers to halt shipments,BBC Business,2025-06-30T07:29:31.573600
Nike pledges to cut reliance on Chinese factories,Company executives say the sportwear giant will cut its reliance on producing goods in China to ease the impact of US trade policies,BBC Business,2025-06-30T07:29:31.573600
Satirical Bezos mannequins pop up in Venice ahead of wedding,Unflattering installations depicting Amazon founder and his bridetobe are attracting attention in the Italian city,BBC Business,2025-06-30T07:29:31.573600
The woman who could bust Trumps big beautiful bill,The Senate parliamentarian often called a referee has thrown a spanner in Trumps tax bill,BBC Business,2025-06-30T07:29:31.573600
Canada passes law fasttracking nationbuilding projects to counter Trump,The government hopes the legislation will reduce dependence on the US but has drawn criticism from environmental groups,BBC Business,2025-06-30T07:29:31.573600
Rising school fees push Indian families to the brink,Parents accuse private schools of steep fee raises which are stretching budgets to breaking point,BBC Business,2025-06-30T07:29:31.573600
Pound hits near 4year high as Trump rattles dollar,A report that the US President could name the new head of the central bank early raises concerns over its independence,BBC Business,2025-06-30T07:29:31.573600
Anna Wintour stepping back as US Vogues editorinchief,Dame Anna who has been editorinchief for 37 years will continue to hold a senior role at the company,BBC Business,2025-06-30T07:29:31.573600
Made in the USA reference disappears from Trump phone listing,Trump Mobile maintains the gold smartphone will be made in the US despite the changed wording on its website,BBC Business,2025-06-30T07:29:31.573600
Glastonbury Organizers Appalled by Bob Vylan Chants There Is No Place for Antisemitism,The rap duo has come under fire for encouraging audiences at the UK music festival to join in on shouting death to the IDF during their set,Hollywood Reporter,2025-06-30T07:29:32.525948
Charli xcx Burns Brat at Packed Glastonbury Set I Dont Know Who I Am If Its Over,Gracie Abrams on Worthy Farm this weekend as a performer also was selected as the Grammy winners Apple girl on Saturday night,Hollywood Reporter,2025-06-30T07:29:32.525948
Paul Simon Cancels Philadelphia Concerts Due to Chronic and Intense Back Pain,A statement posted to the singers official Instagram account revealed he would be undergoing a minor surgical procedure in the coming days,Hollywood Reporter,2025-06-30T07:29:32.525948
Walter Scott Jr Vocalist of The Whispers Dies at 81,The singer was known for hit tracks like And the Beat Goes On and Rock Steady,Hollywood Reporter,2025-06-30T07:29:32.525948
Kneecap Shocks as Expected With Raucous Glastonbury Set The BBC Editor Is Going to Have Some Job,The Irish rap trio has drawn widespread criticism in recent months with UK politicians criticizing the choice to allow them to perform at the musical festival,Hollywood Reporter,2025-06-30T07:29:32.525948
Dolly Partons Vegas Residency Sold Out in 90 Minutes Heres How Fans Can Still Snag Tickets,The sixshow engagement marks the country legends first extended run in 32 years Heres how to secure seats with THRexclusive promo codes,Hollywood Reporter,2025-06-30T07:29:32.525948
Matty Healy Gives Mixed Message on Politics as The 1975 Kick Off Glastonbury Headline Sets,I know Im meant to be a rockstar but this is really scary and Im really nervous said the bands frontman to the 100000 crowd Friday night,Hollywood Reporter,2025-06-30T07:29:32.525948
Rebekah Del Rio Singer in Mulholland Drives Club Silencio Scene Dies at 57,The musician first crossed paths with the legendary late director David Lynch thanks to agent Brian Loucks,Hollywood Reporter,2025-06-30T07:29:32.525948
Sean Combs Son Releases New Song Diddy Free With Kanye West,Before Diddys team gave closing arguments in his criminal trial on Friday West and Christian Combs released the song through the EP Never Stop,Hollywood Reporter,2025-06-30T07:29:32.525948
Germany Arrests Syrian National Over 2024 Terrorist Plot At Taylor Swift Show,The arrest comes nearly a year after the thwarted plot forced Swift to cancel three Eras Tour concerts in Vienna,Hollywood Reporter,2025-06-30T07:29:32.525948
Diddys Top Attorney Admonished by Judge After SarcasmHeavy Closing Argument,Following Thursdays fourandahalfhour salvo from prosecutors Sean Combs top defense lawyer struck a mocking tone on Friday,Hollywood Reporter,2025-06-30T07:29:32.525948
Penny Noble Veteran Talent Agent Dies,She founded Noble Talent Management in Toronto the forerunner of major Canadian banner Noble Caplan Abrams,Hollywood Reporter,2025-06-30T07:29:32.525948
