Title,Description,Source,Fetched Date,Combined Text,Score,Sentiment
Rivellino wins the 2025 Inglis Millennium,Rivellino named after a World Cupwinning Brazilian footballer could get his chance at Sydneys juvenile triple crown after a barnstorming win in the Inglis Millennium at Randwick,News AU,2025-02-08T07:21:36.556351,rivellino win 2025 inglis millennium . rivellino named world cupwinning brazilian footballer could get chance sydney juvenile triple crown barnstorming win inglis millennium randwick,0.8625,Positive
Reds primed for Super season,The Reds dont want to waste their good work on a successful preseason tour of the United Kingdom when they kickoff their Super Rugby Pacific season later this month,News AU,2025-02-08T07:21:36.556351,red primed super season . red dont want waste good work successful preseason tour united kingdom kickoff super rugby pacific season later month,0.9338,Positive
Wallabies in turmoil as coach calls it quits,Rugby Australia is back on the hunt for yet another new coach after Joe Schmidt confirmed he will step down ahead of the World Cup,News AU,2025-02-08T07:21:36.556351,wallaby turmoil coach call quits . rugby australia back hunt yet another new coach joe schmidt confirmed step ahead world cup,-0.3612,Negative
Olympian to learn familys pain in court,The heartbroken family of an Olympic cyclist are expected to deliver victim impact statements detailing their pain and grief to the court,News AU,2025-02-08T07:21:36.556351,olympian learn family pain court . heartbroken family olympic cyclist expected deliver victim impact statement detailing pain grief court,-0.9451,Negative
Absolutely ridiculous Olympics bomb drops,Donald Trump is pushing International Olympic Committee to change its rules on transgender athletes after he signed a ban of his own,News AU,2025-02-08T07:21:36.556351,absolutely ridiculous olympics bomb drop . donald trump pushing international olympic committee change rule transgender athlete signed ban,-0.8991,Negative
