Title,Description,Source,Fetched Date
Melania Trump launches her own cryptocurrency,Melania is announced a day after Presidentelect Donald Trump launched his own cryptocurrency Trump,BBC Business,2025-01-20T07:23:12.474754
Working from home not proper work exAsda boss,Lord Rose says it harms productivity but expert says hybrid work can be as good as fulltime in the office,BBC Business,2025-01-20T07:23:12.474754
World of Business,Gain the leading edge with global insights for the boardroom and beyond in your inbox every Wednesday,BBC Business,2025-01-20T07:23:12.474754
Toyota unit to settle emissions scandal for 16bn,The truck company will also be banned from importing its diesel engines into the US for five years,BBC Business,2025-01-20T07:23:12.474754
Has Trump promised too much on US economy,He won the election partly to fix inflation but Trump may find his pledges on prices and tariffs conflict say experts,BBC Business,2025-01-20T07:23:12.474754
TikTok restores service in US after Trump pledge,TikTok is resuming services to its 170 million users in US after Presidentelect Donald Trump said he would give the app a reprieve,BBC Business,2025-01-20T07:23:12.474754
Shein backlash fails to deter shoppers I spend 20 a month,Some young shoppers will continue to buy from the fast fashion giant despite concerns over how workers are treated,BBC Business,2025-01-20T07:23:12.474754
Trump launches cryptocurrency with price rocketing,Hours after its launch the market capitalisation for Trump reached nearly 55bn 45bn,BBC Business,2025-01-20T07:23:12.474754
Irreplaceable The real cost of losing TikTok,With an American TikTok ban threatening the app users and creators reflect on what it did for internet culture and what their online worlds might look like without it,BBC Business,2025-01-20T07:23:12.474754
Three reasons Trump tariffs arent Chinas only problem,Chinas economy has hit the governments 5 growth target for 2024 in the face of multiple challenges,BBC Business,2025-01-20T07:23:12.474754
Bank performance signals boost to US economy 16 Jan 2025,Jason Betz from Ameriprise Financial says that there is untapped resilience in the American economy,BBC Business,2025-01-20T07:23:12.474754
Good Bad Billionaire,Simon Jack and Zing Tsjeng find out how the worlds billionaires made their money and then judge them Are they good bad or just another billionaire Listen to season two New episodes released on Mondays,BBC Business,2025-01-20T07:23:12.474754
How one product made a multimillion dollar brand,Nell Diamond CEO of Hill House Home shares how her small business skyrocketed to global success with the launch of the Nap Dress in 2019,BBC Business,2025-01-20T07:23:12.474754
Mark Carney the unreliable boyfriend who ran UKs central bank,Carney is now running for the Liberal Party leadership in Canada What does his time in London tell us,BBC Business,2025-01-20T07:23:12.474754
US Supreme Court upholds TikTok ban law,A law passed last year requires TikToks Chinese parent company to sell the video platform or face a ban,BBC Business,2025-01-20T07:23:12.474754
TikTok says it will go dark on Sunday without US government action,The Supreme Court earlier upheld a law that would ban the video app in the US unless its Chinese parentcompany sells it,BBC Business,2025-01-20T07:23:12.474754
Al Fayed claimed poor health when police investigated abuse,Pelham Spong reported to police in 2017 that Mohammed Al Fayed had assaulted her a decade before but the investigation was shut down,BBC Business,2025-01-20T07:23:12.474754
IMF warns on Trumps plans but upgrades UK outlook,Trumps policies could benefit the US but not the rest of the world the IMF says,BBC Business,2025-01-20T07:23:12.474754
US grounds SpaceXs Starship after test flight explosion,The rockets upper stage disintegrated over the Caribbean forcing airline flights to alter course,BBC Business,2025-01-20T07:23:12.474754
Playing with FIRE How to quit work and retire in your 30s,A personal finance strategy popular among millennials is helping them to quit their job and retire decades early,BBC Business,2025-01-20T07:23:12.474754
Boomerang CEOs Do they ever succeed,Five years after being ousted from WeWork Adam Neumann wants to rebuy the nowbankrupt business,BBC Business,2025-01-20T07:23:12.474754
How industry leaders transformed their career,The BBCs Katty Kay has spoken to successful changemakers to ask what made them pivot in their career,BBC Business,2025-01-20T07:23:12.474754
Women were the original beer brewers what changed,Today the beer industry is maledominated but it wasnt always so,BBC Business,2025-01-20T07:23:12.474754
How waiting alters our perception of time,Expert advice on how to get through a waiting period,BBC Business,2025-01-20T07:23:12.474754
Do the superrich deserve their wealth,Should there be a cap on billionaires wealth and their inheritances,BBC Business,2025-01-20T07:23:12.474754
Four simple hacks to succeed in every conversation,A career coach a choreographer a chef and a dragon boat captain offer advice on giving critical feedback,BBC Business,2025-01-20T07:23:12.474754
Solo and hybrid work Navigating our future and new normal,Covid19 reshaped the way we live and work We rethink solo working and explore the future of worklife,BBC Business,2025-01-20T07:23:12.474754
Can supersonic flight ever be sustainable,How a new era of quiet net zero supersonic airliners could revolutionise the aviation industry,BBC Business,2025-01-20T07:23:12.474754
Commencement speech The surprising pitfall of your passions,Students are graduating in the US this week The commencement speeches might lead them into questionable choices,BBC Business,2025-01-20T07:23:12.474754
ASMR How whispering took over the internet,We meet the creators behind the current ASMR boom,BBC Business,2025-01-20T07:23:12.474754
A desk full of descriptions for your work colleagues,These are the long lost words youve been waiting for to describe your colleagues,BBC Business,2025-01-20T07:23:12.474754
Veterinarian suicide rates are very high Why,Veterinarian professionals are committing suicide at a higher rate than the general population,BBC Business,2025-01-20T07:23:12.474754
Fears empty restaurant TikTok trend could last,There are fears that tax and wage rises mean restaurants and bars will be quieter than usual all year,BBC Business,2025-01-20T07:23:12.474754
Americans and Chinese share jokes on alternative TikTok as US ban looms,RedNotes Chinese users say it is the first time they have been able to speak directly to Americans online,BBC Business,2025-01-20T07:23:12.474754
Apple suspends errorstrewn AI generated news alerts,The tech giant was facing pressure to pull the feature after it made repeated mistakes summarising headlines,BBC Business,2025-01-20T07:23:12.474754
US FDA officially authorises Zyn nicotine pouches for sale,The pouches are used by less than 2 of US teens the FDA said in granting the application allowing them to continue to be sold,BBC Business,2025-01-20T07:23:12.474754
Global growth forecast to flatline as tariffs add to strains,The World Bank predicts global economic growth of 27 this year amid concerns living standards will struggle to improve,BBC Business,2025-01-20T07:23:12.474754
Mark Carney runs for leader of Canadas Liberal Party,The former central banker for the UK and Canada pitched himself as a someone who can help a country navigate economic challenges,BBC Business,2025-01-20T07:23:12.474754
Trump will put measures in place to stop TikTok ban top adviser says,Incoming National Security Adviser Mike Waltz says the law allows a 90day grace period for the apps Chinese owner,BBC Business,2025-01-20T07:23:12.474754
United Health boss defends firm in first earnings results since CEO killing,Sir Andrew Witty says there is heightened energy to address customers frustrations,BBC Business,2025-01-20T07:23:12.474754
Jeff Bezos blasts into commercial space race with rocket launch,The Amazon bosss space company is vying to challenge the dominance of Elon Musks SpaceX,BBC Business,2025-01-20T07:23:12.474754
LA Realtors to the Rescue Im a Public Servant Now,The citys Alist brokers are ignoring old rivalries and working round the clock to house the citys displaced elite,Hollywood Reporter,2025-01-20T07:23:12.799537
Fire Escape Where Hollywood Is Taking Shelter,From Palm Springs to the Peninsula Hotel heres where celebrities and industry insiders are hunkering down to evade the flames,Hollywood Reporter,2025-01-20T07:23:12.799537
Snoop Dogg Blasted for Performing at Crypto Ball Ahead of Donald Trump Inauguration,Despite publicly vowing to roast anyone who endorsed Trump during his previous administration the rapper topped the bill at a Washington DC event honoring the presidentelect,Hollywood Reporter,2025-01-20T07:23:12.799537
ATTNs Matthew Segal Archewell Alum Mandana Dayani Appointed to Holocaust Memorial Council Board of Trustees,Outgoing President Joe Biden made the announcement ahead of his official exit,Hollywood Reporter,2025-01-20T07:23:12.799537
SoCal Fire Fund Auctioning Off Lunch With Julia Roberts and Only Murders in the Building Set Visit to Support Relief Efforts,The wildfire relief fund was launched by the CAA Foundation CORE and the Los Angeles Unified School District Education Foundation,Hollywood Reporter,2025-01-20T07:23:12.799537
Donald Trump Says He Will Probably Travel to LA After Inauguration to View Wildfire Aftermath,I thought it would be better if I went as president the presidentelect told NBC News,Hollywood Reporter,2025-01-20T07:23:12.799537
Menendez Brothers Sentencing Postponed Due to Raging LA Wildfires,The DAs office announced Friday yet another turn in the twisted saga of the Menendez brothers,Hollywood Reporter,2025-01-20T07:23:12.799537
This Just In TV News Still Matters,The LA fires have put oldfashioned broadcast reportage back in the spotlight with both national correspondents like NBCs Jacob Soboroff and a slew of local newscasters proving that legacy media isnt over just yet,Hollywood Reporter,2025-01-20T07:23:12.799537
What Fire Wants Understanding the Enemy,What long has been considered merely a chemical reaction perhaps is best compared to another alltoofamiliar scourge a virus,Hollywood Reporter,2025-01-20T07:23:12.799537
LAs Now in a Doom Era Itll Boom Again,History reminds us that this town eventually flips the script on its apocalyptic storyline,Hollywood Reporter,2025-01-20T07:23:12.799537
Rick Caruso Tells Bill Maher He Predicted Palisades Fire Im So Sad That I Was Right,The former LA mayoral candidate said on Real Time that people should be asking Why wasnt more done to prevent the Los Angeles wildfires,Hollywood Reporter,2025-01-20T07:23:12.799537
Speaker Mike Johnson Suggests Conditions Needed on Federal Aid for LA Wildfires,Johnson also blasted Californias Democratic leadership saying It appears to us that state and local leaders were derelict in their duty,Hollywood Reporter,2025-01-20T07:23:12.799537
Djokovic scandal turns as host spills secret,More details have been revealed about Novak Djokovics boycott of a postmatch interview with Jim Courier as the fallout from the incident continues,News AU,2025-01-20T07:23:15.286695
New age Warner message driving finals run,The two teams who have catapulted themselves in to the Big Bash finals have one very big thing in common,News AU,2025-01-20T07:23:15.286695
New skipper support amid Smith injury,The sight of Steve Smith in an elbow brace across the weekend could open the door for a cult hero to take the reins in Sri Lanka,News AU,2025-01-20T07:23:15.286695
F1 stars 4m Ferrari smashed,A quick test drive in Monaco turned disastrous for one of the biggest names in Formula 1,News AU,2025-01-20T07:23:15.286695
Boneheaded vs mental warfare Whos right in Aus Open war,Tony Jones taunt at Novak Djokovic and his fans has ignited the Australian Open off the court but who is really in the right Scott Gullan and Julian Linden make the case for both,News AU,2025-01-20T07:23:15.286695
Sick star pushes through pain,World no 1 Jannik Sinner has survived a midmatch health scare to keep his title defence alive at Melbourne Park,News AU,2025-01-20T07:23:15.286695
Most popular ExDogs dominate early SuperCoach teams,The early SuperCoach AFL team picker has been open since December and some clear trends are emerging See the exclusive ownership numbers here,News AU,2025-01-20T07:23:15.286695
Weak boy Star torn to shreds over AO act,Media personality Abbie Chatfield has taken the gloves off and slapped down an AFL player over a comment he left on Instagram,News AU,2025-01-20T07:23:15.286695
Broncos cult hero set to make NRL history,Former Brisbane Broncos hardman Sam Thaiday has issued a blunt warning as he prepares to step outside of his comfort zone,News AU,2025-01-20T07:23:15.286695
Hayne named for return team list revealed,Jarryd Hayne is set to feature in an upcoming rugby league tournament but his incredible comeback wont end there,News AU,2025-01-20T07:23:15.286695
Scares me most Shayna Jacks biggest fear,Olympian Shayna Jack has endured a horror past five years with the swimmer revealing what terrifies her more than anything,News AU,2025-01-20T07:23:15.286695
Steph Rice shares stunning honeymoon pics,Aussie swimming legend Stephanie Rice is living her best life on honeymoon after getting married and celebrating in the style,News AU,2025-01-20T07:23:15.286695
Disgusting US turns on NFLs golden child,NFL fans have turned on Patrick Mahomes after the superstar quarterback was at the centre of some fiery playoffs controversy,News AU,2025-01-20T07:23:15.286695
Chiefs quest for historic NFL threepeat continues as star shoves coach in shocking moment,An NFL player was captured sensationally shoving one of his own coaches in the opening minute of the Kansas City Chiefs divisional round win over the Houston Texans,News AU,2025-01-20T07:23:15.286695
Never played the victim Ange takes blame for Spurs horror run,After a humbling loss to relegation battling Everton Tottenham manager Ange Postecoglou says it is his responsibility to turn around a miserable Premier League season,News AU,2025-01-20T07:23:15.286695
EPL giants stance on sacking Aussie Ange,Ange Postecoglous future in the Premier League is in serious doubt after his side were beaten 32 by lowly Everton on Monday morning,News AU,2025-01-20T07:23:15.286695
History made as champ stuns UFC world,Two champions have cemented their place among the greats with displays left that jaws on the floor across the entire UFC world,News AU,2025-01-20T07:23:15.286695
2bn Verstappen bombshell rocks F1,A report has stunned the entire F1 world with reports Max Verstappen has been offered the biggest deal in sporting history,News AU,2025-01-20T07:23:15.286695
Red hot Vasiljevic leads 36ers thumping of Cairns,Dejan Vasiljevics equal career best shooting display from three has powered the Adelaide 36ers to a monster win against Cairns Catch up on all the latest news from round 17,News AU,2025-01-20T07:23:15.286695
Days drive clear after costly finalhole blunder,Jason Day cost himself an extra sixfigures with a finalhole fadeout in California but still made a tidy sum for his podium finish,News AU,2025-01-20T07:23:15.286695
Newcastle previews Son of dud could be Soo good,A Gerald Ryan gelding whose dam was beaten by more than 60 lengths combined in bush maidens will make his debut at Newcastle on Tuesday after a couple of eyecatching trials,News AU,2025-01-20T07:23:15.286695
McDermott and Wright to again lead Reds,The Queensland Reds have named the same cocaptains for their 2025 Super Rugby Pacific season,News AU,2025-01-20T07:23:15.286695
Wallabies star confident of securing new deal,A leading Wallaby is yet to secure his future beyond this year but he seems anything but concerned about it,News AU,2025-01-20T07:23:15.286695
Fan hospitalised in awful freak accident,A devastating crash has marred Saturdays Tour Down Under leaving a fan hospitalized with serious injuries,News AU,2025-01-20T07:23:15.286695
