Title,Description,Source,Fetched Date,Combined Text,Score,Sentiment
Hollywood Stars from Marginalized Communities Urge Fellow Americans to Get Out to Vote in New PSA Exclusive,A halfdozen showbiz figures each of whom hails from a marginalized community within America have recorded a public service announcement that is launching on Tuesday which is National Voter Registration Day and exactly seven weeks to the day from the 2024 presidential election calling upon their fellow Americans to register to vote Participants in,Hollywood Reporter,2024-09-18T07:22:36.164805,hollywood star marginalized community urge fellow american get vote new psa exclusive . halfdozen showbiz figure hail marginalized community within america recorded public service announcement launching tuesday national voter registration day exactly seven week day 2024 presidential election calling upon fellow american register vote participant,0.2023,Neutral
Sean Diddy Combs Arrested in New York Following Grand Jury Indictment,Sean Diddy Combs was arrested in New York City on Monday The Hollywood Reporter has confirmed The music mogul was taken into custody following a grand jurys indictment though the specific charges were not clear We are disappointed with the decision to pursue what we believe is an unjust prosecution of Mr Combs by the,Hollywood Reporter,2024-09-18T07:22:36.164805,sean diddy comb arrested new york following grand jury indictment . sean diddy comb arrested new york city monday hollywood reporter confirmed music mogul taken custody following grand jury indictment though specific charge clear disappointed decision pursue believe unjust prosecution mr comb,-0.802,Negative
White House Responds to Elon Musk Post Wondering Why No One Is Trying to Assassinate BidenKamala,The White House has responded to an inflammatory post on X formerly Twitter by its owner Elon Musk who in the wake of an apparent second assassination attempt on former President Donald Trump this weekend suggested that it doesnt make sense that there havent also been publicly known attempts made on the lives of President,Hollywood Reporter,2024-09-18T07:22:36.164805,white house responds elon musk post wondering one trying assassinate bidenkamala . white house responded inflammatory post x formerly twitter owner elon musk wake apparent second assassination attempt former president donald trump weekend suggested doesnt make sense havent also publicly known attempt made life president,-0.5994,Negative
Janes Addiction Cancels Remaining Tour Dates After Onstage Fight,Janes Addiction has canceled all remaining dates on its North American tour after an onstage confrontation last week between frontman Perry Farrell and guitarist Dave Navarro led to a fight involving all four band members and brought their performance in Boston to an abrupt end On Monday Janes Addiction released a statement regarding the cancellation,Hollywood Reporter,2024-09-18T07:22:36.164805,janes addiction cancel remaining tour date onstage fight . janes addiction canceled remaining date north american tour onstage confrontation last week frontman perry farrell guitarist dave navarro led fight involving four band member brought performance boston abrupt end monday janes addiction released statement regarding cancellation,-0.8176,Negative
Suspect in Apparent Trump Assassination Attempt Camped Outside Golf Course for 12 Hours Records Show,The man suspected in an apparent assassination attempt targeting Donald Trump camped outside a golf course with food and a rifle for nearly 12 hours lying in wait for the former president before a Secret Service agent thwarted the potential attack and opened fire according to court documents filed Monday Ryan Wesley Routh 58 faces,Hollywood Reporter,2024-09-18T07:22:36.164805,suspect apparent trump assassination attempt camped outside golf course 12 hour record show . man suspected apparent assassination attempt targeting donald trump camped outside golf course food rifle nearly 12 hour lying wait former president secret service agent thwarted potential attack opened fire according court document filed monday ryan wesley routh 58 face,-0.9633,Negative
Disgraced ExBBC Anchor Huw Edwards Handed 6Month Suspended Prison Sentence Over Child Sex Abuse Images,Former BBC News presenter Huw Edwards has been handed a sixmonth prison sentence suspended for two years after pleading guilty to making indecent images of children The 63yearold said he was profoundly sorry for the repugnant images before he was sentenced Monday at Londons Westminster Magistrates Court in a case that has shocked the UK,Hollywood Reporter,2024-09-18T07:22:36.164805,disgraced exbbc anchor huw edward handed 6month suspended prison sentence child sex abuse image . former bbc news presenter huw edward handed sixmonth prison sentence suspended two year pleading guilty making indecent image child 63yearold said profoundly sorry repugnant image sentenced monday london westminster magistrate court case shocked uk,-0.9747,Negative
Emmys Shelley Duvall Omitted From In Memoriam Segment,The In Memoriam segment of the 75th Primetime Emmy Awards on Sunday paid tribute to a host of smallscreen stars who have died in the past year but users on social media were quick to point out the notable names that did not make the montage The poignant segment saw rapper Jelly Roll say a,Hollywood Reporter,2024-09-18T07:22:36.164805,emmy shelley duvall omitted memoriam segment . memoriam segment 75th primetime emmy award sunday paid tribute host smallscreen star died past year user social medium quick point notable name make montage poignant segment saw rapper jelly roll say,-0.0258,Neutral
Tito Jackson Original Member of the Jackson 5 Dies at 70,Tito Jackson the brother of Michael and Janet Jackson and a singer and guitarist who was part of the highly influential pop bands The Jackson 5 and later The Jacksons has died He was 70 Longtime Jackson family friend and manager Steve Manning told Entertainment Tonight that Tito Jackson died Sunday while driving from New,Hollywood Reporter,2024-09-18T07:22:36.164805,tito jackson original member jackson 5 dy 70. tito jackson brother michael janet jackson singer guitarist part highly influential pop band jackson 5 later jackson died 70 longtime jackson family friend manager steve manning told entertainment tonight tito jackson died sunday driving new,0.5095,Positive
Jon Stewart Calls for a No Shooting Policy Following Second Assassination Attempt on Trump,While being interviewed backstage at the 2024 Emmys in Los Angeles Jon Stewart commented on the assassination attempt reportedly made on former President Donald Trump on Sunday suggesting a no shooting policy be agreed upon by all In Florida on Sunday a man with a rifle was spotted by Secret Service agents as Trump played,Hollywood Reporter,2024-09-18T07:22:36.164805,jon stewart call shooting policy following second assassination attempt trump . interviewed backstage 2024 emmy los angeles jon stewart commented assassination attempt reportedly made former president donald trump sunday suggesting shooting policy agreed upon florida sunday man rifle spotted secret service agent trump played,-0.6486,Negative
23andMe sees independent board directors quit en masse,23andMe the personal genomics company went public in early 2021 via a merger with a blank check company that valued it at 35 billion Then its fortunes began to sink,TechCrunch,2024-09-18T07:22:36.350640,23andme see independent board director quit en masse . 23andme personal genomics company went public early 2021 via merger blank check company valued 35 billion fortune began sink,0.4404,Positive
Governor Newsom on California AI bill SB 1047 I cant solve for everything,California Governor Gavin Newsom said there are 38 bills on his desk that would create laws around artificial intelligence on Tuesday but one looms larger than all of them SB,TechCrunch,2024-09-18T07:22:36.350640,governor newsom california ai bill sb 1047 cant solve everything . california governor gavin newsom said 38 bill desk would create law around artificial intelligence tuesday one loom larger sb,0.4035,Positive
Amazon taps longtime exec to lead India business as competition intensifies,Amazon has named longtime executive Samir Kumar as the new head of its India consumer business a month after its domestic business head resigned,TechCrunch,2024-09-18T07:22:36.350640,amazon tap longtime exec lead india business competition intensifies . amazon named longtime executive samir kumar new head india consumer business month domestic business head resigned,0.1027,Neutral
Al Gore roasts corporations and politicians comparing their climate crisis promises to New Years resolutions,Al Gore has enjoyed a very successful career including as a US senator US Vice President US presidential nominee and even Nobel Peace Prize winner in 2007 for informing the,TechCrunch,2024-09-18T07:22:36.350640,al gore roast corporation politician comparing climate crisis promise new year resolution . al gore enjoyed successful career including u senator u vice president u presidential nominee even nobel peace prize winner 2007 informing,0.9423,Positive
Californias 5 new AI laws crack down on election deepfakes and actor clones,On Tuesday California Governor Gavin Newsom signed some of Americas toughest laws yet regulating the artificial intelligence sector Three of these laws crack down on AI deepfakes that could influence,TechCrunch,2024-09-18T07:22:36.350640,california 5 new ai law crack election deepfakes actor clone . tuesday california governor gavin newsom signed america toughest law yet regulating artificial intelligence sector three law crack ai deepfakes could influence,0.4215,Positive
Intuitive Machines lands 48B NASA contract to build Earthmoon communications infrastructure,NASA wants to establish a permanent human presence on the moon but right now astronauts have to be in direct line of sight with Earth to phone home The space,TechCrunch,2024-09-18T07:22:36.350640,intuitive machine land 48b nasa contract build earthmoon communication infrastructure . nasa want establish permanent human presence moon right astronaut direct line sight earth phone home space,0.0772,Neutral
JPMorgan could take over Goldmans Apple Card business,JPMorgan Chase is in talks to take over the Apple Card business from Goldman Sachs The Wall Street Journal reports Goldman has issued credit for the Apple Card since its,TechCrunch,2024-09-18T07:22:36.350640,jpmorgan could take goldman apple card business . jpmorgan chase talk take apple card business goldman sachs wall street journal report goldman issued credit apple card since,0.3818,Positive
Why United chose SpaceXs Starlink to power its free WiFi,Late last week United Airlines announced that it signed an agreement with Elon Musks SpaceX to bring its Starlink internet service to its entire fleet and for the first time offer free WiFi to all passengers To dig a bit deeper into why United went with Starlink what,TechCrunch,2024-09-18T07:22:36.350640,united chose spacexs starlink power free wifi . late last week united airline announced signed agreement elon musk spacex bring starlink internet service entire fleet first time offer free wifi passenger dig bit deeper united went starlink,0.9531,Positive
Patreon launches features to automate away creators administrative workload and help them make more money,Every month 400000 free members upgrade to paid memberships the company says According to Patreon Autopilot improved the rate of freetopaid membership upgrades by an average of 19 in testing,TechCrunch,2024-09-18T07:22:36.350640,patreon launch feature automate away creator administrative workload help make money . every month 400000 free member upgrade paid membership company say according patreon autopilot improved rate freetopaid membership upgrade average 19 testing,0.8442,Positive
BlackRock and Microsoft are reportedly planning a 30B AIfocused megafund,Investment powerhouse BlackRock is set to launch a massive AIfocused fund exceeding 30 billion in collaboration with Microsoft and the Abu Dhabibacked investment outfit MGX the FT reported today According,TechCrunch,2024-09-18T07:22:36.350640,blackrock microsoft reportedly planning 30b aifocused megafund . investment powerhouse blackrock set launch massive aifocused fund exceeding 30 billion collaboration microsoft abu dhabibacked investment outfit mgx ft reported today according,0.0,Neutral
Neuralinks breakthrough device clearance from FDA does not mean it has cured blindness,Neuralink the Elon Muskowned braincomputer interface company on Tuesday received breakthrough device clearance from the FDA But this does not mean the outfit has developed a cure for blindness no,TechCrunch,2024-09-18T07:22:36.350640,neuralinks breakthrough device clearance fda mean cured blindness . neuralink elon muskowned braincomputer interface company tuesday received breakthrough device clearance fda mean outfit developed cure blindness,0.0,Neutral
Discord launches endtoend encrypted voice and video chats,Discord will now offer audio and video calls that even the company wont be able to listen in on,TechCrunch,2024-09-18T07:22:36.350640,discord launch endtoend encrypted voice video chat . discord offer audio video call even company wont able listen,-0.6597,Negative
Mozilla exits the fediverse and will shutter its Mastodon server in December,Users will be able to download their data or migrate their account to another Mastodon instance if they choose,TechCrunch,2024-09-18T07:22:36.350640,mozilla exit fediverse shutter mastodon server december . user able download data migrate account another mastodon instance choose,0.0,Neutral
Mistral launches a free tier for developers to test its AI models,Mistral AI launched a new free tier to let developers finetune and build test apps with the startups AI models the company announced in a blog post Tuesday The startup,TechCrunch,2024-09-18T07:22:36.350640,mistral launch free tier developer test ai model . mistral ai launched new free tier let developer finetune build test apps startup ai model company announced blog post tuesday startup,0.7964,Positive
Ursa Major nabs 125M from US Navy DoD for 3Dprinted rocket motors,Ursa Major a startup that produces rocket motors through 3D printing received a 125 million grant to develop new solidfuel rocket engines,TechCrunch,2024-09-18T07:22:36.350640,ursa major nabs 125m u navy dod 3dprinted rocket motor . ursa major startup produce rocket motor 3d printing received 125 million grant develop new solidfuel rocket engine,0.3612,Positive
Prukalpa Sankar on why empathy is her companys greatest asset,Do you remember what life was like before the cloud Before this AI revolution Prukalpa Sankar the cofounder and CEO of Atlan sat down with,TechCrunch,2024-09-18T07:22:36.350640,prukalpa sankar empathy company greatest asset . remember life like cloud ai revolution prukalpa sankar cofounder ceo atlan sat,0.8481,Positive
Snaps extremely large Spectacles bring impressive AR to developers at 99 a month,The Spectacles 5 are designed specifically for developers,TechCrunch,2024-09-18T07:22:36.350640,snap extremely large spectacle bring impressive ar developer 99 month . spectacle 5 designed specifically developer,0.5106,Positive
AWS shuts down DeepComposer its MIDI keyboard for AI music,AWS weird AIpowered keyboard experiment DeepComposer is no more In a blog post today the company announced its shutting down the 5yearold DeepComposer a physical MIDI piano and AWS service,TechCrunch,2024-09-18T07:22:36.350640,aws shuts deepcomposer midi keyboard ai music . aws weird aipowered keyboard experiment deepcomposer blog post today company announced shutting 5yearold deepcomposer physical midi piano aws service,-0.1779,Neutral
Snaps new AI feature lets you create Snapchat Lenses by simply describing them,Snap Snapchats parent company is expanding its suite of AI tools for creators At this years Snap Partner Summit in Santa Monica California Snap announced a new feature Easy Lens,TechCrunch,2024-09-18T07:22:36.350640,snap new ai feature let create snapchat lens simply describing . snap snapchats parent company expanding suite ai tool creator year snap partner summit santa monica california snap announced new feature easy lens,0.6124,Positive
Snapchat launches video comments and tools for creators seeking brand deals,At Tuesdays annual Snap Partner Summit the Snapchat maker unveiled new tools for creators designed to bring its app more in line with its competitors like TikTok and Instagram The,TechCrunch,2024-09-18T07:22:36.350640,snapchat launch video comment tool creator seeking brand deal . tuesday annual snap partner summit snapchat maker unveiled new tool creator designed bring app line competitor like tiktok instagram,0.3612,Positive
Stars Wayne Bennett lifeline after 1m axing,Supercoach Wayne Bennett may have just landed his next player project after signing one of the NRLs most maligned stars,News AU,2024-09-18T07:22:38.260727,star wayne bennett lifeline 1m axing . supercoach wayne bennett may landed next player project signing one nrl maligned star,0.0,Neutral
Hinkley says fine saga taken care of,The Port Adelaide coach fronted the media for the first time since being hit with a 20000 fine from the AFL for his postgame runin with Hawthorn players,News AU,2024-09-18T07:22:38.260727,hinkley say fine saga taken care . port adelaide coach fronted medium first time since hit 20000 fine afl postgame runin hawthorn player,0.7003,Positive
In my corner Power stars unlikely adviser,Port Adelaides vicecaptain has had help from an unlikely source as he prepares for a battle with a hardnosed Sydney tagger,News AU,2024-09-18T07:22:38.260727,corner power star unlikely adviser . port adelaide vicecaptain help unlikely source prepares battle hardnosed sydney tagger,0.0258,Neutral
Biggest loser from Comm Games revamp,Crickets future in a more sustainable Commonwealth Games is murky as other sports also face the chop in a streamlined format,News AU,2024-09-18T07:22:38.260727,biggest loser comm game revamp . cricket future sustainable commonwealth game murky sport also face chop streamlined format,-0.5267,Negative
Wild Wests Tigers cringe post stuns NRL,Longmaligned half Luke Brooks finally broke his NRL finals duck on Sunday afternoon but his former club has entered the chat,News AU,2024-09-18T07:22:38.260727,wild west tiger cringe post stuns nrl . longmaligned half luke brook finally broke nrl final duck sunday afternoon former club entered chat,-0.4019,Negative
Aussie journey to history begins,The upcoming T20 World Cup is always in Alyssa Healys thoughts but theres only one thing she wants from a threematch series against New Zealand,News AU,2024-09-18T07:22:38.260727,aussie journey history begin . upcoming t20 world cup always alyssa healys thought there one thing want threematch series new zealand,0.0772,Neutral
Aussie tennis champ model girlfriend split,Aussie tennis star Thanasi Kokkinakis has seemingly ended his 18month relationship with his glamorous model girlfriend,News AU,2024-09-18T07:22:38.260727,aussie tennis champ model girlfriend split . aussie tennis star thanasi kokkinakis seemingly ended 18month relationship glamorous model girlfriend,0.7506,Positive
Novaks strict parenting rule infuriates wife,Tennis champion Novak Djokovic has revealed the common parenting conundrum that has sparked arguments with his wife,News AU,2024-09-18T07:22:38.260727,novaks strict parenting rule infuriates wife . tennis champion novak djokovic revealed common parenting conundrum sparked argument wife,-0.296,Negative
Darts prodigy is here to win in Australia,Luke Littler has taken the darts world by storm this year and the teenager is in Australia this week determined to continue his red hot form,News AU,2024-09-18T07:22:38.260727,dart prodigy win australia . luke littler taken dart world storm year teenager australia week determined continue red hot form,0.7351,Positive
Absolutely hate it Aussies in Paris drama,A new rule at the Olympics athletics events is sure to divide athletes and fans and produce high drama in Paris writes Sally Pearson,News AU,2024-09-18T07:22:38.260727,absolutely hate aussie paris drama . new rule olympics athletics event sure divide athlete fan produce high drama paris writes sally pearson,-0.101,Neutral
Astonishing rise set to flip F1 in 215m race,Daniel Ricciardo has been given a reality check as the urgency mounts at Red Bull amid a threehorse race to replace a struggling driver,News AU,2024-09-18T07:22:38.260727,astonishing rise set flip f1 215m race . daniel ricciardo given reality check urgency mount red bull amid threehorse race replace struggling driver,-0.4215,Negative
Swirling Ricciardo rumour is worst one yet,Daniel Ricciardo is at the centre of the Formula 1 rumour mill again with the Australian reportedly set to be told some crushing news,News AU,2024-09-18T07:22:38.260727,swirling ricciardo rumour worst one yet . daniel ricciardo centre formula 1 rumour mill australian reportedly set told crushing news,-0.765,Negative
Bathurst 1000 to change Supercars forever,A massive change is coming to Supercars that will shake up the much loved motor racing series and its iconic Bathurst 1000 forever,News AU,2024-09-18T07:22:38.260727,bathurst 1000 change supercars forever . massive change coming supercars shake much loved motor racing series iconic bathurst 1000 forever,0.4939,Positive
Disabled boy banned from sport over rule,A 12yearold boy from Sydney with a disability has been banned from participating in his favourite hobby due to a heartbreaking rule change,News AU,2024-09-18T07:22:38.260727,disabled boy banned sport rule . 12yearold boy sydney disability banned participating favourite hobby due heartbreaking rule change,-0.8402,Negative
Taylor Swift stuns at latest NFL game,Taylor Swift made another stunning entrance and showed off her support for boyfriend Travis Kelce at his latest NFL game,News AU,2024-09-18T07:22:38.260727,taylor swift stuns latest nfl game . taylor swift made another stunning entrance showed support boyfriend travis kelce latest nfl game,0.7906,Positive
Alleged doublekiller breaks down in court,The man charged over the deaths of ice hockey star Johnny Gaudreau and his brother has burst into tears as a judge handed down a decision,News AU,2024-09-18T07:22:38.260727,alleged doublekiller break court . man charged death ice hockey star johnny gaudreau brother burst tear judge handed decision,-0.6908,Negative
Irankunda makes UEFA Youth League debut,Socceroos whizkid Nestory Irankunda continues to push for a firstteam opportunity at Bayern Munich,News AU,2024-09-18T07:22:38.260727,irankunda make uefa youth league debut . socceroos whizkid nestory irankunda continues push firstteam opportunity bayern munich,0.4215,Positive
Socceroo hoping to revive career in Adelaide,Surplus to requirements at Melbourne Victory a onetime Socceroo is hoping to kickstart his career with Adelaide United,News AU,2024-09-18T07:22:38.260727,socceroo hoping revive career adelaide . surplus requirement melbourne victory onetime socceroo hoping kickstart career adelaide united,0.8689,Positive
Outraged World champions shock arrest,Ukrainian president Volodymyr Zelenskyy has been left fuming after the nations greatest champion was detained in Poland,News AU,2024-09-18T07:22:38.260727,outraged world champion shock arrest . ukrainian president volodymyr zelenskyy left fuming nation greatest champion detained poland,-0.2263,Neutral
Identify as female Golf controversy erupts,Three members of an elite Australian golf club have been suspended over a sexism row related to membership fees,News AU,2024-09-18T07:22:38.260727,identify female golf controversy erupts . three member elite australian golf club suspended sexism row related membership fee,-0.4767,Negative
New to SuperCoach NBL Pick this team,Need a SuperCoach NBL team in a hurry We ran the numbers on six expert teams to deliver the ultimate starting lineup,News AU,2024-09-18T07:22:38.260727,new supercoach nbl pick team . need supercoach nbl team hurry ran number six expert team deliver ultimate starting lineup,0.0772,Neutral
Wallabies keen to silence external noise,The soul searching continues for the Wallabies ahead of their Bledisloe Cup clash against New Zealand on Saturday,News AU,2024-09-18T07:22:38.260727,wallaby keen silence external noise . soul searching continues wallaby ahead bledisloe cup clash new zealand saturday,0.3612,Positive
Injured Wallabies skipper targeting November return,Having tried to rush back from a shoulder injury without success onetime Wallabies captain Liam Wright is now taking a steady approach to his recovery,News AU,2024-09-18T07:22:38.260727,injured wallaby skipper targeting november return . tried rush back shoulder injury without success onetime wallaby captain liam wright taking steady approach recovery,-0.8175,Negative
Growing Empire doing exactly that for Yulong,Theyve cherry picked the very best broodmares Australia has to offer in the past 18 months and now Yulong Farm has a stallion prospect that could further elevate the operation,News AU,2024-09-18T07:22:38.260727,growing empire exactly yulong . theyve cherry picked best broodmare australia offer past 18 month yulong farm stallion prospect could elevate operation,0.7964,Positive
Incredible Aussie trio make cycling history,One Australian on the podium at the end of a cycling grand tour is an achievement but three in Spain made for an historic day,News AU,2024-09-18T07:22:38.260727,incredible aussie trio make cycling history . one australian podium end cycling grand tour achievement three spain made historic day,0.4588,Positive
