Title,Description,Source,Fetched Date,Combined Text,Score,Sentiment
Tupperware files for bankruptcy as demand slides,The US company says it will ask for court permission to start a sale process of the business,BBC Business,2024-09-18T07:22:35.920977,tupperware file bankruptcy demand slide . u company say ask court permission start sale process business,-0.128,Neutral
What will a US interest rate cut mean for me,It will influence mortgages credit card and saving rates for millions of people in the US and even around the world,BBC Business,2024-09-18T07:22:35.920977,u interest rate cut mean . influence mortgage credit card saving rate million people u even around world,0.5423,Positive
Guardian in talks to sell worlds oldest Sunday paper,The Guardian owner is in exclusive talks to sell the Observer newspaper to Tortoise Media,BBC Business,2024-09-18T07:22:35.920977,guardian talk sell world oldest sunday paper . guardian owner exclusive talk sell observer newspaper tortoise medium,0.128,Neutral
Amazon tells staff to get back to office five days a week,The ecommerce giant is ending hybrid working and will stop people hotdesking in the US,BBC Business,2024-09-18T07:22:35.920977,amazon tell staff get back office five day week . ecommerce giant ending hybrid working stop people hotdesking u,-0.128,Neutral
What will happen when VAT is added to private UK school fees,The Labour governments changes will come into effect in January 2025,BBC Business,2024-09-18T07:22:35.920977,happen vat added private uk school fee . labour government change come effect january 2025,0.0,Neutral
Marlboro owner sells asthma inhaler firm over backlash,Philip Morris International bought Vectura Group just three years ago in a deal worth more than 1bn,BBC Business,2024-09-18T07:22:35.920977,marlboro owner sell asthma inhaler firm backlash . philip morris international bought vectura group three year ago deal worth 1bn,0.2263,Neutral
The Plucky Squire From Pokmon to a pageturning indie hit,How a former Pokmon art director launched a studio and made one of the years most anticipated games,BBC Business,2024-09-18T07:22:35.920977,plucky squire pokmon pageturning indie hit . former pokmon art director launched studio made one year anticipated game,0.128,Neutral
Facebook owner bans Russian state media networks,Russian state media outlets have come under increased scrutiny in Western countries,BBC Business,2024-09-18T07:22:35.920977,facebook owner ban russian state medium network . russian state medium outlet come increased scrutiny western country,-0.3612,Negative
Four simple hacks to succeed in every conversation,A career coach a choreographer a chef and a dragon boat captain offer advice on giving critical feedback,BBC Business,2024-09-18T07:22:35.920977,four simple hack succeed every conversation . career coach choreographer chef dragon boat captain offer advice giving critical feedback,0.5106,Positive
Good Bad Billionaire,Simon Jack and Zing Tsjeng find out how the worlds billionaires made their money and then judge them Are they good bad or just another billionaire Listen to season two New episodes released on Mondays,BBC Business,2024-09-18T07:22:35.920977,good bad billionaire . simon jack zing tsjeng find world billionaire made money judge good bad another billionaire listen season two new episode released monday,-0.296,Negative
How Microsoft is tackling AI bias,Microsoft is turning to AI to make its workplace more inclusive,BBC Business,2024-09-18T07:22:35.920977,microsoft tackling ai bias . microsoft turning ai make workplace inclusive,-0.1027,Neutral
Aly Raisman on competing at the highest level,The decorated US gymnast opened up to the BBCs Katty Kay about blocking out the noise trusting her training and her winning mindset,BBC Business,2024-09-18T07:22:35.920977,aly raisman competing highest level . decorated u gymnast opened bbcs katty kay blocking noise trusting training winning mindset,0.5423,Positive
Jackie JoynerKersees goldmedal attitude,The retired athlete and halloffamer opened up to the BBCs Katty Kay about the challenges she faced on the road to the Olympics and the winning mindset that saw her through them,BBC Business,2024-09-18T07:22:35.920977,jackie joynerkersees goldmedal attitude . retired athlete halloffamer opened bbcs katty kay challenge faced road olympics winning mindset saw,0.5719,Positive
Secret Service aware of Elon Musk post about Harris Biden,The tech tycoon has deleted the post about assassination attempts on the president and vicepresident saying it was a joke,BBC Business,2024-09-18T07:22:35.920977,secret service aware elon musk post harris biden . tech tycoon deleted post assassination attempt president vicepresident saying joke,-0.4019,Negative
Instagram boosts privacy and parental control on teen accounts,Meta says parents will be able to guide a safer experience critics say the firm itself should do more,BBC Business,2024-09-18T07:22:35.920977,instagram boost privacy parental control teen account . meta say parent able guide safer experience critic say firm,0.5267,Positive
Publishers try skinnier books to save money and emissions,Subtle changes to the font can make books much slimmer and lighter saving money and CO2 emissions,BBC Business,2024-09-18T07:22:35.920977,publisher try skinnier book save money emission . subtle change font make book much slimmer lighter saving money co2 emission,0.4939,Positive
Norway sees electric cars outnumber petrol models,Norway one of the worlds largest oil exporters now has more electric cars on its roads than petroldriven ones,BBC Business,2024-09-18T07:22:35.920977,norway see electric car outnumber petrol model . norway one world largest oil exporter electric car road petroldriven one,0.0,Neutral
Right to WFH boosts productivity Labour says,Firms should judge people on outcomes not presenteeism Jonathan Reynolds insists,BBC Business,2024-09-18T07:22:35.920977,right wfh boost productivity labour say . firm judge people outcome presenteeism jonathan reynolds insists,0.4019,Positive
TikTok says US ban would have staggering impact on free speech,The US government wants TikTok sold or divested because it says it is a threat to national security,BBC Business,2024-09-18T07:22:35.920977,tiktok say u ban would staggering impact free speech . u government want tiktok sold divested say threat national security,-0.25,Negative
Playing with FIRE How to quit work and retire in your 30s,A personal finance strategy popular among millennials is helping them to quit their job and retire decades early,BBC Business,2024-09-18T07:22:35.920977,playing fire quit work retire 30 . personal finance strategy popular among millennials helping quit job retire decade early,0.5267,Positive
Boomerang CEOs Do they ever succeed,Five years after being ousted from WeWork Adam Neumann wants to rebuy the nowbankrupt business,BBC Business,2024-09-18T07:22:35.920977,boomerang ceo ever succeed . five year ousted wework adam neumann want rebuy nowbankrupt business,0.5423,Positive
How industry leaders transformed their career,The BBCs Katty Kay has spoken to successful changemakers to ask what made them pivot in their career,BBC Business,2024-09-18T07:22:35.920977,industry leader transformed career . bbcs katty kay spoken successful changemakers ask made pivot career,0.5859,Positive
Women were the original beer brewers what changed,Today the beer industry is maledominated but it wasnt always so,BBC Business,2024-09-18T07:22:35.920977,woman original beer brewer changed . today beer industry maledominated wasnt always,0.3182,Positive
How waiting alters our perception of time,Expert advice on how to get through a waiting period,BBC Business,2024-09-18T07:22:35.920977,waiting alters perception time . expert advice get waiting period,0.0,Neutral
Do the superrich deserve their wealth,Should there be a cap on billionaires wealth and their inheritances,BBC Business,2024-09-18T07:22:35.920977,superrich deserve wealth . cap billionaire wealth inheritance,0.7506,Positive
Solo and hybrid work Navigating our future and new normal,Covid19 reshaped the way we live and work We rethink solo working and explore the future of worklife,BBC Business,2024-09-18T07:22:35.920977,solo hybrid work navigating future new normal . covid19 reshaped way live work rethink solo working explore future worklife,0.0,Neutral
Can supersonic flight ever be sustainable,How a new era of quiet net zero supersonic airliners could revolutionise the aviation industry,BBC Business,2024-09-18T07:22:35.920977,supersonic flight ever sustainable . new era quiet net zero supersonic airliner could revolutionise aviation industry,0.0,Neutral
Commencement speech The surprising pitfall of your passions,Students are graduating in the US this week The commencement speeches might lead them into questionable choices,BBC Business,2024-09-18T07:22:35.920977,commencement speech surprising pitfall passion . student graduating u week commencement speech might lead questionable choice,0.4404,Positive
ASMR How whispering took over the internet,We meet the creators behind the current ASMR boom,BBC Business,2024-09-18T07:22:35.920977,asmr whispering took internet . meet creator behind current asmr boom,0.0,Neutral
A desk full of descriptions for your work colleagues,These are the long lost words youve been waiting for to describe your colleagues,BBC Business,2024-09-18T07:22:35.920977,desk full description work colleague . long lost word youve waiting describe colleague,-0.3182,Negative
Veterinarian suicide rates are very high Why,Veterinarian professionals are committing suicide at a higher rate than the general population,BBC Business,2024-09-18T07:22:35.920977,veterinarian suicide rate high . veterinarian professional committing suicide higher rate general population,-0.8658,Negative
Inflation rate holds steady in August at 22,The latest figure means inflation remains above the Bank of Englands target of 2,BBC Business,2024-09-18T07:22:35.920977,inflation rate hold steady august 22. latest figure mean inflation remains bank england target 2,0.0,Neutral
New bank hubs to open but many cant print statements,New rules on branch closures take effect but questions remain over the facilities in shared hubs,BBC Business,2024-09-18T07:22:35.920977,new bank hub open many cant print statement . new rule branch closure take effect question remain facility shared hub,0.34,Positive
Ovo to pay 24m over customer complaint failures,Ofgem says nearly 1400 customers were hit by problems including long delays in dealing with complaints,BBC Business,2024-09-18T07:22:35.920977,ovo pay 24m customer complaint failure . ofgem say nearly 1400 customer hit problem including long delay dealing complaint,-0.9022,Negative
Disabled woman told to repay 5000 of benefits,Yvonne Buckley from Ipswich says the DWP initially insisted she was entitled to the money,BBC Business,2024-09-18T07:22:35.920977,disabled woman told repay 5000 benefit . yvonne buckley ipswich say dwp initially insisted entitled money,0.6249,Positive
Boeing warns of job losses and cuts spending after strike,The strike at Boeing has sent the company scrambling to save cash,BBC Business,2024-09-18T07:22:35.920977,boeing warns job loss cut spending strike . strike boeing sent company scrambling save cash,-0.3818,Negative
Rupert Murdochs Succession court battle begins,The court battle will determine the future of the billionaires media empire,BBC Business,2024-09-18T07:22:35.920977,rupert murdoch succession court battle begin . court battle determine future billionaire medium empire,-0.5267,Negative
How much is the winter fuel payment and how can I still claim it,Plans to change winter fuel payments have highlighted the problem of unclaimed pensioner benefits,BBC Business,2024-09-18T07:22:35.920977,much winter fuel payment still claim . plan change winter fuel payment highlighted problem unclaimed pensioner benefit,0.0772,Neutral
I got a 44000 student loan now I owe 54000,The new repayment rate for student loans started this month but for some graduates the debt pile keeps growing,BBC Business,2024-09-18T07:22:35.920977,got 44000 student loan owe 54000. new repayment rate student loan started month graduate debt pile keep growing,-0.2023,Neutral
780000 eligible pensioners to lose out on fuel payment DWP,Pensioners aged 80 and over would take the biggest financial hit a government analysis found,BBC Business,2024-09-18T07:22:35.920977,780000 eligible pensioner lose fuel payment dwp . pensioner aged 80 would take biggest financial hit government analysis found,-0.4019,Negative
Climate change is turbocharging Somalias problems but theres still hope,Despite facing a catastrophic combination of challenges there is optimism in the African country,BBC Earth,2024-09-18T07:22:35.994493,climate change turbocharging somalia problem there still hope . despite facing catastrophic combination challenge optimism african country,0.7669,Positive
How New Orleans prepared itself for a hurricane,As Hurricane Francine leaves households without basic power in New Orleans a handful of community lighthouses could offer a crucial lifeline,BBC Earth,2024-09-18T07:22:35.994493,new orleans prepared hurricane . hurricane francine leaf household without basic power new orleans handful community lighthouse could offer crucial lifeline,0.2263,Neutral
The fisher folk reviving Finlands moonscape,Finlands Linnunsuo wetland used to be a barren moonscape A local fishing community has transformed it into a biodiverse haven and an important carbon sink,BBC Earth,2024-09-18T07:22:35.994493,fisher folk reviving finland moonscape . finland linnunsuo wetland used barren moonscape local fishing community transformed biodiverse important carbon sink,0.2023,Neutral
The Bahamas The last lighthouse of its kind,Reece Parkinson heads to the Bahamas where he meets a community adapting to unpredictable weather patterns,BBC Earth,2024-09-18T07:22:35.994493,bahamas last lighthouse kind . reece parkinson head bahamas meet community adapting unpredictable weather pattern,0.5267,Positive
Protecting Thailands famous paradise beach,Lucy Hedges is in Thailand where she explores the beach made worldfamous by Hollywood,BBC Earth,2024-09-18T07:22:35.994493,protecting thailand famous paradise beach . lucy hedge thailand explores beach made worldfamous hollywood,0.6369,Positive
The scientists drilling into an active Icelandic volcano,Scientists are preparing to drill into the rock of an Icelandic volcano to learn more about how volcanoes behave,BBC Earth,2024-09-18T07:22:35.994493,scientist drilling active icelandic volcano . scientist preparing drill rock icelandic volcano learn volcano behave,0.4019,Positive
Earths spectacular and remote capital of lightning,With storms occurring between 140 to 160 nights a year its no wonder the area is a world record holder,BBC Earth,2024-09-18T07:22:35.994493,earth spectacular remote capital lightning . storm occurring 140 160 night year wonder area world record holder,0.0,Neutral
Less is more Can degrowth save the world,The degrowth movement questions the feasibility of the idea of endless economic growth on a finite planet,BBC Earth,2024-09-18T07:22:35.994493,less degrowth save world . degrowth movement question feasibility idea endless economic growth finite planet,0.6728,Positive
How fixing how we farm might stop the next pandemic,Land use for food and agriculture around the world is putting pressure on climate and biodiversity,BBC Earth,2024-09-18T07:22:35.994493,fixing farm might stop next pandemic . land use food agriculture around world putting pressure climate biodiversity,-0.5267,Negative
How electric vehicles could improve our mental health,Noise and air pollution are major threats and EVs can therefore offer a promising solution,BBC Earth,2024-09-18T07:22:35.994493,electric vehicle could improve mental health . noise air pollution major threat ev therefore offer promising solution,0.5423,Positive
How greening our cities can reduce heat stress,Heat is the most deadly extreme weather phenomenon and cities are seeking ways to cool their urban cores,BBC Earth,2024-09-18T07:22:35.994493,greening city reduce heat stress . heat deadly extreme weather phenomenon city seeking way cool urban core,-0.128,Neutral
How climate chaos is threatening the real Paddington bear,Drought forces the real Paddington Bear into deadly conflict with cattle farmers in the Andes,BBC Earth,2024-09-18T07:22:35.994493,climate chaos threatening real paddington bear . drought force real paddington bear deadly conflict cattle farmer andes,-0.8555,Negative
Tidal kites New technology harnessing ocean energy,These mechanical creatures lurk beneath the waters surface and power homes in the Faroe Islands,BBC Earth,2024-09-18T07:22:35.994493,tidal kite new technology harnessing ocean energy . mechanical creature lurk beneath water surface power home faroe island,0.0772,Neutral
Malaysias adventure hotspot that crosses seven habitats,An 11mile hike in the Bako National Park in Malaysia transports travellers through seven distinct habitats,BBC Earth,2024-09-18T07:22:35.994493,malaysia adventure hotspot cross seven habitat . 11mile hike bako national park malaysia transport traveller seven distinct habitat,0.3182,Positive
The global phenomenon swallowing whole neighbourhoods,Giant ravines Entire communities are disappearing because of an extreme form of soil erosion,BBC Earth,2024-09-18T07:22:35.994493,global phenomenon swallowing whole neighbourhood . giant ravine entire community disappearing extreme form soil erosion,0.0,Neutral
A tale of the US through abandoned buildings,Two urban explorers stories of decay tell a tale of a changing American cultural landscape,BBC Earth,2024-09-18T07:22:35.994493,tale u abandoned building . two urban explorer story decay tell tale changing american cultural landscape,-0.6908,Negative
What makes the emperor penguin an eggcellent father,In the BBC Select documentary Penguins Spy in the Huddle we explore the world of penguin fathers,BBC Earth,2024-09-18T07:22:35.994493,make emperor penguin eggcellent father . bbc select documentary penguin spy huddle explore world penguin father,0.0,Neutral
The floating houses that are resilient to extreme weather,The floating houses built to withstand typhoons and flooding in the Philippines,BBC Earth,2024-09-18T07:22:35.994493,floating house resilient extreme weather . floating house built withstand typhoon flooding philippine,0.0,Neutral
What its like to camp in Antarctica,Marc Cieslak spends a night on ice camping under the stars,BBC Earth,2024-09-18T07:22:35.994493,like camp antarctica . marc cieslak spends night ice camping star,0.3612,Positive
Why sunsets on Mars are tinted blue,The reason behind the Red Planets nickname is also why its sunrises and sunsets look pale blue,BBC Earth,2024-09-18T07:22:35.994493,sunset mar tinted blue . reason behind red planet nickname also sunrise sunset look pale blue,0.0,Neutral
Molossia A small unrecognised nation within the US,With its own currency and head of state this American micronation has become an odd tourist destination,BBC Earth,2024-09-18T07:22:35.994493,molossia small unrecognised nation within u . currency head state american micronation become odd tourist destination,-0.3182,Negative
Can these 3Dprinted sea walls protect marine wildlife,One team is on a mission to create 3D printed sea walls with environmental benefits,BBC Earth,2024-09-18T07:22:35.994493,3dprinted sea wall protect marine wildlife . one team mission create 3d printed sea wall environmental benefit,0.7717,Positive
Ghost towns What nature does without us,Ghost towns are remnants of lost communities but also a testament to natures persistence,BBC Earth,2024-09-18T07:22:35.994493,ghost town nature without u . ghost town remnant lost community also testament nature persistence,-0.7096,Negative
Climate a more fundamental threat than terror Lammy,Foreign Secretary David Lammy vows to put climate change at the heart of the UKs foreign policy,BBC Earth,2024-09-18T07:22:35.994493,climate fundamental threat terror lammy . foreign secretary david lammy vow put climate change heart uk foreign policy,-0.7783,Negative
Why humpback whales are changing course,The first humpback whale to return to the North Pacifics Salish Sea in decades tells a new story about the global threat to whale populations,BBC Earth,2024-09-18T07:22:35.994493,humpback whale changing course . first humpback whale return north pacific salish sea decade tell new story global threat whale population,-0.5267,Negative
Mystery tremors were from massive nineday tsunami,Scientists launched an investigation after being baffled by seismic signals picked up across the world,BBC Earth,2024-09-18T07:22:35.994493,mystery tremor massive nineday tsunami . scientist launched investigation baffled seismic signal picked across world,0.128,Neutral
I wouldnt wish it on my worst enemy The people who work inside the eye of a hurricane,As climate change makes hurricane systems more dangerous the need to understand their inner workings is greater than ever,BBC Earth,2024-09-18T07:22:35.994493,wouldnt wish worst enemy people work inside eye hurricane . climate change make hurricane system dangerous need understand inner working greater ever,0.5083,Positive
UK farmings net zero climate target in doubt,Doubts are raised over UK farmings ability to reach net zero greenhouse gas emissions by 2040,BBC Earth,2024-09-18T07:22:35.994493,uk farming net zero climate target doubt . doubt raised uk farming ability reach net zero greenhouse gas emission 2040,-0.3818,Negative
The town that should have burned but didnt,In 2017 one of Californias largest ever wildfires was steadily approaching Montecito But it had long been preparing for just such an event,BBC Earth,2024-09-18T07:22:35.994493,town burned didnt . 2017 one california largest ever wildfire steadily approaching montecito long preparing event,0.0,Neutral
The secluded life of the USs lasagne lizard,Scuba diving scientists are scouring riverbeds for the USselusive endangered hellbender also known as the snot otter to give them a fighting chance of survival,BBC Earth,2024-09-18T07:22:35.994493,secluded life us lasagne lizard . scuba diving scientist scouring riverbed usselusive endangered hellbender also known snot otter give fighting chance survival,-0.0516,Neutral
The Sicilian ocean songs with a hidden message,Sicilys mysterious ocean songs contain secret messages about ancient fishing practices with ramifications for todays ecology,BBC Earth,2024-09-18T07:22:35.994493,sicilian ocean song hidden message . sicily mysterious ocean song contain secret message ancient fishing practice ramification today ecology,0.0,Neutral
What weve learned since the biggest oil spill in US history,Fourteen years after the BP Deepwater Horizon disaster would we fare any better at cleaning up another huge oil spill,BBC Earth,2024-09-18T07:22:35.994493,weve learned since biggest oil spill u history . fourteen year bp deepwater horizon disaster would fare better cleaning another huge oil spill,0.0258,Neutral
Gracie Abrams Is Taking a Curious and Sensitive Approach to Life Music and Aspirations,The past few years may have been a whirlwind for Gracie Abrams but shes enjoying every moment especially all the firsts happening all the time Though Abrams is quite busy performing in soldout venues on her headlining tour which kicked off earlier this month Abrams recently took some time to chat with The Hollywood Reporter,Hollywood Reporter,2024-09-18T07:22:36.164805,gracie abrams taking curious sensitive approach life music aspiration . past year may whirlwind gracie abrams shes enjoying every moment especially first happening time though abrams quite busy performing soldout venue headlining tour kicked earlier month abrams recently took time chat hollywood reporter,0.6908,Positive
Sean Diddy Combs Charged With Sex Trafficking and Racketeering in Unsealed Indictment,Sean Diddy Combs has been charged with sex trafficking and racketeering for directing a vast criminal enterprise through which he assaulted and trafficked women with the help of his various businesses from at least 2008 Federal prosecutors in an indictment unsealed on Tuesday accused the music mogul of engaging in a pervasive pattern of abuse,Hollywood Reporter,2024-09-18T07:22:36.164805,sean diddy comb charged sex trafficking racketeering unsealed indictment . sean diddy comb charged sex trafficking racketeering directing vast criminal enterprise assaulted trafficked woman help various business least 2008 federal prosecutor indictment unsealed tuesday accused music mogul engaging pervasive pattern abuse,-0.8934,Negative
BlumFest to Include Paranormal Activity ReRelease,BlumFest has found its lineup for this years Halloween season It will kick off with the 2009 found footage feature Paranormal Activity that will get a onenight only rerelease Writerdirector Oren Pels Paranormal Activity kicks off the fest on Sept 25 in 150 AMC locations in 54 cities It will be followed every Wednesday by,Hollywood Reporter,2024-09-18T07:22:36.164805,blumfest include paranormal activity rerelease . blumfest found lineup year halloween season kick 2009 found footage feature paranormal activity get onenight rerelease writerdirector oren pel paranormal activity kick fest sept 25 150 amc location 54 city followed every wednesday,0.0,Neutral
