Title,Description,Source,Fetched Date
US Postal Service stops accepting parcels from China and Hong Kong,It says the suspension will be in place until further notice and did not offer a reason for the decision,BBC Business,2025-02-05T07:23:26.918360
100000 eggs stolen from one US grocer as bird flu drives up prices,The price of eggs has risen amid a bird flu epidemic making them an unexpectedly costly menu option,BBC Business,2025-02-05T07:23:26.918360
World of Business,Gain the leading edge with global insights for the boardroom and beyond in your inbox every Wednesday,BBC Business,2025-02-05T07:23:26.918360
Google drops pledge on AI use for weapons,The tech giant has updated the principles governing its development of artificial intelligence,BBC Business,2025-02-05T07:23:26.918360
Why Trump tariffs could mean Barbie dolls cost more,The firm says it could raise prices and make changes to its supply chains to deal with new import taxes,BBC Business,2025-02-05T07:23:26.918360
Billionaire and spiritual leader the Aga Khan dies,The philanthropist and spiritual leader died peacefully at the age of 88 in Lisbon Portugal,BBC Business,2025-02-05T07:23:26.918360
India looks on nervously as Trump wields tariff threat,Delhi hopes tariff cuts have put it ahead of the game but will that satisfy Trump or is trade action still on the table,BBC Business,2025-02-05T07:23:26.918360
Ros Atkins on What is the US getting out of tariffs,The BBCs Analysis Editor takes a look at the latest round of tariffs announced by President Trump and what the US has got in return,BBC Business,2025-02-05T07:23:26.918360
Ghana wants more for its cashews but its a tough nut to crack,The African nation exports its cashews in raw form but processing them would be more lucrative,BBC Business,2025-02-05T07:23:26.918360
Five ways China is hitting back against US tariffs,China has set out a series of measures to kick in next week after the US introduced 10 tariffs on imports from the country,BBC Business,2025-02-05T07:23:26.918360
Muted open for US stocks after tariff turmoil 5 Feb 2025,Expert says markets are looking at tariffs as negotiating tactics that are working well for the US,BBC Business,2025-02-05T07:23:26.918360
Good Bad Billionaire,Simon Jack and Zing Tsjeng find out how the worlds billionaires made their money and then judge them Are they good bad or just another billionaire Listen to season two New episodes released on Mondays,BBC Business,2025-02-05T07:23:26.918360
How one product made a multimillion dollar brand,Nell Diamond CEO of Hill House Home shares how her small business skyrocketed to global success with the launch of the Nap Dress in 2019,BBC Business,2025-02-05T07:23:26.918360
The opening salvos have been fired in Trumps trade war what comes next,Are we seeing the opening moves in a wider trade war and what are the potential economic consequences,BBC Business,2025-02-05T07:23:26.918360
The Chinese AI app that has the world talking,A Chinese startup has built a lowcost AI model using less technologically advanced chips,BBC Business,2025-02-05T07:23:26.918360
Este Lauder ramps up job cuts as warns on tariffs,The firm that owns Clinique MAC and Bobbi Brown shedding double the number of jobs than planned warning of global volatility,BBC Business,2025-02-05T07:23:26.918360
Turmoil as Trump and Musk take aim at top US aid agency,Americas top diplomat Marco Rubio says he is now the acting head of the agency that distributes billions of dollars in aid around the world,BBC Business,2025-02-05T07:23:26.918360
Australia bans DeepSeek on government devices over security risk,The Australian government says the Chinese AI app is a threat to it and its assets,BBC Business,2025-02-05T07:23:26.918360
South Africas president calls Musk to calm Trump land row,President Trump who Elon Musk advises has threatened to cut funding over South Africas land policy,BBC Business,2025-02-05T07:23:26.918360
Playing with FIRE How to quit work and retire in your 30s,A personal finance strategy popular among millennials is helping them to quit their job and retire decades early,BBC Business,2025-02-05T07:23:26.918360
Boomerang CEOs Do they ever succeed,Five years after being ousted from WeWork Adam Neumann wants to rebuy the nowbankrupt business,BBC Business,2025-02-05T07:23:26.918360
How industry leaders transformed their career,The BBCs Katty Kay has spoken to successful changemakers to ask what made them pivot in their career,BBC Business,2025-02-05T07:23:26.918360
Women were the original beer brewers what changed,Today the beer industry is maledominated but it wasnt always so,BBC Business,2025-02-05T07:23:26.918360
How waiting alters our perception of time,Expert advice on how to get through a waiting period,BBC Business,2025-02-05T07:23:26.918360
Do the superrich deserve their wealth,Should there be a cap on billionaires wealth and their inheritances,BBC Business,2025-02-05T07:23:26.918360
Four simple hacks to succeed in every conversation,A career coach a choreographer a chef and a dragon boat captain offer advice on giving critical feedback,BBC Business,2025-02-05T07:23:26.918360
Solo and hybrid work Navigating our future and new normal,Covid19 reshaped the way we live and work We rethink solo working and explore the future of worklife,BBC Business,2025-02-05T07:23:26.918360
Can supersonic flight ever be sustainable,How a new era of quiet net zero supersonic airliners could revolutionise the aviation industry,BBC Business,2025-02-05T07:23:26.918360
Commencement speech The surprising pitfall of your passions,Students are graduating in the US this week The commencement speeches might lead them into questionable choices,BBC Business,2025-02-05T07:23:26.918360
ASMR How whispering took over the internet,We meet the creators behind the current ASMR boom,BBC Business,2025-02-05T07:23:26.918360
A desk full of descriptions for your work colleagues,These are the long lost words youve been waiting for to describe your colleagues,BBC Business,2025-02-05T07:23:26.918360
Veterinarian suicide rates are very high Why,Veterinarian professionals are committing suicide at a higher rate than the general population,BBC Business,2025-02-05T07:23:26.918360
Why employees smuggle AI into work,Many staff are using AI at work without the permission of their employers,BBC Business,2025-02-05T07:23:26.918360
Trumps trade war with neighbours is delayed what did they all get out of it,BBC reporters in the US Canada and Mexico assess the fallout after Trump gets border promises in return for a 30day pause on tariffs,BBC Business,2025-02-05T07:23:26.918360
US sovereign wealth fund could buy TikTok Trump says,The president has kickstarted the creation of a national fund which he says could buy the social media platform,BBC Business,2025-02-05T07:23:26.918360
Share falls ease after Trump tariff turmoil,US shares regained some ground after falling sharply in early trade as Trump paused tariffs on Mexico and Canada,BBC Business,2025-02-05T07:23:26.918360
US and Mexico reach deal to put tariffs on hold for now,A trade war between the US and Mexico has been temporarily averted after the two sides agreed a deal,BBC Business,2025-02-05T07:23:26.918360
Ontario ends contract with Musks Starlink over US tariffs,It is part of Canadas response to sweeping tariffs levied by US President Donald Trump on its imports,BBC Business,2025-02-05T07:23:26.918360
UK not choosing between US and EU says Starmer,US President Donald Trump threatens EU with trade taxes but hints he could reach a deal with the UK,BBC Business,2025-02-05T07:23:26.918360
What are tariffs and why is Trump threatening to use them,The cost of cars fruit and pharmaceuticals could increase because of Trumps tariff announcement,BBC Business,2025-02-05T07:23:26.918360
Bill Gates Weve given away 100bn but my children wont be poor when Im gone,The Microsoft cofounder says he enjoys giving away his fortune and it wont leave his kids poor,BBC Business,2025-02-05T07:23:26.918360
Princess Bride Actor Wallace Shawn Compares Israeli Treatment of Gaza to Nazi Germany,Some of them might in 10 years wake up and say Why did I justify that,Hollywood Reporter,2025-02-05T07:23:27.816755
Joe Rogan Says Harris Campaign Lied About Being Misled by Show We Have the Receipts,The podcaster details what he says really happened between his podcast team and the Harris campaign during their muchdisputed booking effort Its someone trying to cover their ass,Hollywood Reporter,2025-02-05T07:23:27.816755
Questions Swirl Around Killer Mikes Arrest at 2024 Grammys as Rapper Sues Security Firm,The rapper filed a civil rights lawsuit against SS Labor Force over the events leading up to his arrest The company has denied any involvement in the incident,Hollywood Reporter,2025-02-05T07:23:27.816755
FireAid Benefit Concerts Estimated to Have Raised 100M for Los Angeles,The January 30 events at LAs Kia Forum and Intuit Dome featured Billie Eilish Red Hot Chilli Peppers and Joni Mitchell as the devastating fires were finally contained,Hollywood Reporter,2025-02-05T07:23:27.816755
Kanye West Defends Bianca Censoris Nude Grammys Outfit in Deleted Comments,The rapper gave his reaction to the backlash to his wifes transparent awards show dress and then deleted all his Instagram posts,Hollywood Reporter,2025-02-05T07:23:27.816755
Amber Ruffin to Headline 2025 White House Correspondents Dinner,The event is traditionally attended by the US President Theres no word yet on whether Trump will attend the Washington gala,Hollywood Reporter,2025-02-05T07:23:27.816755
Peter Kiefer Named WriteratLarge of The Hollywood Reporter Joining the Brands WorldClass Editorial Team,The awardwinning journalist will cover Hollywoods agencies and studios while writing insider profiles and deepdive features on the industrys most powerful personalities and institutions,Hollywood Reporter,2025-02-05T07:23:27.816755
Don Lemon and Kanye West Face Off on Social Media After Controversial Grammys Appearance,Lemon and West went back and forth over false rumors that West and his wife were escorted out of the Grammys,Hollywood Reporter,2025-02-05T07:23:27.816755
How Doja Cat the Jonas Brothers and the Grammy Awards Buoyed Businesses Stricken by LA Fires,The five local business ads that ran as part of the 2025 Grammys came together in two weeks as the blazes tore across the city,Hollywood Reporter,2025-02-05T07:23:27.816755
Neil Gaiman Sued for Sexual Assault Human Trafficking by Former Nanny,The lawsuit alleges several instances in which Gaiman violently raped a babysitter The author has maintained that the sexual encounters were consensual,Hollywood Reporter,2025-02-05T07:23:27.816755
Sal Maida Bassist With Roxy Music and Milk N Cookies Dies at 76,He also played with Sparks Ronnie Spector Cracker and The Runaways during his career,Hollywood Reporter,2025-02-05T07:23:27.816755
Janelle Mone Says F You Nelly for Singers Trump Inauguration Performance You Sold Out,Mone rapped her comments during a Grammys afterparty where she sang a cover of Nellys Hot in Herre,Hollywood Reporter,2025-02-05T07:23:27.816755
Drugs seized from scene of AFL stars death,West Coast Eagles premiership star Adam Hunter has died at the age of 43 with police seizing drugs from the scene in Western Australia,News AU,2025-02-05T07:23:30.091171
Pity to miss derby says Mata,With the Sydney derby taking place on Saturday night a hamstring injury has come at the wrong time for ALeague drawcard Juan Mata,News AU,2025-02-05T07:23:30.091171
Fevola breaks down over Selwood death,AFL great Brendan Fevola was left broken hearted and cut a dejected figure as he paid tribute to former teammate Troy Selwood,News AU,2025-02-05T07:23:30.091171
Origin dream put aside for Storm gun,He was invited to a meeting with the new NSW Origin coach last week and one Storm gun is daring to dream,News AU,2025-02-05T07:23:30.091171
Battling Aussies suffer dual injury blow,Australia is set to make further late changes to its Champions Trophy squad with two of its premier players unlikely to get up from injury concerns,News AU,2025-02-05T07:23:30.091171
Highquality Pontings plea for Aussie callup,Australian legend Ricky Ponting has watched the rise of a BBL final hero closeup and has urged national selectors to make a big call,News AU,2025-02-05T07:23:30.091171
Shock tears as exworld No 1 retires on spot,A muchloved tennis champs career has ended in sad scenes when she grabbed a microphone on court and left spectators in tears,News AU,2025-02-05T07:23:30.091171
Hewitts brutal blow after nepotism claim,Cruz Hewitts push to replicate his tennis legend father Lleyton continues to suffer setbacks with the latest a brutal blow to the youngster,News AU,2025-02-05T07:23:30.091171
Kalyn Ponga drops rugby league bombshell,Knights fullback Kalyn Ponga has sent shockwaves through the rugby league world dropping a hint he may be set for a big change,News AU,2025-02-05T07:23:30.091171
America loses it over Aussie megastar,Australias Rhea Ripley is taking wrestling by storm as one of WWEs biggest stars but her dominance has sparked debate,News AU,2025-02-05T07:23:30.091171
Thanks Kylie How old soaps playing role in Aussie SailGP success,Soaps Neighbours and Home and Away and a British Olympian who watched them are strangely playing a part in the resurgence of the Aussie crew in the SailGP series hitting Sydney at speed,News AU,2025-02-05T07:23:30.091171
Michael Jordans reality star son arrested,The Real Housewives star son of basketball legend Michael Jordan was pulled over by police in Florida and remains in prison,News AU,2025-02-05T07:23:30.091171
Matildas captaincy under threat as fans fume,Football Australia has addressed the calls to strip Sam Kerr of the Matildas captaincy as more details come to light,News AU,2025-02-05T07:23:30.091171
Conor McGregors ugly fan act goes viral,Former UFC champ Conor McGregor has been caught on video appearing to spit in the face of a fan after jibe about a UFC rival,News AU,2025-02-05T07:23:30.091171
Bathurst rocked by massive smash,The driver of this Mercedes was lucky to escape serious injuries after flying through the air at 200kmh,News AU,2025-02-05T07:23:30.091171
Supercars team owner airborne in terrifying Bathurst crash,Supercars team owner Stephen Grove has been hospitalised after a scary airborne crash at the top of Mount Panorama in the Bathurst 12 Hour,News AU,2025-02-05T07:23:30.091171
Hard moments for me Doncics title vow after shock of LA trade,Luka Doncic has vowed to lead the LA Lakers to an NBA title and admitted his own shock at being traded away by the Dallas Mavericks,News AU,2025-02-05T07:23:30.091171
Should be banned New rules for golf scourge,Time wasters in golf could be in for a shock with new rules to penalise slow play and a tiresome technique used by the likes of Adam Scott panned,News AU,2025-02-05T07:23:30.091171
Group 1 jockey and racings nice guy to retire Saturday,Michael Cahill has been riding since Melbourne Cup day 1980 but the fivetime Group 1 winning jockey and racing nice guy will take his final rides on Saturday,News AU,2025-02-05T07:23:30.091171
Update on 5m code hopper after scare,After a false start stopped his club rugby debut Rugby Australias most expensive signing ever has given a clear indication when hell play again,News AU,2025-02-05T07:23:30.091171
Tahs suffer early Suaalii blow with injury icing debut,Superstar JosephAukuso Suaaliis hotly anticipated debut in the NSW Waratahs jersey has been cruelled by an injury,News AU,2025-02-05T07:23:30.091171
Olympian to learn familys pain in court,The heartbroken family of an Olympic cyclist are expected to deliver victim impact statements detailing their pain and grief to the court,News AU,2025-02-05T07:23:30.091171
Anna Kournikova went from star to recluse,The Russian beauty had a cocktail and even computer virus named after her at height of fame before her horror stalking ordeal,News AU,2025-02-05T07:23:30.091171
