Title,Description,Source,Fetched Date
EU calls for respect after Trump threatens 50 tariffs,Trade chief Maros Sefcovic said the EU is ready to defend its interests after Trump threatened 50 tariffs on the bloc,BBC Business,2025-05-25T07:24:25.253680
Analysis Trumps tariff plans could spark global economic shock,The move threatens significant volatility in the coming weeks ahead of a crucial G7 summit in Canada next month,BBC Business,2025-05-25T07:24:25.253680
World of Business,Gain the leading edge with global insights for the boardroom and beyond in your inbox every Wednesday,BBC Business,2025-05-25T07:24:25.253680
Protestors accuse Trump of corruption as he hosts crypto gala dinner,Trump hosted the biggest investors in his own cryptocurrency but insisted he put the country ahead of his businesses interests,BBC Business,2025-05-25T07:24:25.253680
Amazon tribe sues New York Times over story it says led to porn addict claims,The lawsuit claims a report portrayed the Marubo people as unable to handle basic internet exposure,BBC Business,2025-05-25T07:24:25.253680
Boeing to avoid prosecution in US Justice Department deal over crashes,The two crashes happened in 2018 and 2019 and left 346 people dead,BBC Business,2025-05-25T07:24:25.253680
The Bitcoin hum that is unsettling Trumps Maga heartlands,Trump has said he wants to turn the US into the cryptomining capital of the world but that has realworld implications for many of his core voters,BBC Business,2025-05-25T07:24:25.253680
Harvard foreign students face uncertainty as Trump plan to block enrolment is halted for now,It comes a day after the administration said it had revoked Harvards access to student visa programmes,BBC Business,2025-05-25T07:24:25.253680
Cyber criminals contact BBC to claim hack on Coop MS,Hackers reached out to the BBCs Joe Tidy on Telegram frustrated that their ransom demands werent being met,BBC Business,2025-05-25T07:24:25.253680
Chip maker TSMC expands US reach with new Arizona factory,The BBC gets exclusive access to the Taiwanese companys new factory in the Arizona desert just outside Phoenix,BBC Business,2025-05-25T07:24:25.253680
Trump tax bill can have good and bad effects 22 May 2025,Investment Strategist Guy LeBas says the tax bill passed by the House has good and bad impacts on growth,BBC Business,2025-05-25T07:24:25.253680
Why so many military veterans move into cybersecurity,The vigilance needed in the military can be an asset in the cybersecurity industry,BBC Business,2025-05-25T07:24:25.253680
Trump reignites tensions with EU tariff threats,EU says threats should not guide trade talks as Trump says he wants tariffs of 50 on European goods as soon as 1 June,BBC Business,2025-05-25T07:24:25.253680
What tariffs has Trump announced and why,Tariffs are a key part of the US presidents political vision but economists fear a global trade war,BBC Business,2025-05-25T07:24:25.253680
Daily Telegraph to be sold to US firm RedBird,The American company agrees to buy the Daily and Sunday Telegraph after a twoyear ownership vacuum,BBC Business,2025-05-25T07:24:25.253680
Labubu fan fury after dolls pulled from stores,The popular toys have been removed from UK shelves until June following reports of customers fighting over them,BBC Business,2025-05-25T07:24:25.253680
A look at the key items in Trumps big beautiful bill,The tax and spending bill which must still pass in the Senate includes sweeping changes to the tax code Social Security and more,BBC Business,2025-05-25T07:24:25.253680
Denmark to raise retirement age to highest in Europe,From 2040 Danish people born after 31 December 1970 will be eligible to retire at 70 years old,BBC Business,2025-05-25T07:24:25.253680
Playing with FIRE How to quit work and retire in your 30s,A personal finance strategy popular among millennials is helping them to quit their job and retire decades early,BBC Business,2025-05-25T07:24:25.253680
Boomerang CEOs Do they ever succeed,Five years after being ousted from WeWork Adam Neumann wants to rebuy the nowbankrupt business,BBC Business,2025-05-25T07:24:25.253680
How industry leaders transformed their career,The BBCs Katty Kay has spoken to successful changemakers to ask what made them pivot in their career,BBC Business,2025-05-25T07:24:25.253680
Women were the original beer brewers what changed,Today the beer industry is maledominated but it wasnt always so,BBC Business,2025-05-25T07:24:25.253680
How waiting alters our perception of time,Expert advice on how to get through a waiting period,BBC Business,2025-05-25T07:24:25.253680
Do the superrich deserve their wealth,Should there be a cap on billionaires wealth and their inheritances,BBC Business,2025-05-25T07:24:25.253680
Four simple hacks to succeed in every conversation,A career coach a choreographer a chef and a dragon boat captain offer advice on giving critical feedback,BBC Business,2025-05-25T07:24:25.253680
Solo and hybrid work Navigating our future and new normal,Covid19 reshaped the way we live and work We rethink solo working and explore the future of worklife,BBC Business,2025-05-25T07:24:25.253680
Can supersonic flight ever be sustainable,How a new era of quiet net zero supersonic airliners could revolutionise the aviation industry,BBC Business,2025-05-25T07:24:25.253680
Commencement speech The surprising pitfall of your passions,Students are graduating in the US this week The commencement speeches might lead them into questionable choices,BBC Business,2025-05-25T07:24:25.253680
A desk full of descriptions for your work colleagues,These are the long lost words youve been waiting for to describe your colleagues,BBC Business,2025-05-25T07:24:25.253680
Veterinarian suicide rates are very high Why,Veterinarian professionals are committing suicide at a higher rate than the general population,BBC Business,2025-05-25T07:24:25.253680
ASMR How whispering took over the internet,We meet the creators behind the current ASMR boom,BBC Business,2025-05-25T07:24:25.253680
In South Korea even your cup of Starbucks could be too political,All six presidential candidates names are banned in Starbucks stores to maintain neutrality,BBC Business,2025-05-25T07:24:25.253680
US House passes Trumps big beautiful tax and spending bill,The bills passage is a victory for the White House which warned that failure would be a betrayal,BBC Business,2025-05-25T07:24:25.253680
Trump administration ends Harvards ability to enrol international students,The move escalates the administrations row with Americas oldest university over hiring admissions and teaching practices,BBC Business,2025-05-25T07:24:25.253680
US Treasury confirms the end of the penny,There has been a long debate over the cost and usefulness of one cent coins in the US,BBC Business,2025-05-25T07:24:25.253680
US Congress moves to block California ban on petrolonly cars,Californias plan was expected to have significant influence over the wider car industry in the US,BBC Business,2025-05-25T07:24:25.253680
Nike to raise US prices as firms face tariffs uncertainty,The US sportswear giant says its price increases are part of seasonal planning,BBC Business,2025-05-25T07:24:25.253680
How a joke about rice cost a Japan cabinet minister his job,Soaring rice prices are a powerful trigger in Japan where shortages have caused political upsets before,BBC Business,2025-05-25T07:24:25.253680
MS website back online allowing users to browse,After going down overnight the website is open for browsing again but online orders remain suspended after the recent cyber attack,BBC Business,2025-05-25T07:24:25.253680
Trump meets Republican hardliners in hopes of moving tax bill forward,The House may vote on his big beautiful bill soon and Trump needs the support of almost all Republicans for it to pass,BBC Business,2025-05-25T07:24:25.253680
The NineMinute Bromance Video That Launched a 6 Billion AI Mystery,They stroll they sip they gaze meaningfully The one thing Open AI CEO Sam Altman and former Apple designer Jony Ive dont do Explain what their new device actually is,Hollywood Reporter,2025-05-25T07:24:25.685652
Different President Same Song Trump Pulls a Nixon in His Battle Against The Boss,Bruce Springsteen isnt the first rock star to face the ire of a pushy POTUS Fifty years ago Richard Nixon went to war against John Lennon over the former Beatles peacenik politics,Hollywood Reporter,2025-05-25T07:24:25.685652
Who Really Took the Iconic Napalm Girl Photo Director of New Doc Addresses the Controversy Exclusive,Since its premiere at Sundance The Stringer has led to a divisive reexamination of the credit for the Pulitzer Prizewinning 1972 photograph that captured the horrors of the Vietnam War,Hollywood Reporter,2025-05-25T07:24:25.685652
Paris Court Finds Ringleader Seven Others Guilty in 2016 Robbery of Kim Kardashian,None of the eight people convicted will face additional time behind bars as two of the 10 defendants were acquitted,Hollywood Reporter,2025-05-25T07:24:25.685652
Billy Joel Shares Brain Disorder Diagnosis,The iconic singer has canceled all concerts amid the news Im sincerely sorry to disappoint our audience,Hollywood Reporter,2025-05-25T07:24:25.685652
PragerUs Plan to Red Pill Our Kids,Dennis Pragers rightleaning media platform has built an audience of millions by marrying slick Hollywood production values with MAGA stars and conservative ideology Now its setting its sights on a new market Americas schoolchildren,Hollywood Reporter,2025-05-25T07:24:25.685652
Drummer and Music Talent Agency Owner Killed in San Diego Plane Crash,Daniel Williams the former drummer of the rock band The Devil Wears Prada and Dave Shapiro the owner of Sound Talent Group were killed in the early morning crash,Hollywood Reporter,2025-05-25T07:24:25.685652
Kid Cudi Testifies About Porsche Bombing LA Home BreakIn He Says Sean Diddy Combs Was Behind,The Grammywinning rapper was dating Cassie Ventura at the same time as the disgraced mogul who is on trial for sex trafficking and racketeering in New York,Hollywood Reporter,2025-05-25T07:24:25.685652
Inside the Sean Diddy Combs Courtroom Angry Stares Zero Fashion Flair and Who Sits Where,YouTube personality Tisa Tells gives her unfiltered take on the trial so far including whos really running the defenses strategy,Hollywood Reporter,2025-05-25T07:24:25.685652
Harvey Weinstein Survivors Speak Out to Support Three Women Testifying Against Him In New Trial,The statement comes amid a climate of cynicism about the MeToo movement the women say and less outside support for the accusers on the stand,Hollywood Reporter,2025-05-25T07:24:25.685652
Kendrick Lamar Commands Home Crowd as SZA Brings Out Lizzo for Surprise Duet During the First Night of LA Tour Stop,Lebron James and Winnie Harlow were spotted among the concertgoers at the first of three soldout Los Angeles shows on the Grand National Tour,Hollywood Reporter,2025-05-25T07:24:25.685652
Kid Cudi Testifies in Diddy Trial That His Car Was Set on Fire Weeks After Sean Combs Broke Into His Home,Cudi whose real name is Scott Mescudi took the witness stand in the disgraced moguls sex trafficking trial and said he and Cassie briefly dated in 2011,Hollywood Reporter,2025-05-25T07:24:25.685652
Footy stars bedroom confession revealed,An NRL superstar has revealed the make or break moment with her now husband when the couple were just two weeks into dating,News AU,2025-05-25T07:24:26.786423
Tigers star joins rival effective immediately,Lachlan Galvin is set to leave the Wests Tigers and join a rival club effective immediately as NRL supremo Phil Gould gets his way,News AU,2025-05-25T07:24:26.786423
Debate erupts over sickening AFL collision,Fremantle Dockers captain Alex Pearce is set to be suspended for an ugly hit on an opposition player sparking heated debate in AFL circles,News AU,2025-05-25T07:24:26.786423
F Lewis F1 stars in huge Monaco drama,Lewis Hamilton and Max Verstappen have clashed in tense scenes following a frenetic qualifying for the F1 Monaco Grand Prix,News AU,2025-05-25T07:24:26.786423
Horsburgh loses the plot in fiery clash,Two of Canberras top forwards are on report and one binned in a fiery clash between the Raiders and Warriors Follow live here,News AU,2025-05-25T07:24:26.786423
What just happened Will Gawn brain fade cost Demons,Max Gawn is putting in another SuperCoach masterclass against Sydney but a bizarre blunder could come back to bite Melbourne FOLLOW LIVE,News AU,2025-05-25T07:24:26.786423
Axe looms for teen as shock act comes to light,Sam Konstas is expected to miss out on the WTC final but it hasnt stopped the Aussie youngster from trying to change selectors minds,News AU,2025-05-25T07:24:26.786423
Hes the future Former Aussie star backs batting prodigy,A former Australian star is urging selectors to back in the future in next months World Test Championship final at Lords,News AU,2025-05-25T07:24:26.786423
Wildly inappropriate camera act slammed,Just months after becoming enemy No 1 in Australia Danielle Collins was at her fiery best again with a wild cameraman clash,News AU,2025-05-25T07:24:26.786423
Damir Dokic Jelenas abusive dad dies,Damir Dokic the abusive estranged father of former Aussie tennis star and current commentator Jelena Dokic has died,News AU,2025-05-25T07:24:26.786423
Massive gamble to blow up in AFL clubs face,A fallen AFL dynasty has suddenly turned its fortunes around as a massive gamble looks set to blow up in a rival clubs face,News AU,2025-05-25T07:24:26.786423
Piastri escapes catastrophe but suffers Monaco blow,Oscar Piastri has his work cut out for him if hes going to win the Monaco Grand Prix with an eventful qualifying session opening the door for his main title rival,News AU,2025-05-25T07:24:26.786423
Reds their own worst enemy after falling short in nailbiter,Queensland Reds were shooting for a guaranteed spot in the Super Rugby playoffs and its first win over the Hurricanes since 2013 but were their own worst enemy in a nailbiting loss,News AU,2025-05-25T07:24:26.786423
Sliding Reds need to be better,The Queensland Reds are searching for some answers to their dip in form ahead of the Super Rugby Pacific finals series,News AU,2025-05-25T07:24:26.786423
Celebrities lose it after huge NBA victory,The stars were out in force as the New York Knicks sealed a droughtbreaking NBA win sparking wild celebrations across the city,News AU,2025-05-25T07:24:26.786423
Baseball world rocked by Aussie icons death,A massive outpouring of shock and loss has swept through the Australian sporting world after the unexpected death of an Aussie Olympian,News AU,2025-05-25T07:24:26.786423
Kill off the main character Ominous Ange joke amid unclear future,Ange Postecoglou has sheepishly walked back comments made at Tottenhams Europa League trophy parade with the Australian manager making it clear his future at the club remains uncertain,News AU,2025-05-25T07:24:26.786423
Anges hilarious reaction to sack question,Ange Postecoglou has delivered a hilarious response to a question about his Tottenham future as he rethought his iconic parade declaration,News AU,2025-05-25T07:24:26.786423
25yo star dies weeks after getting married,Tributes are flowing around the boxing world after a talented fighter died at the age of 25 in a heartbreaking tragedy,News AU,2025-05-25T07:24:26.786423
Scheffler outlasts Rahm to claim third major at PGA Championship,World number one Scottie Scheffler has captured his third major title seeing off Spains Jon Rahm down the back nine in the final round to win the PGA Championship,News AU,2025-05-25T07:24:26.786423
Unthinkable choke turns NBA on its head,Tyrese Haliburton knocked down a ridiculous gametying shot sparking a truly extraordinary Indiana Pacers comeback win,News AU,2025-05-25T07:24:26.786423
On The Punt Sun to rise at Mornington on Monday,Herald Sun tipster Gilbert Gardiners selections for Mornington on Monday,News AU,2025-05-25T07:24:26.786423
Aussies epic solo escape to claim maiden Grand Tour stage win,Aussie cyclist Luke Plapp held a bottle of bubbly as he revealed the emotional roller coaster of his season so far after taking out his maiden Grand Tour stage win,News AU,2025-05-25T07:24:26.786423
Sports presenter quits in shock move,Just two months after being overlooked for a plum national TV role a popular Channel 9 sports presenter has quit the network,News AU,2025-05-25T07:24:26.786423
Tragedy as WWE star killed in accident at 63,The WWE community is in mourning after a wrestling star was killed in a shocking accident at the age of 63,News AU,2025-05-25T07:24:26.786423
