Title,Description,Source,Fetched Date
Executive order delaying TikTok ban gets Trump signoff,The order was among a slew of directives Trump signed on Monday evening,BBC Business,2025-01-21T07:22:36.159603
Canada avoids Trumps tariffs for now,President Donald Trump stopped short of imposing tariffs on Canada on day one but said they may come as soon as 1 February,BBC Business,2025-01-21T07:22:36.159603
World of Business,Gain the leading edge with global insights for the boardroom and beyond in your inbox every Wednesday,BBC Business,2025-01-21T07:22:36.159603
Melania Trump launches her own cryptocurrency,Melania is announced after Presidentelect Donald Trump launched his own cryptocurrency Trump,BBC Business,2025-01-21T07:22:36.159603
Working from home not proper work exAsda boss,Lord Rose says it harms productivity but expert says hybrid work can be as good as fulltime in the office,BBC Business,2025-01-21T07:22:36.159603
Stock markets cautious as Trump signals new tariffs,The US president said he is considering imposing new tariffs on Canada and Mexico from 1 February,BBC Business,2025-01-21T07:22:36.159603
Inside Icelands futuristic farm growing algae for food,Next to a geothermal plant in Iceland a startup is growing microalgae for food,BBC Business,2025-01-21T07:22:36.159603
Panama rejects Trump vow to take back Panama Canal,Donald Trump claims China is operating the key US trade route but Panama says it belongs to them,BBC Business,2025-01-21T07:22:36.159603
Why is TikTok back after being banned for one day,What happens to TikTok in the US now that Donald Trump becomes president,BBC Business,2025-01-21T07:22:36.159603
Shein backlash fails to deter shoppers I spend 20 a month,Some young shoppers will continue to buy from the fast fashion giant despite concerns over how workers are treated,BBC Business,2025-01-21T07:22:36.159603
Bank performance signals boost to US economy 16 Jan 2025,Jason Betz from Ameriprise Financial says that there is untapped resilience in the American economy,BBC Business,2025-01-21T07:22:36.159603
Good Bad Billionaire,Simon Jack and Zing Tsjeng find out how the worlds billionaires made their money and then judge them Are they good bad or just another billionaire Listen to season two New episodes released on Mondays,BBC Business,2025-01-21T07:22:36.159603
How one product made a multimillion dollar brand,Nell Diamond CEO of Hill House Home shares how her small business skyrocketed to global success with the launch of the Nap Dress in 2019,BBC Business,2025-01-21T07:22:36.159603
TikTok restores service in US after Trump pledge,TikTok is resuming services to its 170 million users in US after Presidentelect Donald Trump said he would give the app a reprieve,BBC Business,2025-01-21T07:22:36.159603
Trump launches cryptocurrency with price rocketing,Hours after its launch the value of the coins for Trump reached nearly 55bn 45bn,BBC Business,2025-01-21T07:22:36.159603
Toyota unit to settle emissions scandal for 16bn,The truck company will also be banned from importing its diesel engines into the US for five years,BBC Business,2025-01-21T07:22:36.159603
Has Trump promised too much on US economy,He won the election partly to fix inflation but Trump may find his pledges on prices and tariffs conflict say experts,BBC Business,2025-01-21T07:22:36.159603
Mark Carney the unreliable boyfriend who ran UKs central bank,Carney is now running for the Liberal Party leadership in Canada What does his time in London tell us,BBC Business,2025-01-21T07:22:36.159603
US Supreme Court upholds TikTok ban law,A law passed last year requires TikToks Chinese parent company to sell the video platform or face a ban,BBC Business,2025-01-21T07:22:36.159603
Playing with FIRE How to quit work and retire in your 30s,A personal finance strategy popular among millennials is helping them to quit their job and retire decades early,BBC Business,2025-01-21T07:22:36.159603
Boomerang CEOs Do they ever succeed,Five years after being ousted from WeWork Adam Neumann wants to rebuy the nowbankrupt business,BBC Business,2025-01-21T07:22:36.159603
How industry leaders transformed their career,The BBCs Katty Kay has spoken to successful changemakers to ask what made them pivot in their career,BBC Business,2025-01-21T07:22:36.159603
Women were the original beer brewers what changed,Today the beer industry is maledominated but it wasnt always so,BBC Business,2025-01-21T07:22:36.159603
How waiting alters our perception of time,Expert advice on how to get through a waiting period,BBC Business,2025-01-21T07:22:36.159603
Do the superrich deserve their wealth,Should there be a cap on billionaires wealth and their inheritances,BBC Business,2025-01-21T07:22:36.159603
Four simple hacks to succeed in every conversation,A career coach a choreographer a chef and a dragon boat captain offer advice on giving critical feedback,BBC Business,2025-01-21T07:22:36.159603
Solo and hybrid work Navigating our future and new normal,Covid19 reshaped the way we live and work We rethink solo working and explore the future of worklife,BBC Business,2025-01-21T07:22:36.159603
Can supersonic flight ever be sustainable,How a new era of quiet net zero supersonic airliners could revolutionise the aviation industry,BBC Business,2025-01-21T07:22:36.159603
Commencement speech The surprising pitfall of your passions,Students are graduating in the US this week The commencement speeches might lead them into questionable choices,BBC Business,2025-01-21T07:22:36.159603
ASMR How whispering took over the internet,We meet the creators behind the current ASMR boom,BBC Business,2025-01-21T07:22:36.159603
A desk full of descriptions for your work colleagues,These are the long lost words youve been waiting for to describe your colleagues,BBC Business,2025-01-21T07:22:36.159603
Veterinarian suicide rates are very high Why,Veterinarian professionals are committing suicide at a higher rate than the general population,BBC Business,2025-01-21T07:22:36.159603
TikTok says it will go dark on Sunday without US government action,The Supreme Court earlier upheld a law that would ban the video app in the US unless its Chinese parentcompany sells it,BBC Business,2025-01-21T07:22:36.159603
Al Fayed claimed poor health when police investigated abuse,Pelham Spong reported to police in 2017 that Mohammed Al Fayed had assaulted her a decade before but the investigation was shut down,BBC Business,2025-01-21T07:22:36.159603
IMF warns on Trumps plans but upgrades UK outlook,Trumps policies could benefit the US but not the rest of the world the IMF says,BBC Business,2025-01-21T07:22:36.159603
US grounds SpaceXs Starship after test flight explosion,The rockets upper stage disintegrated over the Caribbean forcing airline flights to alter course,BBC Business,2025-01-21T07:22:36.159603
Americans and Chinese share jokes on alternative TikTok as US ban looms,RedNotes Chinese users say it is the first time they have been able to speak directly to Americans online,BBC Business,2025-01-21T07:22:36.159603
Three reasons Trump tariffs arent Chinas only problem,Chinas economy has hit the governments 5 growth target for 2024 in the face of multiple challenges,BBC Business,2025-01-21T07:22:36.159603
Apple suspends errorstrewn AI generated news alerts,The tech giant was facing pressure to pull the feature after it made repeated mistakes summarising headlines,BBC Business,2025-01-21T07:22:36.159603
US FDA officially authorises Zyn nicotine pouches for sale,The pouches are used by less than 2 of US teens the FDA said in granting the application allowing them to continue to be sold,BBC Business,2025-01-21T07:22:36.159603
Global growth forecast to flatline as tariffs add to strains,The World Bank predicts global economic growth of 27 this year amid concerns living standards will struggle to improve,BBC Business,2025-01-21T07:22:36.159603
Cecile Richards Former Planned Parenthood President Womens Rights Activist Dies at 67,The daughter of the late Texas Gov Ann Richards had glioblastoma an aggressive form of brain cancer,Hollywood Reporter,2025-01-21T07:22:37.069483
Trump Inaugurations Surprise Celebrities Joe Rogan Logan Paul More,Donald Trumps second inauguration included several celebrities in attendance who werent announced in advance,Hollywood Reporter,2025-01-21T07:22:37.069483
After Tech Issues Carrie Underwood Performs A Cappella at Inauguration Ceremony,The audience including outgoing President Biden and Vice President Kamala Harris sang along with country singer for her performance of America the Beautiful during Trumps inauguration ceremony,Hollywood Reporter,2025-01-21T07:22:37.069483
Nina Dobrev Says She Has Survivors Guilt After House Near LA Fires Made It,The actress revealed she had to evacuate her home on her Jan 9 birthday and urged people to donate and help those affected by the wildfires as her birthday wish,Hollywood Reporter,2025-01-21T07:22:37.069483
First Responders Get the Star Treatment at Chateau Marmont,Plus Matthew Perrys Palisades home miraculously survives and a burning AI Oscar fools Isabella Rossellini,Hollywood Reporter,2025-01-21T07:22:37.069483
Melania Trump Draws Carmen Sandiego Comparisons With Inauguration Outfit,The First Ladys inauguration outfit has everybody on social media making the same joke,Hollywood Reporter,2025-01-21T07:22:37.069483
Donald Trump Promises Sweeping Change Rips Biden Administration in Inaugural Address,With temperatures reaching a high of 24 degrees in Washington DC Trumps political comeback was cemented inside the Capitol Rotunda with a reduced audience,Hollywood Reporter,2025-01-21T07:22:37.069483
Biden in Final Act in Office Pardons His Family Due to Unrelenting Attacks From Trump and Allies,Biden also issued pardons to Dr Anthony Fauci retired Gen Mark Milley and members of the House committee that investigated the Jan 6 attack on the Capitol in his final hours to guard against potential revenge by the incoming Trump administration,Hollywood Reporter,2025-01-21T07:22:37.069483
Iranian Pop Star Tataloo Sentenced to Death for Blasphemy Reports,Iranian media is reporting that Irans Supreme Court has sentenced the musician to death for insulting the Prophet Muhammad,Hollywood Reporter,2025-01-21T07:22:37.069483
Chappell Roan Id Be More Successful If I Was OK Wearing a Muzzle,If I were to override more of my basic instincts I would be bigger I would be way bigger And I would still be on tour right now the pop star said about being dubbed a diva in the music industry,Hollywood Reporter,2025-01-21T07:22:37.069483
Olivia Rodrigo Billie Eilish Lady Gaga Jelly Roll to Perform at FireAid Benefit Concert for LA Wildfire Victims,Tate McRae No Doubt Katy Perry Alanis Morissette Anderson Paak Dawes Graham Nash John Fogerty Peso Pluma Stevie Wonder and the Black Crowes are also set to take the stage for the benefit show with John Mayer and Dave Matthews performing together for the first time,Hollywood Reporter,2025-01-21T07:22:37.069483
Three Israeli Hostages Arrive in Israel as Fragile Ceasefire Passes First Hurdle 90 Palestinian Prisoners and Detainees Released by Israel,In Tel Aviv thousands of people gathered to watch the news on large screens erupted in cheers In the Israelioccupied West Bank families and friends had gathered excitedly as cars honked and people waved the Palestinian flag,Hollywood Reporter,2025-01-21T07:22:37.069483
Eddie McGuires son does the unthinkable,Joe McGuire the son of broadcaster Eddie has won an allAussie punting duel in a performance few would have seen coming,News AU,2025-01-21T07:22:39.165706
Quite remarkable young stars leadership rise,A young star has been elevated to a significant leadership position at North Melbourne who will have a solo skipper in 2025,News AU,2025-01-21T07:22:39.165706
Reds eyeing more Dutch delight,Adelaide United wants to further its hopes of winning the ALeague title by adding another Dutch defender to its ranks,News AU,2025-01-21T07:22:39.165706
New age Warner message driving finals run,The two teams who have catapulted themselves into the Big Bash finals have one very big thing in common,News AU,2025-01-21T07:22:39.165706
Nothing Rookie waits for word on Test debut,Steve Smith is on his way to the Australian team camp in Dubai where a 21yearold allrounder is waiting to learn if hell be making his Test debut in Sri Lanka,News AU,2025-01-21T07:22:39.165706
Bomb drops as offcamera moment revealed,There has been a huge twist in the Australian Opens Novak Djokovic problem with word about an offcamera moment leaking out,News AU,2025-01-21T07:22:39.165706
Buddy its a feather Tempers flare over let calls,Tommy Paul and Alexander Zverev have both blown up on Rod Laver Arena over umpire calls at key moments with Zverev livid over a feather FOLLOW DAY 10 LIVE,News AU,2025-01-21T07:22:39.165706
Bulldogs explain No1 picks absence,A star forward has been mysteriously absent from preseason training sessions and the Western Bulldogs have given an update,News AU,2025-01-21T07:22:39.165706
SuperCoach is back with extra features and new FLEX position,Welcome to the best season of NRL SuperCoach yet featuring a host of game improvements and the biggest rule change in years,News AU,2025-01-21T07:22:39.165706
Carney reality TV star married in style,Former NRL bad boy Todd Carney and MAFS contestant Susie Bradley have dropped the first photos of their glitzy wedding day,News AU,2025-01-21T07:22:39.165706
Pit of piranhas World title chase stirs Sally,Sally Fitzgibbons has been close to a world title in a rollercoaster career and the energetic Aussie cant get enough of the ride as a 16th campaign begins,News AU,2025-01-21T07:22:39.165706
Scares me most Shayna Jacks biggest fear,Olympian Shayna Jack has endured a horror past five years with the swimmer revealing what terrifies her more than anything,News AU,2025-01-21T07:22:39.165706
Disgusting US turns on NFLs golden child,NFL fans have turned on Patrick Mahomes after the superstar quarterback was at the centre of some fiery playoffs controversy,News AU,2025-01-21T07:22:39.165706
Socceroo to join exodus to UK club,Another talented young Australian player is set to join English Championship club Portsmouth,News AU,2025-01-21T07:22:39.165706
History made as champ stuns UFC world,Two champions have cemented their place among the greats with displays left that jaws on the floor across the entire UFC world,News AU,2025-01-21T07:22:39.165706
Dream of racing in red Hamilton era begins at Ferrari,Lewis Hamilton has said he will bring everything to delivering first Ferrari championship since 2007 as he declares he always dreamed of racing in the iconic red of the Italian team,News AU,2025-01-21T07:22:39.165706
F1 stars 4m Ferrari smashed,A quick test drive in Monaco turned disastrous for one of the biggest names in Formula 1,News AU,2025-01-21T07:22:39.165706
Car crash that broke Simmons and how he can get back,Make no mistake Ben Simmons was worth the hype a genuine superstar of the NBA with an unbelievable ceiling In a single moment everything changed,News AU,2025-01-21T07:22:39.165706
Days drive clear after costly finalhole blunder,Jason Day cost himself an extra sixfigures with a finalhole fadeout in California but still made a tidy sum for his podium finish,News AU,2025-01-21T07:22:39.165706
Kensington preview Pride in pursuit of double,With luck in running trainer Joe Pride holds high hopes of snaring a winning double at the Randwick Kensington meeting on Wednesday,News AU,2025-01-21T07:22:39.165706
McDermott and Wright to again lead Reds,The Queensland Reds have named the same cocaptains for their 2025 Super Rugby Pacific season,News AU,2025-01-21T07:22:39.165706
Wallabies star confident of securing new deal,A leading Wallaby is yet to secure his future beyond this year but he seems anything but concerned about it,News AU,2025-01-21T07:22:39.165706
Fan hospitalised in awful freak accident,A devastating crash has marred Saturdays Tour Down Under leaving a fan hospitalized with serious injuries,News AU,2025-01-21T07:22:39.165706
