Title,Description,Source,Fetched Date
Trump expands exemptions from Canada and Mexico tariffs,Trump said he was granting the two US neighbours a temporary exemption on tariffs that he imposed two days ago,BBC Business,2025-03-07T07:23:53.221587
SpaceX rocket explodes raining debris from sky for second time in a row,It grounded flights in Orlando Miami and Palm Beach after debris concerns from Starships failed launch,BBC Business,2025-03-07T07:23:53.221587
World of Business,Gain the leading edge with global insights for the boardroom and beyond in your inbox every Wednesday,BBC Business,2025-03-07T07:23:53.221587
Jack Daniels hits out at Canada pulling US alcohol,Some Canadian provinces have removed USmade alcohol from shelves in response to US tariffs,BBC Business,2025-03-07T07:23:53.221587
European Central Bank cuts interest rates again,The bank cuts rates to 25 but faces pressures from threatened US tariffs and plans to boost military funding,BBC Business,2025-03-07T07:23:53.221587
Why did Trump just establish a crypto strategic reserve,The reserve will hold cryptocurrency forfeited to the government in criminal or civil proceedings said the White House,BBC Business,2025-03-07T07:23:53.221587
Boots gets new US owner in multibillion dollar deal,It is unclear what the deal would mean for Boots and its UK operations,BBC Business,2025-03-07T07:23:53.221587
As US and Canada trade barbs its so far so good for Mexicos Sheinbaum,Donald Trump and Justin Trudeaus clear tensions are a stark contrast to the Mexican leaders approach to the White House,BBC Business,2025-03-07T07:23:53.221587
Can Trumps tariffs break Chinas grip on manufacturing,The Made in China juggernaut was built over decades Can Trumps moves set it back,BBC Business,2025-03-07T07:23:53.221587
Boom to gloom India middleclass jitters amid trilliondollar market rout,One in five Indian households invest in the stock market but the recent crash has left investors anxious,BBC Business,2025-03-07T07:23:53.221587
NYSE Opening Bell,Watch the latest from BBCs new daily business programme coming from the heart of New Yorks financial district,BBC Business,2025-03-07T07:23:53.221587
How one product made a multimillion dollar brand,Nell Diamond CEO of Hill House Home shares how her small business skyrocketed to global success with the launch of the Nap Dress in 2019,BBC Business,2025-03-07T07:23:53.221587
Carmakers win break from Trumps tariffs on Canada and Mexico,Trump says he will exempt cars from the new import taxes while continuing his criticism of Canada,BBC Business,2025-03-07T07:23:53.221587
Sweden is no longer a country that cannot be trusted,Sweden and Finlands defence sectors are benefiting from their countries joining Nato,BBC Business,2025-03-07T07:23:53.221587
Denmark postal service to stop delivering letters,The decision will end 400 years of the companys letter service and postboxes will disappear from June,BBC Business,2025-03-07T07:23:53.221587
Irish economy grew at a solid pace in 2024,The finance minister says the figures are consistent with the strength of our labour market,BBC Business,2025-03-07T07:23:53.221587
US charges Chinese hackers who targeted dissidents,The Justice Department said Chinese agencies paid as much as 75000 58200 for each hacked email inbox,BBC Business,2025-03-07T07:23:53.221587
Warning people in UK could have less money due to US tariffs,Trump tariffs could affect UK economic growth hitting UK consumers in the pocket Bank experts warn,BBC Business,2025-03-07T07:23:53.221587
Playing with FIRE How to quit work and retire in your 30s,A personal finance strategy popular among millennials is helping them to quit their job and retire decades early,BBC Business,2025-03-07T07:23:53.221587
Boomerang CEOs Do they ever succeed,Five years after being ousted from WeWork Adam Neumann wants to rebuy the nowbankrupt business,BBC Business,2025-03-07T07:23:53.221587
How industry leaders transformed their career,The BBCs Katty Kay has spoken to successful changemakers to ask what made them pivot in their career,BBC Business,2025-03-07T07:23:53.221587
Women were the original beer brewers what changed,Today the beer industry is maledominated but it wasnt always so,BBC Business,2025-03-07T07:23:53.221587
How waiting alters our perception of time,Expert advice on how to get through a waiting period,BBC Business,2025-03-07T07:23:53.221587
Do the superrich deserve their wealth,Should there be a cap on billionaires wealth and their inheritances,BBC Business,2025-03-07T07:23:53.221587
Four simple hacks to succeed in every conversation,A career coach a choreographer a chef and a dragon boat captain offer advice on giving critical feedback,BBC Business,2025-03-07T07:23:53.221587
Solo and hybrid work Navigating our future and new normal,Covid19 reshaped the way we live and work We rethink solo working and explore the future of worklife,BBC Business,2025-03-07T07:23:53.221587
Can supersonic flight ever be sustainable,How a new era of quiet net zero supersonic airliners could revolutionise the aviation industry,BBC Business,2025-03-07T07:23:53.221587
Commencement speech The surprising pitfall of your passions,Students are graduating in the US this week The commencement speeches might lead them into questionable choices,BBC Business,2025-03-07T07:23:53.221587
ASMR How whispering took over the internet,We meet the creators behind the current ASMR boom,BBC Business,2025-03-07T07:23:53.221587
A desk full of descriptions for your work colleagues,These are the long lost words youve been waiting for to describe your colleagues,BBC Business,2025-03-07T07:23:53.221587
Veterinarian suicide rates are very high Why,Veterinarian professionals are committing suicide at a higher rate than the general population,BBC Business,2025-03-07T07:23:53.221587
UK competition watchdog drops MicrosoftOpenAI probe,Digital rights campaigners say it shows the regulator has given into Big Tech and been defanged,BBC Business,2025-03-07T07:23:53.221587
China targets 5 growth as it reels from Trump tariffs,A key meeting has begun to revive Chinas lagging economy which is now facing a trade war with the US,BBC Business,2025-03-07T07:23:53.221587
UK chancellor set to cut welfare spending by billions,Cuts to areas including welfare will be put to the official forecaster ahead of the Spring Statement,BBC Business,2025-03-07T07:23:53.221587
Hong Kong billionaire to sell Panama Canal ports to US firm,BlackRock will buy two ports after Trumps interest in taking back control of the key shipping route,BBC Business,2025-03-07T07:23:53.221587
Can Teslas EVs win over Indias priceconscious buyers,The EV giant has begun hiring in India and is reportedly hunting for showrooms in Delhi and Mumbai,BBC Business,2025-03-07T07:23:53.221587
Trudeau hits out at dumb tariffs as Trump warns of further hikes against Canada,Canada has imposed its own retaliatory tariffs which will remain in place until the US reverses course,BBC Business,2025-03-07T07:23:53.221587
Canadians turn to local goods as Trump tariffs go into effect,Some say the US tariffs have unified their country with others pledging to fully avoid American products,BBC Business,2025-03-07T07:23:53.221587
US stock markets fall amid trade war fears,Canadas Prime Minister Justin said Donald Trumps decision to impose import taxes was very dumb,BBC Business,2025-03-07T07:23:53.221587
Apple takes legal action in UK data privacy row,The tech giant is appealing a government order for access to customers private data the BBC understands,BBC Business,2025-03-07T07:23:53.221587
King Charles Partners With Apple Music to Release His Playlist Featuring Kylie Minogue Raye and More,In an extraordinarily personal insight into Charles IIIs music taste The Kings Music Room was recorded at Buckingham Palace in his private office,Hollywood Reporter,2025-03-07T07:23:54.117922
Pamela Bach Baywatch Actress and David Hasselhoffs ExWife Dies at 62,They were married for 17 years and share two daughters,Hollywood Reporter,2025-03-07T07:23:54.117922
The Future of Reggae and Dancehall Discussed at Island Music Conference in Jamaica,I would really like for the artists to come in and make connections and understand the game and not get fucked like the old ones did said Shaggy of the third annual confab,Hollywood Reporter,2025-03-07T07:23:54.117922
Olivia Rodrigo and The 1975 to Headline Glastonbury 2025,Neil Young Charli XCX Noah Kahan The Prodigy Raye Loyle Carner Gracie Abrams and more have also been confirmed to perform at the UKs biggest music festival,Hollywood Reporter,2025-03-07T07:23:54.117922
Mercury Records Taps Tyler Arnold as Chairman and CEO Ben Adelson as President and COO,Mercury Records announced the executives promotions on Tuesday both having been with the company since its relaunch in 2022,Hollywood Reporter,2025-03-07T07:23:54.117922
Gwyneth Paltrow Says She Drank Every Night During LA Wildfires,The Oscar winner also opens up about how alcohol impacted her menopause symptoms,Hollywood Reporter,2025-03-07T07:23:54.117922
Roy Ayers JazzFunk Musician Behind Everybody Loves the Sunshine Dies at 84,The vibraphonists hits have been sampled by Mary J Blige Common Tyler the Creator and Kanye West,Hollywood Reporter,2025-03-07T07:23:54.117922
Steve Carell Helps LA Students Affected by the Fires Go to Prom for Free,The Office star partnered with Alices Kids which is providing prom tickets to high school seniors,Hollywood Reporter,2025-03-07T07:23:54.117922
80s Cruise Bands Singer to Skip Show After Fiance Went Overboard,Faster Pussycat is still planning to perform its scheduled show but without lead singer Taime Downe after his fiance went missing and is presumed dead,Hollywood Reporter,2025-03-07T07:23:54.117922
Hamilton Cancels Kennedy Center Run After Trump Takeover,Producer Jeffrey Seller said the show could not participate in the new culture of the institution,Hollywood Reporter,2025-03-07T07:23:54.117922
Joshua Jackson Excited for the Opportunity to Rebuild His Childhood Home After LA Fires,Jackson lost his childhood home which is also where he had raised his fouryearold daughter in the Palisades fire,Hollywood Reporter,2025-03-07T07:23:54.117922
Neil Gaiman Says WhatsApp Messages Prove Former Nannys Claims of Rape Are a Sham Shes a Fantasist,The author has been accused of repeatedly raping and assaulting Scarlett Pavlovich while she was working for his family in New Zealand in 2022,Hollywood Reporter,2025-03-07T07:23:54.117922
Yips in the past as White eyes Uniteds NBL title charge,Jack White admits he was in my own head as he caught the yips from the free throw line during the NBL semifinals but that overthinking is in the past as he gears up for Melbourne Uniteds grand final redemption arc,News AU,2025-03-07T07:23:55.532693
Former Olympian added to FBIs most wanted,The FBI has added a Canadian who once competed in snowboarding at the Winter Olympics to its list of top 10 most wanted fugitives,News AU,2025-03-07T07:23:55.532693
Top Swans defiant message to Opening Round critics,Sydney boss Andrew Pridham has hailed Opening Round a resounding success but opened the door for a blockbuster game in Melbourne to be added,News AU,2025-03-07T07:23:55.532693
NRL stars face tense race against time,Dolphins players fear they may not be able to make it home to their loved ones despite the NRL booking a charter flight to Redcliffe,News AU,2025-03-07T07:23:55.532693
Knights arrive for battle Benji makes late switch,Wests Tigers coach Benji Marshall has made one key change to his starting side ahead of the round one clash against the Knights while the Dolphins have avoided being stranded in Sydney,News AU,2025-03-07T07:23:55.532693
Highprofile AFL management fined for player breach,A highprofile player agent company has been fined by the AFL Players Association after breaching regulations relating to a pathways player,News AU,2025-03-07T07:23:55.532693
England apologises for Pope Francis tweet,The England Cricket Board have been left with some egg on their face after an off colour social media post about Pope Francis,News AU,2025-03-07T07:23:55.532693
Australias highest paid athletes revealed,Some of Australias brighest young stars are set for some truly eyewatering paydays as the sporting rich list gets a whole new look,News AU,2025-03-07T07:23:55.532693
Tears flow from injured Kyrgios as reality sets in,The playing future of Nick Kyrgios looks grim after a sad end to his return to the court in California,News AU,2025-03-07T07:23:55.532693
Kyrgios in tears tennis career in jeopardy,Nick Kyrgios was inconsolable on Friday after another brutal setback as his tennis career stutters towards a sad conclusion,News AU,2025-03-07T07:23:55.532693
Fans say same thing as Ricciardo goes viral,Daniel Ricciardo has been living his best life away from TV cameras for six months but hes now been compelled to return to the spotlight,News AU,2025-03-07T07:23:55.532693
I control you Aussie F1 stars scary warning,Australias newest F1 driver has received an ominous warning from his team boss amid fears his seat is already under threat,News AU,2025-03-07T07:23:55.532693
ExQueensland star OConnor praised by Reds,The Reds are set for an exciting challenge when they take on former Queensland star James OConnor on Sunday,News AU,2025-03-07T07:23:55.532693
OConnor targets former teammates,James OConnor has been happy to share Queensland Reds secrets with his new Crusaders teammates,News AU,2025-03-07T07:23:55.532693
Absolute chills NBA stars heartbreaking act,The Dallas Mavericks nightmare season has gone from bad to worse after Kyrie Irving went down with what could be a serious injury,News AU,2025-03-07T07:23:55.532693
Sky Blues on verge of semifinal berth,Sydney FC is closing in on a spot in the AFC Champions League Two semifinals after a crucial win in South Korea,News AU,2025-03-07T07:23:55.532693
Wild scenes as Thurman and Jarvis need to be separated,Things nearly got underway five days early as Keith Thurman and Brock Jarvis went facetoface following a sledge about another Aussie boxing star,News AU,2025-03-07T07:23:55.532693
Schoolboy sensation soars to NZ PGA championship lead,A 16yearold schoolboy who has already shattered junior records is threatening to write the latest remarkable chapter on the PGA Tour of Australasia,News AU,2025-03-07T07:23:55.532693
Youre delusional How top jockey was talked out of retiring,Ethan Brown was considering hanging up the saddle after a scary race fall until trainer Ciaron Maher gave him some wise advice,News AU,2025-03-07T07:23:55.532693
Aussie defectors staggering gold medal act,Six months after sensationally switching his allegiance from Australia to England the cycling defector has rubbed salt in the wounds,News AU,2025-03-07T07:23:55.532693
Lost a legend Tributes flow for Aussie champion,Tributes are flowing for a beloved champion Australian triathlete and coach after she passed away following a battle with cancer,News AU,2025-03-07T07:23:55.532693
Surfing great injured in Cyclone Alfred waves,Threetime world champ Mick Fanning was among the surfers that couldnt resist the cyclone waves although he came off second best,News AU,2025-03-07T07:23:55.532693
