Title,Description,Source,Fetched Date,Combined Text,Score,Sentiment
USBoeing deal over crashes repugnant lawyer for victims families,The plane maker has agreed to pay 11bn to avoid prosecution over two fatal crashes that killed 346 people,BBC Business,2025-06-05T07:27:34.691109,usboeing deal crash repugnant lawyer victim family . plane maker agreed pay 11bn avoid prosecution two fatal crash killed 346 people,-0.9595,Negative
How airline fees have turned baggage into billions,The amount carriers now charge for luggage is raising the ire of politicians and consumer groups,BBC Business,2025-06-05T07:27:34.691109,airline fee turned baggage billion . amount carrier charge luggage raising ire politician consumer group,0.0,Neutral
World of Business,Gain the leading edge with global insights for the boardroom and beyond in your inbox every Wednesday,BBC Business,2025-06-05T07:27:34.691109,world business . gain leading edge global insight boardroom beyond inbox every wednesday,0.5267,Positive
Analysis Tariff relief for UK but new clock ticking on US deal,If the UKs deal with the US is not finalised by 9 July the UKs tariff on steel will go back up to 50,BBC Business,2025-06-05T07:27:34.691109,analysis tariff relief uk new clock ticking u deal . uk deal u finalised 9 july uk tariff steel go back 50,0.4767,Positive
UK chancellor announces 15bn for transport projects,Money will be spent on tram train and bus projects in England across the Midlands North and West Country,BBC Business,2025-06-05T07:27:34.691109,uk chancellor announces 15bn transport project . money spent tram train bus project england across midland north west country,0.0,Neutral
Stores open at midnight as fans rush to buy Nintendo Switch 2,One retailer says its the biggest gaming preorder ever but there questions over whether high prices will dent sales,BBC Business,2025-06-05T07:27:34.691109,store open midnight fan rush buy nintendo switch 2. one retailer say biggest gaming preorder ever question whether high price dent sale,0.3182,Positive
Musk turns on Republicans and gives Trumps big bill a harder path,The billionaires criticism could embolden Republicans who are considering voting against the tax and spending bill,BBC Business,2025-06-05T07:27:34.691109,musk turn republican give trump big bill harder path . billionaire criticism could embolden republican considering voting tax spending bill,-0.4404,Negative
Musk urges Americans to tell lawmakers to kill the bill,Billionaire says the bill which faces a key test in the Senate undercuts efforts to slash federal spending,BBC Business,2025-06-05T07:27:34.691109,musk urge american tell lawmaker kill bill . billionaire say bill face key test senate undercut effort slash federal spending,-0.7783,Negative
US green energy firms brace for federal funding cuts,Billions of dollars of US federal funding for green energy projects hangs in the balance,BBC Business,2025-06-05T07:27:34.691109,u green energy firm brace federal funding cut . billion dollar u federal funding green energy project hang balance,0.2732,Positive
Winemakers finding Trumps tariffs hard to swallow,Wine producers in both France and the US are unhappy at the US presidents trade actions,BBC Business,2025-06-05T07:27:34.691109,winemaker finding trump tariff hard swallow . wine producer france u unhappy u president trade action,-0.4939,Negative
Trump tax bill can have good and bad effects 22 May 2025,Investment Strategist Guy LeBas says the tax bill passed by the House has good and bad impacts on growth,BBC Business,2025-06-05T07:27:34.691109,trump tax bill good bad effect 22 may 2025. investment strategist guy lebas say tax bill passed house good bad impact growth,0.1027,Neutral
The British jet engine that failed in the Valley of Death,Workers at Reaction Engines felt they were close to completing a revolutionary jet engine,BBC Business,2025-06-05T07:27:34.691109,british jet engine failed valley death . worker reaction engine felt close completing revolutionary jet engine,-0.802,Negative
Trumps 50 tariffs on metals come into effect,Trump doubles down on his tariffs while sparing the UK from the latest duties,BBC Business,2025-06-05T07:27:34.691109,trump 50 tariff metal come effect . trump double tariff sparing uk latest duty,0.0,Neutral
UK temporarily spared from Trumps 50 steel tariffs,The executive order raises import taxes for US firms buying from other countries but the levy remains at 25 for the UK,BBC Business,2025-06-05T07:27:34.691109,uk temporarily spared trump 50 steel tariff . executive order raise import tax u firm buying country levy remains 25 uk,0.0,Neutral
Oreo maker sues Aldi in US over copycat packaging,The discount supermarket is being sued in a US court accused of imitating the American biscuit brand,BBC Business,2025-06-05T07:27:34.691109,oreo maker sue aldi u copycat packaging . discount supermarket sued u court accused imitating american biscuit brand,-0.296,Negative
Debt and trade issues weaken UK growth OECD says,The policy group lowers its UK economy forecast due to trade barriers and Britains very thin financial buffer,BBC Business,2025-06-05T07:27:34.691109,debt trade issue weaken uk growth oecd say . policy group lower uk economy forecast due trade barrier britain thin financial buffer,-0.6597,Negative
Pornhub pulls out of France over age verification law,Its the latest setback for the worlds most popular porn site which is also under investigation by the EU,BBC Business,2025-06-05T07:27:34.691109,pornhub pull france age verification law . latest setback world popular porn site also investigation eu,0.4215,Positive
Tesla is not interested in producing cars in India minister,This is the first time India has publicly admitted that it has not been able to lure investment dollars from Musk,BBC Business,2025-06-05T07:27:34.691109,tesla interested producing car india minister . first time india publicly admitted able lure investment dollar musk,0.4767,Positive
Playing with FIRE How to quit work and retire in your 30s,A personal finance strategy popular among millennials is helping them to quit their job and retire decades early,BBC Business,2025-06-05T07:27:34.691109,playing fire quit work retire 30 . personal finance strategy popular among millennials helping quit job retire decade early,0.5267,Positive
Boomerang CEOs Do they ever succeed,Five years after being ousted from WeWork Adam Neumann wants to rebuy the nowbankrupt business,BBC Business,2025-06-05T07:27:34.691109,boomerang ceo ever succeed . five year ousted wework adam neumann want rebuy nowbankrupt business,0.5423,Positive
How industry leaders transformed their career,The BBCs Katty Kay has spoken to successful changemakers to ask what made them pivot in their career,BBC Business,2025-06-05T07:27:34.691109,industry leader transformed career . bbcs katty kay spoken successful changemakers ask made pivot career,0.5859,Positive
Women were the original beer brewers what changed,Today the beer industry is maledominated but it wasnt always so,BBC Business,2025-06-05T07:27:34.691109,woman original beer brewer changed . today beer industry maledominated wasnt always,0.3182,Positive
How waiting alters our perception of time,Expert advice on how to get through a waiting period,BBC Business,2025-06-05T07:27:34.691109,waiting alters perception time . expert advice get waiting period,0.0,Neutral
Do the superrich deserve their wealth,Should there be a cap on billionaires wealth and their inheritances,BBC Business,2025-06-05T07:27:34.691109,superrich deserve wealth . cap billionaire wealth inheritance,0.7506,Positive
Four simple hacks to succeed in every conversation,A career coach a choreographer a chef and a dragon boat captain offer advice on giving critical feedback,BBC Business,2025-06-05T07:27:34.691109,four simple hack succeed every conversation . career coach choreographer chef dragon boat captain offer advice giving critical feedback,0.5106,Positive
Solo and hybrid work Navigating our future and new normal,Covid19 reshaped the way we live and work We rethink solo working and explore the future of worklife,BBC Business,2025-06-05T07:27:34.691109,solo hybrid work navigating future new normal . covid19 reshaped way live work rethink solo working explore future worklife,0.0,Neutral
Can supersonic flight ever be sustainable,How a new era of quiet net zero supersonic airliners could revolutionise the aviation industry,BBC Business,2025-06-05T07:27:34.691109,supersonic flight ever sustainable . new era quiet net zero supersonic airliner could revolutionise aviation industry,0.0,Neutral
Commencement speech The surprising pitfall of your passions,Students are graduating in the US this week The commencement speeches might lead them into questionable choices,BBC Business,2025-06-05T07:27:34.691109,commencement speech surprising pitfall passion . student graduating u week commencement speech might lead questionable choice,0.4404,Positive
A desk full of descriptions for your work colleagues,These are the long lost words youve been waiting for to describe your colleagues,BBC Business,2025-06-05T07:27:34.691109,desk full description work colleague . long lost word youve waiting describe colleague,-0.3182,Negative
Veterinarian suicide rates are very high Why,Veterinarian professionals are committing suicide at a higher rate than the general population,BBC Business,2025-06-05T07:27:34.691109,veterinarian suicide rate high . veterinarian professional committing suicide higher rate general population,-0.8658,Negative
ASMR How whispering took over the internet,We meet the creators behind the current ASMR boom,BBC Business,2025-06-05T07:27:34.691109,asmr whispering took internet . meet creator behind current asmr boom,0.0,Neutral
Defamation trial begins for MyPillow boss Mike Lindell over election claims,The MyPillow boss is being sued by a former Dominion Voting Systems employee who says his reputation was irreparably tarnished,BBC Business,2025-06-05T07:27:34.691109,defamation trial begin mypillow bos mike lindell election claim . mypillow bos sued former dominion voting system employee say reputation irreparably tarnished,0.0,Neutral
UK threatens to sue Abramovich over Chelsea sale,The proceeds have been frozen since the UK government forced the clubs sale following Russias invasion of Ukraine,BBC Business,2025-06-05T07:27:34.691109,uk threatens sue abramovich chelsea sale . proceeds frozen since uk government forced club sale following russia invasion ukraine,-0.6808,Negative
Thames Waters future in doubt after investor pulls out,The setback increases the possibility that the company will collapse into a governmentsupervised administration,BBC Business,2025-06-05T07:27:34.691109,thames water future doubt investor pull . setback increase possibility company collapse governmentsupervised administration,-0.5267,Negative
North Face and Cartier customer data stolen in cyber attacks,They are the latest in a string of highprofile companies publicly reporting being hacked,BBC Business,2025-06-05T07:27:34.691109,north face cartier customer data stolen cyber attack . latest string highprofile company publicly reporting hacked,-0.8402,Negative
Disney makes hundreds more layoffs as it cuts costs,The media giant has been under pressure as viewers move away from cable TV to streaming platforms,BBC Business,2025-06-05T07:27:34.691109,disney make hundred layoff cut cost . medium giant pressure viewer move away cable tv streaming platform,-0.5106,Negative
TikTok Shop food listings in UK putting people at risk,The BBC finds food listed on TikTok shop without ingredient and allergen information,BBC Business,2025-06-05T07:27:34.691109,tiktok shop food listing uk putting people risk . bbc find food listed tiktok shop without ingredient allergen information,-0.2732,Negative
Tulsa plans 105m in reparations for Americas hidden massacre,A century ago a white mob burned down part of the Oklahoma city known as Black Wall Street killing hundreds,BBC Business,2025-06-05T07:27:34.691109,tulsa plan 105m reparation america hidden massacre . century ago white mob burned part oklahoma city known black wall street killing hundred,-0.6597,Negative
Bill Gates to give most of his 200bn fortune to Africa,The Microsoft founder urges young innovators to use Artificial Intelligence to improve health services,BBC Business,2025-06-05T07:27:34.691109,bill gate give 200bn fortune africa . microsoft founder urge young innovator use artificial intelligence improve health service,0.7184,Positive
China says US has severely violated tariffs truce,The comments come after Trump said on Friday that China had totally violated its agreement with us,BBC Business,2025-06-05T07:27:34.691109,china say u severely violated tariff truce . comment come trump said friday china totally violated agreement u,-0.7447,Negative
Jessie J Reveals Early Breast Cancer Diagnosis,The Grammy nominee took to Instagram to share the news because she wanted to be open and share it partly because selfishly I do not talk about it enough,Hollywood Reporter,2025-06-05T07:27:35.566236,jessie j reveals early breast cancer diagnosis . grammy nominee took instagram share news wanted open share partly selfishly talk enough,-0.4779,Negative
Aging CEOs Ambitious Nepo Babies and a Tech Revolution Succession in the Music Biz,Meet the new boss same as the old boss As the industry prepares for the AI takeover insiders question whos next in line at the major labels,Hollywood Reporter,2025-06-05T07:27:35.566236,aging ceo ambitious nepo baby tech revolution succession music biz . meet new bos old bos industry prepares ai takeover insider question who next line major label,0.5994,Positive
Billy Joel Tells Howard Stern Im Not Dying,The music icon discussed his brain disorder issues with Stern after canceling his tour,Hollywood Reporter,2025-06-05T07:27:35.566236,billy joel tell howard stern im dying . music icon discussed brain disorder issue stern canceling tour,-0.4019,Negative
ABBAs Bjrn Ulvaeus on Writing a Musical Assisted by AI and Those Kiss Avatars SXSW London,The Future of Entertainment was the topic in focus for the Swedish singer songwriter producer and cofounder of Pophouse Entertainment,Hollywood Reporter,2025-06-05T07:27:35.566236,abbas bjrn ulvaeus writing musical assisted ai kiss avatar sxsw london . future entertainment topic focus swedish singer songwriter producer cofounder pophouse entertainment,0.8126,Positive
Death of Grassroots Live Electronic Music Venues Gets UK Parliament Review SXSW London,With input from fans the goal is to support a thriving grassroots music scene and building a sustainable talent pipeline that ensures the UK music industry remains one of the UKs global success stories,Hollywood Reporter,2025-06-05T07:27:35.566236,death grassroots live electronic music venue get uk parliament review sxsw london . input fan goal support thriving grassroots music scene building sustainable talent pipeline ensures uk music industry remains one uk global success story,0.765,Positive
Former Celebrity Lawyer Tom Girardi Gets 7 Years in Prison for Stealing Millions From Clients,A jury in August found him guilty of four counts of wire fraud and he could have been sentenced to up to 80 years in prison,Hollywood Reporter,2025-06-05T07:27:35.566236,former celebrity lawyer tom girardi get 7 year prison stealing million client . jury august found guilty four count wire fraud could sentenced 80 year prison,-0.9517,Negative
Diddy Trial Sees Heckler Disrupt Court as Judge Learns Anonymous Witness Name Leaked Online,The eightweek federal trial is steadily moving along and on time with several witnesses testifying but some bumps in the road came on Tuesday,Hollywood Reporter,2025-06-05T07:27:35.566236,diddy trial see heckler disrupt court judge learns anonymous witness name leaked online . eightweek federal trial steadily moving along time several witness testifying bump road came tuesday,-0.3182,Negative
Heart Band Members Report Stolen Instruments Offer Reward for Their Return,The news comes after the rock band was set to perform at the Hard Rock Hotel Casino in Atlantic City this past Saturday,Hollywood Reporter,2025-06-05T07:27:35.566236,heart band member report stolen instrument offer reward return . news come rock band set perform hard rock hotel casino atlantic city past saturday,0.0258,Neutral
Vinyl Me Please Finds New Ownership to Get Saved From Bankruptcy,We have big plans to grow this community and welcome a new generation of collectors But first we have to do right by the customers who built it CEO Nick Alt said,Hollywood Reporter,2025-06-05T07:27:35.566236,vinyl please find new ownership get saved bankruptcy . big plan grow community welcome new generation collector first right customer built ceo nick alt said,0.7964,Positive
Sabrina Carpenter Summer Singer Announces New Single Manchild Ahead of Primavera Sound Set,This ones about you the twotime Grammy Award winner wrote in an Instagram post sharing the news of the new song,Hollywood Reporter,2025-06-05T07:27:35.566236,sabrina carpenter summer singer announces new single manchild ahead primavera sound set . one twotime grammy award winner wrote instagram post sharing news new song,0.8779,Positive
Sean Diddy Combs Paid to Hide Cassie Beating Video Because He Feared Career Ruin Witness Says,A security guard testified Tuesday that the fallen mogul gave him a brown paper bag stuffed with cash in order to buy what he hoped was the only copy of surveillance footage of the assault,Hollywood Reporter,2025-06-05T07:27:35.566236,sean diddy comb paid hide cassie beating video feared career ruin witness say . security guard testified tuesday fallen mogul gave brown paper bag stuffed cash order buy hoped copy surveillance footage assault,-0.9186,Negative
The 13 Commandments of Being a Background Actor,From enduring bad haircuts to avoiding stunt people the author of Unfortunately I Was Available details the dos and donts of life as a film and TV extra,Hollywood Reporter,2025-06-05T07:27:35.566236,13 commandment background actor . enduring bad haircut avoiding stunt people author unfortunately available detail do donts life film tv extra,-0.8074,Negative
