Title,Description,Source,Fetched Date,Combined Text,Score,Sentiment
Difficult Matildas admit to Fowler problem,In the continued absence of Sam Kerr the spotlight is on Mary Fowler every time she steps out for the Matildas,News AU,2024-10-28T07:24:02.178974,difficult matildas admit fowler problem . continued absence sam kerr spotlight mary fowler every time step matildas,-0.5267,Negative
OMG Aussie UFC star has jaw shattered,GRAPHIC WARNING A gruesome photo has emerged showing just how badly Australias Rob Whittaker was mutilated in his UFC loss,News AU,2024-10-28T07:24:02.178974,omg aussie ufc star jaw shattered . graphic warning gruesome photo emerged showing badly australia rob whittaker mutilated ufc loss,-0.926,Negative
Rankin on track for Webex Players Series triumph,A new grip and putter has helped to turn Brett Rankins career around with the new father on the path for a droughtbreaking victory at the Webex Players Series in South Australia,News AU,2024-10-28T07:24:02.178974,rankin track webex player series triumph . new grip putter helped turn brett rankin career around new father path droughtbreaking victory webex player series south australia,0.4767,Positive
Bledisloe drought breaker even tougher,The Wallabies havent won the Bledisloe Cup since 2002 and the schedule for the 2025 showdown is a tough one,News AU,2024-10-28T07:24:02.178974,bledisloe drought breaker even tougher . wallaby havent bledisloe cup since 2002 schedule 2025 showdown tough one,0.0516,Neutral
NRL convert in shock Wallabies call,His last game was in an NRL final and now JosephAukuso Suaalii is set to play his next match as a Wallaby in the UK after a rapid elevation and confirmation hes not going to England just for a ride,News AU,2024-10-28T07:24:02.178974,nrl convert shock wallaby call . last game nrl final josephaukuso suaalii set play next match wallaby uk rapid elevation confirmation he going england ride,-0.0516,Neutral
Via Sistina remains in Melbourne Cup mix after third acceptances,Outstanding Cox Plate winner Via Sistina is one of 35 hopefuls remaining in the Melbourne Cup after Mondays third acceptances for next Tuesdays showpiece event,News AU,2024-10-28T07:24:02.178974,via sistina remains melbourne cup mix third acceptance . outstanding cox plate winner via sistina one 35 hopeful remaining melbourne cup monday third acceptance next tuesday showpiece event,0.9524,Positive
Second tragedy hits Olympian icon after reveal,After dropping heartbreaking news about his terminal diagnosis Sir Chris Hoy has gone public with his familys second secret tragedy,News AU,2024-10-28T07:24:02.178974,second tragedy hit olympian icon reveal . dropping heartbreaking news terminal diagnosis sir chris hoy gone public family second secret tragedy,-0.9153,Negative
